video_id,title,publishedAt,channelId,channelTitle,categoryId,trending_date,tags,view_count,likes,dislikes,comment_count,thumbnail_link,comments_disabled,ratings_disabled,description,duration
"tj55T5xx_TI","Дагестан празднует победу Нурмагомедова лезгинкой на улицах","2020-10-25T05:15:01Z","UCXNCizpfwx4_ETssjXWPmqQ","Мир 24","25","20.25.10","хабиб гэтжи|гэтжи хабиб|хабиб гэтжи бой|хабиб гэтжи полный бой|хабиб гэтжи прогноз|джастин гэтжи|хабиб нурмагомедов|UFC|хабиб нурмагомедов джастин гэтжи|бой хабиб гэтжи|юфс|новости мма|конор макгрегор|тони фергюсон|прогноз|анализ боя|ufc|24 октября|бой за титул|пояс чемпиона|борцы|смерть отца хабиба|спорт|телеканал мир|мир 24|победа|хабиб победил гэтжи|хабиб|гэтжи","239043","4931","109","345","https://i.ytimg.com/vi/tj55T5xx_TI/default.jpg","False","False","В Дагестане практически в каждом доме сейчас ликуют, ведь Хабиб Нурмагомедов одолел американца Джастина Гэтжи, завоевав чемпионский титул UFC в легком весе. Люди танцуют лезгинку и поздравляют друг друга с победой, называя ее «общей».В крупных городах образовались заторы на дорогах. Водители останавливают авто и танцуют лезгинку прямо на проезжей части. Народ ликует. После трансляции боя толпы людей вышли на улицы. Многие из них в белых папахах.Жители Дагестана смотрели поединок либо дома, либо в кинотеатрах, либо в кафе или ресторане. На специальных площадках в Махачкале, Дербенте и Каспийске велась трансляция встречи.Напомним, в ночь на воскресенье, 25 октября, Хабиб Нурмагомедов досрочно победил Джастина Гэтжи на турнире UFC 254. Нурмагомедов защитил титул абсолютного чемпиона UFC в третий раз. В своей речи после боя Хабиб объявил о завершении карьеры.-----------Подпишись на канал:https://www.youtube.com/user/mir24tv?sub_confirmation=1Наши интернет-ресурсы:МИР 24 • http://mir24.tvТелеканал МИР • http://www.mirtv.ruТелеканал МИР PREMIUM • http://www.mirpremium.tvРадио МИР • http://radiomir.fm/Мы в социальных сетях:VK • https://vk.com/mir24tvFacebook • https://www.facebook.com/Mir24TVOK.RU • https://ok.ru/mir24tvTwitter • https://twitter.com/mir24tvInstagram • https://www.instagram.com/mir24tv/Telegram • https://t.me/mir24tvЧитайте также:Яндекс.Дзен • https://zen.yandex.ru/media/mir24tvЯндекс.Новости • https://yandex.ru/news/?favid=3087&from=rubric","1M29S"
"zB3WOH-6KOE","РЕАКЦИЯ НА SLAVA MARLOW & MORGENSHTERN - БЫСТРО / РЕАКЦИЯ ИНОСТРАНЦА НА СЛАВА МАРЛОУ И МОРГЕНШТЕРНА","2020-10-24T11:26:12Z","UCIis6WCutJ4ubeMKzPPskDw","Bro JF","24","20.25.10","slava marlow быстро реакция|slava marlow|слава марлоу|morgenshtern|моргенштерн|слава мэрлоу|реакция|slava|marlow|я гоню быстро|слава марлоу реакция|morgenstern|быстро|слава быстро|морген быстро|я гоню быстро реакция|slava marlow быстро|slava marlow morgenshtern быстро|еду быстро|slawa marlow быстро|morgenstern быстро|я гоню быстро slava marlow|слава марлоу и моргенштерн|слава марлоу и моргенштерн быстро|bro jf|bro jf реакция|реакция иностранцев|бро джеф","28728","3631","69","274","https://i.ytimg.com/vi/zB3WOH-6KOE/default.jpg","False","False","Вчера вышла песня SLAVA MARLOW & MORGENSHTERN - БЫСТРО, на который я жду клип, но сегодня вас ждет реакция на песню слава марлоу и моргенштерна - быстро. Алишер и Слава, вы лучшие и я ХОЧУ СДЕЛАТЬ С ВАМИ ФИТ!!!Instagram: https://www.instagram.com/bro_jf/Тик Ток: https://vm.tiktok.com/tUN7m4/Telegram: https://surflink.ru/PwQtyjРЕАКЦИЯ НА SLAVA MARLOW & MORGENSHTERN - БЫСТРО / РЕАКЦИЯ ИНОСТРАНЦА НА СЛАВА МАРЛОУ И МОРГЕНШТЕРНА","4M16S"
"52q1o7YUgns","ПРУЖИНА - ЧТО ЕСЛИ СБРОСИТЬ  МОЛОТ ТОРА в 70 КГ.  ОТПРЫГНЕТ или НЕТ..?","2020-10-24T12:00:01Z","UC2il4ZKYE7gwjoVDGAbgMbQ","TimOn ChaveS","24","20.25.10","молот|тора|бронестекло|пружина|эксперимент|наковальня|гиря в 24 кг|nokia 3310|что если скинуть|Тимон|TimOn ChaveS|с 5 этажа|как делают|поспорил с серегой|молот тора|как сделать|самому|меч|лава|обсидиан|раскаленная лава|что будет если|Тимон лицо|на стекло машины|реакция|выплавляю|тимон","161865","24639","685","972","https://i.ytimg.com/vi/52q1o7YUgns/default.jpg","False","False","● Скачивай War Thunder бесплатно и получай бонусы - https://wtpub.ru/timon--------------- ►ЧТО ЕСЛИ ПРИГОТОВИТЬ ОСЬМИНОГА во ФРИТЮРЕ и СЪЕСТЬ ЕГО...?! - https://youtu.be/p7455EhFdFE--------------ВНИМАНИЕ! Видео снято как Проверка Эксперимента!  Не повторять! Любые действия в видео не являются призывом к их повторению! Пожалуйста, будьте ответственны всегда!♦♦♦♦♦♦♦♦♦♦♦♦♦♦♦♦♦♦♦♦ ►ЗАКАЗАТЬ РЕКЛАМУ: timonchaves@adisom.com♦♦♦♦♦♦♦♦♦♦♦♦♦♦♦♦♦♦♦♦ ► канал ТИМКИ СУРИКАТА - http://surl.li/baps★ Моя группа в VK: http://vk.com/club98612792★ Мой ИНСТАГРАМ:  https://goo.gl/uBKkwy ★ТУТ Я ЭКОНОМЛЮ на АЛИЕКСПРЕСС до 15% https://is.gd/Z2Ztl8♦♦♦♦♦♦♦♦♦♦♦♦♦♦♦♦♦♦♦♦Понравились ВИДЕО?!  Еще★ ДОСТАЛ ДО ЛУНЫ МОЩНЫМ ЛАЗЕРОМ в 10000 МИЛИВАТ  - СМОТРЮ в ТЕЛЕСКОП - https://youtu.be/9IAWm_nFY9Q★ ФРИТЮРНИЦА - ЧТО ЕСЛИ ЗАЛИТЬ в НЕЁ ЖИДКИЙ АЗОТ ..? - https://youtu.be/g_LEcudt7Ow★ ЧТО ЕСЛИ ПРИГОТОВИТЬ  STRETCH ARMSTRONG во ФРИТЮРЕ.. ?! - https://youtu.be/XRmJghSsCU★ ТРЕШ ВАФЛЯ из СЮРСТРЁММИНГА .. СИЛЬНО ВЗДУЛСЯ с НИМ ЧТО-ТО НЕ ТАК ?!- https://youtu.be/loAwacSu-Ns★ ЧТО ЕСЛИ ПРИГОТОВИТЬ ШАРИКОВЫЕ РУЧКИ во ФРИТЮРЕ.. ?! - https://youtu.be/ziHov8PfpWw★ МОЯ МАШИНА -  СБРОСИЛИ ГИГАНТСКИЙ МЕЧ  60 КГ. + МОЛОТ ТОРА - https://youtu.be/_E3R9xCxpCI♦♦♦♦♦♦♦♦♦♦♦♦♦♦♦♦♦♦♦ТОП 3 - Проверенные КРУТЫЕ товары РЕКОМЕНДУЮ:✔ Павербанк как у меня - http://ali.pub/3y8rh✔ ФОНАРЬ 32000 люмен  как у меня - http://ali.pub/4fd86p✔ ЛАЗЕР 1000 мА как у меня - http://ali.pub/8djpf✔ Керамбит ЗУБ ТИГРА как у меня: https://is.gd/jt5VCt♦♦♦♦♦♦♦♦♦♦♦♦♦♦♦♦♦✔Моя YOTUBE партнерка https://goo.gl/xQoEjQ●  Новый ЭКСПЕРИМЕНТ с моим МОЛОТОМ ТОРА в 70 КГ.... В этот раз я хочу проверить силу ГИГАНТСКОЙ ПРУЖИНЫ... КАК думаете  сможет его отбросить или НЕТ ..?#тимон #лава #молоттора","9M26S"
"JWdD1UY_mDE","Хабиб Нурмагомедов победил Джастина Гэтжи на турнире UFC 254","2020-10-24T21:21:18Z","UCXNCizpfwx4_ETssjXWPmqQ","Мир 24","25","20.25.10","хабиб гэтжи|гэтжи хабиб|хабиб гэтжи бой|хабиб гэтжи полный бой|хабиб гэтжи прогноз|джастин гэтжи|хабиб нурмагомедов|UFC|хабиб нурмагомедов джастин гэтжи|бой хабиб гэтжи|юфс|новости мма|конор макгрегор|тони фергюсон|прогноз|анализ боя|ufc|24 октября|бой за титул|пояс чемпиона|борцы|смерть отца хабиба|спорт|телеканал мир|мир 24|победа|хабиб победил гэтжи|хабиб|гэтжи","364170","5259","168","361","https://i.ytimg.com/vi/JWdD1UY_mDE/default.jpg","False","False","Россиянин Хабиб Нурмагомедов во втором раунде одержал уверенную победу во втором раунде над американцем Джастином Гэтжи в рамках турнира UFC 254. Сразу после боя он заявил, что это был его последний поединок в карьере. -----------Подпишись на канал:https://www.youtube.com/user/mir24tv?sub_confirmation=1Наши интернет-ресурсы:МИР 24 • http://mir24.tvТелеканал МИР • http://www.mirtv.ruТелеканал МИР PREMIUM • http://www.mirpremium.tvРадио МИР • http://radiomir.fm/Мы в социальных сетях:VK • https://vk.com/mir24tvFacebook • https://www.facebook.com/Mir24TVOK.RU • https://ok.ru/mir24tvTwitter • https://twitter.com/mir24tvInstagram • https://www.instagram.com/mir24tv/Telegram • https://t.me/mir24tvЧитайте также:Яндекс.Дзен • https://zen.yandex.ru/media/mir24tvЯндекс.Новости • https://yandex.ru/news/?favid=3087&from=rubric","20S"
"50xlpxL9UTs","AMONG US VS MINECRAFT ◑ Амонг Ас ПРОТИВ Майнкрафт Песня Клип [СУПЕР РЭП БИТВА]","2020-10-24T06:00:12Z","UCR_NE6tCWMDsMkw0mZZhW4g","ДАМБО MUSIC","27","20.25.10","among us|minecraft|minecraft among us|among us minecraft|амонг ас|майнкрафт|песня among us|клип among us|among us песня|among us клип|рэп битва|рэп among us|клип|песня|дамбо music|дамбо|among us vs minecraft|among us vs|among|us|игра|музыка|против|vs|майнкрафт клип|майнкрафт песня|among us funny|предатель среди нас","61082","10185","257","3179","https://i.ytimg.com/vi/50xlpxL9UTs/default.jpg","False","False","Игра AMONG US или же Предатель среди нас (Амонг Ас) против Minecraft - Майнкрафт в рэп битве. Кто же выиграет? Хм-м→Группа ВК (ПОДПИСЫВАЙСЯ): https://vk.com/dambo_official →Мой ВК: https://vk.com/serega_art →Инстаграм: https://www.instagram.com/dambomusic_yt/→ПРОШЛОЕ ВИДЕО: https://www.youtube.com/watch?v=05K_5v8jB5Q--------------------------------------AMONG US VS MINECRAFT ◑ Амонг Ас ПРОТИВ Майнкрафт Песня Клип [СУПЕР РЭП БИТВА]#minecraft #amongus #майнкрафт","2M27S"
"FkGK7bitav0","Donald Trump vs Joe Biden. Epic Rap Battles Of History","2020-10-24T19:00:00Z","UCMu5gPmKp5av0QCAajKTMhw","ERB","24","20.25.10","erb|epic rap battles of history|trump vs biden|joe biden vs donald trump|donald trump vs joe biden|biden vs trump|2020 election|joe biden vs donald trump rap battle|donald trump rap|joe biden rap|donald trump vs joe biden rap battle|epic rap battles|epic rap|2020 erb|donald trump|joe biden|rap battles|trump erb|biden erb|trump rap|biden rap|joe biden vs donald trump epic rap battles of history|trump rap battle|biden rap battle|us election 2020","1993376","238554","10492","54779","https://i.ytimg.com/vi/FkGK7bitav0/default.jpg","False","False","Download this song here: ► http://hyperurl.co/TRUMPvsBIDENEpic Rap Battles of History: Donald Trump vs Joe Biden! The 2020 Election Battle. Who won? Who’s next? You decide! Special Thanks to all our Patrons. Join our team: http://patreon.com/erb The Behind The Scenes video for Donald Trump vs Joe Biden is coming out next week: Please subscribe to ERB2 if you want to be first to see that video: http://www.youtube.com/erb22020 has been a roller coaster of a year. We hope you enjoy the video. Stay safe. Stay well. We'll have another rap battle for you pretty soon :) Beat Produced by: Hollywood Legendshttps://www.soundclick.com/artist/default.cfm?bandID=1240873Official ERB Website: https://erbofhistory.comOfficial ERB Merch: https://erbmerch.comAnd don't forget to subscribe to our channel: https://bit.ly/2zBQU53Thank you!np & eL#epicrapbattles #trump #biden #erb #election #fakenews #shutupmanCAST==========Donald J. Trump: EpicLLOYDhttp://www.youtube.com/EpicLLOYDIG/Twitter: @theepiclloydJoe Biden: Nice Peterhttp://www.youtube.com/NicePeterCREW==========Written by Nice Peter, EpicLLOYD, Frak and the many most excellent contributors of our Patreon Writers Crew. Thank you to everyone involved.Please check out Frak’s new album here. It's epic! - https://ffm.to/frakblist IG - @frakthepersonProducer: Atul SinghDirector of Photography: Andy ChinnMakeup and Hair: Maryann YeeDIT: Josh BestVideo Editors: Ross Fearnley, Josh Best, Nice Peter, Javi Sanchez BlancoVFX and Compositing: Josh Best and Javi Sanchez BlancoMusic Mixed and Mastered by: Nice PeterDirected by: EpicLLOYD and Nice PeterShot on the RED GeminiEdited in Adobe Premiere and After EffectsRecorded and mixed in Pro Tools KeEp iN TOuch WitH Us OnliNe!========http://instagram.com/erbhttp://facebook.com/erbhttp://twitter.com/ERBofHistoryhttp://erbofhistory.comhttp://erbmerch.com","3M49S"
"TrR7XhkAygg","360 VIDEO | EL PROBLEMA Голосами Политиков (MORGENSHTERN & Тимати)","2020-10-24T07:35:09Z","UCLlIpB6BriygXXVmtqjvBdw","ND Production","10","20.25.10","ND Production|ТВ Зкщвгсешщт|НД Продакшн|Андрей Немодрук|НДПродакшн|Немодрук|Немадруг|Немодруг|timati|тимати|el problema|morgenshtern|моргенштерн|пародии|пародии на голоса|голосами политиков|эй примеро|у меня проблема|ламба или фера|у меня проблема ламба или фера|эй проснись|путин|козырный уголок|360|360 градусов","68361","5242","643","300","https://i.ytimg.com/vi/TrR7XhkAygg/default.jpg","False","False","Parimatch даёт эпичный БОНУС по моей ссылке - http://bet3.pm/bonus_NDМЕРЧ ФУТБОЛКИ: http://vsrap.ru/ndprodINSTA: http://www.instagram.com/AndrewNemodrukND PRODUCTION: http://youtube.com/NDproductYOUTUBE LIVE: http://youtube.com/NDbloggingVK: http://vk.com/AndrewNemodrukПо вопросам Рекламы: ND.3VMedia@yandex.ru#360 #elproblema #morgenshtern","3M9S"
"7Ts3NVhTA1E","Хабиб ОБЕЗВОЖЕН - как за полтора дня он превращается в МОНСТРА? Взвешивание перед UFC 254","2020-10-23T07:18:01Z","UCYRWYBFzbMhYVcCti081TFw","Разрешите вас перебить | ММА, UFC","17","20.25.10","хабиб нурмагомедов|джастин гэтжи|взвешивание|сделал вес|хабиб|ufc|нурмагомедов|абдулманап нурмагомедов|ufc 254|khabib|gaethje|лютиков","501949","9636","587","1257","https://i.ytimg.com/vi/7Ts3NVhTA1E/default.jpg","False","False","Видео со взвешивания к бою Нурмагомедов vs Гэтжи заставляет еще раз поговорить о том, как Хабиб Нурмагомедов за 36 часов между взвешиванием и боем успевает превратиться в самого опасного бойца планеты. Лютиков в инстаграме: https://instagram.com/a_lutikovПодпишись на «Разрешите вас перебить»: https://www.youtube.com/channel/UCYRWYBFzbMhYVcCti081TFw?sub_confirmation=1Бой Хабиб Нурмагомедов vs Джастин Гэтжи за титул чемпиона UFC в легком весе пройдет 24 октября 2020 года в Абу-Даби на турнире UFC 254. Хабиб Нурмагомедов, 32 года. Статистика в ММА: 28 побед, 0 поражений. Чемпион UFC в легком весе. Джастин Гэтжи, 31 год. Статистика в ММА: 22 победы, 2 поражения. Временный чемпион UFC в легком весе. Прямая трансляция боя Нурмагомедов - Гэтжи пройдет на канале РЕН ТВ.#хабиб #ufc254 #нурмагомедов","5M36S"
"qxOeWuAHOiw","Joe Rogan Experience #1554 - Kanye West","2020-10-24T17:00:07Z","UCzQUP1qoWDoEbmsQxvdjxgQ","PowerfulJRE","22","20.25.10","Joe Rogan Experience|JRE|Joe|Rogan|podcast|MMA|comedy|stand|up|funny|Freak|Party|Kanye West|Joe Rogan|JRE #1554|comedian|President|Yeezy|2020","4012351","175086","11826","71801","https://i.ytimg.com/vi/qxOeWuAHOiw/default.jpg","False","False","Kanye West is a rapper, record producer, fashion designer, and current independent candidate for office in the 2020 United States Presidential Election. @Kanye West","2H57M29S"
"fV-gL0Q_qn0","КАК РУССКИХ И РОССИЮ ПОКАЗЫВАЮТ В АНИМЕ??? (Афрорусский и Владивосток!)","2020-10-23T16:39:37Z","UCUFl0SxF14-eZGTxhWuhM8Q","Уголок Акра","24","20.25.10","дюрара|Durarara|blood|акр|разбор|ссср|анимация|призидент|опенинг|топ","204933","26668","328","1671","https://i.ytimg.com/vi/fV-gL0Q_qn0/default.jpg","False","False","Качай World of Warships и Играй бесплатно на ПК - https://wo.ws/36C7qn0 и на Консолях: World of Warships: LegendsМОЙ ИНСТАГРАМ - https://www.instagram.com/akrkutachovМОЙ ПРОФИЛЬ ВК - https://vk.com/akr815МОЯ ГРУППА ВК - https://vk.com/akrobzor","12M15S"
"rolTXm8wXRU","Ольга Бузова и Дмитрий Соловьев - Романс. Ледниковый период 2020.  24.10.2020","2020-10-24T17:45:01Z","UCR7_eJ_lYr7CedzMmgLIRyA","Ледниковый Период","24","20.25.10","Спорт|Фигурно-катание|Шоу-бизнес|Ольга Бузова|Дмитрий-оловьев|лед|коньки|фигурист|жюри|шоу|телеведущая","167193","3495","303","887","https://i.ytimg.com/vi/rolTXm8wXRU/default.jpg","False","False","На льду – телеведущая и певица Ольга Бузова и олимпийский чемпион Дмитрий Соловьев. Они выступают под песню «Романс» в исполнении Владимира Преснякова.Ледниковый период 2020. Новый сезон. За кадром. https://www.youtube.com/playlist?list=PL4UofAt2BXnMqrfbgc3fqJM-CJCb4mOOeУчастники 03.10.2020. Ледниковый период 2020.https://www.youtube.com/playlist?list=PL4UofAt2BXnNMM3JReyWwFsg_p4XFujjVУчастники. 10.10.2020. Ледниковый период 2020. https://www.youtube.com/playlist?list=PL4UofAt2BXnOQNUMfBrwsnG7B48j-x4DVУчастники. 17.10.2020. Ледниковый период 2020.  https://www.youtube.com/playlist?list=PL4UofAt2BXnMGxYgaU6yWAGusB4CvS_JEУчастники. 24.10.2020. https://www.youtube.com/playlist?list=PL4UofAt2BXnNOne8rcb_nOvJ3wy5iu45P","11M28S"
"UK7F_89A4aY","Научили летать беспилотник - но вот сколько он КУШАЕТ на минималках ???","2020-10-24T08:30:15Z","UCb9_Bhv37NXN1m8Bmrm9x9w","Игорь Негода","28","20.25.10","российский беспилотник|самолет на водороде|тяжелый беспилотный|russian drone|hydrogen airplane","231192","24314","232","1781","https://i.ytimg.com/vi/UK7F_89A4aY/default.jpg","False","False","В этом видео мы, энтузиасты из города Ростов на Дону проводим испытания довольно большого и тяжелого самолета и при этом хотим чтоб он потреблял очень мало энергии в полете. ОЧЕНЬ ХОТИМ !!!","22M41S"
"2eg5X0_5-EM","КУПИЛ IPHONE 12 ЗА 79990 РУБЛЕЙ - ЧТО ИЗМЕНИЛОСЬ И ПОЧЕМУ ТАК ДОРОГО?","2020-10-23T08:47:08Z","UCs2DTZsK_6t6JD-m3yTapxg","DimaViper","28","20.25.10","[none]","297661","16120","1469","3905","https://i.ytimg.com/vi/2eg5X0_5-EM/default.jpg","False","False","Обзор смартфона Apple iPhone 12 - отзыв, плюсы и минусы телефонаКупить Oukitel C21-http://ali.pub/55i7qaКупить Honor 9X Lite-http://ali.pub/553ubaКупить Cubot Note 7-http://ali.pub/54tffvКупить Poco X3 NFC-http://ali.pub/52y1rnКупить Redmi 9C-http://ali.pub/51qa9yКупить Redmi 9A-http://ali.pub/4yb1hiКупить Umidigi A7 Pro-http://ali.pub/4wa8ybКупить Poco f2 pro-http://ali.pub/4w791pКупить Ulefone Note 8P-http://ali.pub/4w40jjКупить Redmi Note 9-http://ali.pub/4uzuucКупить Redmi 9-http://ali.pub/4upu30Купить Redmi Note 9 Pro-http://ali.pub/4uf3qzКупить Oukitel C18 Pro-http://ali.pub/4udzasКупить Redmi Note 8 Pro-http://ali.pub/4t4c87Купить Redmi Note 8T-http://ali.pub/4si28bКупить Redmi Note 9S-http://ali.pub/4sd8zwКитайская версия Redmi 8A с глобальной прошивкой-http://ali.pub/4sgehkRealme 5i-http://ali.pub/4pl4m9Meizu Note 9-http://ali.pub/4pl4pdHonor 9X-http://ali.pub/4pl4utRedmi Note 8 Pro-http://ali.pub/4pl4w6Redmi Note 8T-http://ali.pub/4pl4ybiPhone 4S-http://ali.pub/3hifrjiPhone 5c-http://ali.pub/3fhhuhiPhone 5-http://ali.pub/3fhhv2iPhone 5s-http://ali.pub/3fhi0biPhone 6-http://ali.pub/3fhi3miPhone SE-http://ali.pub/3fhi74iPhone 6s-http://ali.pub/3fhi9giPhone 6 Plus-http://ali.pub/3fhibsiPhone 6s Plus-http://ali.pub/3fhiepiPhone 7-http://ali.pub/3fhihmiPhone 7 Plus-http://ali.pub/3fhikjiPhone 8-http://ali.pub/3fhirciPhone 8 Plus-http://ali.pub/3fhiu2iPhone X-http://ali.pub/3fhiw0Группа вк-https://vk.com/mrdimaviperОформление ютуб каналов-https://vk.com/sotrexdesignМоя партнерка-https://youpartnerwsp.com/join?13760Мой 2 канал-https://www.youtube.com/channel/UCY_5y5X34AxL_uWTPNndxogСамый лучший кэшбек-https://letyshops.com/soc/sh-1?r=8839070Мой instagram-https://www.instagram.com/dimaviper_youtube/#apple #iphone12 #айфон12 #dimaviper #телефон #эпл #iphone12обзор","36M53S"
