video_id,title,publishedAt,channelId,channelTitle,categoryId,trending_date,tags,view_count,likes,dislikes,comment_count,thumbnail_link,comments_disabled,ratings_disabled,description,duration
"s84NzZ4ShoY","Nain Katore | The Haryanvi Mashup 2.5 (THM 2.5) Gurmeet Bhadana, Desi King, Baba B,Totaram, Lokesh G","2020-12-22T05:33:20Z","UCQuLyitHTE9LfUAxlhDfgig","White Hill Dhaakad","10","20.27.12","Gaanth maarlo kaan pe saare ho jao taiyar|Nain katore pagal hore mein to sab kuch haar gaya|Nain katore|THM 2.5|THM 2020|The haryanvi mashup|The Haryanvi Mashup 2.5|I am Desi World|Lokesh Gujjar|Gurmeet Bhadana|Desi King|Baba Bhairupia|New Haryanvi Songs 2020|new haryanvi songs haryanavi 2020|haryanvi songs haryanavi dj|dj songs|haryanvi dj songs|haryanvi gaane|haryanvi song|haryanvi songs 2020|latest haryanvi songs|haryanvi|हरियाणवी|हरियाणवी सॉन्ग","4751243","121825","7693","4028","https://i.ytimg.com/vi/s84NzZ4ShoY/default.jpg","False","False","New Haryanvi Songs Haryanavi 2020 Nain Katore The Haryanvi Mashup 2.5 | Gurmeet Bhadana | Desi King | Baba Bhairupia | Totaram | Lokesh Gurjar | Pragati VermaWhite Hill Dhaakad presents new Haryanvi DJ Song The Haryanvi Mashup 2.5 (THM 2.5) Nain Katore. Sung by Totaram Sondhiya Baba Bhairupia,Archana Singh.Music by Desi King.Lyrics by Gurmeet Bhadana, Baba Bhairupia.Rap by Lokesh Gurjar, Gurmeet Bhadana , Desi King.We value our audience and that's why we came with something exceptional for you .We hope that this will make you grin and dance.Click to share on Facebook: http://bit.ly/3mGO7NUAlso Available On :-►Apple Music:  https://geo.itunes.apple.com/at/album/id1544801533►iTunes : https://geo.itunes.apple.com/at/album/id1544801533?at=1l3v9Tx&app=itunes►JioSaavn : https://www.saavn.com/s/song/hindi/Challiya/Challiya/FSFGZyB-fmM►Gaana : https://gaana.com/song/the-haryanvi-mashup-25 ►Amazon Music : https://www.amazon.de/-/en/dp/B08QJLCD9M/ref=sr_1_1?__mk_de_DE=%EF%BF%BDM%EF%BF%BDZ%EF%BF%BD%EF%BF%BD&dchild=1&keywords=The+Haryanvi+Mashup+2.5&qid=1608612564&s=dmusic&sr=1-1&x=0&y=0►Amazon Prime Music : https://music.amazon.in/albums/B08QJK1Q4D?marketplaceId=A21TJRUUN4KGV&musicTerritory=IN&trackAsin=B08QJHXYKW►Spotify : http://open.spotify.com/album/0NRCJPzTHcu69YQYUUJdRG►YouTube Music : https://music.youtube.com/watch?v=0rCinKoiylc&feature=share►Hungama : https://www.hungama.com/song/the-haryanvi-mashup-2-5/61005737/►Resso :  https://m.resso.app/ZSnQVYGm/Credits :Song : The Haryanvi Mashup 2.5 ( THM 2.5 )Singer : Totaram Sondhiya , Baba BhairupiaFemale Vocals: Archana SinghMusic: Desi King Lyrics: Gurmeet Bhadana, Baba BhairupiaRap : Lokesh Gurjar, Gurmeet Bhadana , Desi KingMix: Desi King Master : D ChanduArtists : Pragati, Anoop Chahal , Phupa Phool Singh Directed by : Gurmeet BhadanaCo - Directed by : Desi KingD.O.P : Video Doctor DaljeetPost Production : Suyash Chhabra (The Showman Studio)Mua : Naitik Dance Group : Mohit Sharma Management : Aedal GurjarWardrobe : I am Desi World Special thanks : Gurgaon TalkiesSocial Media Promotions : HOT(Hub Of Talent)Produced By : Gunbir Singh Sidhu & Manmord SidhuLIKE || SHARE || SUBSCRIBE--------------------------------------Follow I am Desi World --------------------------------------Instagram : http://www.instagram.com/iamdesiworldFacebook  : https://www.facebook.com/iamdesiworldTwitter       : http://www.twitter.com/iamdesiworld-----------------------------------Follow Lokesh Gujjar -----------------------------------Instagram : http://www.instagram.com/LokeshGurjarFacebook  : http://www.fb.com/LokeshBhatiGurjarTwitter : http://www.twitter.com/lokegurjar------------------------------------------Follow Gurmeet Bhadana------------------------------------------Facebook  : https://www.facebook.com/GurmeetbhadanaInstagram : https://www.instagram.com/gurmeetbhadanahttp://www.twitter.com/gurmeetbhadana-----------------------------Follow Desi King-----------------------------Facebook  : https://www.facebook.com/DesikingofficialInstagram : https://www.instagram.com/desikingofficial-------------------------------------Follow Baba Bhairupia-------------------------------------Facebook  : https://www.facebook.com/bababhairupiaInstagram : https://www.instagram.com/bababhairupiaSubscribe us on :-YouTube : https://www.youtube.com/channel/UCQuLyitHTE9LfUAxlhDfgig?view_as=subscriberFacebook : - https://www.facebook.com/White-Hill-Dhaakad-100157068292167/Instagram : https://www.instagram.com/whitehilldhaakad/?hl=enWebsite : https://www.whitehillstudios.comPublished Year : 2020Copyright : White Hill Beats Private LimitedF-545,1st Floor,Phase -8A Industrial Area,Mohali - 160059Gaanth maarlo kaan pe saare ho jao taiyar,Nain katore pagal hore mein to sab kuch haar gaya,Nain katore,THM 2.5,THM 2020,The haryanvi mashup,The Haryanvi Mashup 2.5,I am Desi World,Lokesh Gujjar,Gurmeet Bhadana,Desi King,Baba Bhairupia,New Haryanvi Songs 2020,new haryanvi songs haryanavi 2020,haryanvi songs haryanavi dj,dj songs,haryanvi dj songs,haryanvi gaane,haryanvi song,haryanvi songs 2020,latest haryanvi songs,haryanvi,हरियाणवी,हरियाणवी सॉन्ग","4M44S"
"y8kdfkX16qo","Popping 1000 Balloons - Yes  We Are Mad 😎","2020-12-26T15:00:06Z","UCSiDGb0MnHFGjs4E2WKvShw","MR. INDIAN HACKER","28","20.27.12","balloon pop|popping balloons|big|big balloons|super|super size balloons|monster balloon|mr indian hacker|mr. indian hacker|giant balloons|pop|popping","1364548","238791","5384","10422","https://i.ytimg.com/vi/y8kdfkX16qo/default.jpg","False","False","In this video we inflate 1000 balloons and pop them lol. Some Of The Videos That You Will Love.1. हमारी कार पलट गई - Crazy Modification In Our Car     https://youtu.be/-j4jSlI4Sk82. Only For Titanium Army - Color Explosion     https://youtu.be/sSW9GQQ0PAU3. चलती गाड़ी में लगा दी आग - Ghost Rider Bike 100% Real     https://youtu.be/VWamm8YvmNM4. बड़े VIP ने मचाया कार में धमाल - Big Vip Vs Our Car Experiment     https://youtu.be/8iETO5EgIMs5.  Testing NASA Rocket Fuel - असली रॉकेट ईधन ने मचाया धमाल      https://youtu.be/RNv3kcA0kKU6.  Running Bike On Deodorant - Shocking But 100% Working       https://youtu.be/hWL_oemgAk07.  We Made India's Biggest Parachute - Gone Out Of control     https://youtu.be/boBJzML_1UI8.  We Fly India's Biggest Hot Air Balloon - Worth ₹ 1Crore...      https://youtu.be/SLA-KwFSw009.  Flying India's Biggest Water Bottle Rocket      https://youtu.be/WcqrkHdYBfc10. अब होगा असली धमाल - Coca Cola Rocket Chain Reaction       https://youtu.be/PgB71tKj2wgWarning -  This Video Is Just For Entertainment And Fun Purposes Only Plz Don't Try To Do Or Recreate Any Action Shown In This Video Just Watch And Enjoy.       Love You Titanium Army Follow Us on -INSTAGRAM: https://www.instagram.com/dilraj_singh_rawat/FACEBOOK: https://www.facebook.com/mrindianhacker00TWITTER: https://twitter.com/MR_INDIANHACKERThanks For Visit Have Fun","4M26S"
"HzW2s1em8AE","The Indian Santa, Girlfriend Aur Wishes | Guddu Bhaiya","2020-12-22T07:29:47Z","UCFLTZgzWmWs1DmdWJWCE3_g","Guddu Bhaiya","24","20.27.12","the indian santa|secret santa|when santa claus visited india|santa ka taufa|santa funny video|Christmas special|desi santa claus|desi santa|funny video|viral video|trending|if santa came to india|if santa was punjabi|viral|guddu|guddu bhaiya|vibhu|vibhu varshney|the perfect gift|christmas funny video|hindi funny video|hindi comedy video|comedy|fun|funny|funniest|ridhu pidhu","1424492","17521","4153","1108","https://i.ytimg.com/vi/HzW2s1em8AE/default.jpg","False","False","Connect with me on Instagram !https://www.instagram.com/dilsepaneerHello Guys ! Merry Christmas !I am here again with a new video which is  The Indian Santa, Girlfriend aur Wishes  !In this video, I showed various kinds of wishes that I asked from the Santa Claus !This video is just for the entertainment purpose only.I hope you enjoy !Cast - Vibhu VarshneyValence KundraHimanshi AroraHridyansh (Ridhu Pidhu)Edit by Vibhu VarshneyManaged by Pankaj SharmaThank you for watching !#TheIndianSanta #ChristmasSpecial #SantaClaus","9M29S"
"dOt8mdGUM9o","Antim: The Final Truth - First Look | Salman Khan | Aayush Sharma | Releasing 2021","2020-12-21T08:29:19Z","UCz3Mq_cS7AVRatrpGQi7QUQ","Salman Khan Films","24","20.27.12","antim|antim teaser|antim trailer|antim first look|Antim - The Final truth|salman khan|aayush sharma|mahesh ma|Mahesh Manjrekar|Antim Salman Khan|Antim Aayush Sharma|Mahima Makwana|antim shoot|salman khan films|Salman Khan in Antim|Salman Khan Antim look|antim movie|antim the final truth movie|antim action scene|Salman Khan Aayush Sharma|Salman Aayush action scene|skf","4486323","201170","96825","24758","https://i.ytimg.com/vi/dOt8mdGUM9o/default.jpg","False","False","Unveiling the first look of Aayush Sharma from Antim: The Final Truth. Aayush as the lead of this two hero film, undergoes full body transformation to bring out a never seen before gritty avtar.#SalmanKhan #AayushSharma #AntimTheFinalTruth #AntimFirstLook  Enjoy & stay connected with us!►Subscribe to SKF: http://bit.ly/SKFYouTube► Like us on Facebook: https://www.facebook.com/SKFilmsOfficial► Follow us on Twitter: https://twitter.com/skfilmsofficial► Follow us on Instagram: https://www.instagram.com/skfilmsofficial/","36S"
"WTzpbDSwA4Q","Pinjara Khubsurti Ka | पिंजरा खुबसूरती का | Episode 90 & 91 | Recap","2020-12-26T07:30:31Z","UC55IWqFLDH1Xp7iu1_xknRA","Colors TV","24","20.27.12","colors tv serials all|colors tv promo|colors tv new serial|colors tv naagin|colors tv khatron ke khiladi|bigg boss|hindi shows|कलर्स टीवी|comedy show|horror show|crime show|reality show|Colors TV|full episodes|colors hindi full show|Pinjara Khubsurti|Bhoomika Mirchandani|voot|pinjra khoobsurti ka|pinjra khubsurti ka serial|pinjra khubsurti ka|latest episode|new episode","695782","6719","529","98","https://i.ytimg.com/vi/WTzpbDSwA4Q/default.jpg","False","False","Mayura prevents the attack on Omkar by alerting him at the right time. However, the mysterious attacker escapes and Omkar chases after him. Will he get hold of the attacker and uncover Aishwarya's plot?#ColorsTV #PinjaraKhubsurtiKaTo subscribe this channel go to: http://www.youtube.com/subscription_center?add_user=colorstvTo download the Voot app please click on the link :IOS: https://apps.apple.com/in/app/voot/id1011777157Android: https://play.google.com/store/apps/details?id=com.tv.v18.violaFire TV: https://www.amazon.in/Viacom18-Media-Pvt-Ltd-Originals/dp/B01N2PCGG3/ref=sr_1_1?dchild=1&keywords=voot+tv&qid=1595417708&s=mobile-apps&sr=1-1To go to the show playlist please click: https://www.youtube.com/playlist?list=PLcC6hSpO26Ku74uKKTMfTwGCDH6MWTzz5Follow us on: Facebook: https://www.facebook.com/ColorsTVInstagram: https://www.instagram.com/colorstv/Mayura is the epitome of beauty, grace and intelligence, but the world only sees her beauty. Trapped in a cage by a society that judges by looks, Mayura yearns for her freedom to fly free. What happens to her fight for individuality when she ends up in a marriage with Omkar, a control freak obsessed with her beauty? Will he ever see his wife beyond her physical form? Will Mayura ever fulfil her own dreams? Or will she remain trapped in her beautiful pinjaraa for life?The accuracy, completeness, currency and/or suitability of the above video description is not endorsed by its licensor or broadcaster or the Channel. They shall not be liable for loss and/or damage arising from the video description.","10M16S"
"nPqVhYX7S5w","Cheap Vs Expensive Vs Nothing Gift Challenge | Christmas Special Challenge | Hungry Birds","2020-12-25T08:57:59Z","UCTLZ1jlmY-VogpQXng48iKQ","Hungry Birds","27","20.27.12","christmas challenge|christmas challenge hungry birds|cheap vs expensive food|cheap vs expensive|cheap vs expensive christmas gifts|cheap vs expensive gifts|food challenge india|hungry birds channel|hungry birds travel|hungry birds challenge in hindi|hungry birds challenge new video|hungry birds new video|hungry birds new video 2020|hungry birds new video 2019|hungry birds new show","2256885","115623","5327","11864","https://i.ytimg.com/vi/nPqVhYX7S5w/default.jpg","False","False","For Latest Updates of Our Life Please FollowInstagram - https://www.instagram.com/the_hungry_birds_official/Facebook = https://www.facebook.com/hungrybirds4 Cast=Sanket,Akshada,Umesh,PritiEdited By=Saurabh SawantDirected By = Umesh,Sanket,PritiBackground Music By -Epidemic Sound#HungryBirds #FoodChallengeIndia #ChristmasChallenge","24M26S"
"pef6efjv2k4","Shakti | शक्ति | Episode 1138 & 1139 | Recap","2020-12-26T07:30:22Z","UC55IWqFLDH1Xp7iu1_xknRA","Colors TV","24","20.27.12","colors tv serials all|colors tv promo|colors tv new serial|colors tv naagin|colors tv khatron ke khiladi|bigg boss|hindi shows|कलर्स टीवी|comedy show|horror show|crime show|reality show|shakti|shakti colors tv|shakti colors serial|शक्ति|हरमन सिंह|soumya|rubina dilaik|vivian dsena|jigyasa singh|sudesh berry|kamya punjabi|heer singh|preeto|kinnar|शक्ति सीरियल|शक्ति सीरियल शुरू से|sony tv|sonyliv|romantic hindi show","759676","6699","639","92","https://i.ytimg.com/vi/pef6efjv2k4/default.jpg","False","False","Mallika arrives to take Heer away and have her be a part of their transgender group, as she feels that Heer's gender identity being revealed has put a strain on all her relationships. Meanwhile, Preeto and the others attempt to persuade Mallika to leave Heer alone. Will Preeto be able to convince Mallika?#ColorsTV #ShaktiTo subscribe this channel go to: http://www.youtube.com/subscription_center?add_user=colorstvTo download the Voot app please click on the link :IOS: https://apps.apple.com/in/app/voot/id1011777157Android: https://play.google.com/store/apps/details?id=com.tv.v18.violaFire TV: https://www.amazon.in/Viacom18-Media-Pvt-Ltd-Originals/dp/B01N2PCGG3/ref=sr_1_1?dchild=1&keywords=voot+tv&qid=1595417708&s=mobile-apps&sr=1-1To go to the playlist please click: https://www.youtube.com/playlist?list=PLcC6hSpO26KvW8epq68trmgmuFgW1dWBYFollow us on: Facebook: https://www.facebook.com/ColorsTVInstagram: https://www.instagram.com/colorstv/Set against the backdrop of culturally rich and vibrant Punjab, Shakti-Astitva Ke Ehsaas Ki portrays the power of a family to dictate the fate of its daughters, Soumya and Surbhi. Deprived of an education, companions and toys, Soumya can't understand the indifference her father and Dadi show towards her and finds solace only in her mother's arms. Meanwhile Surbhi gets everything she wants, except for the one thing she yearns for-her mother's love. What has caused these heart-breaking rifts in this otherwise perfect family? What makes parents discriminate between their own daughters? Watch the mystery unfold.The accuracy, completeness, currency and/or suitability of the above video description is not endorsed by its licensor or broadcaster or the Channel. They shall not be liable for loss and/or damage arising from the video description.","10M6S"
"U8GW69_enac","Mini Foods that You can Eat","2020-12-21T08:33:43Z","UCtyltqstMm6iKnkk2Y9Zt8A","Wanderers Hub","22","20.27.12","mini food cooking|diy miniature food|diy mini food real|miniature cooking pizza|mini food that you can eat|troom troom miniature food vs giant food|mini food that is real|mini food that you can actually eat|how to make mini food that you can eat|tiny food cooking|tiny food that you can eat|hindi food videos|5 minute crafts food hacks|wanderershub|triggered insaan|5 minutes crafts|5 minute crafts food|laughing out loud|giant foods that you can eat","3778197","237900","8515","15058","https://i.ytimg.com/vi/U8GW69_enac/default.jpg","False","False","IC bitly -  https://bit.ly/wandereryt Amazon link - https://amzn.to/2BGhjmMToday, we are going to try and make mini and tiny foods that is so satisfying. #Minifoods #5MinuteCrafts SUBSCRIBE!!! . . Read my travel stories: https://www.wanderershub.com/ Facebook - https://www.facebook.com/WHtravel/ Twitter - https://twitter.com/HubWanderers Instagram - https://www.instagram.com/wanderershub/ Pinterest - https://in.pinterest.com/WandererHub/ ..About Me ► My name is Prerna Malhan. I'm from Delhi and I'm a WRITER. Now I am pursuing Youtube full-time. I make entertainment and travel videos on this channel. Thanks for reading.","11M55S"
"aTR_CViIqnE","KARONA (Official Video) by ARUN SOLANKI feat. ANJALI ARORA | MUKKU | DINESH SOI |LATEST PUNJABI SONG","2020-12-24T03:30:17Z","UCpMoGK8pm4nuNERpX6_DwOQ","Worldwide Records PUNJABI","10","20.27.12","Punjabi New Songs|Punjabi Videos|Worldwide Records|Punjabi new song|punjabi world|punjabi boliyan|PUNJAB|super punjab|new punjabi song|new punjabi song 2020|dj song|dj punjab|lamborghini song|phool song|new punjabi hits|latest punjabi song|punjabi song 2020|Worldwide Records Punjabi|Latest Punjabi Song|Karona|Arun Solanki|Anjali Arora|Latest Hindi Song|New Trending Song|New Punjabi Song|karona arun solanki|arun solanki karona|latest hindi songs","2306632","36388","2376","3119","https://i.ytimg.com/vi/aTR_CViIqnE/default.jpg","False","False","Subscribe Worldwide Records Punjabi 👉 https://bit.ly/3btPDhUStarring : Arun Solanki & Anjali Arorahttps://www.instagram.com/arunsolankiofficial  https://www.instagram.com/anjimaxuofficiallySinger : Arun Solanki Music : STK https://www.instagram.com/musicstkofficialLyrics & Composer : Mukku  https://www.instagram.com/mukkumusicDirected By & Project By: Dinesh Sudarshan Soi  https://www.instagram.com/dineshsoiofficial............................................................► Stream the Full Song ► Wynk : http://bit.ly/2WHGEU0Gaana : http://bit.ly/2WCEN2USpotify : Coming Soonitunes : http://apple.co/3pn1PabSaavn : Coming SoonHungama : http://bit.ly/3mKtj7WAmazon Music : Coming SoonMusic Youtube :https://bit.ly/37IJCOwKKBOX : http://bit.ly/38xw6MH............................................................DOP : Hardeep SinghEditor: Monty @montyeditorChoreographer : Ronit Sharma @ronit8171 & Ricky Chawla @rickychawla86 Casting & Social Media Promotions: Team DS Creations™️ Creative Director: @soniamalhotrasoiMakeup & Styling By: Shweta Arora @shwetaaroramakeoversWardrode By: Emperior By Arun Solanki @emperiorbyarunsolankiJacket By: Tigdam By Arun Solanki @tigdam_by_arunsolankiPresentation: Manish Mehta @iammanishmehtaLocation: Arnav Resort, Jurasik Park Inn @arnavresortTerminal C @terminal_cPoster Design: @rahuldevphotographySpecial Thanks: Chandan Bakshi @chandanbakshi01Executive Producer : Deepak Soi Conceived By : Sumit Bhardwaj Producer : Ratnakar Kumar LABEL : WORLDWIDE RECORDS -------------------------------------------------------------------------------------------------https://www.instagram.com/dop_hardeep_singhhttps://www.instagram.com/rickychawla86 https://www.instagram.com/ronit8171https://www.instagram.com/dscreationsofficialhttps://www.instagram.com/soniamalhotrasoihttps://www.instagram.com/shwetaaroramakeovershttps://www.instagram.com/emperiorbyarunsolankihttps://www.instagram.com/tigdam_by_arunsolankihttps://www.instagram.com/iammanishmehta https://www.instagram.com/sumitbhardwajofficialhttps://www.instagram.com/ratnakarwwrindiahttps://www.instagram.com/worldwiderecordspunjabi-------------------------------------------------------------------------------------------------📱Contact Office : 9373694924 , 9321157080 , 9820441454👉 Subscribe Our Channel - https://bit.ly/3btPDhU👉Follow us  - https://www.instagram.com/sumitbhardwajofficial👉Follow us - https://www.instagram.com/worldwiderecordspunjabi👉  Like us on -https://www.facebook.com/WorldwideRecordsPunjabiProducer - RATNAKAR KUMAR :https://www.instagram.com/ratnakarwwrindia#KARONA #LATESTPUNJABISONG2020","2M28S"
"Dvk0-srSkLs","Ishq Mein Marjawan S2 | इश्क़ में मरजावाँ | Episode 148 & 149 | Recap","2020-12-26T07:30:16Z","UC55IWqFLDH1Xp7iu1_xknRA","Colors TV","24","20.27.12","colors tv serials all|colors tv promo|colors tv new serial|colors tv naagin|colors tv khatron ke khiladi|bigg boss|hindi shows|कलर्स टीवी|comedy show|horror show|crime show|reality show|ishq mein marjawan season 2|ishq mein marjawan colors tv|इश्क़ में मरजावाँ|romantic thriller|colors tv thriller show|helly shah|riddhima|murder|mystery|suspect|arjun bijlani|ishq mein marjawan theme song|sony tv|sonyliv|star plus|romantic hindi show","747792","10757","460","157","https://i.ytimg.com/vi/Dvk0-srSkLs/default.jpg","False","False","Riddhima is out of the hospital and Vansh decides to take her to a special location and spend quality time with her. However, Riddhima plans to reveal the truth about her entry into Vansh's life before starting everything afresh with him. Will Vansh accept Riddhima after learning her secret?#ColorsTV #IshqMeinMarjawanTo subscribe this channel go to: http://www.youtube.com/subscription_center?add_user=colorstvTo download the Voot app please click on the link :IOS: https://apps.apple.com/in/app/voot/id1011777157Android: https://play.google.com/store/apps/details?id=com.tv.v18.violaFire TV: https://www.amazon.in/Viacom18-Media-Pvt-Ltd-Originals/dp/B01N2PCGG3/ref=sr_1_1?dchild=1&keywords=voot+tv&qid=1595417708&s=mobile-apps&sr=1-1To go to the playlist please click: https://www.youtube.com/playlist?list=PLcC6hSpO26KuzynY3nmk5YdPA718YPX2aFollow us on: Facebook: https://www.facebook.com/ColorsTVInstagram: https://www.instagram.com/colorstv/She had the perfect life, the perfect man but little did she know that she was walking into the perfect trap. What happens when the man you love turns out to be a genius manipulator? Watch now.The accuracy, completeness, currency and/or suitability of the above video description is not endorsed by its licensor or broadcaster or the Channel. They shall not be liable for loss and/or damage arising from the video description.","10M3S"
