video_id,title,publishedAt,channelId,channelTitle,categoryId,trending_date,tags,view_count,likes,dislikes,comment_count,thumbnail_link,comments_disabled,ratings_disabled,description,duration
"81ATTogt6sw","അഞ്ജലിക്ക് മുന്നിൽ ജയിക്കാൻ ശിവന്റെ കിടിലൻ ബുദ്ധി..","2020-12-26T14:00:41Z","UCp_r6Z-Oh0YTf-ym71z5Nqg","Asianet","24","20.27.12","Santhwanam|asianet|asianet serials|malayalam serials|new serial|chippy|Sandwanam|Sandhwanam|Santhwanam serial|Santhwanam asianet serial|Santhwanam hotstar|Santhwanam asianet|Santhwanam Hotstar|Popular serial Santhwanam|Watch Santhwanam Serial|Santhwanam Latest Episode|Santhwanam Full Episode|Santhwanam Serial Online|Chippy|Rajeev Parameshwar","872450","12077","294","388","https://i.ytimg.com/vi/81ATTogt6sw/default.jpg","False","False","അങ്ങനെ സ്വന്തം മുറിയിൽ നിന്നും ഇറങ്ങിപ്പോകാൻ ഒന്നും ശിവനെ കിട്ടില്ല! അഞ്ജലിക്ക് മുന്നിൽ ജയിക്കാൻ ശിവന്റെ കിടിലൻ ബുദ്ധി..Santhwanam || Mon to Sat at 7 PM || Asianet#Santhwanam #Chippy #Asianet #SisterLove #AsianetSerials #MalayalamSerials #RajeevParameshwar #Sreedevi #Shivanjali","1M24S"
"MkS2Mq-v8SM","B.Tech | Malayalam Sketch | Arun Pradeep","2020-12-24T14:37:41Z","UCAtHvaOVgCf28z79vUJm-bg","Arun Pradeep","23","20.27.12","arun pradeep|karikku|arun pradeep karikku|btech|arun pradeep btech|b.tech","464706","65135","643","3825","https://i.ytimg.com/vi/MkS2Mq-v8SM/default.jpg","False","False","Cast :Arun Pradeep - https://www.instagram.com/arunpradeepmusicDhanya Dhanapalan - https://www.instagram.com/dhanya_lachu31Bindhu RNamitha Pradeep https://www.instagram.com/_namitha_pradeep","6M49S"
"gydXy1NNPL4","Kundanapu Bomma || Episode - 4 || Sheetal Gauthaman || Srividya || Yuva Chandra || Infinitum Media","2020-12-24T14:45:34Z","UC91nMMzLsVOt--za8U61PnQ","Sheetal Gauthaman","24","20.27.12","sheetal|sheetal gauthaman|infinitum|sheetal gauthaman short films|sheetal gauthaman latest short films|sheetal gauthaman new|sheetal gauthaman latest|sheetal single video|infinitum media|Kundanapu Bomma|latest telugu short films|telugu comedy videos|telugu web series|Srividya Software Devloveper|Sri vidya software developer|Srividya Shanmukh|sheetal gauthaman videos|kundanapu bomma episode 1|kundanapu bomma episode 2|kundanapu bomma episode 3","722169","23950","1036","1810","https://i.ytimg.com/vi/gydXy1NNPL4/default.jpg","False","False","From the creators of #SoftwareDevLOVEper comes a new web series #KundanapuBomma starring #SheetalGauthaman, #SrividyaMaharshi, #YuvaChandra and #ChanduJC. A rich successful brat chances upon a hapless yet independent woman and decides to change her life... only to prove a point! What she makes of the lemons he aims at her and her tryst with destiny is what makes her Kundanapu Bomma.Cast : Sheetal Gauthaman, Yuva Chandra, Srividya Maharshi, Chandu JC, Avinash, Suhani Mehra, Madhu, Sai Kiran YedidaStory & Written bySD ChadaDirectorPavan YenagandulaDOPCharles RajEditing, Colour Grading & SFXVenkatesh ChunduruMusic & MixingSrujan ShashankaViolinSandilya PisapatiTitle Animations & VfxNikhil KumarPoster DesignerDesign ManchuSound EngineerNalli Vamshi Vinod (Nani)Costume DesignerAnusha DevaraProducer Infinitum Media#Infinitum #SheetalGauthaman","27M38S"
"04hIqD3xLDs","Bigg Boss Tamil Season 4  | 26th December 2020 - Promo 3","2020-12-26T13:30:00Z","UCvrhwpnp2DHYQ1CbXby9ypQ","Vijay Television","24","20.27.12","biggboss|tamil|vijay television|starvijay|Ulaganayagan|தமிழ்|விஜய் டிவி|தொலைக்காட்சி|Tamil TV|Tamil Shows|Redefining Entertainment|Star|Star Vijay TV|Vijay TV|hotstar|Kamal Haasan|Bigg Boss|Bigg Boss Tamil 4|பிக்பாஸ்|பிக்பாஸ் 4|Bigg Boss Season 4|Teaser","2500309","58756","1917","9985","https://i.ytimg.com/vi/04hIqD3xLDs/default.jpg","False","False","#BiggBossTamil #BiggBossTamil4 #BB #BiggBoss4 #Promo #BiggBossSeason4 #BB4 #BiggBoss #VijayTV #VijayTelevision #StarVijayTV #StarVijay #TamilTV #RedefiningEntertainment #BiggBoss #BiggBossTamil #KH #Kamal #KamalHaasan #UniversalHero #Eviction #Nomination #BiggBossTamilPromo #Promo பிக்பாஸ் - தினமும் இரவு 9:30 மணிக்கு நம்ம விஜய் டிவில.. Click here https://www.hotstar.com/in/tv/bigg-boss/14455 to watch the full episode","36S"
"iIEmlcrnHKc","കൃഷ്ണാ സ്‌റ്റോഴ്‌സിൽ വച്ച് ശിവനും അഞ്ജലിയും വീണ്ടും കണ്ടുമുട്ടുന്നു..!","2020-12-26T14:00:52Z","UCp_r6Z-Oh0YTf-ym71z5Nqg","Asianet","24","20.27.12","Santhwanam|asianet|asianet serials|malayalam serials|new serial|chippy|Sandwanam|Sandhwanam|Santhwanam serial|Santhwanam asianet serial|Santhwanam hotstar|Santhwanam asianet|Santhwanam Hotstar|Popular serial Santhwanam|Watch Santhwanam Serial|Santhwanam Latest Episode|Santhwanam Full Episode|Santhwanam Serial Online|Chippy|Rajeev Parameshwar","1293425","21971","472","1203","https://i.ytimg.com/vi/iIEmlcrnHKc/default.jpg","False","False","കൃഷ്ണാ സ്‌റ്റോഴ്‌സിൽ വച്ച് ശിവനും അഞ്ജലിയും വീണ്ടും കണ്ടുമുട്ടുന്നു..!  ഒരുമിപ്പിക്കാൻ ഒരേ മനസ്സോടെ ബാലനും ദേവിയും..Santhwanam || Mon to Sat at 7 PM || Asianet#Santhwanam #Chippy #Asianet #SisterLove #AsianetSerials #MalayalamSerials #RajeevParameshwar #Sreedevi #Shivanjali","1M"
"Y6-LBo0WzlA","Bigg Boss Tamil Season 4  | 26th December 2020 - Promo 2","2020-12-26T11:30:02Z","UCvrhwpnp2DHYQ1CbXby9ypQ","Vijay Television","24","20.27.12","biggboss|tamil|vijay television|starvijay|Ulaganayagan|தமிழ்|விஜய் டிவி|தொலைக்காட்சி|Tamil TV|Tamil Shows|Redefining Entertainment|Star|Star Vijay TV|Vijay TV|hotstar|Kamal Haasan|Bigg Boss|Bigg Boss Tamil 4|பிக்பாஸ்|பிக்பாஸ் 4|Bigg Boss Season 4|Teaser","2901862","61706","1280","8538","https://i.ytimg.com/vi/Y6-LBo0WzlA/default.jpg","False","False","#BiggBossTamil #BiggBossTamil4 #BB #BiggBoss4 #Promo #BiggBossSeason4 #BB4 #BiggBoss #VijayTV #VijayTelevision #StarVijayTV #StarVijay #TamilTV #RedefiningEntertainment #BiggBoss #BiggBossTamil #KH #Kamal #KamalHaasan #UniversalHero #Eviction #Nomination #BiggBossTamilPromo #Promo பிக்பாஸ் - தினமும் இரவு 9:30 மணிக்கு நம்ம விஜய் டிவில.. Click here https://www.hotstar.com/in/tv/bigg-boss/14455 to watch the full episode","36S"
"iIEmlcrnHKc","കൃഷ്ണാ സ്‌റ്റോഴ്‌സിൽ വച്ച് ശിവനും അഞ്ജലിയും വീണ്ടും കണ്ടുമുട്ടുന്നു..!","2020-12-26T14:00:52Z","UCp_r6Z-Oh0YTf-ym71z5Nqg","Asianet","24","20.27.12","Santhwanam|asianet|asianet serials|malayalam serials|new serial|chippy|Sandwanam|Sandhwanam|Santhwanam serial|Santhwanam asianet serial|Santhwanam hotstar|Santhwanam asianet|Santhwanam Hotstar|Popular serial Santhwanam|Watch Santhwanam Serial|Santhwanam Latest Episode|Santhwanam Full Episode|Santhwanam Serial Online|Chippy|Rajeev Parameshwar","1293425","21971","472","1203","https://i.ytimg.com/vi/iIEmlcrnHKc/default.jpg","False","False","കൃഷ്ണാ സ്‌റ്റോഴ്‌സിൽ വച്ച് ശിവനും അഞ്ജലിയും വീണ്ടും കണ്ടുമുട്ടുന്നു..!  ഒരുമിപ്പിക്കാൻ ഒരേ മനസ്സോടെ ബാലനും ദേവിയും..Santhwanam || Mon to Sat at 7 PM || Asianet#Santhwanam #Chippy #Asianet #SisterLove #AsianetSerials #MalayalamSerials #RajeevParameshwar #Sreedevi #Shivanjali","1M"
"QzDMzaM9sdE","Baagian De Kisse | Tarsem Jassar | Kulbir Jhinjer | Vehli Janta Records | Latest Punjabi Song 2020","2020-12-27T04:33:05Z","UCyXTmEh_ftszgyO3FTe4-jA","VehliJantaRecords","10","20.27.12","Vehli Janta Records|Vehli Janta Music|Best of Punjabi Song|Punjabi Song|Latest Punjabi song|New Punjabi Song|punjabi song 2020|punjabi new song|latest punjabi song 2020|best of punjabi music|punjabi rap song|Tarsem Jassar|Kulbir Jhinjer","342897","43562","180","3520","https://i.ytimg.com/vi/QzDMzaM9sdE/default.jpg","False","False","Vehli Janta Records & Manpreet Johal Presenting: Baagian De Kisse By Tarsem Jassar & Kulbir Jhinjer  Song : Baagian De KisseSinger : Tarsem Jassar & Kulbir JhinjerLyrics : Tarsem Jassar Music : Beat Inspector Editor : R Singh ArtsDop : Harmeet SinghLabel : Vehli Janta RecordsProducer: MANPREET JOHAL                                                                        Insta: http://instagram.com/manpreetjohalofficial                                  Snapchat: https://www.snapchat.com/add/johal.manpreetStay Connected With Artist Social Media:Tarsem Jassar :-Facebook: http://bit.ly/TarsemJassarFBInstagram: http://bit.ly/TarsemJassarIGSnapchat: http://bit.ly/TarsemJassarSCKulbir Jhinjer :-Facebook: https://bit.ly/KulbirJhinjerFBInstagram: https://bit.ly/KulbirJhinjerIGSnapchat: https://bit.ly/KulbirJhinjerSCStay Connected with Vehli Janta Records:Youtube: http://bit.ly/2Ny1CTHFacebook: http://bit.ly/32aINJmInstagram: http://bit.ly/2NwWO0W","3M26S"
"CJeHXqRBUoM","Ramar Bhamar Lagan | Amdavadi Man | Gujju Marriage | રમણ ભમણ લગન","2020-12-25T02:30:10Z","UCK7iCgfQQsBnwuD6w4doHAw","Amdavadi Man","24","20.27.12","Ramar Bhamar Lagan|રમણ ભમણ લગન|Amdavadi Man|ramad bhamad lagan|lagan ramad bhamad|amdavadi man lagan|amdavadi man marriage|gujju marriage|gujarati marriage|gujarati lagan|funny gujarati lagan|amdavadi man na lagan|varghodo lagan ramad bhaman|kushal mistry marriage video|raman bhaman lagan|Ramar Bhamar Lagan | Amdavadi Man | Gujju Marriage | રમણ ભમણ લગન","489390","39365","656","1390","https://i.ytimg.com/vi/CJeHXqRBUoM/default.jpg","False","False","Ramar Bhamar Lagan , Amdavadi Man,  Gujju Marriage, રમણ ભમણ લગન.Written By: Kushal Mistry[https://www.instagram.com/kushalmistryofficial]Videoshoot & Edit : Maulik Mistry Films[https://www.instagram.com/maulikmistryfilms]BGM: Kushal MistryPerformed By:Kushal Mistry[https://www.instagram.com/kushalmistr...]Parth Parmar[https://www.instagram.com/_parth_parmar]Jatin Prajapati[https://www.instagram.com/jatinprajap...]Vijay Gurjar[https://www.instagram.com/vijju_badshah]Bhoomi Somani[https://www.instagram.com/bhoomi_somani_]Neni Mistry[https://www.instagram.com/n_mistry17]Dhrumi [https://www.instagram.com/balbie_.doll_]Sunil RavalSpecial Thanks To : Chirag Asodiya  ,Rajan Asodiya, & Murli Party Plot*For Business Inquiry* Mr.Deep Purohit :8733802828. Email: Amdavadiman@gmail.comFollow Us On :Instagramhttps://www.instagram.com/Amdavadimanfacebookhttps://www.facebook.com/AmdavadimanAlso Watch Amdavaadi Man Vs Wildhttps://www.youtube.com/playlist?list...Chhokri Kevi Rite Pataavvihttps://www.youtube.com/playlist?list...Our All Gujarati Sketch Comedyhttps://www.youtube.com/playlist?list...Chaalo Rakhadvahttps://www.youtube.com/playlist?list...Gujju News Reportinghttps://www.youtube.com/playlist?list...ignoreplox#RamarBhamarLagan #AmdavadiMan #GujjuMarriageamdavadi man ,swagger baba video , amdavadi man. amdavadi man vs wild ,sweggar baba , Gujju Man Vs Wild , Kushal Mistry , swagger baba new video ,swagger baba , gujju comedy video , gujju baba , amdavadi man vs wild , gujarati comedy video , Kushal Mistry, yo yo gujarati gujarati comedy natak , funny gujju video , gujarati funny video ,gujarati natak comedy full gujarati comedy drama ,comedy gujarati video , download gujarati video gujarati drama free download , new movie gujarati dayro video gujarati jokes,amdavadi man tiktok comedy video, Dhamo don.Gujarati CID, Gujarati Navratri.","12M19S"
"Y6-LBo0WzlA","Bigg Boss Tamil Season 4  | 26th December 2020 - Promo 2","2020-12-26T11:30:02Z","UCvrhwpnp2DHYQ1CbXby9ypQ","Vijay Television","24","20.27.12","biggboss|tamil|vijay television|starvijay|Ulaganayagan|தமிழ்|விஜய் டிவி|தொலைக்காட்சி|Tamil TV|Tamil Shows|Redefining Entertainment|Star|Star Vijay TV|Vijay TV|hotstar|Kamal Haasan|Bigg Boss|Bigg Boss Tamil 4|பிக்பாஸ்|பிக்பாஸ் 4|Bigg Boss Season 4|Teaser","2901862","61706","1280","8538","https://i.ytimg.com/vi/Y6-LBo0WzlA/default.jpg","False","False","#BiggBossTamil #BiggBossTamil4 #BB #BiggBoss4 #Promo #BiggBossSeason4 #BB4 #BiggBoss #VijayTV #VijayTelevision #StarVijayTV #StarVijay #TamilTV #RedefiningEntertainment #BiggBoss #BiggBossTamil #KH #Kamal #KamalHaasan #UniversalHero #Eviction #Nomination #BiggBossTamilPromo #Promo பிக்பாஸ் - தினமும் இரவு 9:30 மணிக்கு நம்ம விஜய் டிவில.. Click here https://www.hotstar.com/in/tv/bigg-boss/14455 to watch the full episode","36S"
"Sjz457HDH9o","INTRO WENT WRONG !! My Special dance performance with Johanna","2020-12-26T15:42:28Z","UCpOnZdJQxa5vyR5dNtIoNjg","DAN JR VLOGS","22","20.27.12","dan jr|dan jr vlogs|danjr vlogs|Christmas celebration with family|Santa Claus dance with johanna|Johanna and Isaac vlogs|chocolate waffle|playing with kids|dancing with kids|singing with kids|pranking my wife|wife introduction|family Christmas celebration","343699","20248","443","2062","https://i.ytimg.com/vi/Sjz457HDH9o/default.jpg","False","False","Connect me on :Email me : Danjrvlogs@gmail.comMy Instagram ID DAN JR : https://Instagram.com/danieljainrajFacebook : https://www.facebook.com/danjrvlogs/Our Official Website : https://danjrvlogs.comTwitter : https://www.twitter.com/DANJRVLOGS","13M47S"
"q_XYrHrC7uc","RED Movie Official Trailer 4K | Ram Pothineni | Nivetha | Malvika | Amritha | Tirumala Kishore","2020-12-24T05:29:25Z","UCRrvsqGO9eOGJmAwT_Ff0kA","Ram Pothineni","24","20.27.12","red|red trailer|red movie trailer|red official trailer|red theatrical trailer|ram red trailer|red telugu trailer|red movie telugu trailer|red movie telugu|ram pothineni|nivetha pethuraj|malvika sharma|amritha aiyer|ram red|mani sharma|kishore tirumala|ram latest","7229879","109477","2187","4810","https://i.ytimg.com/vi/q_XYrHrC7uc/default.jpg","False","False","THE WAIT IS OVER. Presenting the official Theatrical trailer of MOST AWAITED film RED. #REDTrailer #RAPO #RedTheFilm #RamPothineni#RED movie featuring Ram Pothineni, Nivetha Pethuraj, Malvika Sharma, Amrita Aiyer and others, Directed by Tirumala Kishore, Produced by 'Sravanthi' Ravi Kishore under Sri Sravanthi Movies Banner. Music composed By Mani Sharma. Presented by Krishna Pothineni.Movie Details :Title : REDCast : Ram Pothineni, Nivetha Pethuraj, Malvika Sharma, Amrita Aiyer and othersDirector : Tirumala KishoreProducer : 'Sravanthi' Ravi KishoreMusic Director : Mani SharmaCinematography : Sameer ReddyStunts - Peter HeinEditor : Junaid SiddiquiArt : AS PrakashBanner : Sri Sravanthi MoviesFor more updates about RED Movie and me :Like - https://www.facebook.com/ActorRamOfficialSubscribe - https://www.youtube.com/user/PothineniRamFollow - https://twitter.com/ramsayzFollow - https://instagram.com/ram_pothineni","2M1S"
"p34EqzkFs1A","SISTER'S - Rich vs Normal | ShrutiArjunAnand","2020-12-22T12:00:12Z","UCIsotCCdTjStPCLyD9iBCCQ","Shruti Arjun Anand","24","20.27.12","shruti|shruti anand|shruti arjun anand|shrutiarjunanand|reality|comedy|vlogs|funny|vloggers|laugh|sketch|blog|role play|comedy videos|anaysa|funny girl|youtubers|rich vs normal|rich vs poor|rich girl|normal girl|girls lifestyle|desi girl|love story|desi mom|modern dad|modern life|desi life|normal saloon|rich restaraunt|normal restaraunt|spiceup|spiceup media|spice up media|spicemedia|fun|car","6280972","234194","20386","8221","https://i.ytimg.com/vi/p34EqzkFs1A/default.jpg","False","False","Agar video pasand aye toh hit LIKE to 2,00,000 & Do SHARE it with your  Friends & Family and don't forget to comment from which sequence you will relate yourself because we are replying of your comments ..CREDITS:Produced By : SpiceUp MediaCreative Head : Shruti AnandDirected By : Vikram ChoudharyScripted By : Shruti, Vikram, Himani, BhartiDOP : DevAssistant DOP : Deepak Mathuriya Edited By : Shubham Raj Verma,Tushar PanchalPresented By : Shruti AnandCo - Actors : Bharti Singh, Priyanka Devnath, Danish Khan, Jeetu Shri Yadav, Rita, Sonu Gupta.Channel Coordinator: AkanshaShoot Coordinator : Sonu GuptaSupport Staff : Sagar, Manoj, RitaSocial Media : Danish KhanPowered By: http://spiceupmedia.com~ XoXo~ Shruti ♥️ ♥️ BUSINESS INQUIRY ♥️ ♥️ contactus@shrutiarjunanand.comFollow on Instagram https://www.instagram.com/shrutiarjun...AUDIO DISCLAIMER/CREDITS –Music from Epidemic Sound (http://www.epidemicsound.com)DISCLAIMER: All products used in my videos, regardless of whether the video is sponsored or not, are the products that I love using unless otherwise stated in case of first impression reviews. The information provided on this channel is for general purposes only and should NOT be considered as professional advice. We are not a licensed professional or a medical practitioner so always make sure you consult a professional in case of need. We always try to keep our channel and its content updated but we cannot guarantee it. All opinions expressed here are our own and we are not compensated by any brand, advertiser, PR representative or affiliate for the same unless explicitly stated in our videos and/or description box. We never try to push products on anyone but we do make recommendations based on our personal experience. All the content published on this channel is our own creative work and is protected under copyright law and in case you need to use our content for any purpose please write to us - contactus@shrutiarjunanand.com#ShrutiArjunAnand #ShrutiArjunAnandFamily #HeraPheri #PhirHeraPheri #FamilyComedy #Money #BeautyBlogger #Wish #RichvsNormal #RichvsDesi #BestYoutuber #Trending #Anaysa #MyMissAnand #Fun #SpiceItUp #SpiceUpMedia","10M39S"
"uw07JcP9Tzs","ನಟ ಚಿಕ್ಕಣ್ಣನ ಫಾರ್ಮಹೌಸ್​ನಲ್ಲಿ ಏನೇನಿದೆ? | Chikkanna Exclusive Interview | Part 01 | NewsFirst Kannada","2020-12-25T15:39:42Z","UCFRlIV1mX-traJb5fd7S3nw","NewsFirst Kannada","25","20.27.12","NewsFirst Kannada|News First Kannada|NewsFirst Live|Kannada Live TV|Kannada News Channel|Kannada TV Channel|Kannada Live News|Kannada Latest News|Karnataka Political Developments|Karnataka Latest News|Live Today|Kannada TV Live News|ಕನ್ನಡ ಲೈವ್ ನ್ಯೂಸ್|Chikkanna|Actor Chikkanna|Mysore|Chikkanna Farm House|Comedy Actor Chikkanna|Mysore Form House|Chikkanna Interview|Chikkanna With NewsFirst|Chikkanna Excluisve Interview|Chikkanna Special Interview","467912","12634","396","490","https://i.ytimg.com/vi/uw07JcP9Tzs/default.jpg","False","False","ನಟ ಚಿಕ್ಕಣ್ಣನ ಫಾರ್ಮಹೌಸ್​ನಲ್ಲಿ ಏನೇನಿದೆ? | Chikkanna Exclusive Interview | Part 01 | NewsFirst Kannada--------------------------------------------------------------News First is a Pioneering 24x7 Kannada News Channel.Delivering high quality news content not seen before in Kannada Television News.  Promoted by the team which brought ‘Live' Kannada news to Karnataka’s doorsteps. This daring, dependable and determined team brings credible news to you ‘at any cost’Be the First to get:Breaking Local, Regional, National and International newsExtensive Hyper Local NewsIn-depth Coverage of Karnataka’s PoliticsDetailed National and Regional News The Latest Sports Matches, Scores and more The Widest Cinema Coverage and Biggest Star StoriesInteresting Stories from Across the WorldNewsFirst Live TV | NewsFirst Kannada| Kannada News | Latest News | News1st Kannada| Breaking News| Clarity News | News 24x7 | TOP News | Kannada TV Channel |     News Channel | Fastest News |  Best News| NewsFirst LIVE--------------------------------------------------------------Official website: http://www.newsfirstlive.comSubscribe to Youtube Channel: https://youtube.com/newsfirstkannadaLike us on FaceBook: https://www.facebook.com/newsfirstkannadaFollow us on Instagram: https://www.Instagram.com/newsfirstkannadaaFollow us on Twitter: https://www.twitter.com/newsfirstkan-----------------------------------------#Chikkanna #ExcluisveInterview #Mysore #ChikkannaFarmHouse #ComedyActorChikkanna #MysoreFormHouse #ChikkannaInterview #ChikkannaWithNewsFirst, #ChikkannaSpecialInterview #ActorChikkanna #SomannnaMachimada #NewsFirstKannada, #NewsFirstLive, #News1stKannada, #KannadaNewsChannel, #LatestNews, #LatestKannadaNews,","18M11S"
"56rdT6ROSWs","അപർണ്ണയ്ക്കും അഞ്ജലിയ്ക്കുമിടയിൽ സൗഹൃദം ഉടലെടുക്കുന്നു..","2020-12-26T14:00:41Z","UCp_r6Z-Oh0YTf-ym71z5Nqg","Asianet","24","20.27.12","Santhwanam|asianet|asianet serials|malayalam serials|new serial|chippy|Sandwanam|Sandhwanam|Santhwanam serial|Santhwanam asianet serial|Santhwanam hotstar|Santhwanam asianet|Santhwanam Hotstar|Popular serial Santhwanam|Watch Santhwanam Serial|Santhwanam Latest Episode|Santhwanam Full Episode|Santhwanam Serial Online|Chippy|Rajeev Parameshwar","882942","17309","297","621","https://i.ytimg.com/vi/56rdT6ROSWs/default.jpg","False","False","അപർണ്ണയ്ക്കും അഞ്ജലിയ്ക്കുമിടയിൽ സൗഹൃദം ഉടലെടുക്കുന്നു.. പരസ്പരം കൂട്ടുകൂടി സാന്ത്വനം വീട്ടിലെ ഈ മരുമക്കൾ..Santhwanam || Episode 84 || 26-12-20 (Watch Full Episode on Disney+ Hotstar)#Santhwanam #Chippy #Asianet #SisterLove #AsianetSerials #MalayalamSerials #RajeevParameshwar #Sreedevi #Shivanjali","1M29S"
"SvxwmC-SXCk","200 KG CHRISTMAS VILLAGE CAKE | 400 Pounds X'mas Cake Making","2020-12-24T13:30:15Z","UCuSD-BXA1p8S3HfE8LsEkHA","Village Food Channel","26","20.27.12","christmas cake|giant cake|cake recipe|biggest cake|cake making|cake","1506414","117975","2309","5208","https://i.ytimg.com/vi/SvxwmC-SXCk/default.jpg","False","False","It's a huge size cake and about 800 + poor people were gathered to enjoy Christmas.","13M49S"
"pLh3_FgUhIE","2020 Rewind Mashup | Top Tamil Hits in 5 Minutes | Joshua Aaron | ft. Various Artists","2020-12-26T04:30:13Z","UCn1rfzaJZHJiJBQc1hFEBTA","Joshua Aaron","10","20.27.12","2020 rewind|2020 mashup|2020 hits mashup|2020 rewind mashup|joshua aaron mashup|ahmed meeran|srinisha|srinisha jayaseelan|sam vishal|srinisha sam vishal|vijay tevevision|aishwerya|allan pretham|master|vaathi coming|rakkita|tamil mashup","173078","21429","305","985","https://i.ytimg.com/vi/pLh3_FgUhIE/default.jpg","False","False","A whole year in 5 Minutes, Presenting the ‘ Best of 2020 ‘ with chart topping hits featuring Sam Vishal, Srinisha Jayaseelan, Ahmed Meeran, Aishwerya and Allan Preetham! Hope you guys like it, Do subscribe and share it around :)Check out my social media handles:Instagram: https://www.instagram.com/joshuaaronn/Facebook: https://m.facebook.com/JoshuaAaronnMusicTwitter: https://twitter.com/JoshuaaronMusicProgrammed/Arranged/Mix and Master: Joshua AaronFeaturing: Sam Vishal, Srinisha Jayaseelan, Ahmed Meeran, Aishwerya and Allan PreethamGuitar: Joshua CharlesDrums: Suman BatteurExecutive Producer : Arun ShivanandRecorded: StudioJA / Phone RecordingProduction: JA#2020Rewind #TamilMashup","5M2S"
