video_id,title,publishedAt,channelId,channelTitle,categoryId,trending_date,tags,view_count,likes,dislikes,comment_count,thumbnail_link,comments_disabled,ratings_disabled,description,duration
"Hw3NH_-_ja8","Jingle Bell | Hommie Dilliwala Ft. Yo Yo Honey Singh (Official Video)","2020-12-25T14:00:11Z","UC1KonH1j8WMhc5cT6Bp7NtA","Yo Yo Honey Singh","10","20.27.12","honey singh|yo yo honey singh|alfaaz|punjabi|bollywood|rap|most watched artist|latest songs|latest bollywood songs|latest punjabi songs|latest hindi songs|jingle bell song|jingle bell yo yo honey singh|jingle bell hommie dilliwala|yo yo honey singh hommie dilliwala|honey singh new song","10580120","1137259","37514","109528","https://i.ytimg.com/vi/Hw3NH_-_ja8/default.jpg","False","False","#YoYoHoneySingh Christmas Gift #JingleBell Is Out NowHommie Dilliwala Ft. Yo Yo Honey SinghPlay/Download Audio On : Wynk : http://bit.ly/2JkxLgjGaana : http://bit.ly/3mPEkFlSpotify : http://spoti.fi/3aG340jApple Music : http://apple.co/37Ktr3gJio Saavn : http://bit.ly/3pt7VGnHungama : http://bit.ly/2WNHcI0Amazon Uk : http://amzn.to/2JjPlAVYT Music : http://bit.ly/2JpFYQoiTunes : http://apple.co/37Ktr3gPrime Music : https://amzn.to/3pqYZkFResso : https://m.resso.app/ZSWMufLp/Singers : Hommie Dilliwala Feat. Yo Yo Honey Singh Lyrics : Hommie Dilliwala & Yo Yo Honey Singh Music Produced By : Yo Yo Honey Singh Mix & Master : SinghstaDirected By : Mihir GulatiProject By : Bobby Suri Special Thanks : Music MG, Sukh E, Alfaaz, Juggy D, Umesh Sharma, Roshan Agarwal, Aman Goel, Priyank Sukhija, Prateek Chaudhry, Nitika Tehri, Yogesh DixitCast & Crew : Big Dance Production Coordinator : Rohit ChhabraVideo : Frogalised Camera Team : Manish Shunty, Rishabh Dang, Anubhav Gulati, Abhijeet RawatDirection Team : Archit Gulati, Gaurav Singh, Guneet SinghEdit : Hitesh Chandwani , Rishabh Dang, Archit Gulati, Gaurav Singh Graphics : PU RohitDigital Marketing : Raj Deep Mayer : RDM MediaVenue: Diablo, DelhiPromotions & Digital Powered By : GK DIGITALArtwork : Roop Kamal SinghMusic Label : Yo Yo Honey SinghYou Can Contact Facebook : https://www.facebook.com/YoYoHoneySinghInstagram : https://www.instagram.com/YoYoHoneySinghTwitter : https://twitter.com/AsliYoYoSnapChat : https://www.snapchat.com/add/itsAsliYoYo","3M17S"
"4tTR6uNn750","1000 PANI PURI | Golgappa Recipe Cooking in South Indian Village | How to make Pani Puri Recipe","2020-12-25T13:34:51Z","UCk3JZr7eS3pg5AGEvBdEvFg","Village Cooking Channel","26","20.27.12","pani puri|pani puri recipe|golgappa street food|street food|indian street food|how to make pani puri|golgappa recipe","5722466","122411","10548","5238","https://i.ytimg.com/vi/4tTR6uNn750/default.jpg","False","False","Pani Puri Recipe is one of the most popular street food snacks all over India. But the origin of the golgappa is north India. Today we made 1000 Pani Puris in our south Indian village.We use two Pani's first one is green water and the second one is tamarind sweet water. In this video, you can enjoy how to make Pani puri to make this recipe own in your home.","17M19S"
"O0bd2bq8LG4","Panjab (My Motherland) Sidhu Moose Wala | TheKidd | NavkaranBrar | GoldMedia | New Punjabi Songs","2020-12-26T16:13:41Z","UC9ChdqQRCaZmTCwSJ49tcbw","Sidhu Moose Wala","10","20.27.12","sidhu moosewala|sidhu moosewala latest song|sidhu moosewala leaked songs|sidhu moosewala official videos|sidhu moosewala official song|latest punjabi song 2020","2683347","405350","15518","70281","https://i.ytimg.com/vi/O0bd2bq8LG4/default.jpg","False","False","Sidhu Moose Wala PresentsTitle : PanjabSinger/Lyrics/Composer/Concept : Sidhu Moose WalaMusic : The KiddMix Master : DenseVisuals  : Navkaran BrarPromotions : Gold Media https://www.instagram.com/goldmediaa/This Is Official Channel Of Punjabi Singer SIDHU MOOSE WALA This Channel is Made For Live Video And Other Events Broadcast, V LogsDo Subscribe & Be A Part Of My Life - https://bit.ly/SidhuMooseWalaSubscribeOnline Promotion Gold MediaTo Stream & Download Full Song:iTunes - https://music.apple.com/in/album/panjab-single/1546485491Spotify :- https://open.spotify.com/album/5Jtu3QrbP0OQui6JDNVTIb?si=l_m8i_pdSC-_sciherUBqQGaana - https://gaana.com/album/panjab-punjabiHungama - http://www.hungama.com/album/panjab/61240395/Resso - https://m.resso.app/ZSWxeqpy/YouTube Music - https://music.youtube.com/watch?v=DFGHScEXIPoAnghami - https://play.anghami.com/song/95471863Boomplay - https://www.boomplay.com/share/music/51658990Enjoy And Stay Connected With Artist || SIDHU MOOSE WALAClick to Subscribe - https://bit.ly/SidhuMooseWalaSubscribeTwitter - https://www.twitter.com/iSidhuMooseWalaFacebook - https://www.facebook.com/SidhuMooseWalaInstagram - https://instagram.com/Sidhu_MooseWalaSnapChat - https://www.snapchat.com/add/SidhuShubh","3M26S"
"tQxur_ZrLfk","DJ | Part- 2 of 2 | Karikku | Comedy","2020-12-24T17:36:02Z","UC2bNrKQbJLphxNCd6BSnTkA","Karikku","23","20.27.12","karikku|malayalam|funny|comedy|webseries|lolan|george|karikk|karikke|film|trending|sketch|vine|flowerstv","7417043","520675","11496","35811","https://i.ytimg.com/vi/tQxur_ZrLfk/default.jpg","False","False","Download the OctaFX Copytrading App at https://bit.ly/OctaFX_Karikku and get 50% bonus for your first-time copying! 🎁 Let the best professional traders make money for you!💰Directed by: KrishnachandranStory & dialogues: Anu K Aniyan, KrishnachandranAssociate Director:  Anu K AniyanCinematographer: Harishankar VenugopalBgm:  Adarsh Anoop, Sabir MadarEditor: Anand MathewsTitle & VFX: Binoy JohnDI: Vivek V BabuSync & Sound: Ajin Manuel Antony, Jishnu Ram, Vishnu T SomanFocus Puller: Rahul Alex, Arjun Shaji, Aneesh Wayanad, Vishnu Chandran, Akeesh RCamera Unit: Sensor FilmsArt: Shuffle EventsLight: Lights Up Kochi, Camleeds CinematicsProduction Manager:Jestin J GeorgeSubtitles: Shyam Narayanan TK  Cast: Mitun M Das, Unni Mathews, Anu K Aniyan, Sabareesh Sajjin, Krishnachandran, Anand Mathews, Anagha Maria Varghese, Reenu Sunny, Athira Niranjan, Riju Rajeev, Hari K C, Deepu Pankaj, Vishnu V, Shyam Kumar, Ashith K V, Aravind Krishnakumar, Anoop C Madhu, Rahul Chandrababu, Reethu Ramanan, Pooja Harshan, Meera Manju,ThanksSalu K George(Art)Ajesh(Lights)","25M"
"0ICA4JuYECY","Tution Teacher Ki Beti Se Pyar || Episode 2 || Elvish Yadav","2020-12-25T06:29:58Z","UCbmu9wfzxKls40WkCzvqtRA","Elvish yadav","23","20.27.12","Tution Teacher Ki Beti Se Pyar Episode 2 Elvish Yadav|elvish yadav|elvish yadav new video|elvish yadav latest video|tution teacher ki beti se pyar|52 gaj ka daaman|elvish yadav videos|tution teacher part 2|tution teacher ki beti se pyar part 2|elvish yadav tution teacher|elvish yadav funny videos|elvish yadav vines|elvis yadav|lvish yadav school video|tution ka pyaar|love story|sad story|school life videos|comedy videos","4238986","516743","12510","34964","https://i.ytimg.com/vi/0ICA4JuYECY/default.jpg","False","False","This Video Is Episode 2 Of Tution Teacher Ki Beti Se Pyar. Watch Episode 1 Episode 1- https://www.youtube.com/watch?v=Bl9iLKMjn68Elvish Yadav Vlogs- https://www.youtube.com/channel/UCHxj...Written by: Elvish Yadav, Kannu Yadav, Vansh Yadav, Nikhil YadavDirected by: Elvish yadavDirector of Photography: Imran KhanAssistant DOP: Naveen SoniEdited by: Akram Wasim, Elvish yadavColor Correction: Akram Wasim, Elvish YadavExecutive Producer: Elvish yadavThumbnail: Vishal Rana (Pheonix)CastElvish yadavKirti MehraLove katariaLakshay kaushikArchit kaushikSameer MongaAryamannDeepanshu Akshay YadavChahat YadavAnoop Chahal And TeamFOLLOW MY SOCIAL MEDIA HANDLESINSTAGRAM-    http://instagram.com/elvish_yadavFACEBOOK. -    http://facebook.com/theindianvinerTWITTER-         http://twitter.com/elvishyadavSNAPCHAT -   @elvishyadav","17M53S"
"Myj3yGaUBVI","Silence Sothanaigal | Fantasy Comedy","2020-12-25T10:45:12Z","UCD1CuflSWxeAGVOwicubsWw","Sothanaigal","24","20.27.12","maragadha nanayam|maragatha naanayam|Silence Sothanaigal|Fantasy Comedy|police comedy|police|diamond|diamonds|tetema|waka|nana|sothanaigal|silence sothanaigal|sothanaigal new video|stone|treasure|treasure boy|treasure come to me|treasure comedy|sothanaigal channel|sothanaigal video|sothanaigal gokul|gokul|sothanaigal channel tamil|sothanaigal vasanth marvin|sothanaigal latest video|traffic police|traffic police fight|police punishment","1421775","81397","2769","5121","https://i.ytimg.com/vi/Myj3yGaUBVI/default.jpg","False","False","Best Chance To Earn Real Cash For Xmas Gifts!  Here 👉 https://bit.ly/2KwOCggHere is the video of hilarious fantasy comedy- Silence Sothanaigal.Watch and enjoy the video till the end...#Silencesothanaigal #Fantasycomedy SUBSCRIBE and SUPPORT our New Channel Gagsters:  https://youtube.com/c/GagstersCast:Gokul -  https://www.instagram.com/gokul_rocks/Praveen - https://www.instagram.com/praveenboxing95/Vasanth - https://www.instagram.com/vasanth_parthi/Marvin - https://www.instagram.com/vasanth_marvin/Veera - https://www.instagram.com/veera_z_/Pavithra - https://www.instagram.com/steaffipavi/Vishnupriya -https://www.instagram.com/priya_beyonce/Karthick - Mugilan - Rajesh ______________________________Camera:Moorthi Sachin - https://www.instagram.com/moorthi_sachin/______________________________Editing-Vfx- Sound designGowtham Rakshit - https://www.instagram.com/gowthamrakshit/______________________________Script & Direction : SOTHANAIGAL TEAM _______________________________Facebook: https://www.facebook.com/Sothanaigal-...Instagram: https://www.instagram.com/sothanaigal_/Twitter: https://twitter.com/sothanaigal?lang=enWebsite: http://www.sothanaigal.com/_____________________________In Association with DIVO - Digital Partnerhttps://www.facebook.com/divomovieshttps://twitter.com/divomovieshttps://www.instagram.com/divomovies/","11M8S"
"pEO2a7QzXqQ","KHYAAL RAKHYA KAR - Neha Kakkar ft. RohanPreet Singh | Anshul Garg | Babbu | Rajat Nagpal |","2020-12-22T05:30:04Z","UCLtNvbkqea8wN_kGtfgx_Mw","Desi Music Factory","10","20.27.12","tony kakkar|neha kakkar|sonu kakkar|music|song|desi music factory|Neha Kakkar songs|Nehu da vyah|Karan aujla|Sidhu moosewala songs|Latest punjabi songs 2020|Latest punjabi songs 2021|Punjabi hits|Chote hee change lagde|Shona Shona|Naach meri Laila|Guru randhawa new song|Jass manak new song","38979651","1905838","119834","87148","https://i.ytimg.com/vi/pEO2a7QzXqQ/default.jpg","False","False","Anshul Garg presents KHYAAL RAKHYA KAR by the Queen Neha Kakkar ft. RohanPreet Singh. Listen it on - 🎵iTunes: https://music.apple.com/in/album/khyaal-rakhya-kar-single/1545300108Gaana: https://gaana.com/song/khyaal-rakhya-kar-1Saavn: https://www.saavn.com/s/song/punjabi/Khyaal-Rakhya-Kar/Khyaal-Rakhya-Kar/BFofbiAGGgoSpotify: https://open.spotify.com/track/2RKGtM8v2JM72Gyo1wLmgg?si=gZeZ6u96SP2pwUnXNb4E1wApple Music: https://music.apple.com/in/album/khyaal-rakhya-kar-single/1545300108Wynk: https://wynk.in/u/1Y0tgtj97Singer - Neha Kakkar Music - Rajat Nagpal Lyrics - BabbuSarangi Harpinder kangRecorded by Rahul Sharma @AMV assisted by Samir DharapFeaturing - Neha Kakkar & Rohanpreet SinghProducer - Anshul GargDirectors - Agam Mann & Azeem MannConcept & Screenplay : Neha Kakkar Video Supervisor - Raghav SharmaDOP - Shinda SinghChoreographer - JohnProject Manager - Piyush Chandok Childhood Neha - Guddu Childhood Rohanpreet - AarushProduction - RahulDI - Onkar SinghArt Director - BlaccADs - Jogi, Ashish Uppal, Jass Panesar, Ravi GoyalChild Artist casting - Elvin Art Academy RajpuraChildren - Ghazal, Rihanna, Kashvi, Saanvi, Eshanya, Kayanna, Nitya, Deepali, Inayat, Vrinda, Komal, Kavya,Vanya, Tanishtha, Drishti, Prince, Samar, Harshit, Himanshu, Viraj, Kairav, Aarav, Morfin, Garv, Gurshan, Namish, KanishekCollege boy - Money RomanaArtwork - Vicky Sandhu DesignDistribution: Believe DigitalPromotions : Underdog DigitalLyrics :Tu trump de warga hainMain obame wargi hanTenu kyun lagda hai mainKise drame wargi hanTu cheez pyari hai ehnu sambhaal rakhya karMera tu hi tu tan hain tu apna khyaal rakhya karGallan wich laake tu taj mehal vikaa sakdanJinna tu jhootha hain politics ch jaa sakdanMethon na sach chupaaya karJithe jana daske jaya karMain fer tenu kuch nai kehndiKuch khaan nu laike aaya karTe ghanta ghanta waiting wich na call rakhya karMera tu hi tu tan hain tu apna khyaal rakhya karTu brad pitt vadda na geriyan laaya karJ kudi naal meeting hai Mainu naal lejaaya karTenu kudiyan nal milaunde neTere dost hi tenu pilaunde neAh kaisa rang karaaya haiTenu ki ki oh sikhaunde neChote hi changey lagde chote vaal rakhya karMera tu hi tu tan hain Tu apna khyaal rakhya kar#KhyaalRakhyaKar #NehaKakkar #RohanPreet","3M34S"
"IelZ5QkMMHI","If YouTube Was Indian Government Office? | Angry Prash","2020-12-25T11:25:20Z","UCz-iDa_Z-GWaZ_YweEus6iw","Angry Prash","23","20.27.12","youtube|youtube India|youtube trending|funny|funny video|comedy|angry prash|angry prash new video|cartoon|animation|prash|angry|Indian|Government","2085049","419512","4504","17882","https://i.ytimg.com/vi/IelZ5QkMMHI/default.jpg","False","False","In this funny video I am trying to show how YouTube will work in Indian government office. What if youtube created or made In India comedy video.#youtubeJoin Me On-Facebook►- https://www.facebook.com/angryprashTwitter► https://twitter.com/angryprashInstagram► https://www.instagram.com/angryprashDisclaimer► The following is a satrical video, meant only for educational and entertainment purpose. Any resemblance or reference in its contents to events already occurred is purely coincidental. The comedian may not be taken to express any judgement thereon.About Angry Prash is a Indian YouTuber, where you will find different types of comedy videos in hindi :)","5M38S"
"2zJwmV-PX0Q","Tru Hair Rock Paper Scissors |S02 EP1 | The Letter | Karikku Fliq | Mini Webseries","2020-12-25T04:30:00Z","UC6RsQGglWCXre5du9GuLX2A","Karikku Fliq","24","20.27.12","[none]","4459457","158928","8987","7937","https://i.ytimg.com/vi/2zJwmV-PX0Q/default.jpg","False","False","#karikku #karikkufliq #webseriesGet 20% off on Tru Hair, the World's first Ayurvedic hair oil with the heater. Buy the product here : https://truhairandskin.com/product/tru-hair-oil/#utm_source=KarikuE1&utm_medium=YTDirected by: Shyamin Gireeshhttps://instagram.com/shyamingireesh?igshid=r6md6xs3qsa7Executive Producer : Nikhil PrasadStory & Screenplay: Nileen Sandra https://instagram.com/nileen_sandra?igshid=18olwalhhheppDOP : Akhil Xavierhttps://instagram.com/akhil_xavier92?igshid=i1s0ex5m44mnCreative Director & Editor : Rakesh Cherumadamhttps://instagram.com/rakezdp?igshid=aet9f7suxmjpMusic : Ajmal Hasbullahttps://instagram.com/ajmalhasbulla?igshid=1t9k4rlblc3x5Art Direction: Sivadas Kavullapurayilhttps://instagram.com/sivadaskavullapurayil?igshid=112663v5vkwoxAudiography: Krishnanunni K Kumarhttps://instagram.com/kichu_unni?igshid=1x0u2he04sr8uColorist : Azif IsmailVFX: Midhun KS , Vineesh VRhttps://instagram.com/midhu_sid?igshid=s0hpzj6q7q7chttps://instagram.com/midhu_sid?igshid=s0hpzj6q7q7cTitle & Poster Design: Binoy Johnhttps://instagram.com/binoy.jo1?igshid=100nzgfoepd8nBrand Partnership: Unni Mathewshttps://instagram.com/unnimathews?igshid=1tg2mf5fg1oc1Associate Art Director:Deepu Rajeevan https://instagram.com/deepurajeevan?igshid=cbh4pgrj80ceCamera Assistants:Vishok kalathil, Joyal Thomashttps://instagram.com/_im_vk?igshid=s0qsyb6eiqashttps://instagram.com/cinematography_465?igshid=vh36ckvmu9suAssistant Directors: Tarun Mathew, Abhay Sudevanhttps://instagram.com/the_tarun_mathew?igshid=16arm6piwbw32https://instagram.com/abhaysudevan?igshid=18gsni842bc19Camera Technicians: Vivek Baiju, Amal KS, Unni.https://instagram.com/vivekbaiju32?igshid=1x8tiw6s5qat3Art Assistants: Abhijith V mohananChandu mohanAbhinav sureshSmrithi k battathiriSidharth.kNikhil mathewSudha krishnanCast: Shruthy Sureshhttps://instagram.com/_sruthy.suresh_?igshid=da62c6fi1npiVidhya Vijaykumarhttps://instagram.com/vidhya.vijaykumar?igshid=p68y25v7ic9nDeepa Thomashttps://instagram.com/deepa__thomas?igshid=1rn61fkpwdwz8Nileen Sandrahttps://instagram.com/nileen_sandra?igshid=o5tyj8pyo1dhKrishnachandranhttps://instagram.com/krishnachandran97?igshid=12w23ofwpx0hbRahul Rajagopalhttps://instagram.com/rajagopal_rahul?igshid=3vzp7zw7m6wwAdithyan Chandrashekharhttps://instagram.com/aaditales?igshid=1aqifa4zefjjsDeepu Rajeevan https://instagram.com/deepurajeevan?igshid=cbh4pgrj80ceTarun MathewRahna RajAkshay BhasiUnni MeghalanThejus AbrahamVishok kalathilShilpa MariyaMahi PremkumarSajna AnilkumarAnjana BabuMithul PremkumarJoyal Thomas","24M54S"
"-iTqD3ZyVGA","10-C II EP 2 II Kanakku Sir II Webseries Season 1 II #Im4u","2020-12-25T07:30:01Z","UCkXdMeaGTGXQlOQybcATujA","IM4U","22","20.27.12","im4u|malayalam|anuraj and preena|malayalam web series|short films|malayalam latest|10c|webseries|anurajrajan|preenaanuraj|sanju madhu|sanju and lakshmy|hima sumith|sumith|jithinbethanya|karikku|kanimangalam kovilakam|chakkapazham|valli|popcorn|asianet|web series|vidhu prathap","1168092","60582","1664","4033","https://i.ytimg.com/vi/-iTqD3ZyVGA/default.jpg","False","False","10-C II EP 2 II Kanakku Sir II Webseries Season 1 II #Im4u ||An Im4u Production  https://instagram.com/im4uproductions?igshid=tccylywz81e6Script & Direction : Ajin RajStory: Im4u TeamCinematography, Colouring & Titles : Jithin Bethanya Editing : Jithin Bethanya & Anuraj Rajan Associate Director : Anuraj RajanArt & Make up : Preena AnurajProduction Controller : Sibi JosephAssociate Cameraman : Vishnu MuraliAssistant Directors : Sumith MB, Preena Anuraj,Sibi JosephCamera Assistants : Suraj Shiva, Ashik ThengamomEnglish Subtitles: Mable BijuKanakku Sir SongMusic & Lyrics : Jithin Bethanya Vocal : Sibi Joseph Cast:Maths Sir:Raju AchoosStudents: Sanju Madhu, Lakshmy Sanju, Sumith Mb, Hima Sumith, Anuraj Rajan, Ajin Raj, Parvathy Vipin, Nikhil Kalabhavan, Saphin Popz, Sneha Sharath, Aiswarya Ajith, Anuj K Sajan, Aswini Sreekumar, Varghese K George, George K GeorgePrincipal: Sibi JosephTeacher : Ancy AlexPeon : Ashik J RLocation : Newman Central School, MangaduCatering : Malabar Hotel, Puthusheribhagom Special ThanksThomas Mathew Sir & Family Vidhu Chettan & FamilyK M Cheriyan & FamilyTherakatthu Mani & FamilyFr Vinod EshowKrishna kumarSalim Rawthoor","11M10S"
"jXcQpqYaxWA","QNA 2020 || 7 Million Special || Desi Gamers","2020-12-27T03:26:14Z","UCuApqv2tNQ73S7gcfrfCSDw","Desi Gamers","24","20.27.12","desi gamers qna|amitbhai qna|desi gamers|2020 qna|desi gamers 2020 qna|amitbhai 2020 qna|7 million desi gamers|7 million special qna desi gamers|2020 qna 7 million desi army|amitbhai desi army|desi army|free fire|qna","1755971","419420","4611","49928","https://i.ytimg.com/vi/jXcQpqYaxWA/default.jpg","False","False","Instagram ► https://www.instagram.com/desigamers1/Discord ► https://discord.gg/desigamersFacebook ► https://www.facebook.com/DesiGamers2/TWITTER ► https://twitter.com/desigamers01-----------------------------------------------#QNA #DesiGamers #AmitBhaiBecome a Member - https://www.youtube.com/channel/UCuApqv2tNQ73S7gcfrfCSDw/joinDusra Channal  - https://www.youtube.com/channel/UC6T0jZjpR5H6owSVJseum5A Hey Guys, I Am Amit,I make family friendly Gaming Entartaining videos (PC/Phone) for everyone to enjoy with their Friends & family.           Meri Video Dekhne Ke leye Headphone Ki Jarurat Nahi Padegi. Yaha Tak Padhne Ke Leye Sukriya.Disclaimer - This Videos Are Gameplay Videos For Entertainment Purpose Only, No Any Harmful Contents or visual in this video.For Livestreeam - Please Dont Send Me Suparchat Saying Add me in game or play with me or Channel Promotion, Main Nahi Kar Sakta aur Na Hi Karna Chahta.                   Buri Najar Wale Tera Muh Kaala Haha XDDesi Gamers 2020 Special  QNA WITH AmitBhai qna 2020 desi gamersdesi gamers 2020","10M39S"
"v2bAEek6nc4","India’s bowlers fire on entertaining Boxing Day | Vodafone Test Series 2020-21","2020-12-26T07:36:20Z","UCkBY0aHJP9BwjZLDYxAQrKg","cricket.com.au","17","20.27.12","australia|india|cricket|test|boxing day|melbourne","14954928","283741","8961","10443","https://i.ytimg.com/vi/v2bAEek6nc4/default.jpg","False","False","Eleven wickets fell on the opening day of the second Vodafone Test as India responded to their defeat in Adelaide by rattling Australia’s batters.Stream all the Test action via Kayo Sports: https://watch.cricket.com.au/     Fixtures, news, videos for the #AUSvIND Tests: https://cricketa.us/AUSvIND-Tests   Follow us on Facebook: https://www.facebook.com/cricketcomau    Follow us on Instagram: https://www.instagram.com/cricketcomau    Follow us on Twitter: https://www.twitter.com/cricketcomau","8M30S"
"3kxerdAFlv0","Neenaade Naa -Yuvarathnaa Kannada | Puneeth Rajkumar | Santhosh Ananddram | Thaman S | Hombale Films","2020-12-25T06:34:04Z","UCarJoVXH0T2pdtcHBu9J8Bw","Hombale Films","24","20.27.12","yuvarathnaa|yuvarathnaa movie|puneeth rajkumar|yuvarathnaa song|hombale films|power star puneeth rajkumar|yuvarathnaa puneeth rajkumar|thaman s|yuvarathna|powerstar|puneeth rajkumar yuvaratna|kannada songs|power star|Sayyeshaa Saigal|power of youth kannada song|puneeth rajkumar yuvarathnaa|puneeth rajkumar songs|aarambame|puneeth rajkumar movies|yuvarathnaa songs|#hombalefilms|Neenaade Naa|neenaade naa kannada song|neenaade naa song|kannada song","1610628","96467","3012","25157","https://i.ytimg.com/vi/3kxerdAFlv0/default.jpg","False","False","Presenting #NeenaadeNaa From Puneeth Rajkumar's #Yuvarathnaa Directed By Santhosh Ananddram, Music By Thaman S, Produced By Vijay Kiragandur.Starring: Puneeth Rajkumar, Sayyeshaa Saigal, Sonu Gowda, Dhananjay, Prakash Raj, Diganth Manchale.Listen to Yuvarathnaa (Kannada) - Neenaade Naa Album on JioSaavn http://bit.ly/2M80AO0Song Details:Song Name : Neenaade NaaSingers :  Shreya Ghoshal, Armaan Malik & Thaman S Lyricist : Ghouse PeerMusic Director : Thaman SProgrammed & Arranged By - Thaman S Vocal Supervision- Sri Krishna Chennai Strings Section Orchestra Conducted By - Prabhakar Assisted By - Ravi Raghav Violins Violas Cellos and Double Bass Sections Recorded at - AM STUDIOS String Section Recorded at - VGP StudiosFlute - NAVEEN ( Mumbai ) Mandolin & Strings - Ankur Mukherjee ( Mumbai ) Electric Guitars - Jobin ( Mumbai ) Additional Programming - SiDdhanth & Osho Recorded at YRF ( MUMBAI ) AM STUDIOS (CHENNAI ) VGP STUDIOS AND V STUDIOS ( CHENNAI ) BY BIJU Shivakumar & OSHO V Mixed and Mastered By - Shadab Rayeen At New Edge ( Mumbai ) New Edge ( NY ) Assisted By - Abhishek & Tapas Musicians Coordinator - MANIGANDAN STUDIO Assistance - Kannan Seenu & LingamLyrical Video Animation : Ruban (Divo)Movie Details:Produced by: Vijay Kiragandur Production House : Hombale FilmsStory, Written & Directed by : Santhosh AnanddramMusic: S. ThamanCinematography: Venkatesh AngurajEditor: Jnaanesh B MatadChoreography - Chinni Prakash MasterStunt : Ram-Lakshman, Anbu-Arivu, Vijay Master, Dhilip SubbarayanDigital & Marketing Partner : KRG ConnectsCostume : Yogi G RajVFX & DI : Igene, ChennaiPoster Design : Kaani StudiosArt : ShivakumarEffects : RajenFollow Us on Social Media Platforms:YouTube: http://bit.ly/HombaleFilmsFacebook: https://www.facebook.com/HombaleFilms/Twitter: https://www.Twitter.com/hombalefilmsInstagram: https://www.instagram.com/hombalefilmsDigital Partner : DivoIn Association with DivoFB : https://www.facebook.com/divomovies/Twitter : https://www.twitter.com/divomovies/Insta : https://www.instagram.com/divomovies/Telegram : https://t.me/divodigital#HombaleFilms #PuneethRajkumar #ThamanS","4M24S"
"Wt-7RlrpAFY","Kili | Season 01 Episode 01 | Vishnu Govindhan | Kaarthik Shankar | Aju Varghese | Funtastic Films","2020-12-26T12:29:09Z","UC3mbMucw7FKRm3cdk6nrePg","Funtastic Films","1","20.27.12","Kili|Kili Episode 1|kaarthik shankar|Vishnu Govindhan|vaishakh nair|Funtastic Films|rj mathukutty|kiliparakkatte|kili webseries|aju varghese comedy|aju varghese web series|kili trapiler|kili teaser|kili new webseries|Kili latest Web serious|Kili New Episode|Comedy Web Serious","380899","20857","1772","1360","https://i.ytimg.com/vi/Wt-7RlrpAFY/default.jpg","False","False","Funtastic Films & Mydesignation Studios Presents KiliCast : Vishak Nair, Karthik Shankar, Sreejith Ravi, Vishnu Govind, R J Mathukutty, Anand Manmadhan, Sreejith B, Gopan Mangat, Megha Jenin, Ganga, Mithun M Das, Shamil Basheer, Jeril Varghese, Aju VargheseWritten & Directed By  : Vishnu Govindhan Producer  :  MyDesignation Studios and Funtastic Films Line Producer  : Ashlee Issac Abraham Cinematography  : Abraham JosephCo - Writers  : Sreejith B, Anand Manmadhan, Jithin Issac ThomasChief Associate Director  :  Sreejith BAssociate Directors  : Sachin R Chandran, Jithin Issac Thomas Editor  :  Bineesh BhaskaranMusic  :  Niranj SureshArt  :  Manav SureshMake up  :  Rony VellattthoovalCostume  : Vipin DasSync Sound  :  Abhijith TharengalColorist  : Liju Prabhakar Sound Mixing  :  Karun Prasad VFX  : DTMProduction Executive  : Sarath SasidharanStill Photography  : Anand ManmadhanPublicity design  :  Nadamel Designs#kiliparakkatteSubscribe On YouTube  :  https://goo.gl/WrX5DKLike  On Facebook : https://goo.gl/bhNNq4Follow on Instagram : https://goo.gl/kz9iMnFollow on Twitter : https://goo.gl/KvKi7GDigital Partner : Avenir TechnologyLike Us : https://www.facebook.com/AvenirTechIndia","24M53S"
