video_id,title,publishedAt,channelId,channelTitle,categoryId,trending_date,tags,view_count,likes,dislikes,comment_count,thumbnail_link,comments_disabled,ratings_disabled,description,duration
"FJLWr7AKPnM","Shiv sama rahe | शिव समा रहे | Baba hansraj Raghuwanshi | Ricky T giftrulers | One man army","2020-12-26T09:30:11Z","UCigV1clokmoz4LZrGL9fRNw","Hansraj Raghuwanshi","10","20.27.12","baba hansraj raghuwansi|baba ji|hansraj raghuwansi|peramjit pummy ji","292762","36603","314","1768","https://i.ytimg.com/vi/FJLWr7AKPnM/default.jpg","False","False","शिव समारहे  गाना बाबाजी के दिल के बहुत करीब हे और फाइनल ऑफिशल सांग Jan 2,2021 को रिलीज़ हो रहा हे |Teaser Out Now Produced By Bholenath Song : Shiv sama rahe Singer/Composer : Hansraj Raghuwanshi https://instagram.com/baba_hans_raghuwanshi?igshid=1o5cmwwnj1xp5Lyrics : Suman Thakur ( Advocate )Music : Ricky T GiftRulers https://instagram.com/ricky_t_giftrulers?igshid=i9hdcvcrms11Mix & Master : Amit Monga https://instagram.com/amitmonga123?igshid=awjx37nxxsh6Director/Editor :  OneManArmy ( Vipin )https://instagram.com/officialonemanarmy?igshid=11l1x0pjmkqsfD.O.P : Raj SamaDrone : Satish Thakur ( The Portable Television)Publicity Design : G Dhillon, One Man Army Project by : Komal Saklani Digital partner : Fatafat Digital","1M21S"
"JRsTj_otOa4","HONDA GADI FULL  VIDE0 4K//JONY & PRERNA//RAJU SOREN & NEHA SOREN//LATEST SANTHALI VIDEO","2020-12-23T12:00:10Z","UCLr8DWMx4Kk5yAi8cacVpYw","Raju Soren","24","20.27.12","[none]","1171495","23417","1853","1855","https://i.ytimg.com/vi/JRsTj_otOa4/default.jpg","False","False","Song Title - Honda Gadi Sponsored By - Bikes India Honda,DumkaLyrics - Samuel MarandiSinger - Raju Soren & Neha SorenDirector - Sudhir HembromAsst. Director - SunilCast & Choreography- Jony Hembrom & Prerna PrabhaMusic - Cs BrothersMakeup Artist - Anamika SorenDOP - Raj & Ro shanEdit - Raj MooSpecial ThanksHarish kr. VermaRaju Kumar","5M6S"
"Apyu3JbrJxI","NEW! Ep 3062 - Tapu Sena ki Checking?! | Taarak Mehta Ka Ooltah Chashmah | तारक मेहता का उल्टा चश्मा","2020-12-21T15:45:00Z","UCnSFZ-olBoLGLRUS_3RI2Aw","Taarak Mehta Ka Ooltah Chashmah","24","20.27.12","Taarak Mehta Ka Ooltah Chashmah|तारक मेहता|sab tv channel|taarak mehta latest episode|hindi comedy show|sab tv funny show|taarak mehta funny|Babita and Jethalal funny|popatlal comedy|taarak mehta comedy|taarak mehta comedy scenes|bhide comedy scenes|jethalal babita funny|funny taarak mehta videos|tarak maheta ka ulta chasma|jethalal|babita|sonu tmkoc|tmkoc|india comedy show|indian tv show|tapu sonu|daya|jetha bhide|jetha daya|tapu sena|taarak episode","9322080","131755","12193","4425","https://i.ytimg.com/vi/Apyu3JbrJxI/default.jpg","False","False","Click here to Subscribe to Taarak Mehta Ka Ooltah Chashmah Official Channel: https://www.youtube.com/taarakmehtakaooltahchashmah?sub_confirmation=1 Click here to watch all your favorite Episode videos: https://www.youtube.com/watch?v=gqFEadNxmd8&list=PLPbh-P_C0BzRYOkpGxKL-6QmvYSL_ZuCu We bring to you the best videos from your favorite show Taarak Mehta Ka Ooltah Chashmah. So, get your daily dose of laughter with Jethalal, Taarak Mehta, Daya, Champaklal and their neighbors in Gokuldham Society.About Taarak Mehta Ka Ooltah Chashmah:--------------------------------------------------------------------The show is inspired from the famous humorous column 'Duniya Ne Undha Chasma' written by the eminent Gujarati writer Mr. Tarak Mehta. This story revolves around daily happenings in Gokuldham Co-operative Society and covers topical issues which are socially relevant. The show predominantly - revolves around 'Jethalal' (Dilip Joshi) who is an uneducated Gujarati businessman. Your 'Taarak Mehta' (Shailesh Lodha), is his neighbor. 'Jethalal' finds a friend and philosopher in 'Taarak Mehta' and often goes to him for advice whenever he is in trouble. Jethalaal's family includes his simpleton wife 'Daya Ben' (Disha Wakani) and a mischievous son 'Tapu' (Bhavya Gandhi / Raj Anadkat). Tapu is a menace and a constant source of trouble to all the members of Gokuldham. They have often warned 'Jethalal' to reform 'Tapu' or else be prepared to leave the premises. Lost hopes of being heard by his son push Jethalaal' to call his father 'Champaklal' (Amit Bhatt) from the village. This was his great idea of leashing some control over the mischievous Tapu. The opposite happens and the grandfather joins hands with the grandson to make life a roller coaster troublesome ride for Jethalal.Cast:---------Dilip Joshi as Jethalal Champaklal GadaDisha Vakani as Daya Jethalal GadaRaj Anadkat / Bhavya Gandhi as Tipendra Jethalal Gada (Tapu) Amit Bhatt as Champaklal Jayantilal GadaShailesh Lodha as Taarak MehtaNeha Mehta as Anjali Taarak MehtaTanuj Mahashabde as Krishnan Subramaniam IyerMunmun Dutta as Babita Krishnan IyerMandar Chandwadkar as Aatmaram Tukaram BhideSonalika Joshi as Madhvi Aatmaram BhideNidhi Bhanushali / Palak Sidhwani as Sonalika Aatmaram Bhide (Sonu) Gurucharan Singh as Roshan Singh Harjeet Singh SodhiJennifer Mistry Bansiwal as Roshan Kaur Roshan Singh SodhiKavi Kumar Azad / Nirmal Soni as Dr. Hansraj Hathi Ambika Ranjankar as Komal Hansraj HathiKush Shah as Gulabkumar Hansraj Hathi (Goli)Shyam Pathak as Popatlal PandeySharad Sankla as AbdulAzhar Shaikh as Pinku Produced By: Neela Asit Modi, Asit Kumarr Modi Special Thanks: Mahesh Vakil, Indu Tarak MehtaSet Design: Jayant DeshmukhCreative Consultant: Dayashankar PandeyOn-Air Promotion  ( SAB): SAB OAPCostume Designer: Alka MehtaCostume Stylist: Ekta BrahmbhattSound Recordist: Shakeel Mansuri Cameraman: Aamir ViraniProduction Head: Arvind MarchandeProduction Controler: Vinod ShishupalBackground Music: Sunil PatniOnline Editors: Vishal Tambe, Sandeep Singh Executive Producer: Jatin Yogesh BajajEditor: Dinesh GosaviCreative Supervision ( Post Production): Krunal KhakhkharProgramming Team: Vinod Rao, Leanne DemeloProject Head: Sohil RamaniWritten By: Ashok ParmarDirectors: Harshad Joshi, Malav Suresh RajdaTelevision Adaptation and Designed By: Asit Kumarr ModiMore Useful Links : * Like us on Facebook : http://www.facebook.com/tmkoc.sabtv* Follow us on Instagram : http://www.instagram.com/taarakmehtakaooltahchashmahnfp * Follow us on Twitter : http://www.twitter.com/tmkoc_ntf* Visit us at : http://www.tmkoc.com#tmkoc #taarakmehta #tmkocsmileofindia","6M1S"
"-r1IBVt8FzE","SHINCHAN का सच - Shinchan Facts and Various Random Scientific and Technological Facts - TEF Ep 119","2020-12-23T12:44:21Z","UCGdPm5Aq081vVD7ih9jZf6Q","FactTechz","28","20.27.12","spirituality|spiritual|knowledge|science|amazing facts|facts|technology|हिंदी|वीडियो|amazing|facttechz|facttechz new video|top enigmatic facts|tef|shinchan|shinchan in hindi","3487616","352469","7884","30570","https://i.ytimg.com/vi/-r1IBVt8FzE/default.jpg","False","False","How far science has gone in terms of exoskeleton technology development? How does the earth look compared to the biggest objects in the universe? Have you ever closely looked at the bristles of your brush? Let's explore some random enigmatic facts in this episode 119 of TEF (Top Enigmatic Facts).Follow:Instagram: https://instagram.com/facttechzTwitter: https://twitter.com/facttechzFacebook: https://facebook.com/facttechzSee you in the next enigmatic and scientific video full of knowledge.","22M47S"
"cJF74ZyMLy0","Master - Chitti Story Lyric (Telugu) | Thalapathy Vijay | Anirudh Ravichander | Lokesh Kanagaraj","2020-12-25T06:45:58Z","UCn4rEMqKtwBQ6-oEwbd4PcA","Sony Music South","10","20.27.12","Sony Music South|Sony Music|Latest Song|Tamil song|Tamil Latest Song|Tamil Latest Songs 2018|Tamil Latest Songs 2019|Latest songs in Tamil|Songs in Tamil|Latest Tamil Movies|Tamil Movie Songs|Latest Video Songs Tamil|latest Tamil Love Songs|Latest Tamil Hit Songs|Telugu Songs 2019|New Tamil Songs|Songs in Telugu|Telugu Movie Songs|Video Songs Telugu|new Telugu Songs","923273","109840","1879","5593","https://i.ytimg.com/vi/cJF74ZyMLy0/default.jpg","False","False","#Thalapathy's #ChittiStory packed with large lessons for life! Hop on this fun journey with #Anirudh for the star's hugely-awaited #Master! Watch the official Telugu lyric video here!Song Title - Chitti StoryMovie: MasterComposed by Anirudh RavichanderLyrics - Anantha SriramVocals by Anirudh Ravichander & Sam VishalStarring Vijay, Vijay SethupathiMalavika Mohanan, Arjun Das, Andrea, Shanthanu Written & Directed by Lokesh KanagarajDop - Sathyan SooryanEditor - Philomin RajProducer - Xavier BrittoCo-Producers - Lalit Kumar, Jagadish PalanisamyMusiciansShehnai - BaleshBass - Naveen NapierPercussions - Anirudh RavichanderKeyboards, Synth and Rhythm Programmed by Anirudh RavichanderMusic Advisor - AnanthakrrishnanCreative Consultant - Sajith SatyaTelugu Supervisor – Priya MaliRecorded at Albuquerque Records, Sound Engineers - Srinivasan M, AnanthakrrishnanVintage Sound Garage, Sound Engineer – Rajesh KannanMixed & Mastered by Vinay Sridhar & Srinivasan MMusic Co ordinator - VelavanMusic Label - Sony Music Entertainment India Pvt. Ltd.© 2020 Sony Music Entertainment India Pvt. Ltd.Subscribe Now: http://bit.ly/SonyMusicSouthVevoSubscribe Now: http://bit.ly/SonyMusicSouthYTFollow us: https://www.instagram.com/sonymusic_south/Follow us: Twitter: https://twitter.com/SonyMusicSouthLike us: Facebook: https://www.facebook.com/SonyMusicSouth","5M23S"
"2ye0GVSaw5o","TESTING LIFE HACKS WITH MY BROTHER & SISTER GRAND FINALE PART 4 | Rimorav Vlogs","2020-12-24T13:50:40Z","UCaqULAbiq-6ZRlKmx0Uv_Cw","Rimorav Vlogs","24","20.27.12","Rimorav|Rimorav Vlogs|TESTING LIFE HACKS WITH MY BROTHER & SISTER GRAND FINALE PART 4 Rimorav Vlogs|Life hacks grand finale|Life hacks grand finale part 4|Life hacks Rimorav Vlogs|Christmas Life hacks|Christmas|Christmas 2020|Rishi Dev|Rimorav Vlogs presents RI Vlogs|Baby queen|Diksha Sharma|Sanjay Dutt|Springspoon","1947167","236716","2956","16799","https://i.ytimg.com/vi/2ye0GVSaw5o/default.jpg","False","False","Watch TESTING LIFE HACKS WITH MY BROTHER & SISTER GRAND FINALE PART 4 by Rimorav Vlogs","9M56S"
"5l9as0y-4uY","CBSE Exam Date Announcement 2021 👍","2020-12-26T18:24:55Z","UCRGl2gA9X6BXqOvNL2jePtw","Mahatmaji Technical","27","20.27.12","[none]","59828","8642","381","458","https://i.ytimg.com/vi/5l9as0y-4uY/default.jpg","False","False","Download Unacademy Learning App & Use This Coupon Code MJT100 To Get Access Of Live Classes ► : https://play.google.com/store/apps/details?id=com.unacademyapp&hl=en_IN&gl=USUse This Coupon Code MJT100 To or Get 10% Extra Discount On Cbse Class 9 Plus Subscription ►  : https://unacademy.com/goal/cbse-class-9/SUVLV/subscribe► Join Our Telegram Group To Get Powerful Exam Strategy For Board Exam Students : https://t.me/mahatmaji_technical►  INSTAGRAM- https://www.instagram.com/mahatmaji_technical/► MY NEW CHANNEL- https://www.youtube.com/channel/UCr6hHjMNvgQxErQ1ZJV4drw► MY MIC - http://amzn.to/2fimr1G► MY LAPTOP - http://amzn.to/2hoh1qb► MY CAMERA - http://amzn.to/2fji9qOFOLLOW ME►FACEBOOK- https://www.facebook.com/mahatmajitechnical► TWITTER- https://twitter.com/mahatmajitechजब तुम नहीं पढ़ रहे हो तो , उस टाइम कोई न कोई पढ़ रहा होगा, और जिस  दिन वह तुमसे मिलेगा वह जीत जाएगा [Amresh] Mahatmaji Technical is a YouTube Channel, where you will find Educational, informative, motivational Videos, like how to study, how to motivate  in Hindi,  :)Topic:- how to study, how to study smart, student motivational video for success ►S-U-B-S-C-R-I-B-E- mahatmaji technical  https://www.youtube.com/channel/UCRGl2gA9X6BXqOvNL2jePtw","5M53S"
"06hq7B93KjY","Kevvu  Karthik Performance | Extra Jabardasth| 25th December 2020 | ETV Telugu","2020-12-25T19:05:22Z","UCnoqvTW4YZExfDeq7_Wmd-w","ETV Jabardasth","23","20.27.12","jabardasth|etv jabardasth|jabardasth telugu|jabardasth 2018|hyper aadi|telugu jabardasth|jabardasth 2019|hyper aadi jabardasth|jabardasth aadi|aadi jabardasth|jabardasth naresh|youtube jabardasth|jabardasth in telugu|etv telugu jabardasth|today jabardasth","2068953","38373","2024","1058","https://i.ytimg.com/vi/06hq7B93KjY/default.jpg","False","False","#Jabardasth #ExtraJabardasth #TeluguShow #ETVWin #TeluguComedyShow #Anasuya #Roja #HyperAadi #Mano #SudigaaliSudheer #Rashmi #SekharMaster To watch your ETV all channel’s programmes any where any time Download ETV Win App for both Android & IOS: https://f66tr.app.goo.gl/appsETV Telugu(Youtube) - http://bit.ly/2QR0yu9  Facebook - http://bit.ly/2L2GYYhETV Jabardasth(Youtube) - http://bit.ly/35xdqtuETV Dhee(Youtube) - http://bit.ly/2Ok8zWFETV Plus India(Youtube) - http://bit.ly/2OlEAOgFacebook - http://bit.ly/2DudC0tETV Abhiruchi(Youtube) - http://bit.ly/2OkEtTbFacebook - http://bit.ly/2OSrIhvETV Life(Youtube) - http://bit.ly/2OiKAY6Facebook - http://bit.ly/34tiqzkETV Telangana(Youtube) - http://bit.ly/33nRaAKFacebook - http://bit.ly/37GkVQFETV Andhra Pradesh(Youtube) - http://bit.ly/2OKARZzFacebook - http://bit.ly/2R0vs3k► Like us on Facebook : https://www.facebook.com/etvwin► Follow us on Instagram : https://www.instagram.com/etvwin/► Follow us on Twitter : https://twitter.com/etvwin► Visit Website : https://www.etvwin.com/► Pin us on Pinterest: https://in.pinterest.com/etv_win/","14M46S"
"RsSXIWOxpas","Sathya | Premiere Episode 490 Preview - Dec 29 2020 | Before ZEE Tamil","2020-12-26T11:55:27Z","UCXOgAl4w-FQero1ERbGHpXQ","ZEE5","24","20.27.12","zee5|web series trailer|zee5 originals|latest web series 2020|zee5 original movies|hindi web series|tamil web series|bengali web series|upcoming movie trailer|ZEE Marathi|ZEE Marathi tv serial|zee telugu|zee telugu serial|zee bangla|zee bangla serial|zee kannada|zee kannada serial|zee tamil|zee tamil serial|zee tv|zee tv serial|And tv|And tv serial|before tv|spoilers|tv show spoilers|tv serial updates","566644","7712","199","131","https://i.ytimg.com/vi/RsSXIWOxpas/default.jpg","False","False","Watch tomorrow’s Premiere Episodes of ZEE Tamil TV serials today. Get the best of ZEE5 Originals, popular Alt Balaji shows, 1000+ superhit movies, favourite Zindagi shows, popular kids entertainment, Live TV channels and more.https://www.zee5.com/myaccount/subscription?plid=0-11-1503&utm_source=yt&utm_medium=ref&utm_campaign=subscription","1M19S"
"uWUeAfgIAz0","Surprise Gift| Thangu | Chalu Network","2020-12-25T04:30:02Z","UC_GJadJjdUUJ93Wg2qJ6z3w","Chalu Network","23","20.27.12","chalunetwork|chalu|thangu|chalinetwork|chalu network|new chalu|chalu new video|chalunetwork2020|surprise gift|christmas|santa claus","198689","23599","392","1319","https://i.ytimg.com/vi/uWUeAfgIAz0/default.jpg","False","False","Hi there! If you enjoyed my video, dont forget to drop a like!I am active on instagram @chalunetworkInstagram: https://www.instagram.com/chalunetwork/Facebook: https://www.facebook.com/chalunetwork***************************************************************************************Play My GamesSling Superheroes:  https://bit.ly/2DH871XSling Football:  https://bit.ly/3j1jMsR","3M9S"
"RdQ563hOzM0","എൻഗേജ്മെന്റിനു ശേഷം മൃദുലയും യുവയും മാധ്യമങ്ങളെ കണ്ടപ്പോൾ | Mridula Vijay & Yuva Krishna Press Meet","2020-12-23T07:50:22Z","UClFe5TPbW1MVrOPpbNHTDoQ","Indian Cinema Gallery","24","20.27.12","mridula vijay|midhula vijai|yuva krishna|mridula vijay engagement|mridula vijay marriage|mridula vijay yuva krishna interview","1258245","23578","737","1027","https://i.ytimg.com/vi/RdQ563hOzM0/default.jpg","False","False","എൻഗേജ്മെന്റിനു ശേഷം മൃദുലയും യുവയും മാധ്യമങ്ങളെ കണ്ടപ്പോൾ | Mridula Vijay & Yuva Krishna Press Meet after engagement function. Midhula Vijai & Yuva Krishna speaking to media. #mridulavijay #yuvakrishna","4M12S"
"xYlndL7rqI4","SUPER FUN PICTIONARY CHALLENGE | Akash Dodeja | Paras Rupani | Karan Dhanwani","2020-12-25T07:49:12Z","UCYecVZiu7sUbuUw-AdVHM7A","Simran Dhanwani","23","20.27.12","pictionary|pictionary game|pictionary challenge|simran|simran dhanwani|simran dhanwani new video|simran dhanwani dance|simran dhanwani qna|akash dodeja|akash dodeja new video|akash dodeja qna|akash dodeja bts|jadoo vlogs|jadoo new vlog|super fun pictionary challenge|ashish chanchlani|ashish chanchlani diwali|ashish chanchlani new video|ashish chanchlani exam|ashish chanchlani girlfriend|challenge|merry christmas|christmas songs|christmas videos","274074","33012","1101","2679","https://i.ytimg.com/vi/xYlndL7rqI4/default.jpg","False","False","Download Duolingo For Free - https://app.adjust.net.in/jytbt4rPehli baat aap log soch rahe hoge main aur paras kaise jeete? Aap hi batao, channel kiska? video kiska? 😉Arey mazaak kar rahi hun. Main aur Paras working marks se pass huye in SAMBHOG KI PYAASI CHUDAILAur I know video thoda chhota hai coz Grishim ko edit karna nahi ho raha tha toh isliye iska remaining part we will upload on insta.Thank You for Watching this. Like karo, share karo, SUBSCRIBE KARO aur mujhe comments mein apna favourite part batao.SPECIAL THANKS TO:@Akash Dodeja @Paras Rupani Karan Dhanwanihttps://instagram.com/dhanwanikaran?igshid=gzkd93sgtkv3Grishim Nawanihttps://instagram.com/grishim_20?igshid=1g8laoji8g5y0Music:Hustle by Kevin MacLeod is licensed under a Creative Commons Attribution 4.0 license. https://creativecommons.org/licenses/by/4.0/Source: http://incompetech.com/music/royalty-free/index.html?isrc=USUAN1100793Artist: http://incompetech.com/Spy vs Spy - DJ Williams","15M59S"
"wsrnsfDqV1o","We got New pets ( Ram became so happy )","2020-12-24T10:30:32Z","UCs2k3NNHl5iqt2sExe2cu_w","Keerthi Shrathah","26","20.27.12","Keerthi shrathah|shrathah|ram with jaanu|keerthi beauty tips|tamil beauty tips|beauty tips in tamil|vlogger|tamil beauty channel|new pet|new pet surprise|we got a new pet|fish tank|aquarium|fish|aquarium fish tank|ram jaanu pet|febbie|ram with jaanu febbie|febbiedog|tamil youtuber keerthi shrathah|diml|day in my life|a day in my life|vlog|vlogmas|rj vlogs|rj|fish tank tour|fish room|plum kajal|plum kajal review|how to apply kajal|dog reaction","461168","25204","637","853","https://i.ytimg.com/vi/wsrnsfDqV1o/default.jpg","False","False","Hey guys!!  Hope you're doing well!! WE GOT NEW PETS and we loved it so much!!! And the pets we bought are FISHES..  So in this vlog you will see everything from buying the tank, fishes and setting them up! We also made Payasam and i showed the recipe..  Please watch full video to not miss any fun out... Hope you guys enjoy the video ❤Plum KajalTo Purchasehttps://bit.ly/37xa8KO Amazonhttp://amzn.to/37wHMQUVERUM RAM YOUTUBE CHANNEL : https://www.youtube.com/channel/UC1hxOuq2Kp2dvcGdVtTdUBwOUR COUPLE ENTERTAINMENT CHANNEL - RAM WITH JAANU https://www.youtube.com/c/RamWithJaanu❤❤❤❤DISCLAIMER : EVERYTHING I HAVE SHARED IN THIS VIDEO IS COMPLETELY MY THOUGHTS AND OPINIONS. IT IS SHARED FOR PEOPLE WHO MIGHT FIND IT USEFUL! YOU ARE NOT ALLOWED TO USE THE VIDEO WITHOUT MY PERMISSION! ABUSIVE COMMENTS ARE NOT ACCEPTED IN THIS CHANNEL! IF YOU SHARE ABUSIVE COMMENTS YOU WILL BE BLOCKED IMMEDIATELY THEN YOU CAN NEVER COMMENT HERE! CONSTRUCTIVE CRITICISM ARE MOST WELCOME!❤❤❤❤My Instagram HandleMy personal accounthttps://www.instagram.com/keerthishrathah/?hl=enMy bridal makeup accounthttps://www.instagram.com/makeover_by_keerthi/?hl=en","20M23S"
"Hp80LOHTR84","अमीर और गरीब का क्रिसमस, Christmas Day Special, Hindi Moral Story, Motivational Story, Ajay Chauhan","2020-12-22T03:04:07Z","UCMmHfwNsk0QUe0jhv5zTAFQ","Ajay Chauhan","24","20.27.12","अमीर और गरीब का क्रिसमस|ameer aur gareeb ki kahani|ameer aur gareeb ki kahani part 4|christmas day special 2020|motivational story in hindi|motivational story video|motivational story for students|a motivational story with moral|hindi moral stories new|hindi moral stories 2020|hindi moral stories new 2020|hindi moral stories in hindi|hindi moral stories all|hindi moral stories kahaniya new|hindi moral stories channel|ajay chauhan new video|amir aur garib part 20","3325561","27745","10770","1835","https://i.ytimg.com/vi/Hp80LOHTR84/default.jpg","False","False","Subscribe DJ Trader Channel to learn how to make money -  https://bit.ly/345DDkJApp where DJ Trader earns money - https://bit.ly/3gC3RAhajay chauhan vlogs,ajay chauhan new video,ajay chauhan video,ajay chauhan new,ajay chauhan all videos,ajay chauhan ameer vs gareeb,ajay chauhan bhai behan ka pyar part 2,ajay chauhan channel,ajay chauhan diwali,ajay chauhan desi vs modern,ajay chauhan diwali special,ajay chauhan dalit,ajay chauhan devrani jethani,ajay chauhan entertainment,ajay chauhan episode,ajay chauhan expectation vs reality,ajay chauhan new episode,ajay chauhan first video,ajay chauhan funny video,ajay chauhan family,ajay chauhan full movie,ajay chauhan film,ajay chauhan first vlog,ajay chauhan hindi,ajay chauhan hindi medium,ajay chauhan in hindi,ajay chauhan kanjoos patni,ajay chauhan ki video,ajay chauhan ka video,ajay chauhan kanjoos patni ka atyachar","10M29S"
"_ZdtyBvNdJo","CRICKET with SANTA || JaiPuru","2020-12-23T08:17:18Z","UCByS1f-QpAsgUbFb6qSNGZw","JaiPuru","24","20.27.12","jaipuru|jaipuru cricket with santa|jaipuru new video|jaipuru christmas video|jaipuru funny video|jaipuru comedy video|jaipuru funny christmas video|jaipuru cricket video|jaipuru gully cricket|jaipuru santa|jaipuru latest video|jaipuru merry christmas|jaipuru vines|jaipuru videos|jaipuru santa wishes|jaipur videos|jaipuru trending|jaipur funny videos|jai|puru|jaipuru viral|jaipuru funny santa|jaipuru kids|jaipuru school|jaipuru phone|jaipuru rakhyakar","748892","22907","2191","1255","https://i.ytimg.com/vi/_ZdtyBvNdJo/default.jpg","False","False","JaiPuru Vlogs : https://www.youtube.com/channel/UCA84lPTiTp5P0CHu3Rk5j0QFor Behind The Scenes & MoreFollow us on Instagram @JaiPuru https://www.instagram.com/jaipuru/Also Follow us on Facebook : https://www.facebook.com/officialJaiPuruTwitter : https://twitter.com/jai_puru?lang=enInstagram : https://www.instagram.com/jaipuru/SubscribeJaiPuru : https://www.youtube.com/c/jaipuruvines----------------------------------------------------------------------------------Jai : https://www.instagram.com/babybatra/Puru : https://www.instagram.com/justpuru/Edited By : Rajat SethiVideography By : Nitish GoelVFX : Raj SharmaThumbnail : Raj Sharmahttps://www.instagram.com/iamrajsharmaa/","11M21S"
"2rAdzAFwqzs","Coolie No 1 Movie REVIEW | Deeksha Sharma","2020-12-25T07:49:52Z","UCeiAKuJGZrIjYvaq0nMwbJg","Filmi Indian","24","20.27.12","coolie no 1|coolie no 1 review|coolie no 1 varun dhawan|coolie no 1 movie review|coolie no 1 full movie|coolie number 1|coolie no. 1|varun dhawan|movie|review|Sara Ali Khan|govinda|coolie no 1 amazon prime|movie review|wonder woman|ak vs ak|coolie no 1 roast|criminal justice season 2|coolie no 1 movie|filmi indian|amazon prime","525000","52432","8204","5082","https://i.ytimg.com/vi/2rAdzAFwqzs/default.jpg","False","False","Coolie No 1 Movie Review In Hindi By Deeksha Sharma. Coolie No 1 Amazon Prime Movie Featuring Varun Dhawan, Sara Ali Khan is A Remake of Govinda Coolie Movie which was a Perfect Family Comedy Entertainer. Coolie No 1 Full Movie Details & Discussion about Story & Strength Weakness will be shared in this Video. Do let me know your Reaction about Coolie No 1 Varun Dhawan Performance as compared to Govinda in Comment Section.➤ Follow Me on Instagram-     https://www.instagram.com/thefilmiindian➤ Follow Me on Twitter-     https://twitter.com/thefilmiindian#CoolieNo1 #CoolieNo1Review #CoolieNo1VarunDhawan","5M2S"
"ynYKqSptm7Y","Chakkappazham | Flowers | Christmas Special Episode","2020-12-25T12:30:05Z","UCmAPdImtXLGh5E-lTTH4Qmg","Flowers Comedy","24","20.27.12","flowers tv|flower tv comedy|flower tv malayalam|malayalam comedy|malayalam comedy movies|Comedy Utsavam|mimicry|comedy|mimic|stage|kerala|talent|malayalam|entertainment|malayalam cinema","1315619","40992","1425","2435","https://i.ytimg.com/vi/ynYKqSptm7Y/default.jpg","False","False","90+ My Tuition App 5 മുതൽ +2  വരെയുള്ള കേരള സിലബസ് പഠിക്കുന്ന കുട്ടികൾക്കായി ടെക്സ്റ്റ് ബുക്ക് അധിഷ്ഠിതമാക്കിയുള്ള  ഡിജിറ്റൽ ട്യൂഷൻ.Download 90+ My Tuition App now: https://play.google.com/store/apps/details?id=com.mytuitionapp.studentJoin us on Facebook- https://www.facebook.com/flowersonair Twitter     https://www.twitter.com/flowersonairGoogle Plus -https://plus.google.com/+FlowerstvIndia","19M9S"
