video_id,title,publishedAt,channelId,channelTitle,categoryId,trending_date,tags,view_count,likes,dislikes,comment_count,thumbnail_link,comments_disabled,ratings_disabled,description,duration
"flD53AUOEcc","7 МИНУТ СМЕХА | ЛУЧШИЕ ПРИКОЛЫ ОКТЯБРЬ 2020 ПОПРОБУЙ ЗАСМЕЯТЬСЯ ЧЕЛЛЕНДЖ ЗАСМЕЯЛСЯ ПРОИГРАЛ","2020-10-23T07:30:01Z","UCdd2rozVKNHZg9oTeY_X7WQ","Виндяй","23","20.24.10","прикол|приколы|coub|твич втф|реакция|кубы|академия смеха|авто приколы|смотрит|лучшие моменты|смешные видео|twitch wtf|твичру|best coub|союз смеха|стрим|лучшие приколы|тик ток|tik tok|засмеялся подписался|приколы 2020 лучшие|май 2020|2020|лучшие приколы 2020|приколы 2020|10 минут смеха|10 минут приколов|виндяй|винди|windy|windy31|винди31","268732","33155","1207","1083","https://i.ytimg.com/vi/flD53AUOEcc/default.jpg","False","False","Если нашли свое видео - пишите на почту windyreactions31@gmail.com Подпишись, не петушись - http://bit.ly/2dTcaM9Мой вк - https://vk.com/windyaiМоя группа - http://bit.ly/2ep8Ur8Оригинал - https://www.youtube.com/watch?v=GJA_preMUH8Хочешь посмотреть веселые видео или тест на психику не смейся челлендж? Тогда ты пришел по правильному адресу! На этом канале можно найти много блогов и других интересных видео, в том числе, конечно и тест на психику не смейся челлендж. Попробуй не засмеятся на этом видео или продержись дольше меня, тогда с тобой все в порядке, а если нет, то ничего :DВ общем, смотрим тест на психику не смейся челлендж и радуемся жизни, такие дела. Так же не забывай смотреть на другие блоги и видео челленджи на канале и подписываться, чтобы больше найти интересных и веселых видео. ЛУЧШИЕ ПРИКОЛЫ проиграл приколы 2019","6M25S"
"9eUKWyx4hME","Гамбола | Тупицы + Секрет (серия целиком) | Cartoon Network","2020-10-23T11:00:01Z","UCKTDayZg3-A55GqMy7h3BDQ","Cartoon Network Россия","24","20.24.10","детский|мультик|мультфильм|мультсериал|Cartoon Network|картун нетворк|тв|серия|смотреть|видео|медведи|Удивительный мир Гамбола|Гамбола|Гамбол|Тупицы|Секрет|серия целиком","134893","2818","176","0","https://i.ytimg.com/vi/9eUKWyx4hME/default.jpg","False","False","Чтобы вернуть папу Гамбол борется за победу в Сумасшедшей гонке.Гамбол едва не лишается рассудка, пытаясь разгадать тайну Дарвина.Подпишись на канал Cartoon Network Россия на YouTube: https://www.youtube.com/CartoonNetworkRussЗаходи на сайт Cartoon Network Россия: http://www.cartoonnetwork.ruОфициальное сообщество Вконтакте:https://vk.com/cnrussiaВступай в наше сообщество в Facebook:http://www.facebook.com/CartoonNetworkRuДобро пожаловать на официальный канал Cartoon Network Россия, здесь ты всегда найдешь веселые видео, клипы с любимыми мелодиями и песнями, а также интерактивные игры по мотивам «Времени приключений», «Удивительного мира Гамбола», «Бен 10», «Юные титаны, вперед», «Миксели», «Обычный мультик», «Бэтмен», «Дядя Деда», «Вселенная Стивена», «Кларенс», «Луни Тюнз» и других. Будь готов к веселью, подписывайся и смотри новые видео каждую пятницу!","22M39S"
"lSK4Mvap5i0","[BANGTAN BOMB] Musical Actors BTS - BTS (방탄소년단)","2020-10-24T08:00:03Z","UCLkAepWjdylmXSltofFvsYQ","BANGTANTV","10","20.24.10","방탄소년단|BTS|BANGTAN|HIPHOP|알엠|RM|슈가|SUGA|제이홉|jhope|지민|JIMIN|뷔|정국|JUNGKOOK|진|JIN","2580130","755762","1417","33164","https://i.ytimg.com/vi/lSK4Mvap5i0/default.jpg","False","False","Connect with BTS: https://ibighit.com/bts http://twitter.com/BTS_bighithttp://twitter.com/BTS_twt http://www.facebook.com/bangtan.official https://www.youtube.com/user/BANGTANTV http://instagram.com/BTS.bighitofficial https://channels.vlive.tv/FE619 https://www.tiktok.com/@bts_official_bighithttps://weverse.onelink.me/qt3S/94808190https://www.weibo.com/BTSbighithttps://www.weibo.com/BTSmembers http://i.youku.com/btsofficial http://btsblog.ibighit.com","4M9S"
"57G-FiYstlM","ПОСТРОИЛИ НАСТОЯЩИЙ 2-Х ЭТАЖНЫЙ ДОМ ЗА 60 ДНЕЙ ! ЧАН","2020-10-24T12:00:02Z","UCve3T2JUto59BcaBujrn-Lw","Интересный Фикус","28","20.24.10","дом|настоящий дом|настоящий 2-х этажный дом|домик|построили дом|2-х этажный дом|дом за 60 дней|ПОСТРОИЛИ НАСТОЯЩИЙ 2-Х ЭТАЖНЫЙ ДОМ ЗА 60 ДНЕЙ|ремонт|стройка|постройка|интересный фикус|фикус|сергей интересный|построили дом за 60 дней|дом своими руками|как построить дом|дом из газобетона|кухня|обзор дома|чан|баня","98053","13845","197","2395","https://i.ytimg.com/vi/57G-FiYstlM/default.jpg","False","False","ПРОШЛОЕ ВИДЕО : https://youtu.be/-J4NYsN2Xz0МЫ В ЛАЙКЕ !! ЗАЦЕНИ 👍🏻ФИКУС:  https://mobile.likee.video/k/403481164 СЕРГЕЙ https://mobile.likee.video/k/273860551 Интересный : https://instagram.com/sergey_interesniyФикус :     https://www.instagram.com/vi.ficusНаш Лайф-канал : https://goo.gl/nWFxN1Мы в Лайке :https://mobile.likee.video/k/273860551 Фикус : https://mobile.likee.video/k/403481164ВКонтакте - https://vk.com/sergeyinteresniyVK Фикус - https://vk.com/vi.ficusДля сотрудничества и коммерческих предложений : barakumba1@gmail.comМузыка : Production Music courtesy of Epidemic Sound!Мы построили крутой дом , вернее 2-х этажный дом из блока  всего за 60 дней . Это наверное самая быстрая постройка дома , так же из старого дома мы сделали крутую баню , баню на дровах , баню , в которой можно парится на своем участке. #дом  #домсвоимируками #построилидом #стройка #строимдом","16M10S"
"LPpvyRsIwMM","Şeref Sözü | 3. Bölüm Fragmanı","2020-10-23T20:45:31Z","UCcNmp8stehmq_lU7rcgjXAg","Şeref Sözü","1","20.24.10","Şeref Sözü|Şeref sözü dizisi|tolgahan sayışman|Tims&B|yeni dizi|şeref sözü fragman|şeref sözü oyuncuları|Sude Güler|Hülya Darcan|Aras Aydın|Meltem Gülenç|Öykü Çelik|Şeref sözü 1. bölüm|Şeref sözü full bölüm|cihan adabeyli|Şeref sözü yeni bölüm|şeref sözü ilk bölüm|Şeref Sözü 3. Bölüm Fragmanı","568136","13065","169","1052","https://i.ytimg.com/vi/LPpvyRsIwMM/default.jpg","False","False","Şeref Sözü 3. Bölüm FragmanıADABEYLİ ADASI'NI VE ADABEYLİ AİLESİ'Nİ BÜYÜK SIRLAR BEKLİYOR'Adabeyli Ailesi' sahip oldukları adada kendi koydukları kurallar çerçevesinde yaşamaktadır. 'Cihan Adabeyli'; koskoca bir servetin ve toprakların yegane sahibi, atadan kalma bir düzenin temsilcisidir.Ansızın Adabeyli Adası'na bir telefon gelir ve 'Cihan Adabeyli'nin tüm hayatı geçmişte canını kurtaran bir adama verdiği şeref sözünü tutma vaktinin gelmesiyle değişir. Arayan 'İsra'dır.'İsra'nın tek bir umudu vardır; o da 'Cihan Adabeyli'dir.Adabeyli Adası'nda 'İsra'nın gelişi ve yanında getirdikleriyle geçmişin sırları ortaya dökülecek, geleceğe dair büyük bir yangının fitili ateşlenecektir.Verilen şeref sözü, geride kalan her şeyin yıkımına ve çok büyük acılarla sınanacak destansı bir aşkın doğumuna sebep olacaktır.İnstagram : shorturl.at/pBI09Twitter : shorturl.at/ekpUYWEB : shorturl.at/sxAFUFacebook  : shorturl.at/rCJK3@timsandb @showtv","1M22S"
"QbMcYvbXf58","КОРОЧЕ ГОВОРЯ, Я В ПАРАЛЛЕЛЬНОЙ ВСЕЛЕННОЙ 19 [От первого лица] ДРУГОЙ МИР","2020-10-24T07:00:03Z","UC6r7WAQEBceDnEtSQi4MZtA","Корявый VLOG","23","20.24.10","параллельная вселенная|короче говоря|короче|я в параллельной вселенной|короче говоря я в параллельной вселенной|короче говоря параллельная вселенная|короче говоря другой мир|короче говоря от первого лица|другой мир|все наоборот|кароче|rjhjxt ujdjhz|кароче гаваря|от первого лица|вселенная|другая реальность|параллельные миры|корявый|корявый влог|юмор|видео короче говоря|короче говоря корявый влог|корявый влог параллельная вселенная","89467","6661","197","746","https://i.ytimg.com/vi/QbMcYvbXf58/default.jpg","False","False","Короче говоря, я снова оказался в параллельной вселенной. В мире где совсем другая жизнь, где все наоборот и наизнанку. Параллельная вселенная всегда радует нас интересными событиями. Здесь взрослые ходят в школу, а школьники работают. Короче, в этой истории от первого лица вы увидите те самые параллельные миры. Весь движ в INSTAGRAM - http://instagram.com/koryavyivlogДобавляйтесь в друзья в вк - https://vk.com/bubnov_denisМой Tik Tok - https://vm.tiktok.com/xFPH4E/РЕБЯТА, В ДАННОМ ВИДЕО ВСЕ ПЕРСОНАЖИ И СОБЫТИЯ ВЫМЫШЛЕНЫ. Привет! Ты на канале Корявый VLOG! Здесь я снимаю #Корочеговоря, От первого лица, скетчи и вообще все, что будет интересно мне и Вам.   Я не плагиат и не стремлюсь быть похожим на Room Factory, OneTwo, Тим Тим, Mak, ИККЕРО  и прочих. Пытаюсь сделать свой формат.   Если вам понравился этот ролик, поставь лайк, подпишись на канал и нажми на колокольчик, чтобы не пропустить следующие видео! Так я вижу, что мои труды не напрасны! Спасибо! ✉ По вопросам рекламы и сотрудничества - MrSerDonPR@yandex.ru или  https://vk.com/bubnov_denis ✉#отпервоголица #короче #корявый #корявыйвлог #вреальнойжизни #отпервого #робот #киборг #яробот #терминатор Sound Effects by http://www.audiomicro.com/sound-effects  Музыкальная композиция ES_Adventurous (Indie Pop Version) - Alexander Munk принадлежит http://www.epidemicsound.com/ и использована по лицензии для компании ScaleLab Russia.Музыкальная композиция ES_And The Sky Shall Unfold 3 - Johannes Bornlцf принадлежит http://www.epidemicsound.com/ и использована по лицензии для компании ScaleLab Russia.Музыкальная композиция ES_Before The Dawn (COE Remix) - Wild Beaches принадлежит http://www.epidemicsound.com/ и использована по лицензии для компании ScaleLab Russia.Музыкальная композиция ES_Better Late Than Never Baby - Jesse Lawrence принадлежит http://www.epidemicsound.com/ и использована по лицензии для компании ScaleLab Russia.Музыкальная композиция ES_Bring To An End 1 - Johannes Bornlцf принадлежит http://www.epidemicsound.com/ и использована по лицензии для компании ScaleLab Russia.Музыкальная композиция ES_Cause I Am Coming Home (Adua Blaize Remix) (Instrumental Version) - Duty Division принадлежит http://www.epidemicsound.com/ и использована по лицензии для компании ScaleLab Russia.Музыкальная композиция ES_Choo Choo (Instrumental Version) - Stonekeepers принадлежит http://www.epidemicsound.com/ и использована по лицензии для компании ScaleLab Russia.Музыкальная композиция ES_Come On Out (Instrumental Version) - Kalle Engstrom принадлежит http://www.epidemicsound.com/ и использована по лицензии для компании ScaleLab Russia.Музыкальная композиция ES_Crazy for You (Instrumental Version) - Wildflowers принадлежит http://www.epidemicsound.com/ и использована по лицензии для компании ScaleLab Russia.Музыкальная композиция ES_Endless Summer (Instrumental Version) - Sebastian Forslund принадлежит http://www.epidemicsound.com/ и использована по лицензии для компании ScaleLab Russia.Музыкальная композиция ES_Feline (Instrumental Version) - Kadant принадлежит http://www.epidemicsound.com/ и использована по лицензии для компании ScaleLab Russia.Музыкальная композиция ES_Gossip Talk 1 - Gavin Luke принадлежит http://www.epidemicsound.com/ и использована по лицензии для компании ScaleLab Russia.Музыкальная композиция ES_In And Out Of Love (Late Yungin Remix) (Instrumental Version) - Martin Hall принадлежит http://www.epidemicsound.com/ и использована по лицензии для компании ScaleLab Russia.Музыкальная композиция ES_It's Not That Serious - Arthur Benson принадлежит http://www.epidemicsound.com/ и использована по лицензии для компании ScaleLab Russia.Музыкальная композиция ES_Action Adventure Trailer 2 T60 - Magnus Ringblom принадлежит http://www.epidemicsound.com/ и использована по лицензии для компании ScaleLab Russia.Музыкальная композиция ES_Puzzle - Catiso принадлежит http://www.epidemicsound.com/ и использована по лицензии для компании ScaleLab Russia.Музыкальная композиция ES_Lawnmower Trouble - Stationary Sign принадлежит http://www.epidemicsound.com/ и использована по лицензии для компании ScaleLab Russia.Музыкальная композиция ES_Rise Or Fall 1 - Jon Bjцrk принадлежит http://www.epidemicsound.com/ и использована по лицензии для компании ScaleLab Russia.","16M16S"
"wB4aq9mxjv8","Хабиб сделал вес с полотенцем перед боем против Гэтжи / Khabib Nurmagomedov weight in UFC 254","2020-10-23T05:13:25Z","UCkrbi2bmw7DQuuC8k4TP-QA","TRUE GYM MMA","17","20.24.10","хабиб взвешивание|хабиб|хабиб нурмагомедов|хабиб против гэтжи бой|гэтжи|гейджи|хабиб гейджи бой|джастин гейджи|хабиб весогонка|ufc 254|ufc|бой|против|бои|true gym|мма|mma|хабиб гэтжи бой|хабиб гэтжи когда бой|бой хабиб гэтжи|хабиб гэтжи прогноз|хабиб против гэтжи|бой хабиба|тренер|хавьер мендес|битва взглядов хабиб гэтжи|весогонка|взвешивание ufc 254|weight in ufc 254|weight in khabib|weight in gaethje|gaethje|khabib|gaethje vs khabib","792568","17804","515","3277","https://i.ytimg.com/vi/wB4aq9mxjv8/default.jpg","False","False","Хабиб Нурмагомедов взвешивание перед боем против Гэтжи на UFC 254 / Khabib Nurmagomedov weight in UFC 254 Понравился ролик, подпишись 👉🏻 http://goo.gl/JxoIQRНаш Инстаграм 👉🏻 https://www.instagram.com/truegyyym/Группа ВКонтакте 👉🏻 https://vk.com/truegym🥊 Залы для занятия боксом в Москве 👉 http://extrimpower.ru/Лучшая благодарность для нас - твой лайк, репост и комментарий под видео. Огромное спасибо за просмотр ﭢВсе права принадлежат TRUE GYMИспользование фрагментов видео разрешено только с согласия автора.","2M17S"
"r77tQSXNCok","Чернее черного","2020-10-23T15:00:32Z","UCIi2Tk2POJkRgWHD7HGBa7Q","Наука 2.0","24","20.24.10","чернее черного|самый черный|супер черный|самый черный цвет|самый черный материал|самый черный в мире|vantablack|вантаблэк|метаматериалы|Surrey NanoSystems|vantablack paint|vantablack car|what is vantablack|уникальное вещество|углеродных нанотрубок|трехмерное|двухмерное|нанотрубки|углерод|графен|стелс|с покрытием Vantablack|Где применяется вантаблэк|самая черная краска|поглощает свет|blackest black|черная дыра|чернота|бездна|материалы будущего|изобретения","76576","2787","83","232","https://i.ytimg.com/vi/r77tQSXNCok/default.jpg","False","False","Vantablack - чернее черного. Полный выпуск Метаматериалы https://youtu.be/ZrHiMLIGG4YВсе новинки канала смотри в приложении Моя планета: App Store - http://bit.do/planet_ios, Google Play - http://bit.do/planet_android►Подпишись на канал Наука: https://www.youtube.com/c/naukatv?sub_confirmation=1►Все выпуски: https://www.youtube.com/playlist?list=PLS93_pp5BAdUJhqfNK6Kz9uFwrr1zurdE📃 Английская компания разработала уникальное вещество из углеродных нанотрубок, которое обладает самым черным цветом в мире. Оно называется вантаблэк (Vantablack) и поглощает 99,965% падающего на него света. Или, другими словами, отражающий всего 0,035 % света. Человеческий глаз не способен распознать это вещество как трехмерное, оно воспринимается как двухмерный провал в черную дыру. Где применяется вантаблэк?📂 Научные сенсации - это цикл фильмов, рассказывающих о сенсационных научных открытиях и достижениях наших дней. Это научные прорывы, меняющие представление людей о мире, а в перспективе - жизнь человечества. Проект ставит своей задачей дать зрителю представление о месте новейших достижений в самом широком ряду современных научных представлений. Фильмы будут исполнены в различных жанрах (как с ведущим в кадре, так и без), что диктуется спецификой каждой конкретной сенсации.Наши ресурсы:🔸Официальный сайт: http://www.naukatv.ru🔹ВК: https://vk.com/tv_nauka🔸Facebook: https://www.facebook.com/naukatv🔹ОК: https://ok.ru/naukatv🔸Инстаграм: https://www.instagram.com/naukatvОфициальный канал Наука 2.0. Научно-популярный познавательный канал о достижениях российской и мировой науки: человек, техника, технологии и космос. Специальные проекты и программы. Наука 2.0 – канал для тех, кто интересуется настоящим и хочет знать, каким будет наше будущее.Большинство зрителей даже не представляет, что такое современная наука и над чем сегодня работают ученые всего мира. Наша основная задача – рассказывать о значимых изобретениях, технологиях и открытиях. Ведь в 21 веке развитый интеллект, эрудированность и способность к нестандартному мышлению - настоящий ключ к успеху.🔎 Смотри все передачи:◽ Агрессивная среда - https://bit.ly/AggressiveEnvironment◽ Анатомия монстров - https://bit.ly/MonstersAnatomy◽ Бионика - https://bit.ly/ScienceBionics◽ Биосфера. Законы жизни - https://bit.ly/BiosphereZakonyZhizni◽ Большой скачок - https://bit.ly/GreatLeapForward◽ Британские ученые доказали - https://bit.ly/BritishScientists◽ Вопрос времени - https://bit.ly/QuestionOfTime◽ Вопрос науки - https://bit.ly/VoprosNauki◽ Время - https://bit.ly/WhatIsTime◽ Год на орбите - https://bit.ly/AYearInSpace◽ Градусы риска - https://bit.ly/DegreeOfRisk◽ Джуманджи. Животные в мегаполисе - https://bit.ly/JumanjiAnimals◽ Добавки - https://bit.ly/Dobavki◽ EXперименты - https://bit.ly/EXperiments◽ За гранью - https://bit.ly/BeyondEdge◽ Запомнить всё - https://bit.ly/ZapomnitVse◽ Иные - https://bit.ly/InyeLudi◽ Искусственный разум - https://bit.ly/IskusRazum◽ Клонирование - https://bit.ly/Klonirovanie◽ Меганаука - https://bit.ly/MegaNauka◽ На пределе - https://bit.ly/OnTheLimit◽ На пределе. Испытания - https://bit.ly/OnTheLimitExp◽ Наука есть - https://bit.ly/ScienceOfEating◽ Научтоп - https://bit.ly/NaukaTOP◽ Не факт - https://bit.ly/NeFakt◽ НЕпростые вещи - https://bit.ly/NONsimpleThings◽ Несовершенная случайность - https://bit.ly/NesovSluchainost◽ Опыты дилетанта - https://bit.ly/AmateurExperiments◽ Основной элемент - https://bit.ly/BasicElement◽ Пищевая эволюция - https://bit.ly/EdaEvolution◽ Правила взлома - https://bit.ly/LifehacksRules◽ Правила жизни 100-летнего человека - https://bit.ly/How2Live100◽ Просто физика - https://bit.ly/ProstoFizika◽ Путеводитель по Вселенной - https://bit.ly/UniverseGuide◽ Самые важные открытия - https://bit.ly/VazhnyeOtkrytia◽ Сверхспособности - https://bit.ly/SuperPowerMan◽ Следственный эксперимент - https://bit.ly/SledExp◽ Смертельные опыты - https://bit.ly/SmertOpyty◽ Сверхспособности - https://bit.ly/SuperAbilities◽ Тайны анатомии - https://bit.ly/TainyAnatomii◽ Тайны мозга - https://bit.ly/BrainSecrets◽ Угрозы современного мира - https://bit.ly/WorldThreats◽ Ученые против мифов - https://bit.ly/ScientistsVsMyths◽ Физика боя - https://bit.ly/FizikaBoya◽ Химия - https://bit.ly/ChemistryIvanov◽ Химия вкуса - https://bit.ly/ChemistryOfTaste◽ Экспедиция в прошлое - https://bit.ly/ExpeditionToPast◽ Элементарные открытия - https://bit.ly/ElementOtkrytia","4M35S"
