video_id,title,publishedAt,channelId,channelTitle,categoryId,trending_date,tags,view_count,likes,dislikes,comment_count,thumbnail_link,comments_disabled,ratings_disabled,description,duration
"I7hnDwmKczk","SLAVA MARLOW & ЭЛДЖЕЙ - ЗЛОЙ","2020-10-24T14:05:26Z","UCwAlUoQBC1Tqn0PlrNDDz_A","SLAVA MARLOW","10","20.24.10","[none]","470853","102426","1580","9145","https://i.ytimg.com/vi/I7hnDwmKczk/default.jpg","False","False","СЛУШАТЬ АЛЬБОМ - https://lnk.to/smartemСЛУШАТЬ АЛЬБОМ - https://lnk.to/smartemСЛУШАТЬ АЛЬБОМ - https://lnk.to/smartem","2M39S"
"L3lN8bOaeJQ","КОМИКС - Красный из Among Us проломил стену","2020-10-23T14:52:40Z","UCXUqOvkZol11UZt21vFsvQw","Max Maximov","24","20.24.10","лютые приколы|юмор|смешные видео|макс максимов|мемы|приколы|амонг ас|Among Us|комикс по амонг ас","278242","32005","635","4183","https://i.ytimg.com/vi/L3lN8bOaeJQ/default.jpg","False","False","Комикс по игре Among UsПо вопросам сотрудничества: maxmaximov@wildjam.ru","20M49S"
"qD-0WDXbxcw","Битвы взглядов UFC 254: Хабиб - Гэтжи / Final face offs Khabib vs Gaethje weight in staredowns","2020-10-23T07:39:49Z","UCkrbi2bmw7DQuuC8k4TP-QA","TRUE GYM MMA","17","20.24.10","face off ufc 254|битвы взглядов ufc 254|хабиб гэтжи битва взглядов|khabib gaethje face off|хабиб нурмагомедов|джастин гэтжи|гейджи|khabib|gaethje|ufc 254|ufc 254 face off|ufc|khabib gaethje|face off|maclife|mmafighting|true gym|хабиб гэтжи|fight|khabib nurmagomedov|mma|анкалаев куцелаба|волков харрис|рахмонов|face offs ufc 254|weight in staredowns|staredowns ufc 254|рахманов ufc|уиттакер каннонье|джоджуа|джоджуа ufc 254|лилия шакирова|шакирова ufc","793002","15703","598","2731","https://i.ytimg.com/vi/qD-0WDXbxcw/default.jpg","False","False","Битвы взглядов UFC 254: Хабиб - Гэтжи / Final face offs Khabib vs Gaethje weight in staredownsKhabib Nurmagomedov vs. Justin GaethjeRobert Whittaker vs. Jared Cannonier    Alexander Volkov vs. Walt Harris    Jacob Malkoun vs. Phil Hawes    Lauren Murphy vs. Liliya Shakirova    Magomed Ankalaev vs. Ion CuțelabaStefan Struve vs. Tai Tuivasa    Nathaniel Wood vs. Casey Kenney    Alex Oliveira vs. Shavkat Rakhmonov    Da Un Jung vs. Sam AlveyLiana Jojua vs. Miranda Maverick    Joel Álvarez vs. Alexander Yakovlev Хабиб Нурмагомедов VS Джастин ГейджиРоберт Уиттакер VS Джаред КанноньеАлександр Волков VS Уолт ХаррисФил Хоус VS Якоб МалкоунЛилия Шакирова VS Лорен МёрфиМагомед Анкалаев VS Ион КуцелабаСтефан Струве VS Тай ТуйвасаАлекс Оливейра VS Шавкат РахмоновДа Юнь Чжун VS Сэм ОлвиКейси Кенни VS Натаниэль ВудЛиана Джоджуа VS Миранда МаверикЖоэль Альварес VS Александр ЯковлевПодробнее на «Чемпионате»:https://www.championat.com/boxing/news-4169077-ufc-254-polnyj-kard-i-rezultaty-vzveshivanija-turnira-s-glavnym-boem-habib--gejdzhi.html?utm_source=copypasteПонравился ролик, подпишись 👉🏻 http://goo.gl/JxoIQRНаш Инстаграм 👉🏻 https://www.instagram.com/truegyyym/Группа ВКонтакте 👉🏻 https://vk.com/truegym🥊 Залы для занятия боксом в Москве 👉 http://extrimpower.ru/Лучшая благодарность для нас - твой лайк, репост и комментарий под видео. Огромное спасибо за просмотр ﭢВсе права принадлежат TRUE GYMИспользование фрагментов видео разрешено только с согласия автора.","7M9S"
"qs9Z1cS8J14","Мы подняли со дна гигантскую жуткую находку, где затонула буханка во время магнитной рыбалки","2020-10-23T14:00:20Z","UCj3ZYlmofqiDzt4w00KXljQ","Жизнь Виа","22","20.24.10","жизнь виа|виа|вия|магнитная рыбалка|достали со дна|поисковый магнит|жуткие находки|подняли со дна|находки под водой|находки|гигантский магнит|подняли буханку со дна|нашли буханку на дне","137362","7568","578","759","https://i.ytimg.com/vi/qs9Z1cS8J14/default.jpg","False","False","В этом видео мы отправились на магнитную рыбалку на место, где по слухам затонула буханка. Мы должны проверить правда это или нет. Для этого мы кинем наш поисковый магнит и достанем все жуткие находки, которые лежат на дне. Может быть достанем и саму буханку! Поддержать канал: https://www.youtube.com/channel/UCj3ZYlmofqiDzt4w00KXljQ/joinЯ VK: https://vk.com/mega_slavaФАН Клуб ВИА: https://vk.com/viafan_oficialМой Instagram: https://www.instagram.com/mega_slava/#жизньвиа #виа #вия #магнитнаярбылка #жуткиенаходкисодна #поднялисодна #поисковыймагнит #гигантскиймагнит #досталиуазбуханкусодна #поднялибуханкусодна #буханка","25M16S"
"M6UV7LJNiSk","Nathan Chen (USA) | Men Short Program | Guaranteed Rate Skate America 2020 | #GPFigure","2020-10-24T03:45:07Z","UCVZpqbnDjHyScSYGFPMUtYA","Skating ISU","17","20.24.10","Figure Skating|Speed Skating|Short Track Skating|Synchro Skating|Ice Skating|Skating|Winter Sport|Winter Olympics","48744","1563","69","191","https://i.ytimg.com/vi/M6UV7LJNiSk/default.jpg","False","False","Visit https://isu.org/WhereToWatchGP for more information.SUBSCRIBE to our channel:https://www.youtube.com/SkatingISU?sub_confirmation=1LIKE us on Facebook:https://www.facebook.com/ISUFigureSkatinghttps://www.facebook.com/ISUSpeedSkatinghttps://www.facebook.com/ISUShortTrackSpeedSkatingFOLLOW us on Twitter:Figure Skating Branch - https://twitter.com/ISU_FigureSpeed Skating Branch - https://twitter.com/ISU_SpeedFor daily pictures follow us on Instagram:http://instagram.com/isufigureskatinghttp://instagram.com/isuspeedskating","5M50S"
"lRo46ycZFEo","Трудные подростки | 2 сезон 3 серия | more.tv","2020-10-22T09:00:09Z","UCDalvE0aK5bHg7W4HVoXPRg","more tv","1","20.24.10","more|moretv|more.tv|videomore|моретв|лучший онлайн кинотеатр|трудные подростки|эйфория|скинс|скам|skins|shameless|skam|бесстыжие|школа","971905","47752","755","1435","https://i.ytimg.com/vi/lRo46ycZFEo/default.jpg","False","False","«Трудные подростки» возвращаются со вторым сезоном! Новые серии смотри на more.tv в понедельник, а на нашем YouTube-канале в четверг ❤️ Подписывайся на официальный аккаунт сериала в инстаграм: https://instagram.com/trudnyepodrostkiИ ВКонтакте: https://vk.com/trydnyepodrostkiАнтон Ковалев – освобожденный после двух лет заключения футболист. В прошлом — известный и успешный спортсмен, капитан сборной России, в настоящем человек, от которого отвернулись все близкие и друзья, безработный. Срок свой он получил за пьяный дебош в кафе, обернувшийся дракой с причинением тяжких телесных повреждений. Герман — руководитель центра для трудных подростков, товарищ Антона, единственный человек, который не оттолкнул после случившегося. От безысходности Ковалев соглашается подготовить воспитанников центра к соревнованиям, не подразумевая, что в будущем эти странные, агрессивные и неординарные дети станут для него в итоге самыми близкими и важными людьми. В главных ролях: Никита Волков, Вильма Кутавичюте, Виталий Андреев, Анастасия Крылова, Тимофей Елецкий, Владимир Гарцунов, Святослав Рогожан, Алёна Швиденкова, Мила Ершова, Глеб Калюжный, Сергей Новосад.📍 Подписаться на канал: https://www.youtube.com/c/moretvofficial/?sub_confirmation=1Наши соцсети: 📍 ВКонтакте: https://vk.com/itsmoretv📍 Одноклассники: https://ok.ru/group/55370568040686📍 Facebook: https://www.facebook.com/itsmoretv/📍 Instagram: https://www.instagram.com/itsmore.tv/📍 Twitter: https://twitter.com/itsmoretv#трудныеподростки","25M12S"
"RBccLSbppSg","Загадка Фибоначчи (2020). 1 серия. Детектив, премьера!","2020-10-23T17:45:00Z","UCQvAg5h4-xZeWkS4Y4ZlWzA","KINOFABRIKA","1","20.24.10","Загадка Фибоначчи|сериал загадка Фибоначчи|Загадка Фибоначчи сериал|детективный сериал 2020|сериал детективный 2020|сериал детективный россия|детективный сериал|сериалы 2020 года|сериалы 2020|русские сериалы 2020|русские детективные сериалы 2020|новинки детективы 2020 года|детективный сериал 2020 русские новинки|сериал детектив россия|сериал детектив россия лучшие|русские детективы|кино сериал детектив россия|детектив 2020|русские сериалы|детектив мелодрама","351415","2214","195","320","https://i.ytimg.com/vi/RBccLSbppSg/default.jpg","False","False","🔥НЕ ПРОПУСТИТЕ! 🔥НОВИНКА ОКТЯБРЯ, ДЕТЕКТИВ 🔥Эксклюзивная скидка для зрителей KINOFABRIKA! Получи в Эльдорадо дополнительную скидку 20% по промокоду 68569024989613830 на хиты продаж от брендов Tefal, Moulinex, Rowenta, Jamie Oliver, COOK&COOL, Ingenio, Ice Force, CLIP&CLOSE, TRAVEL MUG WAVE🔹🔹🔹🔹🔹🔹🔹Ваш муж спит с  вашей студенткой – такую записку Ольга находит в одном из букетов, которые ей подарили в честь триумфального выступления на научном форуме. Ольга – математик. Она легко высчитывает того, кто послал эту анонимку. Вот только человека  этого находят мёртвым. Так начинается опасная игра, каждый ход которой связан с одним из чисел ряда Фибоначчи. Что они обозначают и как связаны с жизнью Ольги? Ответ – далеко в прошлом. Каждая ошибка будет стоить жизни кому-то из близких героини.🔹🔹🔹🔹🔹🔹🔹Название: Загадка ФибоначчиЖанр: #премьера, #детектив, #ДетективныйСериалСтрана: РоссияРежиссер: Мария МаханькоАвтор сценария: Наталья КлимоваОператор: Виктор ГусаровПродюсеры: Михаил Никитин, Марина КапустинаВ ролях: Алёна Коломина, Дмитрий Пчела, Илья Смирнов, Дмитрий Блохин, Станислав Тикунов, Антонина Дивина, Зоя Мансурова, Анастасия Чепелюк, Алла Малкова, Елена Валюшкина и другие.Производство: ООО «Форте-фильм»Премьера:  23 октября 2020 (ТВЦ)Загадка Фибоначчи (2020). 1 серия. Детектив, сериал","43M39S"
"DfIZ7k6_aKg","Влад Цепеш Дракула | История на ночь #12","2020-10-23T13:40:36Z","UCnDgIiMU3CyNHGP9wlLbgqw","LABELCOM PODCAST","29","20.24.10","стендап|standup|комедия|юмор|стенд ап|подкаст|standup comedy|что было дальше|labelcom|тнт4|labelcom podcast|лейблком подкаст|лэйблком подкаст|женя чебатков|чебатков|расул чабдаров|чабдаров|томас гайсанов|гайсанов|labelcom подкаст|лейбл ком|евгений чебатков|чебатков и чабдаров|евгений чебатков и руслан чабдаров|лейблком|подкасты|история на ночь|история на ночь labelcom|влад цепеш|дракула|влад дракула","106176","8384","164","1022","https://i.ytimg.com/vi/DfIZ7k6_aKg/default.jpg","False","False","В двенадцатом выпуске исторического подкаста Женя Чебатков, Расул Чабдаров и невидимый Томас Гайсанов поговорили о господаре Валахии -  Владе Третьем Дракуле. Летал ли Влад Дракула летучей мышью и пил ли кровь? Сколько человек он посадил на кол и теории о том, откуда у него такая склонность? Ссора княжества Валахии с Венгрией, Венгрии с Турцией и Молдавии с Польшой. Какой рэп читал Влад Монах и пытки турецкими сериалами. А также: Мехмед второй, Янош Хуньяди, Влад Дракул и Влад Дракула, рыцари-гумманитарии, ущербные крестовые походы, секретные говяжьи медальоны и битбокс в 15м веке. Все это и многое другое в новом выпуске Истории на Ночь. Напоминаем, что комментарии под роликом ждут ваших экспертных мнений и оценочных суждений!Женя: https://instagram.com/chebatkov_yevgeniyРасул: https://instagram.com/chabdarrrТомас: https://instagram.com/whytomasСотрудничество с каналом и иные вопросы:labelcompodcast@mediumquality.ruОбложка мэйд бай https://instagram.com/egor_kuksaLABELCOM: https://instagram.com/labelcomedians LABELCOM. VIDEO: https://instagram.com/labelcom.video TELEGRAM.LABELCOM: https://t.me/labelcom_official #Подкаст #labelcom #История","1H1M33S"
"yrGSvxD8vgI","Том и Джерри | Классический мультфильм 102 | WB Kids","2020-10-24T05:00:07Z","UCwKa3PzQeReoqMqNkDgG-8w","WB Kids International","1","20.24.10","Дети|мультфильмы|классика мультипликации|анимация|Луни Тюнз|Багз Банни|Даффи Дак|Скуби Ду|луни тюнз шоу|луни тюнз|шоу луни тюнз|лунитьюс шоу|TJRUS","33991","229","107","0","https://i.ytimg.com/vi/yrGSvxD8vgI/default.jpg","True","False","Гоняйся вместе с Томом за Джерри, убегай от Спайка и играй с Маленьким утенком, котом Бутчем и другими друзьями.В WB Kids ты найдешь все твои любимые фрагменты мультфильмов с участием персонажей Луни Тюнз, Скуби-Ду, Тома и Джерри и многих других! Доступно в цифровом формате! БОЛЬШЕ ВИДЕО ЗДЕСЬ►https://www.youtube.com/channel/UCwKa3PzQeReoqMqNkDgG-8wДРУГИЕ ИГРЫ И АКТИВНОСТИ ЗДЕСЬ►https://www.wbkidsgo.com/ru-ru/All Warner Bros. related characters and elements © & ™ Warner Bros. Entertainment Inc. (s20)","25M6S"
"U0_XYPF1KgA","CMH x LIDA - МОРСКАЯ ЧЕРЕПАШКА","2020-10-24T08:15:42Z","UCrjJjF6n6Ne7Qx04095hZLw","CMH","10","20.24.10","cmh|lida|лида|смн|crazymegahell|lida mudota|cmh lida|lida cmh|морская черепашка|морская черепашка по имени наташка|лида морская черепашка|cmh морская черепашка|CMH x LIDA - МОРСКАЯ ЧЕРЕПАШКА|натали морская черепашка|руслан смн|лида и смн|cmh клип|lida клип|cmh альбом|lida канал","194461","49715","826","1744","https://i.ytimg.com/vi/U0_XYPF1KgA/default.jpg","False","False","#cmh #lida #морскаячерепашкаCMH x LIDA - МОРСКАЯ ЧЕРЕПАШКАтрек вк : https://vk.com/jettrec?w=wall-47061140_235906LIDA : https://www.instagram.com/kingofthespermahttps://vk.com/lidamudotahttps://www.youtube.com/channel/UCPdGk36EZTJl_vt_y9ZKVSwконцерт спб : https://vk.com/cmh_halloweenЛУЧШИЙ МЕРЧ : https://vsrap.ru/cmhРеклама/СМИ - cmhbusiness69@gmail.com Вадимsound by : https://vk.com/spbwavesdirected by  : https://www.instagram.com/frameocean/vfx : https://vk.com/lexonoff","2M50S"
"V03FbrEeWaw","Дмитрий Венгеров. «Take On Me» - Слепые прослушивания - Голос - Сезон 9","2020-10-23T19:38:32Z","UCU1iFn3BNC1We_F_3Zc8VWA","Голос / The Voice Russia","24","20.24.10","The Voice Russia|Голос|The Voice|La Voz|La Voix|Vocea|O Ses|Нагиев|шоу|golos|Голос8|ПолинаГагарина|Гагарина|ВалерийСюткин|Сюткин|СергейШнуров|Шнуров|Баста|Вакуленко|ВасилийВакуленко","176393","6411","121","527","https://i.ytimg.com/vi/V03FbrEeWaw/default.jpg","False","False","Дмитрий исполняет песню Take On Me группы a-ha. Песня вошла в дебютный альбом группы Hunting High and Low 1985 года. Мелодия была написана еще во время работы участников a-ha в группе Bridges. Песня считается главным хитом группы, но успеха достигла только после третьей попытки выпуска синглом. Клип на песню снял режиссер Стив Бэрон в революционной на тот момент технике ротоскопирования — когда отрывок фильма создается путем покадровой перерисовки отснятой кинопленки с реальными актерами и декорациями. На производство видео ушло полгода. Оно получило шесть наград премии MTV Video Music Awards. Обновленная версия клипа, выложенная на YouTube в 2019 году, к февралю 2020 набрала более миллиарда просмотров. Это всего пятое видео, снятое в XX веке, которому удалось преодолеть эту отметку. В шоу «Точь-в-точь» песню исполнял Александр Бон.  #Голос #Голос9#TheVoiceRussia #TheVoiceСайт проекта // Web-site: https://1tv.ru/shows/golos-9Голос в соцсетях // The Voice Russia in social media:http://www.youtube.com/Voice1tvВКонтакте https://vk.com/voice1tvFacebook https://www.facebook.com/voice1tvInstagram http://instagram.com/voice1tvОдноклассники http://www.odnoklassniki.ru/voice1tv«Голос» — суперпроект, принципиально отличающийся от привычных вокальных конкурсов и шоу по поиску музыкальных талантов. Мы нашли лучшие голоса страны. Незаурядные вокальные данные -- это единственный способ попасть в проект Голос, получить уникальный шанс пройти через сито музыкальных дуэлей с конкурентами и влюбить в себя миллионы телезрителей.The Voice is the international musical project. Four famous musicians search for the best voices in Russia. They cannot see the contestants but only hear them. Later they will mentor these singers to become artists. Viewers will decide which singer will be worthy of the grand prize.","5M59S"
"bZT6uByYHGk","Топ10 САМОВЛЮБЛЁННЫХ Ютуберов!","2020-10-24T09:15:00Z","UCYtpIExuf1E6rpz84UjtQZQ","telblog.net","24","20.24.10","Моргенштерн|Марьяна Ро|Инстасамка|Гусейн Гасанов|Егор Крид|Николай Соболев|Егор Шип|Давидыч|Влад Бумага|Владимир Соловьёв","126527","16522","358","1549","https://i.ytimg.com/vi/bZT6uByYHGk/default.jpg","False","False","ВКонтакте ► http://telblog.net/vk2й канал  ► https://youtube.com/telblogredАвтор Канала ► http://telblog.net/avtorРеклама на канале: ad@telblog.net","13M25S"
"jeIKLHdDS6E","1 ПРЕДАТЕЛЬ VS 99 ИГРОКОВ ( АНИМАЦИЯ )","2020-10-24T13:43:50Z","UCpDzpaUTbIkdjkCZ9pmfMrA","Coffi Channel","20","20.24.10","коффи|coffi|кофи|among us|among|us|Among Us|among us gameplay|among us game|among us funny gameplay|among us читы|among us cheats|among us fun|амонг ас|амонг|ас|among us beta|among us update|амонг ас апдейт|амонгс ас обновление|амонг ас анонимное голосование|амонг ас анимация|among us animation|амонг ас мультик|мультик|анимация|among us movie|among us 1 impostor vs 99 players|1 impostor vs 99 players animation","283275","57131","1095","3126","https://i.ytimg.com/vi/jeIKLHdDS6E/default.jpg","False","False","МУЛЬТИК AMONG US!Всем привет! Меня зовут Коффи и так получилось, что я стал единственным предателем на корабле с 99 мирными! Смогут ли меня поймать и отправить в космос? Всем приятного просмотра! ● Автор Мультика - https://bit.ly/34rEwVo● Мой ВК: http://vk.com/ocoffi ● Группа ВК: http://vk.com/coffiofficial ● Мой Инстаграм: https://www.instagram.com/2coffi/","4M11S"
"YSGoSdMuvoI","Таймень 31 кг. Первые два дня экспедиции за тайменем.Hucho taimen siberia 31 kg","2020-10-24T02:58:58Z","UCaD7q5eIWAWUd_BRhWbE9eA","Сергей Митягин Уссури-Синема","1","20.24.10","Сергей Митягин|уссури синема|горная рыбалка|Митягин Сергей|Лефу|рыбалка на спиннинг|таймень|ловля тайменя|как поймать тайменя|рыбалка в якутии|рыбалка с Митягиным|сплав по горным рекам|якутия|Hucho taimen|Yakutia|рыбалка тайменя|таймень на спиининг|таймень на удочку|новый фильм митягина|сергей уссурийск|уссурийск|рыбалка|рыбалка хариуса|рыбалка щуки|сергей митягин|митягин сергей|сергей митягин 2020|таймень 100 кг|митягин 2020|taimen|рыбалка 2020","27533","2126","45","278","https://i.ytimg.com/vi/YSGoSdMuvoI/default.jpg","False","False","Этот поход состоялся в октябре 2020 года. Видеоматериала много. Смонтировать в ближайшее время не имею возможности, так как сейчас займусь видеомонтажом фильма Дикие таймени Станового хребта. Поэтому предлагаю к просмотру небольшой отрывок про первые два дня нашего похода, а сам фильм планирую смонтировать в январе 2021 года.Приятного просмотра.","43M49S"
