video_id,title,publishedAt,channelId,channelTitle,categoryId,trending_date,tags,view_count,likes,dislikes,comment_count,thumbnail_link,comments_disabled,ratings_disabled,description,duration
"LtAD1jLuSFc","Packers vs. Buccaneers Week 6 Highlights | NFL 2020","2020-10-18T23:41:34Z","UCDVYQ4Zhbm3S2dlz7P1GBDg","NFL","17","20.23.10","NFL|Football|offense|defense|American Football|highlight|highlights|game|sport|play|plays|season|2020|touchdown|td|game highlights|week 6|best plays|top plays|packers|green bay|gb|buccaneers|bucs|tampa bay|tb|packers bucs game highlights|packers highlights|bucs highlights|packers td|bucs td","2230629","21928","940","6336","https://i.ytimg.com/vi/LtAD1jLuSFc/default.jpg","False","False","The Green Bay Packers take on the Tampa Bay Buccaneers during Week 6 of the 2020 NFL season.Subscribe to NFL: http://j.mp/1L0bVBuCheck out our other channels:Para más contenido de la NFL en Español, suscríbete a https://www.youtube.com/nflenespanolNFL Fantasy Football https://www.youtube.com/nflfantasyfootballNFL Vault http://www.youtube.com/nflvaultNFL Network http://www.youtube.com/nflnetworkNFL Films http://www.youtube.com/nflfilmsNFL Rush http://www.youtube.com/nflrushNFL Play Football https://www.youtube.com/playfootballNFL Podcasts https://www.youtube.com/nflpodcasts#NFL #Packers #Bucs","11M44S"
"Qthf-vVtQ6A","Blue Key | SCP-860 (SCP Animation)","2020-10-18T21:00:03Z","UC8pmIe5FjmYlwP0Uf2dyQXQ","SCP Animated - Tales From The Foundation","1","20.23.10","scp animated|scp|tales from the foundation|The Blue Key|Blue Key|Blue Key scp|scp-860|the Blue Key scp|origin of SCP-860|SCP 860|containment|containment breach|Dr Clef's Proposal|Blue Key tale|scp animation|scp cartoon|scp illustrated|scp drawn|scp-860 origin story|scp origins|scp explained","343701","24857","190","1340","https://i.ytimg.com/vi/Qthf-vVtQ6A/default.jpg","False","False","► Make sure to SUBSCRIBE! - http://www.youtube.com/c/SCPAnimatedTalesFromTheFoundation►PATREON -https://www.patreon.com/scpanimatedSCP-860 is a key that unlocks a door to a secret realm that exists outside our normal reality. Two D-Class prisoners are sent in to explore, but the SCP starts manifesting itself in unusual ways; and the subjects turn out to have ulterior motives for going the expedition... If you enjoyed this episode of SCP: Tales From the Foundation, please comment telling us what you'd like to see next!Don't forget to like, comment, subscribe and share to show your support for this channel!Follow me here & here for all sorts of cool stuff!►STORE: http://www.newscapepro.com 👕👚🕶►TWITTER: http://www.twitter.com/newscapepro 🐤►INSTAGRAM: http://www.instagram.com/newscapepro 📸►FACEBOOK: http://www.facebook.com/newscapepro 📘Original Authors:►Blue Key based upon “SCP-860” written by Enma Aihttp://www.scpwiki.com/scp-860Licensed under CC-BY-SA 3.0https://creativecommons.org/licenses/by-sa/3.0/","8M40S"
"zJ_WEHCXSPQ","Intence - Gun Eediat (Official Video)","2020-10-18T22:29:45Z","UC4L9nWU5oQo4BrnoHW96ziQ","IntenceVEVO","10","20.23.10","OneBrawla Music|OneTme Music|Shakes|badart|loud|yeng badness|iwaata|zojak|world|wide|takeova","558021","26084","1436","3872","https://i.ytimg.com/vi/zJ_WEHCXSPQ/default.jpg","False","False","#Intence #GunEediat Intence performing his track Gun EediatProduced by OneBrawla Music | OneTme Music | ShakesVideo by #ShotbyDethDirected by Noelhttp://vevo.ly/OcEcfY","3M21S"
"bcIw8q2ieCI","Can This Chef Cook A 3-Course Meal With A Toaster? • Tasty","2020-10-18T15:00:08Z","UCJFp8uSYCjXOMnkUyb3CQ3Q","Tasty","26","20.23.10","Tasty|tasty recipes|buzzfeed|buzzfeed tasty|how to cook|how to|how to bake|easy cooking|cooking|food|food porn|breakfast|lunch|dinner|dessert|breakfast recipes|lunch recipes|dinner recipes|quarantine|social distancing|quarantine recipes|baking|eating|kid-friendly|kid-friendly recipes|fun recipes|easy recipes|chef out of water|chef out of water tasty|tasty microwave|tasty toaster|alexis tasty|tasty alexis|alexis chef out of water","719678","27759","452","2034","https://i.ytimg.com/vi/bcIw8q2ieCI/default.jpg","False","False","“Is the TOASTER the thing that gets me?”Follow Alexis on Instagram: https://www.instagram.com/alexisdeboschnek/Subscribe to Tasty: https://bzfd.it/2ri82Z1TastyTastyThe official YouTube channel of all things Tasty, the world's largest food network. From recipes, world-class talent, and top-of-the-line cookware, we help connect food lovers in every way they interact with food.Connect with Tasty:Shop the NEW Tasty Merch: https://bzfd.it/shoptastyyoutubeSubscribe to Tasty Newsletters: https://bzfd.it/2SC4h0SLike us on Facebook: http://www.facebook.com/buzzfeedtastyFollow us on Instagram: https://www.instagram.com/buzzfeedtasty/Follow us on Twitter: https://www.twitter.com/tastyCheck out our website: https://www.tasty.co/Shop the Tasty Kitchenware line: https://t.co/0dPSuobra7Credits: https://www.buzzfeed.com/bfmp/videos/111033MUSICLicensed via Audio NetworkSFX Provided By AudioBlocks(https://www.audioblocks.com)https://www.youtube.com/c/buzzfeedtasty","13M2S"
"yyLxPpCi5Bk","Mixing Every Nail Polish in My Brand Together (What Colour Will It Be?👀)","2020-10-17T15:29:50Z","UCGCVyTWogzQ4D170BLy2Arw","Simply Nailogical","24","20.23.10","nails|nail art|nail tutorial|beauty tutorial|nail art tutorial|diy nails|diy nail art|simply nailogical|cristine|mixing|mixing all my|mixing nail polish|holo taco|birthday|simply birthday|simplynailogical bday|got cake|mixing makeup|Frankenstein|frankenpolish|what happens when you mix","2604013","115957","2296","20451","https://i.ytimg.com/vi/yyLxPpCi5Bk/default.jpg","False","False","Happy Birthday to ME, who wants some Got Cake? Shop➡️ http://holota.co/simplybdayGot boring nails? Just add a Holo Taco 💿🌮 Sign up for email updates to be notified about restocks ➡️ http://holota.co/holothere1 ♡ Subscribe to never miss n̶e̶w̶ ̶n̶a̶i̶l̶ ̶a̶r̶t̶ ̶t̶u̶t̶o̶r̶i̶a̶l̶s̶! http://bit.ly/subsimply♡ Subscribe to Holo Taco (for nail videos lol): http://bit.ly/SubHoloTaco♡ Subscribe to the Podcast to hear me have adult conversations: http://bit.ly/SubSimplyPodLogical_ _ _ _ _ _ _ _ _ _ _ _ _ _ _ _ _ _ _ _ _ _ _ _ _ _ _ _ _ _ _ _ _ _♡PRODUCTS USED IN THIS VIDEO:♡💿🌮💅🎂H O L O  T A C O  S I M P L Y  B D A Y  P O L I S H:Got Cake? NOW AVAILABLE➡️ http://holota.co/simplybday$13 (USD) multi-dimensional icy nail polish packed with holo flakies, silver foil flakes, and purple iridescent shimmer🥳***This is a LIMITED EDITION polish in a custom lilac holo box. We made one big birthday bash batch which I hope is enough for everyone who wants one to enjoy! Once it sells out, we will not be restocking it.***...this video also included every single other nail polish we've ever made at Holo Taco but I'll spare myself the typing😂Follow the holo:https://www.instagram.com/holotaco/https://twitter.com/holotacohttps://www.facebook.com/holotaco/Other Simply mixing videos:http://bit.ly/MixingTeashttp://bit.ly/Mixing500Holoshttp://bit.ly/MixingNailPowders_ _ _ _ _ _ _ _ _ _ _ _ _ _ _ _ _ _ _ _ _ _ _ _ _ _ _ _ _ _ _ _ _ _Stalk me on all the social medias!http://instagram.com/simplynailogicalhttps://www.snapchat.com/add/simplynailogicahttps://twitter.com/nailogicalhttps://www.facebook.com/simplynailogicalhttp://www.simplynailogical.com (archival materials)My other YouTube channels:https://www.youtube.com/simplypodlogicalhttps://www.youtube.com/holotacohttps://www.youtube.com/simplynotlogical_ _ _ _ _ _ _ _ _ _ _ _ _ _ _ _ _ _ _ _ _ _ _ _ _ _ _ _ _ _ _ _ _ _I film my nail videos with this camera: http://amzn.to/1MgznhtThis 105mm macro lens: http://amzn.to/1Pi8PM3I filmed my face in this video with this camera: https://amzn.to/327OB7bThis lens: https://amzn.to/38HnBgUAudio recorder: https://amzn.to/3dbtg1wExternal mic: https://amzn.to/32AnO3gRing light for face-cams: http://amzn.to/2cU7cNOI edit my videos with: http://bit.ly/videoeditor1I get some cool editing filters from: https://motionvfx.sjv.io/Ze3bRCheck out my personalized Amazon page with stuff I like! https://www.amazon.com/shop/simplynailogicalMusic: http://share.epidemicsound.com/SIMPLY_ _ _ _ _ _ _ _ _ _ _ _ _ _ _ _ _ _ _ _ _ _ _ _ _ _ _ _ _ _ _ _ _ _Disclaimer cause I love you guys: I didn't pay myself specifically to make this video for Holo Taco but I do benefit from Holo Taco sales😊 Some other links above are affiliate links.","14M27S"
"2AeEd195SG8","The Among Us Rap Battle | #NerdOut ft CG5, Pokimane, Preston, Loserfruit & More [Among Us Animation]","2020-10-17T17:00:09Z","UCMvETSFFkMOADyrGBj3gbWA","NerdOut!","10","20.23.10","nerdout|nerd out|NerdOut New|among us rap|among us rap battle|among us|rap battle|among us song|among us animation|among us music|among us animation song|among us nerdout|nerdout among us|among us animated","2080206","95415","1602","9798","https://i.ytimg.com/vi/2AeEd195SG8/default.jpg","False","False","Among Us is all about collaboration so why not make an awesome collaboration between some of your favourite creators! The Among Us Rap Battle featuring CG5, Pokimane, Preston, Loserfruit, Drumsy, LilyPichu, Dawko & Cilvanis! Who do you think won? Like the video if you enjoyed and don't forget to subscribe!Vote for your winner here: http://nerdout.gg/vote🎵 Listen on Spotify, Apple Music, Amazon and more! 🎵Click Here ▶️ http://nerdout.gg/amongusrap/10,000 Likes - ✅ UNLOCKED https://www.youtube.com/watch?v=eQCMkNmLccE&ab_channel=NerdOut215,000 Likes - 🔒 UNLOCK The Instrumental/Karaoke100,000 Likes - 🔒 UNLOCK Round 2![Must be unlocked within 2 months of upload date]------------------------------------------------------------------------------------------------------Video credits:[In order of appearence]Lily Pichu - https://www.youtube.com/user/LilyPichuNemRaps [NerdOut!] - https://www.youtube.com/user/NemRapsPreston - https://www.youtube.com/user/PrestonPlayzCG5 - https://www.youtube.com/channel/UCLCdyRg3u5O-EVP5p46QxcQPokimane - https://www.youtube.com/user/pokimaneDrumsy - https://www.youtube.com/user/CrushTwixBen Schuller [NerdOut!] - https://www.youtube.com/user/BenSchullerMusicLoserfruit - https://www.youtube.com/user/TheLoserfruitCilvanis - https://www.youtube.com/channel/UCccnyrT2NeVDzypO64Dif-ADawko - https://www.youtube.com/user/dawkosgamesSongwriter/Vocals - NemRaps [NerdOut]https://www.youtube.com/user/NemRapsProducer/Songwriter/Vocals - CG5https://www.youtube.com/channel/UCLCdyRg3u5O-EVP5p46QxcQDirector/Post Production - The8thhawk [NerdOut!]https://www.youtube.com/the8thhawkAnimation - Paul Kenneth Tongolhttps://www.youtube.com/channel/UCi4BlN1WkLphMBqNlIiM_ZARepresent the name with NerdOut Merch!https://dbh.la/nerdoutSubscribe to our second channel: http://bit.ly/SubToNerdOut2Subscribe to our gaming channel: http://bit.ly/Sub2NerdOutGamingFollow us on Twitter: https://twitter.com/nerdoutmusicFollow us on Spotify: http://bit.ly/NerdoutSpotifyFollow us on Twitch: https://www.twitch.tv/nerdoutmusicJoin our Discord: https://discord.gg/qKu9nGmFollow us on Facebook: https://www.facebook.com/nerdoutmusicFollow us on Instagram: https://www.instagram.com/nerdoutmusic/Follow us on Reddit: https://www.reddit.com/r/NerdOutMusic/-----------------------------------------------------------------------------------Who is NerdOut?Nemhttps://www.youtube.com/NemrapsBen Schullerhttps://www.youtube.com/BenSchullerMusicJackhttp://www.youtube.com/The8thHawk-----------------------------------------------------------------------------------Please do not reupload this video without our permission!#NerdOut","4M26S"
"eK-ZKdJ1bFA","I MOVED?! | Kelianne Stankus","2020-10-18T18:04:23Z","UCzcf6tiv8Dt0-kkk32S5GKw","Kelianne Stankus","22","20.23.10","Kelianne stankus|hype house|kelianne|kellianne|kellyanne|Tayler holder|Kelianne and chase|leaving the hype house|I moved|Kelianne moves|nate wyatt|triller|compound|Addison rae|the hype house|kelianne tik tok","330496","26057","303","585","https://i.ytimg.com/vi/eK-ZKdJ1bFA/default.jpg","False","False","HI FRIENDS! today I answer a few questions that you asked me on instagram! :) THANK YOU TRILLER! Can’t wait for this crazy year!SUBSCRIBE TO MY CHANNEL: https://www.youtube.com/keliannestank...FOLLOW ME ON SOCIAL MEDIA!MY TWITTER ► https://twitter.com/keliannestankus MY INSTAGRAM ► https://www.instagram.com/keliannesta... Snapchat: kelianne123TIK TOK: keliannestankusTRILLER: keliannestankus","8M7S"
"MfDvD7d5sPw","DIY Halloween Costumes for 2020: Euphoria, Animal Crossing + Bratz Doll","2020-10-18T15:00:03Z","UCap97Ue8K_BpKlrvQRYd6JA","LaurDIY","26","20.23.10","DIY|do it yourself|how to|laurDIY|lauren riihimaki|lauren diy|laurdiy room decor|laurdiy diy master|laurdiy diy challenge|wild til 9|laurdiy podcast|laurdiy vlogs|diy room decor|thrift flip","338742","16498","329","716","https://i.ytimg.com/vi/MfDvD7d5sPw/default.jpg","False","False","✂ NEW VLOG CHANNEL: https://www.youtube.com/laurdiyvlogs✂ WILD 'TIL 9 PODCAST: https://bit.ly/WildTil9Amazon Items Used For The Costume DIYs:https://www.amazon.com/shop/influencer-79c8b8c4 »»»»»»»»»»»»»»»»»»»»»»»»»»»»»»»»»»»»»»»»»»»»»»»»»»»»»»»»»»»»»»MORE LAUR! ⟡ snapchat: laurdiy ⟡ instagram: http://instagram.com/laurdiy⟡ twitter: https://twitter.com/#!/laurDIY⟡ text me: 323-402-5601 »»»»»»»»»»»»»»»»»»»»»»»»»»»»»»»»»»»»»»»»»»»»»»»»»»»»»»»»»»»»»»Hi DIY Babes!!! Welcome to the #prettylittlelaur fam, I'm Lauren - a Canadian living in LA, makin' DIY dreams come true every single day. You'll find everything DIY related and more!! Including hauls, room decor, clothing try-ons, product testing, (many failed) slime DIYs, hacks + vlogs featuring my sweet mini bull terrier Moose! I'm so excited you're here and make sure to leave me a comment down below if you're new here!»»»»»»»»»»»»»»»»»»»»»»»»»»»»»»»»»»»»»»»»»»»»»»»»»»»»»»»»»»»»»»5 Of My FAV VIDEOS! Buying YouTuber Merch & DIYing It: James Charles, David Dobrik + The Dolan Twinshttps://www.youtube.com/watch?v=PTf-ykasp4w&tDIYs You Actually Asked For: Room Decor - Easy & Affordable! https://www.youtube.com/watch?v=C6ki26xnJMc&tDIY Thrift Store Showdown: Best Friend vs Best Friendhttps://youtu.be/w_AA93tn0JsBeing Alisha Marie's Assistant For a Day https://youtu.be/6B1PtpWeDcY Trying Aerial Silks With The Try Guys! https://www.youtube.com/watch?v=ON4Cll9Vx44&t","19M6S"
"iy5w5h1sCL8","3 True Scary Halloween Stories","2020-10-17T20:00:03Z","UCnM02drQP-dF7WMgtJHR4Xw","Mr. Nightmare","24","20.23.10","scary true stories|true scary stories|true stories|scary|horror stories|true creepy stories|creepy|true|horror|disturbing|scary guy|mr. nightmare|mrnightmare|mr nightmare|creepypasta|scary story narration|narration|reading|shocking stories|home alone|creepy home alone|scary home alone|creepy true stories|3 scary stories|10 scary stories|halloween horror stories|october horror stories|trick or treating stories|scary halloween stories|halloween","763876","41785","561","4128","https://i.ytimg.com/vi/iy5w5h1sCL8/default.jpg","False","False","Here is the this years edition of true Halloween horror stories.Story 1 : Sean PeggStory 2 : Cody BaileyStory 3 : AnonymousIf you want to send a personal TRUE story of yours, please send it through email: mrnightmareinbox@gmail.comAnything with poorly structured sentences and grammar will not be read, so please just make them neat and understandable. Please also state how you would like your name to be credited in a video.Insta: https://www.instagram.com/realmrnight...Twitter: https://twitter.com/mista_nightmare?l...","13M1S"
"1V_03efSkg0","$300,000 Influencer Trivia Tournament!","2020-10-18T00:19:57Z","UCX6OQ3DkcsbYNE6H8uQQuVA","MrBeast","24","20.23.10","Creator Games|MrBeast|Mr Beast|Creator Games 2","21707705","1376994","36543","95833","https://i.ytimg.com/vi/1V_03efSkg0/default.jpg","False","False","A trivia elimination tournament to see who is the smartest creator in the world! Last one standing receives $300,000 to give to their subscribers. Competitors: Addison Rae vs. GeorgeNotFound KSI vs. Rosanna Pansino Mark Rober vs. Gibi   Safiya Nygaard vs. Kwebbelkop Charli & Dixie D'Amelio vs. Preston Arsement Yes Theory vs. Bretman Rock Typical Gamer vs. Lexi Rivera  Dream vs. MatPat & Steph   Alex Warren vs. Lazarbeam  Matt Stonie vs. Marques Brownlee  Laurenzside  vs. ZHC  Swoozie vs. Jaiden Animations","24M5S"
"knBfYgOyxrk","Weird Mustard Taste Test","2020-10-19T10:00:30Z","UCzpCc5n9hqiVC7HhPwcIKEg","Good Mythical MORE","24","20.23.10","gmm|good mythical morning|rhettandlink|rhett and link|mythical|rhett|mclaughlin|link|neal|good mythical more|gmmore|will it|taste test|season 18","453457","13083","163","815","https://i.ytimg.com/vi/knBfYgOyxrk/default.jpg","False","False","Today, we're taste testing some mustard. Check it out on Good Mythical MORE, the show after the show! GMMORE #1835Subscribe to GMMORE: https://www.youtube.com/goodmythicalmore?sub_confirmation=1Watch today's GMM: https://youtu.be/XLkLStpyPVcClick the bell icon so you'll know when we add a new episode!Want more GMMORE? Check out these playlists:Season 17 - https://www.youtube.com/playlist?list=PL9VBXk6S6HT9DCbS4zKfSGQyjDdtWz1fUSeason 16 - https://www.youtube.com/playlist?list=PL9VBXk6S6HT8Ng7UBr0LhPJ85ZKScenf5Good Mythical More | Summer 2019: https://www.youtube.com/playlist?list=PL9VBXk6S6HT9FUKo3GyFP2gTwUhyBRD1KGet a copy of our novel, The Lost Causes of Bleak Creek @ http://www.bleakcreek.comPick up official GMM and Mythical merch at https://mythical.comand https://www.amazon.com/mythicalDon’t miss our weekly podcast, Ear Biscuits: https://applepodcasts.com/earbiscuitsJoin the Mythical Society: https://www.mythicalsociety.comFollow Mythical:Instagram: https://instagram.com/mythicalFacebook: https://facebook.com/mythicalTwitter: https://twitter.com/mythicalWebsite: https://mythical.comCheck Out Our Other Mythical Channels:Good Mythical Morning: https://youtube.com/goodmythicalmorningMythical Kitchen: https://youtube.com/mythicalkitchenRhett & Link: https://youtube.com/rhettandlinkWant to send us something? https://mythical.com/contactSubmit your Wheel of Mythicality intro video here: http://bit.ly/GMMWheelIntroSUBMISSIONSIntro Animation by Dana Schechter https://www.danaschechter.com/Intro & Outro Music by Mark Byers http://www.markaholic.com/Supplemental Music from Extreme Production Music: https://www.extrememusic.com/Mic: ‘The Mouse’ by Blue Microphones https://www.bluemic.com/mouse/Get the GMM Set Gear!* Apple AirPort Extreme: https://amzn.to/2NnIvvk* Apple iPad Pro (12.9-inch, Wi-Fi, 64GB) - Space Gray (Latest Model) - MTEL2LL/A: https://amzn.to/2NnKXlw* Guardian Industrial Products DH-CP-4 3 Channel Rubber Cable Ramp (Straight): https://amzn.to/2NdshoR* Cartoni Focus HD Fluid Head with 3 Tube Ultra-Light Tripod, Mid-Level Spreader and Soft Case - Black: https://amzn.to/2X4i7X8* ARRI SkyPanel S60-C LED Softlight (Blue/Silver, Edison): https://amzn.to/2YgM3km* Chef-Master 90050 Professional Heat Lamp, Silver: https://amzn.to/2Xa1Wwr* Samsung UN40H5003 40-Inch 1080p LED TV (2014 Model): https://amzn.to/2NdMU4e* Sony LMDA170 17 Production Video LCD Monitor, 16:9 Native Aspect Ratio, 1080p Resolution: https://amzn.to/2YlB9tH* Behringer Xenyx 1002 Premium 10-Input 2-Bus Mixer with XENYX Mic Preamps and British Eqs: https://amzn.to/2Yeeqzl* Elgato Game Capture Card HD60 S - Stream and Record in 1080p60, for PlayStation 4, Xbox One & Xbox 360 (Renewed): https://amzn.to/2NdOBP6* Pyle Universal Speaker Stand Mount Holder - Heavy Duty Tripod w/ Adjustable Height from 40” to 71” and 35mm Compatible Insert - Easy Mobility Safety PIN and Knob Tension Locking for Stability PSTND2: https://amzn.to/2JcCpce* JBL EON612 Portable 12 2-Way Multipurpose Self-Powered Sound Reinforcement: https://amzn.to/2Ndluvm* Bolt 500 XT 3G-SDI/HDMI Wireless TX/RX: https://amzn.to/2J1OeSk* Voigtlaender 17,5/0,95 Nokton 17.5 mm-17.5 mm Lens: https://amzn.to/2JjUCEP* Blackmagic Design Micro Converter SDI to HDMI (with Power Supply) BMD-CONVCMIC/SH/WPSU: https://amzn.to/2J6iw6y* Panasonic H-HSA35100 F2.8 II ASPH 35-100mm Mirrorless Micro Four Thirds Mount POWER Optical I.S. LUMIX G X VARIO Professional Lens: https://amzn.to/2RAhIul* PANASONIC LUMIX Professional 12-35mm Camera Lens G X VARIO II, F2.8 ASPH, Dual I.S. 2.0 with Power O.I.S., Mirrorless Micro Four Thirds, H-HSA12035 (2017 Model, Black): https://amzn.to/2J9WH5S* Decimator Design DMON-12S | 12 Channel Multi Viewer with HDMI SDI Outputs: https://amzn.to/2J9Xkwg* Decimator MD-HX HDMI and SDI Cross Converter with Scaling & Frame Rate Conversion: https://amzn.to/2Ymj52c* PANASONIC LUMIX GH4 Body 4K Mirrorless Camera, 16 Megapixels, 3 Inch Touch LCD, DMC-GH4KBODY (USA Black): https://amzn.to/2WZjlD6* Blue Microphones Mouse Microphone Kc: https://amzn.to/2Ybu12I","12M56S"
"xVIfx8UR4Fo","10 Things You Didn’t Know About Justin Gaethje!","2020-10-19T13:30:07Z","UCNxIH_iATJ8CjsXx3m7jXvg","Watch MMA","17","20.23.10","ufc|ufc today|justin gaethje|gaethje|gaethje vs khabib|gaethje vs ferguson|gaethje highlights|justin gaethje highlights|justin gaethje vs tony ferguson|justin gaethje wrestling|justin gaethje khabib|ufc 254|nurmagomedov vs gaethje|khabib|khabib vs gaethje|justin gaethje interview|justin gaethje losses|justin gaethje facts|things you didn’t know about justin gaethje|#ufc|watch ufc|watch mma|ufc fighters predict - khabib nurmagomedov vs justin gaethje","269604","5610","614","950","https://i.ytimg.com/vi/xVIfx8UR4Fo/default.jpg","False","False","UFC today, we have 10 things you didn't know about Justin Gaethje! If you didn't know UFC 254: Khabib Nurmagomedov Vs Justin Gaethje is this Satuday! This #UFC video includes justin gaethje highlights, justin gaethje vs tony ferguson and more Justin Gaethje moments! SUBSCRIBE!More #UFC content:UFC Fighters Predict - Khabib Nurmagomedov Vs Justin Gaethje!https://youtu.be/Fva1nfvk8JM10 Conor McGregor Moments UFC Wants You To Forget!https://youtu.be/pqe8bKsIha410 Times UFC Fighters REFUSED To Hit Their Opponent!https://youtu.be/bRmHCayZRhAYou are not required to subscribe, turn notifications on or drop a like to get the xbox one! It is only a recommendation. For more information refer to youtube’s contest policies: https://support.google.com/youtube/answer/1620498?hl=en","10M2S"
"AsYs7jSLnh4","Kyrie Irving’s championship-sealing three needs a deep rewind | 2016 Cavaliers","2020-10-18T15:00:24Z","UCDRmGMSgrtZkOsh_NQl4_xw","Secret Base","17","20.23.10","warriors|deep rewind|rewinder|sbnation|sb nation|secret base|cavs|warriors cavs|cavaliers|cleveland cavaliers|lebron james|kyrie irving|steph curry|stephen curry|golden state|golden state warriors|nba|nba finals|warriors vs cavs nba finals|2016 nba finals|warriors finals|tyronn lue|2016 warriors|2016 cavs championship|cavs championship|cavaliers finals|andre iguodala|steve kerr|clara morris|basketball","328565","13673","456","1535","https://i.ytimg.com/vi/AsYs7jSLnh4/default.jpg","False","False","The 2016 NBA finals gave internet commenters a simple, easy reply for any situation: “The Warriors blew a 3-1 lead.” Oh yeah, and it also gave Cleveland its first championship since the ‘60s, quieted LeBron haters, momentarily broke Steph Curry, and gave Kyrie a moment of glory after he had been promised the world and then had to hand that world over to LeBron.  Remember? The Cavs were like “sure we’ll build around you Kyrie, you’re our guy” and then LeBron said he was coming back to Cleveland, and then the Cavs were like “what’s a Kyrie???”.The 2016 Finals were so good. I mean, it went to seven games, which is exciting enough! But there was so much more! In this video we relive every single part of the series, and everything that lead up to it too — from the Warriors’ insane record-setting seasons full of threes to LeBron’s chasedown blocks to the playoff groin shots. That’s right, groin shots, plural. Draymond Green was going through a stage.And if you want to chit chat, we have a website dedicated to just that, head on over to https://www.sbnation.com/secret-base.Written and produced by: Clara MorrisDirected and Edited by: Ryan SimmonsSubscribe: https://goo.gl/NbabaeCheck out our full video catalog: https://goo.gl/9pMHRVVisit our playlists: https://goo.gl/NvpZFFLike SB Nation on Facebook: https://goo.gl/Pzcs7OFollow on Twitter: https://goo.gl/5LI02DFollow on Instagram: https://goo.gl/aY2FFKExplore SB Nation: http://www.sbnation.com","12M7S"
