video_id,title,publishedAt,channelId,channelTitle,categoryId,trending_date,tags,view_count,likes,dislikes,comment_count,thumbnail_link,comments_disabled,ratings_disabled,description,duration
"bPiofmZGb8o","Second 2020 Presidential Debate between Donald Trump and Joe Biden","2020-10-23T02:49:33Z","UCb--64Gl51jIEVE-GLDAVTg","C-SPAN","25","20.23.10","C-SPAN|CSPAN|2020|Donald Trump|Republican|White House|Joe Biden|Democrat|Debate|Commission on Presidential Debates|Nashville|Tennessee","6641600","94601","6209","59293","https://i.ytimg.com/vi/bPiofmZGb8o/default.jpg","False","False","President Donald Trump and former Vice President Joe Biden participate in the second 2020 presidential debate at Belmont University in Nashville, TN. https://www.c-span.org/debates/Find more from C-SPAN at https://www.c-span.orgDiscover the C-SPAN Video Library at https://www.c-span.org/quickguide/Download our App https://www.c-span.org/special/?radioappC-SPAN: Created by Cable in 1979. Offered as a public service.Subscribe to our YouTube channel: https://www.youtube.com/user/CSPANFollow us:Facebook: https://www.facebook.com/CSPANTwitter: https://twitter.com/cspanInstagram: https://www.instagram.com/cspan/Subscribe:C-SPAN Podcasts: https://www.c-span.org/podcasts/Newsletters: https://www.c-span.org/connect/","1H59M15S"
"tcYodQoapMg","Ariana Grande - positions (official video)","2020-10-23T04:00:10Z","UC0VOyT2OCBKdQhF3BAbZ-1g","ArianaGrandeVevo","10","20.23.10","ariana grande positions|positions ariana grande|ariana grande|grande ariana|ariana grande positions album|positions album ariana grande|ariana|positions|ariana positions|positions ariana|ariana grand|ariana grande ag6|ag6|ariana grande positions leak|positions countdown|ariana grande album|positions album|grande positions|new ariana grande|ariana grande lyrics|lyrics ariana grande|lyrics ariana","7516529","1485130","10810","140549","https://i.ytimg.com/vi/tcYodQoapMg/default.jpg","False","False","The official “positions” music video by Ariana Grande. Listen & download the song here: http://arianagrande.lnk.to/positions ►Subscribe to Ariana Grande: https://arianagrande.lnk.to/subscribe ►Shop Exclusive Merch: https://shop.arianagrande.com ►Follow Ariana Grande:www.arianagrande.com https://instagram.com/arianagrande https://twitter.com/arianagrande https://facebook.com/arianagrande Directed by Dave MeyersDirector Rep: Lark CreativeProduction Company: FreenjoyProduced by Nathan Scherrer & Whitney JacksonDirector of Photography: Scott CunninghamProduction Designer: Tino ShaedlerEditor: Alyssa OhColor: Stefan Sonnenfeld at Company 3VFX Supervisor: Adam Avitabile at Ghost VFXPost: Ghost VFX and Mod CreationsOfficial “positions” Lyrics:Heaven sent you to meI’m just hoping I don’t repeat historyBoy I’m tryna meet your mama on a SundayThen make a lotta love on a MondayNever need no No one else, babe‘Cause I’ll beSwitching the positions for youCooking in the kitchen and I’m in the bedroomI’m in the Olympics way I’m jumping through hoopsKnow my love infinite nothing I wouldn’t doThat I won’t do, switching for Perfect, perfectYou’re too good to be trueBut I get tired of runningFuck it, now I’m running with you (with you)Said boy I’m tryna meet your mamaon a SundayThen make a lotta loveon a MondayNever need no No one else babe‘Cause I’ll beSwitching the positions for youCooking in the kitchen and I’m in the bedroomI’m in the Olympics way I’m jumping through hoopsKnow my love infinite nothing I wouldn’t doThat I won’t do, switching for youCooking in the kitchen and I’m in the bedroomI’m in the Olympics way I’m jumping through hoopsKnow my love infinite nothing I wouldn’t doThat I won’t do, switching for youThis some shit that I Usually don’t doBut for you I kindaKinda want toCause youre down for meAnd I’m down tooYeah I’m down tooSwitching the positions for youThis some shit that I Usually don’t doBut for you I kindaKinda want toCause youre down for meAnd I’m down tooSwitching the positions for youCooking in the kitchen and I’m in the bedroomI’m in the Olympics way I’m jumping through hoopsKnow my love infinite nothing I wouldn’t doThat I won’t do, switching for youCooking in the kitchen and I’m in the bedroomI’m in the Olympics way I’m jumping through hoopsKnow my love infinite nothing I wouldn’t doThat I won’t do, switching for you#ArianaGrande #positions","2M58S"
"np9Ub1LilKU","Jack Harlow - Tyler Herro [Official Video]","2020-10-22T19:00:14Z","UC6vZl7Qj7JglLDmN_7Or-ZQ","Jack Harlow","10","20.23.10","jack harlow|jack rapper|harlow rapper|private garden|jack Harlow confetti|new jack Harlow|Kentucky rapper|white rapper|jack harlow what’s poppin|jack harlow whats popping|jack harlow whats poppin|whats poppin song|what’s poppin song|what’s popping song|whats popping song|confetti|sweet action|sweet action ep|tyler herrro|tyler herro|jack tyler herro|nolimitherro|tyler hero|miami heat|jack harlow freestyle|jack harlow tyler herro","1499338","153028","2006","11013","https://i.ytimg.com/vi/np9Ub1LilKU/default.jpg","False","False","Jack Harlow - Tyler HerroListen now: https://JackHarlow.lnk.to/TylerHerroFOLLOW JACK HARLOWWebsite: https://www.jackharlow.us/Instagram: https://JackHarlow.lnk.to/InstagramTwitter: https://JackHarlow.lnk.to/TwitterFacebook: https://JackHarlow.lnk.to/FacebookLISTEN TO JACK HARLOWYoutube: https://JackHarlow.lnk.to/YouTubeApple: https://JackHarlow.lnk.to/AppleSpotify: https://JackHarlow.lnk.to/SpotifySoundCloud: https://JackHarlow.lnk.to/SoundCloudSUBSCRIBE TO JACK’S YOUTUBE: https://JackHarlow.lnk.to/YouTubeLYRICSThe ones that hate me the most look just like meYou tell me what that meansMake a slick comment and see what that bringsI seen it go down, we can reenact thingsExtreme like BMXingThese boys pussy and they PMSingPeople in the city see the movement occurringAnd say ‘my god I wanna be in that scene’Damn right you wanna be in this sceneShe at the video tryna be in this sceneUsed to fantasize about being this seenBluegrass girl but she got big dreamsCan’t touch me I got instinctsLocked in the house but I’m plotting thingsI brought a gang to the party with meFive white boys but they not *NSYNCFuck what y’all think, fuck everything that you say about meMy dogs like to play Madden and 2KBut one they don’t do is play about meMy homeboy Tyler he play in South BeachHe told me this Summer he gon’ fix my jumperI told Boi1da that we might got a thumper I been tryna pop, now Iman like ShumpertNow they on my bumperGreen room chocked full of all my comfortsHotel room like heaven on earthGot angels in my bed with some all white coversAce Pro, Nemo, Lucci and Quiiso, Shloob, Clay, 2fo And I got a few more I call my brothersI got a lot of flows and they all like butter, oohYou know what that meansI came home nights but I’m going back meanI’m about to globe trot when they know a vaccineMotherfuckers act lost but they know exactly what’s going onMade a mil and I don’t know what to blow it onI tell the critics shut up like my show is onGave a t-shirt to her said throw it onShe one of many high school classmates I’m growing onMy peers aint poppin’ they don’t know what’s going wrongY’all well dressed but you aint got soul and you just can’t sew it onI’m tryna tell y’all boys, I got a few songs I can sell y’all boysI tried it back then it was ‘hell nah’ boyNow I’m in a box like a Kellog’s toyThe official YouTube channel of Generation Now and Atlantic Records artist Jack Harlow. Subscribe for the latest music videos, performances, and more.#JackHarlow #TylerHerro","3M"
"5S4bm3bAt9Y","SURPRISING BEST FRIEND WITH BORAT!!","2020-10-21T19:56:24Z","UCef29bYGgUSoJjVkqhcAPkw","David Dobrik Too","22","20.23.10","[none]","5320147","596894","7044","33648","https://i.ytimg.com/vi/5S4bm3bAt9Y/default.jpg","False","False","Thank you Borat for coming over!! I like youWatch Borat Subsequent Moviefilm on Prime Video: https://www.amazon.com/Borat-Subsequent-Moviefilm-Mike-Pence/dp/B08K3SDZJ9Follow Borat on Twitter: https://twitter.com/boratsagdiyevFollow Borat on Instagram: https://instagram.com/boratsagdiyevFollow Borat on TikTok: https://www.tiktok.com/@boratMiss ya'll !!","5M55S"
"GuEkHIgR46k","Bryson Tiller - Always Forever (Official Video)","2020-10-22T16:00:08Z","UCwhe-6skwaZxLomc-U6Wy1w","BrysonTillerVEVO","10","20.23.10","Bryson Tiller 2020|Bryson Tiller Serenity|Bryson Tiller Exchange|Bryson Tiller TrapSoul|TrapSoul|Bryson Tiller Rambo|Bryson Tiller The Weeknd|Bryson Tiller Don't|Bryson Tiller Blame|Bryson Tiller Drake|Bryson Tiller Inhale|Bryson Tiller Playing Games|Right My Wrongs|Bryson Tiller Leak|Bryson Tiller could've been|Sorry Not Sorry|Bryson Tiller Always Forever|Trapsoul Deluxe|Rambo Remix|Self Righteous Bryson|Bryson|Tiller","862087","82059","657","4459","https://i.ytimg.com/vi/GuEkHIgR46k/default.jpg","False","False","A N N I V E R S A R Y OUT NOW!Stream/Download:https://brysontiller.lnk.to/ANNIVERSARYIDSubscribe for more Bryson Tiller content:https://brysontiller.lnk.to/subscribeFollow Bryson Tiller https://www.instagram.com/brysontillerhttps://twitter.com/brysontillerhttp://twitch.tv/gawdtillahttps://www.facebook.com/BrysonTillerMusic/https://soundcloud.com/brysontillerhttps://trapsoul.com/#BrysonTiller #TrapSoul #Anniversary","2M59S"
"0tn6nWYNK3Q","Machine Gun Kelly ft. Halsey - forget me too [Official Music Video]","2020-10-22T16:00:10Z","UC2a9zmrdjvLsrRgi4G4blWw","MGKVEVO","10","20.23.10","Machine|Gun|Kelly|Halsey|forget|too|Bad|Boy/Interscope|Records|Alternative","2143537","186923","2948","10481","https://i.ytimg.com/vi/0tn6nWYNK3Q/default.jpg","False","False","Machine Gun Kelly - Tickets To My Downfall is available now!https://smarturl.it/TTMDmgkFollow Machine Gun Kelly:https://twitter.com/machinegunkellyhttps://www.facebook.com/machinegunkellymusichttps://www.instagram.com/machinegunkellyFollow Halsey: https://twitter.com/halseyhttps://www.instagram.com/iamhalseyhttps://www.facebook.com/halsey/#MGK #Halsey #TicketsToMyDownfall #ForgetMeToo","2M58S"
"2dLE4Nn6-ug","WE WENT TO THERAPY...","2020-10-22T01:23:18Z","UCWwWOFsW68TqXE-HZLC3WIA","The ACE Family","22","20.23.10","we went to therapy|the ace family we went to therapy|ace family we went to therapy|therapy session|ace family therapy|the ace family|ace family|ace family vlogs|family vlogs","3052198","186673","8850","12714","https://i.ytimg.com/vi/2dLE4Nn6-ug/default.jpg","False","False","WE WENT TO THERAPY...LAST VIDEO: https://www.youtube.com/watch?v=iCJsYBtFJzsJOIN THE ACE FAMILY & SUBSCRIBE: http://bit.ly/THEACEFAMILY *TURN ON OUR POST NOTIFICATIONS FOR SHOUTOUTS IN OUR VIDEOS****BUSINESS INQUIRIES : INFO.THEACEFAMILY@GMAIL.COMMAKE SURE YOU LIKE, COMMENT, SHARE & SUBSCRIBE TO OUR YOUTUBE CHANNEL AND FOLLOW US ON OUR FAMILY ADVENTURES!WATCH MORE VIDEOS!!! VLOGS: https://youtube.com/playlist?list=PLq...PRANKS: https://youtube.com/playlist?list=PLq...CHALLENGES: https://youtube.com/playlist?list=PLq...POPULAR VIDEOS: https://youtube.com/playlist?list=PLq...LATEST VIDEOS: https://youtube.com/playlist?list=PLq... STALK US :)","21M28S"
"sz1ovZUA4nQ","Matthew McConaughey Grunts it Out While Eating Spicy Wings | Hot Ones","2020-10-22T15:00:11Z","UCPD_bxCRGpmmeQcbe2kpPaA","First We Feast","24","20.23.10","First we feast|fwf|firstwefeast|food|food porn|cook|cooking|kitchen|Cook (Profession)sean evans|hot ones|hot ones season 13|sean evans|sean evans interview|sean evans hot ones|matthew mcconaughey|matthew mcconaughey interview|matthew mcconaughey hot ones|hot ones show|chicken wings|spicy wings|hot sauce|hot sauce show|hot sauce challenge|the last dab|the last dab apollo|da bomb|da bomb hot sauce|da bomb reaction|hot sauce reactions","1246718","53162","665","4582","https://i.ytimg.com/vi/sz1ovZUA4nQ/default.jpg","False","False","Matthew McConaughey is an Academy Award-winning actor you know from films like ‘Magic Mike,’ ‘Dallas Buyers Club,’ ‘Interstellar,’ ‘Dazed and Confused,’ ‘The Wedding Planner,’ ‘How To Lose a Guy in 10 Days,’ and countless others. He is also a producer, a college professor, and an author. His latest project is a memoir titled ‘Greenlights,’ available now. How will this Texas Longhorn play defense against the spicy peppers in this hot sauce lineup? Find out how this highwayman fares against the wings of death while answering questions about his writing process, what makes romantic comedies work, how helpful New Yorkers really are, losing a lawsuit against a skin cream company while in high school, and Hank the Cowdog. Will this spiritual life philosopher known for his many McConaughey-isms get through the gauntlet of spice? Alright, alright, alright!BUY HOT ONES TRUTH OR DAB THE GAME NOW: http://truthordabgame.comBUY HOT ONES HOT SAUCE NOW: http://bit.ly/HotOnesSaucesNEWHOT ONES MERCH AVAILABLE NOW: https://bit.ly/2AIS271SIGN UP FOR THE HOT ONES MONTHLY HOT SAUCE SUB BOX: https://bit.ly/2veY50PSIGN UP FOR THE FIRST WE FEAST NEWSLETTER: http://firstwefeast.com/signupSubscribe to First We Feast on YouTube: http://goo.gl/UxFzhKCheck out more of First We Feast here:http://firstwefeast.com/https://twitter.com/firstwefeasthttps://www.facebook.com/FirstWeFeasthttp://instagram.com/firstwefeastFirst We Feast videos offer an iconoclastic view into the culinary world, taking you behind-the-scenes with some of the country's best chefs and finding the unexpected places where food and pop culture intersect.","27M59S"
"B2J3kLJ8PQk","nba youngboy - the story of O.J. (Top Version)","2020-10-21T07:56:28Z","UClW4jraMKz6Qj69lJf-tODA","YoungBoy Never Broke Again","10","20.23.10","YoungBoy Never Broke Again|NBA YoungBoy|YoungBoy IG Live|YoungBoy Instagram|YoungBoy Quando Rondo|YoungBoy Self Control|YoungBoy Leak|No Smoke YoungBoy|House Arrest Tingz|Make No Sense YoungBoy|Youngboy Lost Motives|YoungBoy Lonely Child|YoungBoy NBA Music Video|YoungBoy Never Broke Again TOP|youngboy nba top|nba youngboy top|YoungBoy NBA TOP album|ybnba top album|nba top album|7KTt4_M09Rw|0C80BSgjb8M|qChxuVxs8FA|dYk-yCsuTUo|6MCSr65d9Xc|ALimx-H8C6s","3789523","216158","8785","24388","https://i.ytimg.com/vi/B2J3kLJ8PQk/default.jpg","False","False","YoungBoy Never Broke Again –  ‘TOP’ OUT NOW: https://youngboy.lnk.to/TopAlbumID Subscribe for more official content from YoungBoy NBA: https://youngboy.lnk.to/Subscribe Connect with YoungBoy Never Broke Again: http://www.youngboynba.comhttps://www.facebook.com/nbayoungboyhttps://www.twitter.com/GGYOUNGBOYhttps://www.instagram.com/nba_youngboyhttps://www.soundcloud.com/nba-youngboy The official YouTube channel of Atlantic Records artist YoungBoy Never Broke Again. Subscribe for the latest music videos, performances, and more. #YoungBoyNeverBrokeAgain #TOP #","4M20S"
"hi1zMqY2goU","The Dixie D'Amelio Show with Trippie Redd","2020-10-21T16:30:11Z","UCLOEGprmycLLbyzBj2jozLg","Dixie D'Amelio","22","20.23.10","dixie damelio|dixie d'amelio|dixie|damelio|be happy|music video|tik tok|dixie damelio be happy|dixie d'amelio be happy|charli damelio|charli d'amelio|tiktok|charli|d'amelio|exclusive|ᗷᕼᑌᗴᔕᒍYᗴᔕ|marc d'amelio|heidi d'amelio|talkshow|show|dog|dogs|me|fun|laugh|the dixie d'amelio show|noah beck|noah|dixie and noah|noah and dixie|doah|nixie|hollywood fix|marc|heidi|hype house|sway house|trippie redd","3201605","195100","5529","13568","https://i.ytimg.com/vi/hi1zMqY2goU/default.jpg","False","False","Hey guys! This week on the Early Late Show, Trippie Redd!Website: https://www.dixiedamelio.comSubscribe for more official content from Dixie: https://www.youtube.com/dixiedamelio?sub_confirmation=1Connect with me!TikTok: https://www.tiktok.com/@dixiedamelioInstagram: https://www.instagram.com/dixiedamelioTwitter: https://twitter.com/dixiedamelioWebsite: https://www.dixiedamelio.comConnect with Trippie!TikTok: https://www.tiktok.com/@trippieatplayInstagram: https://www.instagram.com/trippiereddWe love our Tov chairs!https://tovfurniture.comCheck out my merch: https://dixiedamelio.shop/Have you heard my song Be Happy? https://ffm.to/be_happy#dixiedamelio #trippieredd","11M48S"
"9BPMTr-NS9s","Raya and the Last Dragon | Official Teaser Trailer","2020-10-21T12:45:41Z","UC_976xMxPgzIa290Hqtk-9g","Walt Disney Animation Studios","1","20.23.10","Disney|Walt Disney Animation Studios|Disney Animation|Walt Disney|Animation|disney movie|disney movie trailer|movie trailer|new movie|new movie trailer|new disney movie|moana|Disneys Moana|Moana movie|moana trailer|frozen|disney frozen|Disneys frozen|frozen trailer|raya|raya and the last dragon|disney raya|kelly marie tran|awkwafina|south east asia|dragon|disney dragon movie","5672642","189288","5590","27092","https://i.ytimg.com/vi/9BPMTr-NS9s/default.jpg","False","False","Restore peace. Find the last dragon. Watch the new trailer for Raya and the Last Dragon, in theaters March 2021.Long ago, in the fantasy world of Kumandra, humans and dragons lived together in harmony. But when an evil force threatened the land, the dragons sacrificed themselves to save humanity. Now, 500 years later, that same evil has returned and it’s up to a lone warrior, Raya, to track down the legendary last dragon to restore the fractured land and its divided people. However, along her journey, she’ll learn that it’ll take more than a dragon to save the world—it’s going to take trust and teamwork as well. From directors Don Hall and Carlos López Estrada, co-directors Paul Briggs and John Ripa, producers Osnat Shurer and Peter Del Vecho, and featuring the voices of Kelly Marie Tran as Raya and Awkwafina as the last dragon Sisu, Walt Disney Animation Studios’ “Raya and the Last Dragon” opens in U.S. theaters on March 2021.Facebook:  https://www.facebook.com/rayaandthelastdragonTwitter:  https://twitter.com/DisneyRayaInstagram:  https://www.instagram.com/disneyraya/Hashtag: #DisneyRaya","2M3S"
"Xa4Ge7E-4ZA","I Made A Viral TikTok Song","2020-10-21T18:00:09Z","UCSUf5_EPEfl4zlBKZHkZdmw","Danny Gonzalez","23","20.23.10","danny gonzalez|funny|commentary|comedy|react|reaction|reacting|awful|humor","1323218","154365","1124","14285","https://i.ytimg.com/vi/Xa4Ge7E-4ZA/default.jpg","False","False","Thanks to Upstart for sponsoring this video. Go to https://Upstart.com/dannygonzalez, to find out how low your Upstart rate is!Featuring Ned FlamezThanks to Christian for filming https://www.youtube.com/user/PancancakesSong produced by Diamond StyleSupport MeMERCH ► http://dannygonzalez.storeFollow MeINSTAGRAM ► https://www.instagram.com/dannygonzalez/TWITTER ► https://twitter.com/dannygonzalezSECOND CHANNEL ► https://www.youtube.com/c/2Danny2FuriousSPOTIFY ► https://open.spotify.com/artist/6pDkmNhHCLh7YEb3sXceOs?si=8ZpMgF41SoufOS1UZ4vbkgWHY DO I CALL MY FANS GREG?Greg is the strongest family on the internet, we're the fastest growing channel on Youtube, and we make fire content. So, instead of making up some pun using my name and calling my fans that, I decided to use a different name entirely. A name so strong, haters tremble when it is spoken. WE ARE GREG. AND WE ARE TAKING OVER THE INTERNET. And all you have to do to join is hit subscribe and turn on notifications. #dannygonzalez","33M16S"
"zLRPScn1Q7g","Jimmie Allen & Noah Cyrus Perform 'This Is Us' | CMT Music Awards","2020-10-22T02:53:58Z","UCStBfpQeA4imrUzPJoTXoFA","CMT","24","20.23.10","CMT awards|CMT music awards|music awards|country music awards|2020 awards|2020 country music awards|2020 CMT awards|2020 CMT awards live|2020 CMT music awards|2020 award show|award show|country award show|Kane Brown|Sarah Hyland|Ashley McBryde|2020 CMT awards performance|Jimmie Allen|Jimmie Allen CMT|Jimmie Allen Noah Cyrus|Noah Cyrus|Noah Cyrus CMT|This Is Us|This Is Us|live|This Is Us|CMT|This Is Us|CMT|awards|Jimmie Allen CMT Awards","406149","3716","1159","1542","https://i.ytimg.com/vi/zLRPScn1Q7g/default.jpg","False","False","Jimmie Allen & Noah Cyrus perform This Is Us at the 2020 CMT Music Awards. More from the CMT Music Awards here http://www.cmt.com/cmt-music-awards #JimmieAllen #NoahCyrus #CMTawardsSUBSCRIBE now for more CMT: https://bit.ly/2EUv0NcFor updates on all things country, follow CMT!CMT News & More: http://www.cmt.comCMT on FB: https://www.facebook.com/cmtCMT on Twitter: https://twitter.com/cmtCMT on Instagram: https://www.instagram.com/cmt/","3M29S"
"-ZDZtBRTyeI","Why American public transit is so bad | 2020 Election","2020-10-22T12:00:01Z","UCLXo7UDZvByw2ixzpQCufnA","Vox","25","20.23.10","public transportation|subway|buses|transportation|Vox.com|vox|explain|explainer|2020 election|Biden|Trump|U.S. Politics|American Elections|Joe Biden|Donald Trump|President|candidates|cta|cta train|public transit|infrastructure|public transport simulator|chicago transit authority|trains in usa|bus|public transport|commuter train|work commute|vox election|vox transit","952577","36880","1346","4914","https://i.ytimg.com/vi/-ZDZtBRTyeI/default.jpg","False","False","Most Americans have no choice but to drive. How do we change that?What do you wish the presidential candidates would talk about? http://vox.com/ElectionVideosIn the middle of the 20th century, the US government made a decision that would transform American cities: It built a huge system of interstate highways, many of which went right through the downtowns of its biggest cities.This sealed the country's fate as a car culture, and today we're seeing the results. In most cities, it's extremely difficult to get around without a car, in part due to public transit systems built to serve an outdated commute. And when our politics turn to infrastructure, the government often favors building new roads and highways instead of improving and expanding public transportation.The result is a system that forces more Americans to drive, at the expense of those who rely on public transit. It's also the biggest contributor to our country’s carbon footprint. Fixing that over the long term will require a reimagining of American cities and towns. But there's also a way that, if we wanted to, we could improve American transit systems, and get more people riding them, in a matter of weeks.This video is the seventh in our series on the 2020 election. We aren’t covering the horse race; instead, we want to explain the stakes of the election through the issues that matter most to you. To do that, we want to know what you think the presidential candidates should be talking about. Tell us here: http://vox.com/ElectionVideosFor Jonathan English’s research comparing Canadian and US public transit: https://www.bloomberg.com/news/features/2018-08-31/why-is-american-mass-transit-so-bad-it-s-a-long-storyFor research on suburban commutes from the Brookings Institution’s Adie Tomer, Joseph Kane, and Jennifer S. Vey: https://www.brookings.edu/interactives/connecting-people-and-places-exploring-new-measures-of-travel-behavior/For more of Vox’s coverage on public transportation: https://www.vox.com/2015/8/10/9118199/public-transportation-subway-busesFor more historical maps on how the federal highway system transformed cities: http://iqc.ou.edu/2014/12/12/60yrsmidwest/Subscribe to our channel! http://goo.gl/0bsAjOVox.com is a news website that helps you cut through the noise and understand what's really driving the events in the headlines. Check out http://www.vox.com.Watch our full video catalog: http://goo.gl/IZONyEFollow Vox on Facebook: http://goo.gl/U2g06oOr Twitter: http://goo.gl/XFrZ5H","9M40S"
"EQfm-Qqy-wU","Miranda Lambert - Settling Down (Official Video)","2020-10-21T22:04:10Z","UCJQplYDHQjYbmADXC-_y27Q","mirandalambertVEVO","10","20.23.10","Miranda lambert|settling down|husband|bluebird|official video|wildcard|idyllwind|way too pretty for prison|white trash|holy water|how dare you love|fire escape|tequila does|track record|dark bars|wildcard up my sleeve|tik tok|locomotive|cma fest|carrie underwood|kerosene|the house that built me|white liar|vice|fastest girl in town|automatic|all kinds of kinds|heart like mine|the weight of these wings|tin man|time","728798","15213","482","1527","https://i.ytimg.com/vi/EQfm-Qqy-wU/default.jpg","False","False","Listen to Miranda Lambert’s album ‘Wildcard', featuring “Settling Down”, out now: https://Miranda.lnk.to/WildcardAY    CHORUS:I'm a wild child and a homing pigeonCaravan and an empty kitchenBare feet on the tile with my head up in the cloudsI'm one heart goin' both directionsOne love and a couple of questionsAm I settlin' up or settlin' down?Am I settlin' up or settlin' down?Apple Music: https://Miranda.lnk.to/WildcardAY/applemusic Spotify: https://Miranda.lnk.to/WildcardAY/spotify Amazon: https://Miranda.lnk.to/WildcardAY/amazonmusic YouTube Music: https://Miranda.lnk.to/WildcardAY/youtubemusic YouTube: https://Miranda.lnk.to/WildcardAY/youtube Pandora: https://Miranda.lnk.to/WildcardAY/pandora Select clothing in this video is from the Idyllwind Fueled By Miranda Lambert Collection. Shop the complete collection, now: https://ml.lnk.to/IdyllwindAYSign up to receive email updates from Miranda Lambert: http://2ml.us/yt-updatesSubscribe to Miranda Lambert’s Channel: https://Miranda.lnk.to/profileAY/youtube See Miranda Lambert on Tour: http://2ml.us/yt-tour Follow Miranda:Facebook: https://Miranda.lnk.to/profileAY/facebook Instagram: https://Miranda.lnk.to/profileAY/instagram Twitter: https://Miranda.lnk.to/profileAY/twitter TikTok: https://Miranda.lnk.to/profileAY/tik-tok Visit Website: https://Miranda.lnk.to/profileAY/officialsite  #MirandaLambert #SettlingDown #OfficialVideo #Wildcard","3M18S"
