video_id,title,publishedAt,channelId,channelTitle,categoryId,trending_date,tags,view_count,likes,dislikes,comment_count,thumbnail_link,comments_disabled,ratings_disabled,description,duration
"q14QWpUQ5ZQ","iPhone 12 & 12 Pro UNBOXING","2020-10-20T13:00:11Z","UCIrrRLyFMVmmL9NDAU2obJA","SuperSaf","28","20.23.10","iphone 12|iphone 12 pro|iphone 12 unboxing|iphone 12 pro unboxing|apple iphone 12|apple iphone 12 pro|iphone 12 hands on|iphone 12 pro hands on|iphone 12 blue|iphone 12 pro blue unboxing|iphone 12 pro blue|iphone 12 pro max|iphone 12 mini|iphone 12 review|iphone 12 vs iphone 12 pro|iphone 12 pro vs iphone 12|iphone 12 vs iphone 11|supersaf|supersaf tv","757474","21679","1059","2397","https://i.ytimg.com/vi/q14QWpUQ5ZQ/default.jpg","False","False","iPhone 12 vs iPhone 12 Pro Unboxing, First Look & Impressions in Blue vs Pacific Blue.►►►Spigen CasesiPhone 12 Pro Max: https://spigen.co/34dgBc1iPhone 12 Pro/iPhone 12: https://spigen.co/2IMuzcDiPhone 12 mini: https://spigen.co/3jdwZNK►BUY iPhone 12 Pro - US: https://amzn.to/35uN5hc UK: https://amzn.to/2Hihis3►BUY iPhone 12 - US: https://amzn.to/3ojs3ed UK: https://amzn.to/2IOlKPp►SUBSCRIBE for more: https://www.youtube.com/user/SuperSafTV?sub_confirmation=1The iPhone 12 and 12 Pro feature a 6.1” Super Retina XDR display, Aluminium or Stainless Steel Flat Frame, IP68, Dual or Triple 12MP Camera, LiDAR Scanner, Ceramic Shield Glass, A14 Bionic with 5G, MagSafe and Price is from £799/799.The iPhone 12 is available in 5 colors (Blue, White, Black, Green and PRODUCT Red). The iPhone 12 Pro is available in 4 colours (Pacific Blue, Graphite, Silver and Gold).Follow SuperSaf on:Instagram - https://instagram.com/SuperSafTwitter - https://twitter.com/SuperSafTiKTok - https://www.tiktok.com/@SuperSafFacebook - https://www.facebook.com/SuperSafYouTube - https://www.youtube.com/SuperSafOfficial Website: https://www.SuperSaf.com/#iPhone12 #iPhone12Pro #SuperSafStyle","18M15S"
"JLcdjysXPgs","Koffee - Pressure (Remix) [Official Video] ft. Buju Banton","2020-10-20T10:00:04Z","UCIOoP9FirTzjvgeAYTJWLcg","KoffeeVEVO","10","20.23.10","koffee|koffee pressure|koffee lockdown|koffee 2020|koffee rapture|koffee toast|koffee toast lyrics|koffee with karan|koffee ye|koffee burning|koffee raggamuffin|koffee with karan season 6|koffee rapture lyrics|koffee interview|koffee govana rapture remix|koffee govana|koffee mura masa|koffee mura masa toast|koffee mura masa throne|koffee mura masa remix|mura masa koffee|mura masa remix|mura masa|mura masa lovesick|mura","714064","47608","507","2754","https://i.ytimg.com/vi/JLcdjysXPgs/default.jpg","False","False","Directed by Alicia K. HarrisKoffee feat. Buju Banton - Pressure (Remix)Listen/Download: http://smarturl.it/KoffeePressure_BB?IQid=yt 'Pressure' out now: http://smarturl.it/KoffeePressure?IQid=yt ----------More from Koffee:'Lockdown': http://smarturl.it/koffeelockdown?IQid=yt'W' feat. Gunna: http://smarturl.it/KoffeeW?IQid=yt 'Rapture' EP: http://smarturl.it/KoffeeRapture?IQid=ytOfficial videos: https://www.youtube.com/playlist?list=PLCVUuQDxFCSc07JHU7BQ2TK2Pgdl4OhtH----------Follow Koffee:Official Site: http://originalkoffee.comFacebook: https://www.facebook.com/originalkoffeeTwitter: https://twitter.com/originalkoffeeInstagram: https://www.instagram.com/originalkoffee/----------#Koffee #Pressure #BujuBanton #Remix","4M"
"uJLkWxemGvA","Shawn Mendes - In Wonder | Official Trailer","2020-10-20T16:03:02Z","UCAvCL8hyXjSUHKEGuUPr1BA","Shawn Mendes","10","20.23.10","[none]","809966","134216","633","7883","https://i.ytimg.com/vi/uJLkWxemGvA/default.jpg","False","False","A Netflix Original Documentary only on Netflix, November 23.Wonder.lnk.to/InWonderNetflixNew single WONDER out nowListen now: https://Wonder.lnk.to/Single New album WONDER available Dec 4thPre-order now: https://wonder.lnk.to/AlbumFollow Shawn MendesInstagram | https://www.instagram.com/shawnmendes/Twitter | https://twitter.com/ShawnMendesFacebook | https://www.facebook.com/ShawnMendesO...Snap | https://www.snapchat.com/add/shawnmen...TikTok | https://www.tiktok.com/@shawnmendesWebsite | http://www.shawnmendesofficial.com/Subscribe to YouTubehttps://ShawnMendes.lnk.to/Subscribe-...","2M24S"
"ycxsWdpGRJM","Liam Payne LIVE","2020-10-20T17:32:25Z","UCcG6pdVejvmvWSDRJfmeB8A","Liam Payne Official","22","20.23.10","[none]","453711","90450","284","2848","https://i.ytimg.com/vi/ycxsWdpGRJM/default.jpg","False","False","Tickets on sale now for #TheLPShow Act 3 - http://veeps.events/Act3_HalloweenYTConnect with Carly Gibert:http://instagram.com/carlygibert/https://www.youtube.com/carlygiberthttps://twitter.com/carlygibert11Connect with Liam:http://liamp.co/Facebookhttp://liamp.co/Twitter http://liamp.co/Instagramhttp://liamp.co/Official","28M47S"
"dY3PpXOH520","Ryan Gallagher Shines on Andrea Bocelli and Celine Dion's The Prayer - Voice Blind Auditions 2020","2020-10-21T01:33:51Z","UCpdK1NLHxEUGXc1gq2NxkTw","The Voice","24","20.23.10","the voice|watch the voice|the voice blinds performances|the voice blinds|the voice 2020|gwen stefani|kelly clarkson|john legend|blake shelton|ryan gallagher|the prayer|andrea bocelli and celine dion|team kelly|Entertainment TV Series|Celebrities|Music|Songs|Song Writer|Voice|Music Artist|the voice nbc|season 19|the voice new season|The Voice 2020|The Voice USA|The Voice Season 19|The voice winners|Nick Jonas|John Legend|Kelly Clarkson","714586","12881","120","836","https://i.ytimg.com/vi/dY3PpXOH520/default.jpg","False","False","Ryan Gallagher performs The Prayer during The Voice Blind Auditions.» Get The Voice Official App: http://bit.ly/TheVoiceOfficialApp» Subscribe for More: http://bit.ly/TheVoiceSub» Watch The Voice Mondays & Tuesdays 8/7c on NBC!» Stream Now: http://bit.ly/TheVoiceFullEpisodesTHE VOICE ON SOCIAL:Like The Voice: http://Facebook.com/NBCTheVoiceFollow The Voice: https://Twitter.com/NBCTheVoiceFollow The Voice on Instagram: https://instagram.com/nbcthevoice/#TheVoice #TheVoiceBlindAuditions #TheVoice2020 #RyanGallagher #AndreaBocelli #CelineDion #ThePrayer #NBC #Music #Highlight #BlakeShelton #GwenStefani #JohnLegend #KellyClarksonNBC’s The Voice follows the strongest vocalists from across the country and invites them to compete in this season's blockbuster vocal competition.Find The Voice trailers, full episode highlights, previews, promos, clips, and digital exclusives here.NBC ON SOCIAL:YouTube: http://www.youtube.com/nbcTwitter: http://Twitter.com/NBCFacebook: http://Facebook.com/NBCInstagram: http://instagram.com/nbcABOUT THE VOICEThe four-time Emmy Award-winning musical competition series “The Voice” returns with the strongest vocalists from across the country to compete in the show’s newest season. Rock icon and pop culture phenomenon Gwen Stefani reclaims her red chair alongside superstar coaches Kelly Clarkson, John Legend and Blake Shelton for Season 19. Carson Daly returns as host. The show’s innovative format features four stages of competition: the Blind Auditions, the Battle Rounds, Knockouts, and the Live Performance Shows. During the Blind Auditions, the decisions from the musician coaches are based solely on voice and not looks. If a coach is impressed by the artist’s voice, he/she pushes a button to select the artist for his/her team. The singers with the lowest number of votes will be sent home each week. In the end, one will be named “The Voice” and will receive the grand prize of a recording contract.Ryan Gallagher Shines on Andrea Bocelli and Celine Dion's The Prayer - Voice Blind Auditions 2020https://youtu.be/dY3PpXOH520The Voicehttp://www.youtube.com/user/nbcthevoice","6M6S"
"McLgpck2i7A","Why New York City is so Huge","2020-10-20T11:51:51Z","UCmGSJVG3mCRXVOP4yZrU1Dw","Johnny Harris","27","20.23.10","Johnny Harris|Johnny Harris Vox|Vox Borders|Johnny Harris Vox Borders|Vox|New York|New York City|Dutch|Wall street|New Amsterdam|Canal|history|explainer|new york city|wall street|urban planning|big apple|new york city tour","343431","19273","402","1502","https://i.ytimg.com/vi/McLgpck2i7A/default.jpg","False","False","Three reasons why this city became so hugeSign up to Morning Brew for FREE: http://cen.yt/morningbrewjohnnyharrisThanks to Morning Brew for sponsoring this video.I launched a Patreon. If you want to support my videos, head here: https://www.patreon.com/johnnyharrisTom Fox makes custom music for my videos. He's amazing. https://linktr.ee/tomfoxmusic126For anyone who likes smarter travel, Iz and I started a company: https://brighttrip.com/Subscribe to my channel: https://goo.gl/1U8Zy7My Instagram: https://www.instagram.com/johnny.harris/Facebook: https://www.facebook.com/JohnnyHarris Tom Fox made the music for this video: https://tfbeats.com/I also get music from Artlist: https://bit.ly/2XfAE6CAnd Music Bed http://share.mscbd.fm/johnnywharrisIz's Channel: https://www.youtube.com/iz-harrisWe sell our drone prints: https://backdropstock.com/collections/iz-harrisAnd we send an email once a month with a Spotify playlist. Sign up if that sounds cool: https://www.izharris.com/newsletterGear I use: https://www.izharris.com/gear-guideCamera: https://geni.us/xK9AlFavorite Lens: https://geni.us/VrAWNGSecond Favorite Lens: https://geni.us/HcgdrbTravel Tripod: https://geni.us/Sf0bADrone: http://geni.us/glWJhqJohnny Harris is a filmmaker and journalist. He currently is based in Washington, DC, reporting on interesting trends and stories domestically and around the globe. Johnny's visual style blends motion graphics with cinematic videography to create content that explains complex issues in relatable ways. He holds a BA in international relations from Brigham Young University and an MA in international peace and conflict resolution from American University.Vox: https://www.vox.com/authors/johnny-harrisSpotlight: http://byupoliticalscienceblog.com/2016/03/09/alumnus-spotlight-johnny-harris/XYNTEO Interview: https://xynteo.com/insights/latest/power-storytelling-johnny-harrisBonnier Talk: https://vimeo.com/232416596 Neiman Lab: https://tinyurl.com/ybjbvb7hEmmy Nomination: https://tinyurl.com/y9gjgel2 Storytelling Tips: http://chase.be/blog/5-storytelling-tips-by-johnny-harris/Craig Adams Podcast: https://open.spotify.com/episode/4cS0vEIt2p69Wva6BnXGdRSo Money Podcast: https://tinyurl.com/ycjbl4p5","10M58S"
"RUYAqIjEHgE","Can $100 Kobe Wagyu FAT Save $1 Roast!?","2020-10-20T13:15:00Z","UCpFuaxD-0PKLolFR3gWhrMw","Sous Vide Everything","24","20.23.10","sous vide|fat is flavor|cheap roast|expensive fat|expensive meat|cheap meat|tender|juice|best|steak experiment|how to cook a steak|cooking steak","356983","12126","270","1637","https://i.ytimg.com/vi/RUYAqIjEHgE/default.jpg","False","False","Video Sponsored by Ridge Wallet: https://www.ridge.com/SVE Use Code “SVE ” for 10% off your order.If fat is flavor than this is the best of the best. Nothing comes to kobe beef fat. Today I had an insane idea to insert the most expensive fat inside the cheapest piece of meat you can find. Now that question is did I make a mistake or am I a Genius?* Watch the KOBE BEEF Experience *https://youtu.be/nHgKHKHh_UY* Become a MEMBER of SVE *https://www.youtube.com/channel/UCpFuaxD-0PKLolFR3gWhrMw/sponsor----------------------------------------------- SUBSCRIBE to This Channel https://www.youtube.com/SousVideEverything?sub_confirmation=1 ----------------------------------------------- Subscribe to my 2nd Channel https://www.youtube.com/gugafoods?sub_confirmation=1-----------------------------------------------* SVE MERCH *Shirts: https://teespring.com/stores/sveCups & Boards: https://www.etsy.com/shop/GugaStuff-----------------------------------------------* MAIL TIME Want to send something?13876 SW 56th Street #128Miami FL 33175FOLLOW ME ONFacebook: https://www.facebook.com/Sous-Vide-EverythingInstagram: https://www.instagram.com/sveverything/*************************************************THE EQUIPMENT I OFTEN USE IN MOST VIDEOS * SOUS VIDE EQUIPMENT *Nise Wave Sous Vide: https://nise.tech/pages/buywaveJoule Sous Vide Circulator: https://amzn.to/2Ii6SFyAnova Precision: https://amzn.to/2PM1izxSous Vide Container: http://amzn.to/2merrsbSous Vide Container Cover: http://amzn.to/2mbpTxtMy Stove: https://amzn.to/2DBwP2CSteak Tray: https://amzn.to/2Uvoa8ZTongs Tweezers: https://amzn.to/2M6v3GmBest Chamber Sealer: http://amzn.to/2hGHYF8Cheap Suction Sealer: http://amzn.to/2mtj1OiChamber Bags: http://amzn.to/2fpvSzDSuction Bags: http://amzn.to/2mXfSUOBag Holder: http://amzn.to/2vjBYp5Mini Weight: http://amzn.to/2nF3Q2QMy Salt: https://amzn.to/2tofZgNPepper Grinder: http://amzn.to/2BYhNiz﻿Grate Inside Container: http://amzn.to/2pKCxIS (mine is 10x15)Affordable Rack System: https://amzn.to/326c5IhStainless Rack System: http://amzn.to/2qu0eAK (Choose the right size for you)*************************************************** EVERYTHING I USE in one LINK *https://www.amazon.com/shop/sousvideeverything*************************************************** Eye Round and Kobe Fat by Grand Western Steaks Their Website: http://bit.ly/2ConGtC Use Code SVE for 15% Off any purchase, no restrictions! * For Personal Touch Speak to Rep. Emilio (305)310-0559 F.Y.I. They have picanha, TELL HIM GUGA SENT YOU!* My SMOKER and STOVE * Camp Chef WOODWIND: https://bit.ly/2BurRVEMy Powerful Stove: https://bit.ly/3esNW5j* TORCHES OPTIONS *FLAMETHOWER: https://grillblazer.com/Small Torch: http://amzn.to/2BWYvv1Searzall Torch: http://amzn.to/2meJLS7Searzall Head: http://amzn.to/2mX8Pvl* MY KNIVES *Everyday Knives: https://amzn.to/2Xmi5hpChef Knives: https://amzn.to/2FiEFxbStrong Knives: https://amzn.to/2KZs7OWFancy Knives: https://amzn.to/2RmUZSg* SMOKER AND GRILL *Best Smoker: https://bit.ly/2BurRVESmoke Gun: http://amzn.to/2frGzyOSmoke Dome: http://amzn.to/2xAHgj7Portable Stove: https://bit.ly/3esNW5jWood Pellets: http://amzn.to/2mMOR9OCharcoal Grill: http://amzn.to/2mXaIbpHeat Resistant Glove: http://amzn.to/2BFEk3J* Elote Special Ingredients *Cotija Cheese: https://amzn.to/2T89T0LTajin Seasoning: https://amzn.to/3o855qk* OTHERS *Induction Stove: https://amzn.to/36gCKrwHand Blender: https://amzn.to/3cF2HlJBlender: http://amzn.to/2n3IpKxFood Grade Gloves: http://amzn.to/2lTd8H4Glass Mason Jars 8 Oz.: http://amzn.to/2mSF6qmGlass 7 Cup with Lid Container Kit: http://amzn.to/2onMYhB* VIDEO EQUIPMENT *Main Camera: http://amzn.to/2imsWSiDrone: http://amzn.to/2jSbK7GGimbal: http://amzn.to/2ilc3HUMain Lens: http://amzn.to/2AzKumnZoom Lens: http://amzn.to/2BMF7k8Microphone: http://amzn.to/2jVU3UC Slider: https://amzn.to/3kWlTOMVoice Over Mic: http://amzn.to/2n69j1h* My Music *http://share.epidemicsound.com/wJ8n7* If you have any questions please leave a comment below and I will reply.  Thank you so much for watching see you on the next video! :-)* We are a participant in the Amazon Services LLC Associates Program, an affiliate advertising program designed to provide a means for us to earn fees by linking to Amazon.com and affiliated sites.#Steak #SousVide #Experiment","12M4S"
"G62oeL14rQw","NCT U 엔시티 유 'Make A Wish (Birthday Song)' Dance Practice","2020-10-20T11:00:09Z","UCcnk_XPx9NtZDFhBdz-DfIA","채널 NCT DANCE","24","20.23.10","MakeAWish|RESONANCE_Pt1|NCT|NCTU|RESONANCE|NCT_RESONANCE|ch_nct|채널엔시티|엔시티|nct2020|2020|엔시티2020|메이크어위시|DancePractice","3215949","454318","1866","17526","https://i.ytimg.com/vi/G62oeL14rQw/default.jpg","False","False","🎬'Make A Wish (Birthday Song)' Music Video: https://youtu.be/tyrVtwE8Gv0NCT's 2nd album NCT - The 2nd Album RESONANCE Pt. 1 is out!🎧Listen and download on your favorite platform: https://nct2020.lnk.to/resonanceID🎁Official store: https://nct2020official.com#NCT #NCTU #MakeAWish#RESONANCE #RESONANCE_Pt1#NCT_RESONANCESubscribe for more contenthttps://www.youtube.com/c/nctsmtownhttps://www.youtube.com/c/nctdailyhttps://www.youtube.com/c/nctdancehttps://www.youtube.com/c/nctmusicNCT Officialhttp://www.nct2020.comhttp://www.youtube.com/nctsmtownhttp://www.facebook.com/NCT.smtownhttp://www.instagram.com/ncthttp://twitter.com/NCTsmtown","4M3S"
"OP_WC5oOCe8","The Flight Attendant | Official Trailer | HBOMax","2020-10-20T17:12:24Z","UCx-KWLTKlB83hDI6UKECtJQ","HBO Max","24","20.23.10","kayley cuoco|michelle gomez|michiel huisman|colin woodell|rosie perez|zosia mamet|merle dandridge|T.R. Knight|Nolan Gerard Funk|Bebe Neuwirth|The Flight Attendant|HBO|HBO Max|hbomax|thriller|new series|thriller tv|flight attendant","2421144","3494","135","344","https://i.ytimg.com/vi/OP_WC5oOCe8/default.jpg","False","False","The Flight Attendant is a story of how an entire life can change in one night. A flight attendant (Cuoco) wakes up in the wrong hotel, in the wrong bed, with a dead man – and no idea what happened. The dark comedic thriller is based on the novel of the same name by New York Times best-selling author Chris Bohjalian. Streaming November 26 only on HBO Max.Subscribe: http://bit.ly/HBOMaxYouTubeBe the first to know more:HBO Max: https://hbom.ax/YTLike HBO Max on Facebook: http://bit.ly/HBOMaxFacebookFollow HBO Max on Twitter: http://bit.ly/HBOMaxTwitterFollow HBO Max on Instagram: http://bit.ly/HBOMaxInstagramAbout HBO Max: HBO Max is WarnerMedia’s direct-to-consumer offering with 10,000 hours of curated premium content. HBO Max offers powerhouse programming for everyone in the home, bringing together HBO, a robust slate of new original series, key third-party licensed programs and movies, and fan favorites from WarnerMedia’s rich library including Warner Bros., New Line, DC, CNN, TNT, TBS, truTV, Turner Classic Movies, Cartoon Network, Adult Swim, Crunchyroll, Rooster Teeth, Looney Tunes and more. #HBOMax #WarnerMedia","2M1S"
"i9AWA2Q-BA4","Kiki with IGGY AZALEA! (Iggy learns Trixie makeup)","2020-10-19T19:00:03Z","UC0biFgrMdkv1hFAFLVePODQ","Trixie Mattel","26","20.23.10","iggy|azalea|trixie|mattel|the new classic|drag|queen|makeup|cosmetics|getting ready|tutorial","1254076","87845","983","3849","https://i.ytimg.com/vi/i9AWA2Q-BA4/default.jpg","False","False","@Iggy Azalea , yes THAT Iggy Azalea (rapper, singer, songwriter) drops by to try out a Trixie makeover!Follow Iggy:Instagram & TikTok: @/thenewclassicTwitter: @/iggyazaleaShop the products we used at www.trixiecosmetics.comModelle Butter Glaze: https://www.trixiecosmetics.com/shop/modelleSummer of Love Blush Palette: https://www.trixiecosmetics.com/shop/summer-of-love-palette","22M5S"
"jdWhJcrrjQs","Architects - Animals","2020-10-20T08:00:04Z","UCDE5Ezmxq1bNVak4lmkpCMw","Epitaph Records","10","20.23.10","architects|animals|architects animals|architects uk|architects uk animals|animals official video|architects new song|architects new video|architects 2020|epitaph|epitaph records|rock|metalcore|alternative","766108","54759","1921","5278","https://i.ytimg.com/vi/jdWhJcrrjQs/default.jpg","False","False","Animals by @Architects from the album 'For Those That Wish To Exist,' available February 26thPre-order at https://architects.ffm.to/fttwteDirector: Dan SearleProducer: Kode MediaDirector of Photography: Sy TurnbullSam Carter - VocalsDan Searle - Drums & KeysJosh Middleton - Guitars, Vocals & KeysAlex Dean - Bass & KeysAdam Christianson - Guitars Written and performed by ArchitectsLyrics by Dan SearleProduced by Dan SearleCo-Produced by Josh MiddletonAdditional Production by Pete MilesMixed by Zakk CerviniDrums Engineered by Adam ‘Nolly’ Getgood @ Middle Farm StudiosVocals produced & engineered by Dan Searle @ Brighton Electric StudiosLyricsI do my best but everything seems ominousNot feeling blessed, quite the oppositeThis shouldn’t feel so monotonousIt never rains but it pours We’re just a bunch of fucking animalsBut we’re afraid of the outcomeDon’t cry to me because the fiction that we’re living inSays I should pull the pin Should I just pull the pin? I dug my heelsI thought that I could stop the rotThe ground gave wayNow I’ve lost the plotFucked it againThat was all I’ve gotIt never rains but it pours Life is just a dream within a…. Buried under dirtA diamond in the mudInfinity is waiting there‘Cause nobody can burn a glass cathedral ….dream within a dream within a….Official Site: http://www.architectsofficial.com/Facebook: http://www.facebook.com/architectsukTwitter: http://www.twitter.com/architectsukInstagram: http://instagram.com/architectsEpitaph Records is an artist-first indie label founded in Los Angeles by Bad Religion guitarist, Brett Gurewitz.  Early releases from a variety of punk heavyweights helped launch the 90s punk explosion.  Along the way, Epitaph has grown and evolved creatively while sticking to its mission of helping real artists make great recordings on their own terms.#architects #animals #epitaph","4M5S"
"HysV58P1iAM","Dead by Daylight | Hallowed Curse Collection Trailer","2020-10-20T16:00:11Z","UCaSgsFdGbwjfdawl3rOXiwQ","Dead by Daylight","20","20.23.10","Dead by daylight|dead by daylight collection trailer|dead by daylight hallowed curse collection|dead by daylight hallowed curse|dead by daylight halloween|dead by daylight ghost face|dead by daylight ghostface|dead by daylight the legion|dead by daylight the blight|eternal blight|hallowed blight|dead by daylight trailer|dead by daylight|dbd|behaviour interactive|bhvr|slasher game|survival horror","248848","15183","268","2144","https://i.ytimg.com/vi/HysV58P1iAM/default.jpg","False","False","As the Pustula Flower blooms throughout The Entity's Realm, those infected by its powerful nectar become living nightmares. Survivors, investigating the strange phenomenon, search for answers to one of the Realm’s great mysteries.  This new Collection includes a terrifying new cosmetic set for The Ghost Face®.Now available in the store:  • The Ghost Face® – Scorched Ghost Face® Set • The Legion – Chimeric Horde Outfit • The Blight – True Blight Outfit • Yui Kimura – Miss Speedway Outfit • Feng Min – Lady Defiant Outfit • Felix Richter – Grand Planner Outfit Dead by Daylight is an asymmetrical multiplayer horror game where one player takes on the role of a brutal killer and the other four play as Survivors. As a Killer, your goal is to sacrifice as many Survivors as possible. As a Survivor, your goal is to escape and avoid being caught and killed.    BUY GAME: https://deadbydaylight.com/en#buy Join the official forum: https://forum.deadbydaylight.com/en/ Like and follow us on our official Social Media Channels: - Facebook: https://www.facebook.com/DeadByDaylight/ - Twitter: https://twitter.com/deadbybhvr - Instagram: https://instagram.com/deadbydaylight #deadbydaylight #dbd #DbDHalloween","1M27S"
"ClEHz1aVFrE","Behzinga Takes On The London Marathon | How To Be Behzinga","2020-10-19T17:00:10Z","UCHhfSXoDG6gSgpOvLH4wrRw","Behzinga","24","20.23.10","Behzinga|How To Be Behzinga|Ethan Payne|Ethan Paine Sidemen|side men|JJ|Simon|Josh|Tobi|Ethan|Vikram|Harry|KSI|Miniminter|Zerkaa|TBJZL|Vikkstar123|W2S. Mental Health","2692754","316998","1135","10756","https://i.ytimg.com/vi/ClEHz1aVFrE/default.jpg","False","False","Behzinga's decided to run the London Marathon but in between training and pulling a fire engine with just a rope, he also has to figure out how he’s going to run 26 miles without going to the bathroom. Forget coming in at number one; how’s he gonna deal with a number two?💙 Teenage Cancer Trust: https://uk.virginmoneygiving.com/fundraiser-display/showROFundraiserPage?userUrl=EthanPayne&pageUrl=10:00 My Biggest Challenge - EP Teaser1:00 Meeting Mummy Behz2:05 Opening up about my Childhood5:57 I am running the London Marathon6:16 How I got Fit8:19 How to run a Marathon10:32 My Big Announcement!12:39 Finlay's Story14:34 I pulled a Truck with Eddie Hall21:17 COVID ruins my plan - EP2 Teaser","21M41S"
"WBIliqFk5fY","1 Week with the iPhone 12 & iPhone 12 Pro! | The Tech Chap","2020-10-20T21:36:59Z","UCzlXf-yUIaOpOjEjPrOO9TA","The Tech Chap","28","20.23.10","iphone 12|iphone 12 pro|iphone 12 review|apple iphone 12|iphone 11 pro|iphone 2020|iphone 12 vs iphone 12 pro|iphone 11 vs iphone 12|iphone 11 pro vs 12 pro|iphone 11 vs 12|iphone 12 unboxing|iphone 12 pro unboxing|iphone 12 camera|iphone 12 pro review|iphone 12 pro hands on|iphone 12 vs 12 pro|new iphone 12 pro|iphone 12 pro vs pro max|iphone 12 vs|apple iphone 12 pro|iphone 12 vs iphone 11|iphone 12 pro camera|iphone 12 pro vs iphone 11 pro","343233","8163","259","1115","https://i.ytimg.com/vi/WBIliqFk5fY/default.jpg","False","False","iPhone 12 vs iPhone 12 Pro Unboxing & First Impressions! Can the refreshed design, OLED screen, Apple A14 chip, 5G and upgraded camera be worth upgrading to the iPhone 12, and is the Pro worth paying $200 extra? ▶Buy on Amazon (Paid Links):iPhone 12 - US: https://amzn.to/3dHJ24W l UK: https://amzn.to/2FOKdTKiPhone 12 Pro - US: https://amzn.to/37vRrYl l UK: https://amzn.to/35f3WEI#iPhone12 #iPhone12Pro #AppleNotice: [Paid Links] As an Amazon Associate I earn from qualifying purchases. The Tech Chap is a member of the Amazon Associate Program, and can earn fees from links to Amazon.com and Amazon.co.uk.Can't get enough of your TECH? Why not SUBSCRIBE? (it's free!) 😄▶ YouTube: https://bit.ly/2UyCBGq 📷 Instagram: https://www.instagram.com/TheTechChap🐦Twitter: https://twitter.com/TheTechChap🎵 Music by Epidemic & Artlist","12M8S"
