video_id,title,publishedAt,channelId,channelTitle,categoryId,trending_date,tags,view_count,likes,dislikes,comment_count,thumbnail_link,comments_disabled,ratings_disabled,description,duration
"0hZtPwv_Erw","Goukuldham हुआ Popatlal से खुश-Taarak Mehta Ka Ooltah Chashmah-तारक मेहता-Ep 3083 -19th January 2021","2021-01-19T15:30:00Z","UC6-F5tO8uklgE9Zy8IvbdFw","Sony SAB","24","21.20.01","तारक मेहता|Ooltah Chashmah|sab tv channel|sab tv serials|taarak mehta latest episodes|taarak mehta ka ooltah chashmah|hindi comedy show|sab tv funny show|taarak mehta ka ulta chashma|taarak new episode|hindi tv serial|ulta chashma|tarak mehta ka ultah chashma|taarak full episode|jethalal|babita|champak chacha|anjali bhabhi|bhide|tapu sena|comedy show|jethalal funny|Popatlal's wife in gokuldham|Popatlal's Marriage in taarak mehta|taarak mehta ep 3083","1371824","21316","1598","628","https://i.ytimg.com/vi/0hZtPwv_Erw/default.jpg","False","False","Click here to watch the full episode of Taarak Mehta Ka Ooltah Chashmah:https://www.sonyliv.com/shows/taarak-mehta-ka-ooltah-chashmah-1700000084/popatlal-s-journalism-award-1000105107?watch=trueClick here to subscribe to SAB TV: https://www.youtube.com/channel/UC6-F5tO8uklgE9Zy8IvbdFw?sub_confirmation=1Click here to subscribe to SonyLIV: http://www.sonyliv.com/signinClick here to watch all the episodes of Taarak Mehta Ka Ooltah Chashmah:  https://www.sonyliv.com/shows/taarak-mehta-ka-ooltah-chashmah-1700000084/jethalal-and-mehta-s-misunderstanding-1000104091?watch=trueEpisode 3083: Confusion Solved -----------------------------------------------------------------------------Babita and Iyar Solve the confusion of Popatlal's Marriage but still, society has many questions unanswered so one by one everyone asks their question like connections between Venogopal and Popatlal, etc. and Iyar and Babita answer their questions at last Everyone gives blessing to New Couple. watch the full episode.More Useful Links : * Visit us at : http://www.sonyliv.com * Like us on Facebook : http://www.facebook.com/SonyLIV * Follow us on Twitter : http://www.twitter.com/SonyLIVAlso get Sony LIV app on your mobile * Google Play - https://play.google.com/store/apps/details?id=com.msmpl.livsportsphone * ITunes - https://itunes.apple.com/us/app/liv-sports/id879341352?ls=1&mt=8About Taarak Mehta Ka Ooltah Chashmah:----------------------------------------------------------------------The show is inspired by the famous humorous column 'Duniya Ne Undha Chasma' written by the eminent Gujarati writer Mr. Tarak Mehta. This story evolves around happenings in Gokuldham Co-operative Society and covers topical issues that are socially relevant. The show predominantly - Promoolves around 'Jethalaal' (Dilip Joshi) who is an uneducated Gujarati businessman. Your 'Taarak Mehta' (Sailesh Lodha), is his neighbor. 'Jethalaal' finds a friend and philosopher in 'Taarak Mehta' and often goes to him for advice whenever he is in trouble. Jethalaal's family includes his simpleton wife 'Daya Ben' (Disha Wakani) and a mischievous son 'Tapu' (Bhavya Gandhi). Tapu is a menace and a constant source of trouble to all the members of Gokuldham. They have often warned 'Jethalaal' to reform 'Tapu' or else be prepared to leave the premises.","7M25S"
"-hROT9gx_Cc","માધવપુર નો દરીયો || dhaval domadiya - vlog","2021-01-19T04:43:26Z","UCTEfw4GhRUFoeUD6DQZ4RWA","Dhaval Domadiya","24","21.20.01","dhaval domadiya|comedy video|funny video|gujarati comedy video|gujarati funny video|dhaval domadiya new video|dhaval domadiya comedy vide","142507","9252","378","1084","https://i.ytimg.com/vi/-hROT9gx_Cc/default.jpg","False","False","Title : madhavpur no dariyo For Business Inquirymail : dhavaldomadiya@gmail.comlike my Facebook page - https://www.facebook.com/dhavaldomadiyaofficial/follow me on Insta -  https://www.instagram.com/dhaval_domadiya/#dhavaldomadiya","13M18S"
"AqOcQAL7cW0","Indigo Paints IPO Review by CA Rachna Ranade","2021-01-19T15:30:01Z","UCe3qdG0A_gr-sEdat5y2twQ","CA Rachana Phadke Ranade","27","21.20.01","CA Rachana Ranade|stock market basics|basics of share market|share market basics|Stock market|money|share market|fundamental analysis|Rachana|CA Rachana|Indigo Paints IPO|IPO market|indigo ipo|indigo paints ipo|indigo paints ipo review|indigo paints|Indigo Paints IPO Review by CA Rachna Ranade|indigo paints ipo date|indigo|paints|indigo ipo review ipo|ipo|indigo paints ipo latest news|upcoming ipo|upcoming ipo 2021","341732","11497","383","952","https://i.ytimg.com/vi/AqOcQAL7cW0/default.jpg","False","False","Indigo Paints is one of the fastest-growing paint companies in India and in terms of revenue, it is the 5th largest company in the decorative paint industry. The company is engaged in manufacturing different types of decorative paints like enamels, emulsions, wood coatings, primers, distempers, putties, and cement paints✔️Zerodha► https://bit.ly/OpenAccountwithZerodhaWhat is covered? 0:00 - Start00:42 - Introduction02:42 - Company Introduction03:32 - Formula for Company's success05:06 - Industry Analysis06:13 - Peer Comparison08:47 - Company Analysis09:45 - Offer Details10:25 - Financials11:19 - What are Restated Financials13:43 - Valuation15:04 - ConclusionYou can get my Stock Market courses on https://www.rachanaranade.com It’s an opportunity to learn 65+ concepts relating to Basics of Stock Market in 11 sessions! Feel free to WhatsApp on +91 9022196678 if you have any purchase-related queries.Android App: https://bit.ly/CARRAndroidAppiOS App: https://bit.ly/CARRiOSAppBasics of Stock Market Course: https://bit.ly/CARR_BOSM--------------------------------------------------------------------------------------------------------------------Join my YouTube Memberships: https://bit.ly/JoinCARRYTMembership-------------------------------------------------------------------------------------------------------------------Facebook►  https://bit.ly/CARRFacebookTelegram ► https://t.me/CARachanaRanadeInstagram► https://bit.ly/CARRInstagramTwitter► https://bit.ly/CARRTwitterLinkedin► https://bit.ly/CARRLinkedin------------------------------------------------------------------------------------------------------------------------Playlist:Basics of Stock Market For Beginners: https://link.rachanaranade.com/BOSM#IndigoPaints #IPOReview #CARachanaRanade","15M50S"
"sRPX4u6SPUk","Maleesha Kharwa: ఈ అమ్మాయికి బాలీవుడ్, హాలీవుడ్ తారలు కూడా ఫ్యాన్స్ అయిపోయారు, ఎందుకు? | BBC Telugu","2021-01-18T02:16:03Z","UCiTCB-B_weEmwHk7ifNobQw","BBC News Telugu","25","21.20.01","Princess from the Slum|Maleesha Kharwa|Mumbai|BBC Telugu|BBC News Telugu|BBC Telugu News|BBC News Live Telugu|BBC News Telugu Today|BBC News Telugu Live|bbc telugu|bbc news telugu live|bbc telugu live news|bbc news in telugu|bbc telugu live|slums of Bandra|Maleesha|supermodel|Robert Hoffman|మలీశా ఖర్వా|ముంబయి|ప్రిన్సెస్ ఫ్రం ది స్లమ్|సెలబ్రెటీ|బాలీవుడ్|మహారాష్ట్ర","869045","22442","337","455","https://i.ytimg.com/vi/sRPX4u6SPUk/default.jpg","False","False","ముంబయిలో సముద్రపు ఒడ్డున ఉన్న మురికివాడలో ఉంటోంది మలీశా కుటుంబం. ప్రభుత్వ పాఠశాలలో ఏడో తరగతి చదువుతున్న ఈ అమ్మాయి  ఇంగ్లీష్ చక్కగా మాట్లాడగలదు. ద స్ట్రీట్ అనే హాలీవుడ్ చిత్రంలో నటించిన రాబర్ట్ హోఫ్‌మన్ భారత్‌లో పర్యటించినప్పుడు అనుకోకుండా మలీశాను కలిశారు. ‘ప్రిన్సెస్ ప్రమ్ ద స్లమ్’ అన్న బిరుదు ఆమెకు ఇచ్చి, ఆమెతో ఓ ఇన్‌స్ట్రాగ్రామ్ ఖాతా తెరిపించారు. కలలను సాకారం చేసుకోవడంలో మలీశాకు తోడ్పడేందుకు గో ఫండ్ మీ వెబ్‌సైట్ ద్వారా విరాళాల సేకరణ చేపట్టారు.#PrincessfromtheSlum #MaleeshaKharwa #Mumbai--- కరోనావైరస్‌ మన శరీరాన్ని ఎలా దెబ్బతీస్తుంది? వైరస్ సోకితే చనిపోయే ఆస్కారం ఎంత? వ్యాక్సీన్ ఎప్పుడు వస్తుంది? ఈ మహమ్మారికి అంతం ఎప్పుడు? – ఇలాంటి అనేక ప్రశ్నలకు సమాధానాల కోసం ఈ ప్లేలిస్టు https://bit.ly/3aiDb2A చూడండి. కరోనావైరస్‌ ఆంధ్రప్రదేశ్, తెలంగాణ రాష్ట్రాల్లో, భారతదేశంలో ఎలా వ్యాపిస్తోంది? అమెరికా, బ్రెజిల్, బ్రిటన్, ఇతర దేశాల్లో దీని ప్రభావం ఎంత తీవ్రంగా ఉంది? – ఇలాంటి అనేక అంశాలపై బీబీసీ తెలుగు వెబ్‌సైట్ కథనాల కోసం ఈ లింక్  https://bbc.in/34GUoSa క్లిక్ చేయండి. ఫేస్‌బుక్, ఇన్‌స్టాగ్రామ్, ట్విటర్‌లలో బీబీసీ తెలుగును ఫాలో అవ్వండి. ఫేస్‌బుక్: https://www.facebook.com/BBCnewsTelugu ఇన్‌స్టాగ్రామ్: https://www.instagram.com/bbcnewstelugu/ ట్విటర్: https://www.instagram.com/bbcnewstelugu/","2M6S"
"dQT3Sy9nWHk","21 Vi Sdi (Full Video) | Ranjit Bawa | M.Vee | Lovely Noor | Latest Punjabi Songs 2021","2021-01-16T03:30:50Z","UCr7A63cwz2vy7cwIXs_4VFA","Ranjit Bawa","10","21.20.01","21 Vi Sdi|Ranjit Bawa|ranjit bawa songs|ranjit bawa new songs|new song ranjit bawa|latets punjabi songs 2021|new punjabi songs 2021|hit songs|kisan andolan|ranjit bawa all song|ranjit bawa status|ranjit bawa punjabi song|ranjit bawa live","3897216","225199","3020","17027","https://i.ytimg.com/vi/dQT3Sy9nWHk/default.jpg","False","False","Download / Listen Full Audio FromiTunes - https://apple.co/2XMou4eRaunka - https://bit.ly/2XMoxNsGaana - https://bit.ly/38ThRU5Hungama - https://bit.ly/3sCZoD0Wynk- https://bit.ly/3sJfFWXSpotify - https://spoti.fi/2LZtrE2Kkbox -  https://bit.ly/39zD844JioSaavn - https://bit.ly/38Ugi8lTidal - https://bit.ly/3bPpYThYandex Music - https://bit.ly/2Kt0yjkSong - 21 Vi SdiSinger - Ranjit BawaLyrics - Lovely Noorhttps://www.instagram.com/lovelynoorofficialMusic - M.Veehttps://www.instagram.com/m.veemuzic/Mix Master - Vintage Wave StudioVideo - Dhiman ProductionsOnline Promotion- Baaj Mediahttps://instagram.com/BaajmediaProducer: Charan DaasLabel - Ranjit BawaDigital Partner - Bull18 [http://www.instagram.com/Bull18Network]","5M48S"
"J9jEmE6dJ5Q","Pookkalam Varavaayi | Monday to Saturday, 6.30 PM | Promo | Zee Keralam","2021-01-18T13:15:00Z","UCbrfwFuwMVRtxUTtEYJUKKg","Zee Keralam","24","21.20.01","zee keralam|#zeekeralam|zee malayalam|#malayalam|#zeemalayalam|zee keralam tv shows|zee keralam tv serial|malayalam serial|malayalam shows|#entertainment|#drama|#comedy|#keralamserial|#keralamshows|#keralam|#fullepisodes|zee keralam full episodes|malayalam full episodes|#onlineshows|zee keralam popular shows|Pookkalam Varavaayi|pookkalam varavayi serial|pookkalam varavayi","308138","2555","138","70","https://i.ytimg.com/vi/J9jEmE6dJ5Q/default.jpg","False","False","ലിഫ്റ്റിൽ സംയുക്ത കുടുങ്ങിയതെങ്ങനെ എന്ന് അറിയാൻ അഭിമന്യു. കാണുക പൂക്കാലം വരവായി തിങ്കൾ മുതൽ ശനി വരെ വൈകുന്നേരം 6.30 സീ കേരളത്തിൽ.Free Subscription click here: https://www.youtube.com/channel/UCbrfwFuwMVRtxUTtEYJUKKg?sub_confirmation=1Get notified about our Latest update by Clicking the Bell Icon 🔔Paid Subscription Zee5 click here:https://www.zee5.com/myaccount/subscription?utm_source=yt&utm_medium=ref&utm_campaign=subscriptionTo Free Download ZEE5 Mobile app click the link below:Playstore: http://bit.ly/Zee5PlayStoreiTunes: http://bit.ly/Zee5ITunes","20S"
"-xuEY-_AWaI","PICHI YAKUU KI SHADI | Hyderabadi Comedy | Warangal Diaries","2021-01-17T07:32:33Z","UCWSyWK6oS5VL3RrJZuWsdSA","Warangal Diaries","23","21.20.01","warangal diaries|latest|funny|comedy|vines|warangal diaries new video|warangal diaries latest video|warangal diaries comedy|warangal diaries funny|pichi yakuu ka rishta|pichi yakuu wedding|pichi yakuu as groom|pichi yakuu ki shaadi|pichi yakuu new video|pichi yakuu funny video|pichi yakuu comedy video|nabeel afridi ka rishta|nabeel afridi ki shaadi|hyderabadi comedy|hyderabadi funny video|hyderabadi best comedy|hyderabad diaries|noor bhai rishte wale","380743","30113","721","1439","https://i.ytimg.com/vi/-xuEY-_AWaI/default.jpg","False","False","Pichi yakuu ki shaadi ka rishta: a stranger meets pichi yakuu and asks him to get married as soon as possible because 2021 is going to be more worst but it leads to best tragedy ever. It's all about fun & hyderabadi comedy make sure you guys like comment and share this video with your friends, family.NEW HERE? Subscribe to our channel by clicking on the link below! https://www.youtube.com/channel/UCWSyWK6oS5VL3RrJZuWsdSA?sub_confirmation=1Follow us on social media: Facebook :- https://www.facebook.com/WarangalDiariesTwitter :- https://www.twitter.com/WarangalDiariesInstagram :- https://www.instagram.com/WarangalDiariesGoogle+ :- https://www.plus.google.com/+WarangaldiarieschannelYoutube :- https://www.youtube.com/WarangalDiariesChannelSocial media links of artists:Nabeel Afridi: https://www.facebook.com/IamNabeelAfridiInstagram :- https://www.instagram.com/IamNabeelAfridiTwitter :-  https://www.twitter.com/IamNabeelAfridiSnapchat :- IamNabeelAfridiSharjeel Ali: https://www.instagram.com/iamsharjeelaliRehan Waqhar: https://www.instagram.com/me_rehan_waqhar Warangal Diaries bringing you the best hyderabadi linguistic vines & funny videos which you can relate with everyone's routine life.We will make you smile, We will win your hearts.#Hyderabadicomedy #Warangaldiaries #Nabeelproductions'EVERY SUNDAY A NEW VIDEO' #warangaldiariesfamily :)","9M50S"
"WKbhlQ2z4Gk","Nithiin, Megha Akash Emotional Love Scenes || A AA 2 (Chal Mohan Ranga) Latest Hindi Dubbed Movie","2021-01-19T12:15:21Z","UCX_uPA_dGf7wXjuMEaSKLJA","Aditya Movies","1","21.20.01","A Aa 2|New Released|Hindi Dubbed|Hindi full Movies|Latest Movies in hindi|Nithiin|Nithin Hindi Movie|Nithin New Hindi Movies|Nithin Latest Movies|Latest Hindi Movies|2019 Hindi Dubbed Movies|New hindi Movies 2019|online 2019 Hindi Movies|Hindi|Movies|Megha Akash|nithin hindi movies|Chal Mohan Ranga Hindi Dubbed Movie|A Aa 2 Comedy scenes|A Aa 2 full Hindi Dubbed movie|A Aa 2 full movie|nithin all movies in hindi dubbed|Aditya Movies","485471","2695","331","100","https://i.ytimg.com/vi/WKbhlQ2z4Gk/default.jpg","False","False","#AAa2 #Chalmohanranga #NithiinWatch & Enjoy Nithin & Megha Akash  Emotional  Scenes,  A Aa2 (Chal Mohan Ranga)  Hindi dubbed. Watch this south movie in Hindi. Enjoy this newly released south Hindi full HD movie having romantic comedy story. Have a fun by watching this south Indian Hindi dubbed movie.Mohan Ranga falls in love with Megha who is an NRI residing in the United States. However, due to certain circumstances they fall apart. Will they be able to reciprocate their Love & will the destiny unite them is the rest of the story.Subscribe to Aditya Movies for all Latest, Popular, Blockbuster & Superhit Hindi Dubbed Videos.Actors: Nithiin ,Megha Akash ,Ashu ReddyCreditsProduced by : Umesh GupthaWritten & Directed by : Krishna Chaitanaya Music by: S. S. ThamanFor More  Hindi Dubbed Movies :-A Aa Hindi Dubbed Full Movie : https://youtu.be/R7aCOI4DuA0A AA 2 Full Hindi Dubbed Movie : https://youtu.be/JDzXR_mV_fISrinivasa Kalyanam  Hindi Dubbed Movie : https://youtu.be/VeoiEqdkKAkDushmano Ka Dushman Hindi Dubbed Full Movie : https://youtu.be/fEZMVFhXb8IMajili Hindi Dubbed Full Movie : https://youtu.be/lIIvFgwREsIISmart Shankar Hindi Dubbed Full Movie : https://youtu.be/Gtx1pPeKJsA------------------------------------------------------------------For More Full Movies , Subscribe to:►https://www.youtube.com/user/adityacinema►Like us on Facebook: http://www.facebook.com/adityamovies►Follow us on Instagram: https://www.instagram.com/adityamoviesFor Hit & Latest Music:►https://www.youtube.com/user/adityamusic►Follow us on Twitter: http://www.twitter.com/adityamusic►Follow us on LinkedIn: http://bit.ly/2Pp6ze3For Devotional Music: ►https://www.youtube.com/user/adityadevotional© 2021 Aditya Movies India Pvt. Ltd.","10M29S"
"RL0hTfxPjAc","Good Morning | Masoom Sharama, Nidhi Sharma | Manisha Sharma | New Haryanvi Songs Haryanavi 2021","2021-01-17T04:30:12Z","UC1szTzVObtdgqElKQkIb_1g","Sejal Entertainment","10","21.20.01","good morning|good morning song|good morning haryanvi|masoom sharma|nidhi sharma|manisha sharma|gr music|sejal entertainment|new|haryanvi|songs|haryanavi|2021|new haryanvi songs haryanavi 2021|haryanvi songs|haryanvi songs 2021|new haryanvi song 2021|latest haryanvi song 2021|new haryanvi songs|latest haryanvi songs|haryanvi dj songs|haryanvi songs haryanavi|masoom sharma song|masoom sharma new song|masoom sharma all song|haryanvi songs haryanavi 2020","663102","29626","1745","1860","https://i.ytimg.com/vi/RL0hTfxPjAc/default.jpg","False","False","Good Morning | Masoom Sharama, Nidhi Sharma | Manisha Sharma | New Haryanvi Songs Haryanavi 2021Presenting Good Morning (Full Video) a New Haryanvi Songs Haryanavi 2021. Good Morning song starring with Masoom Sharma and Nidhi Sharma. This Superhit Haryanvi Dj Song Sung by Masoom Sharma & Manisha Sharma. Music given by GR Music. Lyrics penned by Masoom Sharma. A Film by Dheeraj M. Music Label by Sejal Entertainment.Subscribe us 👉 https://youtube.com/c/sejalentertainment#GoodMorning #MasoomSharma #NidhiSharma #ManishaSharma #SejalEntertainment #HaryanviDjSongs2021Song 👉 Good Morning (Full Video)Singer 👉 Masoom Sharma and Manisha SharmaStarring 👉 Masoom Sharma and Nidhi SharmaMusic 👉 Gr Music (8708626865)Lyrics 👉 Masoom SharmaEdit/Di/Direction 👉 Dheeraj MDop 👉 Munish SharmaAsst. Director 👉 Mohit Mor, Aman Poonia & Lalit JiLights 👉 Dheeraj BishnoiSpl Thanks 👉 Manjeet Mor and Vikash RajanaProduced By 👉 Ajay JangraMusic Label 👉 Sejal EntertainmentOnline/Digital Promotion 👉 Navi Baadliwal (9910117138)Digital Partner 👉 ABK DigitalCompany Contact Number 📲 8222832003, 8708142015💗LOVE || 👍LIKE || 💬COMMENT || 🔄SHARE || 🔔 SUBSCRIBEEnjoy & stay connected with us!► Facebook : https://www.facebook.com/sejalentertainment/► Instagram : https://www.instagram.com/sejalentertainment/► Twitter : https://twitter.com/sejalmusicWatch Our Other Popular Videos 1. AMIT SAINI ROHTAKIYA : RULE TODNE (Full Video) | Andy Dahiya - https://youtu.be/KE7EaXvSHsI2. AMIT SAINI ROHTAKIYA : VIVAAD 2 (Full Video) - https://youtu.be/Cq5x5nhs5_Y3. Kaliye Ki Maa | Sonika Singh, Kay D | Surender Romio, Renuka Panwar - https://youtu.be/dsFSuYDoYls4. Pakdam Pakdai - Full Video | Mohit Sharma, Pragati | Andy Dahiya - https://youtu.be/ZrcEKib8xXU5. Balam Mera Kala | Vijay Varma, Gori | Ruchika Jangid, Amit Dhull - https://youtu.be/WZTALcYpXWcThanks Everyone for Watching Our Video Song. If you enjoy this Video Song please support us with you LOVE & SUBSCRIBE Our Channel. Must Press Bell 🔔 Icon to get notification of our next music video. Thankyou.","4M19S"
"jHLwf7HbAcc","Taarak Mehta Ka Ooltah Chashmah - Episode 585 - Full Episode","2021-01-19T14:30:03Z","UC6-F5tO8uklgE9Zy8IvbdFw","Sony SAB","24","21.20.01","तारक मेहता|Ooltah Chashmah|sab tv channel|sab tv serials|taarak mehta latest episodes|taarak mehta ka ooltah chashmah|hindi comedy show|sab tv funny show|taarak mehta ka ulta chashma|taarak new episode|hindi tv serial|ulta chashma|tarak mehta ka ultah chashma|taarak full episode|jethalal|babita|taarak|champak chacha|anjali bhabhi|bhide|iyer|tapu sena|comedy show|jethalal funny|navratri in gokuldham|navratri special in taarak mehta|taarak mehta 585","767164","8520","952","266","https://i.ytimg.com/vi/jHLwf7HbAcc/default.jpg","False","False","Click here to Subscribe to SAB TV Channel: https://www.youtube.com/user/sabtv?sub_confirmation=1Click to watch all the episodes of Taarak Mehta Ka Ooltah Chashmah https://www.youtube.com/playlist?list=PL6Rtnh6YJK7Zfu1x9Bd1UqLwUxhZ1oBJhThe show is inspired by the famous humorous column 'Duniya Ne Undha Chasma' written by the eminent Gujarati writer Mr. Tarak Mehta. This story evolves around happenings in Gokuldham Co-operative Society and covers topical issues that are socially relevant. The show predominantly - Promoolves around 'Jethalaal' (Dilip Joshi) who is an uneducated Gujarati businessman. Your 'Taarak Mehta' (Sailesh Lodha), is his neighbor. 'Jethalaal' finds a friend and philosopher in 'Taarak Mehta' and often goes to him for advice whenever he is in trouble. Jethalaal's family includes his simpleton wife 'Daya Ben' (Disha Wakani) and a mischievous son 'Tapu' (Bhavya Gandhi). Tapu is a menace and a constant source of trouble to all the members of Gokuldham. They have often warned 'Jethalaal' to reform 'Tapu' or else be prepared to leave the premises. Lost hopes of being heard by his son push Jethalaal' to call his father 'Champaklal' (Amit Bhatt) from the village. This was his great idea of leashing some control over the mischievous Tapu. The opposite happens and the grandfather joins hands with the grandson to make life a roller coaster troublesome ride for Jethalaal.","19M54S"
"K7oOXAMynas","Nexon ഇടിച്ചു 😑+ Sound proof  +operation Screen || ഇപ്പോഴത്തെ അവസ്ഥ 😑","2021-01-19T04:00:34Z","UC2knu5PFPDfLspFMzwEvxQw","Arun Smoki","2","21.20.01","nexon accident|car modification|modified car|nexon modification|tata harier|tata altroz|malayalam car review|nexon review|malayalam trending|malayalam accident|malayalam youtubers|new car delivery|altroz challenge","308481","22683","521","1810","https://i.ytimg.com/vi/K7oOXAMynas/default.jpg","False","False","കാറിന് സംഭവിച്ച 2 മാറ്റങ്ങളും sound proof installation ഉം ആണ് ഇന്നത്തെ നമ്മുടെ video 🤗Cashkaro Application  Link: https://cashk.app.link/RS6Idq1f9cbCashkaro Website Link: https://cashk.app.link/gBcvao1f9cbFOR COLLABORATIONS DM : ARUNSMOKIVLOG@GMAIL.COMFEEL FREE TO CONTACT ME ON;__________________________________INSTAGRAM PROFILEhttp://www.instagram.com/ArunsmokiFacebook pagehttp://www.fb.com/Arunsmokiii____________________::::::____________________MY GADGETSCamera :Gopro Hero 9Hero 7Eos R With 35mmOther GadgetsHero 8One plus 7pros20 plus5d M4 85mm lensEDITING SOFTWARE ;Power director Pro(FULLY EDITED ON ONEPLUS 7PRO)THUMBNAIL_________________Light room snapseed malayalam photo editierMY OTHER AccountsFOR USED BIKEShttps://www.instagram.com/tcrktmfacebookhttps://www.facebook.com/Thrissurusedktmബൈക്ക് പ്രാന്തന്മാർ FACEBOOK GROUP LINKhttps://www.facebook.com/groups/244177746376307/***______💙 Thanks For watching Guyz 💙______**","16M36S"
"EwVXZFCIB8o","Paruppu Podi Recipe in Tamil | Paruppu Podi for Rice","2021-01-20T05:31:54Z","UCHGktfcQq2BY_8tGPHwvm7g","Madras Samayal","26","21.20.01","paruppu podi|paruppu podi for rice|andhra paruppu podi recipe in tamil|paruppu podi recipe in tamil|paruppu podi recipe|paruppu podi andhra style|variety rice in tamil|madras samayal","327870","12922","245","2526","https://i.ytimg.com/vi/EwVXZFCIB8o/default.jpg","False","False","In this video we will see how to make paruppu podi recipe in tamil. This paruppu podi can be used to make a quick and easy meal by mixing with rice and ghee. This paruppu podi is very simple to make but is absolutely delicious and is the easiest variety rice to make.#ParuppuPodi #ParuppuPodiForRiceFriends, please do try this paruppu podi recipe at home and use it for a quick meal. Also please do share your feedback about the recipe in the comments below. All the best and happy cooking!Ingredients:1/3 cup Moong dal1/3 cup thoor dal1/3 cup Urad dal2 kashmiri chilies3 regular chilies4 pepper 1/8 tsp Cumin seedsCurry leavespinch of Asafoetida1/8 tsp Oil3/4 tsp Salt","4M53S"
