video_id,title,publishedAt,channelId,channelTitle,categoryId,trending_date,tags,view_count,likes,dislikes,comment_count,thumbnail_link,comments_disabled,ratings_disabled,description,duration
"kg_WnRuWBo8","Sachin Tendulkar: This is the best Test series victory | 4th Test Australia V India | The Gabba","2021-01-19T14:11:40Z","UCnzTvgqX77zZBJ5mji5bi7w","Sachin Tendulkar","22","21.20.01","Sachin|Sachin Tendulkar|Sachin Ramesh Tendulkar|Master Blaster|sachin tendulkar|sachin ramesh tendulkar|sachin a billion dreams|4th test|india vs australia 4th test|ind vs aus 4th test|india vs australia|the gabba|gabba|pant|rishabh pant|pujara|cricket|india cricket|cheteshwar pujara|shubhman gill|border gavaskar|border gavaskar trophy 2020|border gavaskar trophy|cricket australia|india|australia|ind|aus vs ind|ind vs aus|aus|test series|test cricket","545256","33756","338","1591","https://i.ytimg.com/vi/kg_WnRuWBo8/default.jpg","False","False","What an exciting series this has been. Every member of the squad deserves credit - all the players, coaches & all the support staff. Cherish the victory everyone. A memorable day for Indian cricket #IndVsAus#BorderGavaskarTrophy","4M11S"
"nWsj52tr0-0","Dino James - Chemicals ft. Kaprila [Teaser]","2021-01-18T07:30:01Z","UCtpDorOuxwQ1URGQ0WLIXmQ","Dino James","10","21.20.01","[none]","1023217","128688","729","4055","https://i.ytimg.com/vi/nWsj52tr0-0/default.jpg","False","False","Mohobbat ya Science?Chemicals releasing tomorrow on @Sony Music India #DinoJames #Chemicals #Kaprila","41S"
"h8LMUHREijY","Hawa Aun De (HD Video) Jigar Ft Gurlej Akhtar | New Punjabi Songs 2021 | Latest Punjabi Songs 2021","2021-01-16T04:30:09Z","UC2Z2M3HR-yAbUpAdyXEGBOQ","Bamb Beats","10","21.20.01","Latest punjabi songs 2020|New punjabi songs 2020|Jigar new songs|Hawan aun de song|New punjabi songs 2021|latest punjabi songs 2021|Jigar all new songs|Bamb beats songs|All new songs|New songs|Latest songs|Gurlej akhtar songs|Desi crew all songs|Nikeet dhillon|Jigar hit songs|Amrit maan songs|Karan aujla songs|Sidhu moose wala songs|Akhil songs|Sunandha sharma songs|Mankirt aulakh songs|Bhangra songs|Beat songs","6020823","158156","6634","4422","https://i.ytimg.com/vi/h8LMUHREijY/default.jpg","False","False","Hawa Aun De (HD Video) Jigar Ft Gurlej Akhtar | New Punjabi Songs 2021| Latest Punjabi Songs 2021 | New Punjabi Songs 2020| Latest Punjabi Songs 2020Amrit Maan & Bamb Beats Presents Singer : Jigar Feat. Gurlez Akhtar https://instagram.com/jigarofficial13Female Lead : Nikeet Dhillon Music : Desi CrewMix & Master : DenseLyrics : Rony Ajnali & Gill Machrai Composer: Gill MachraiVideo : Savio Sandhu & Yug Special Thanx : Amrit MaanProduced By : Rubal Sidhu , Harinder DhaliwalContact : 98727-27054 , 97800-00871Online Promotion : Being DigitalVideo Team  Outfit By : TrendingThreads By Sukh & JessyMakeup : SurbhiZeenaEdit : Gobindpuria D.O.P : Arundeep Teji Assistant’s : Rajveer Maan & Jazz Maan & Manish Choreoghrapher : Sumit & Shubham Production : V Sign Art : Karma ArtPublicity Design : Impressive Design & Yasheen Ghurial Digital Partner : Being Digitalhttps://instagram.com/being.digitalllatest punjabi songs 2020 , latest punjabi songs 2021 , new punjabi songs 2029 , new punjabi songs 2021 , new punjabi songs , jigar all new songs , desi crew songs , gurlej akhtar songs , 2021 new songs , 2021 latest songs , hit songs 2021 , punjabi all new songs 2020 , punjabi songs , beat songs , bhangra songs , dj songs , duet songs , new punjabi latest songs , viral songs , all new hit punjabi songs 2020 , latest new hit songs 2020 , latest punjabi new songs 2021","3M31S"
"yw-b10oYKuE","Kumkum Bhagya | कुमकुम भाग्य | Wedding Promo | Mon-Fri, 9 PM | Zee TV","2021-01-19T11:00:19Z","UCppHT7SZKKvar4Oc9J4oljQ","Zee TV","24","21.20.01","zee tv|#zeetv|hindi serial|zee hindi shows|hindi shows|#entertainment|#drama|#comedy|#hindiserial|#hindishows|#hindi|#fullepisodes|zee full episodes|hindi full episodes|#onlineshows|zee popular shows|kumkum bhagya|kumkum bhagya today full episode|Best Scene|Promo|Webisode|Latest Episode|Full Episode|Watch Online|HD|Haldi Ceremony|Wedding Promo|Kumkum|kumkum bhagya full episode|kumkum bhagya promo|kumkum bhagya aaj ka episode|kumkum bhagya new promo","1298241","15051","732","861","https://i.ytimg.com/vi/yw-b10oYKuE/default.jpg","False","False","Free Subscription click here : https://bit.ly/SubscribetoZeetv Get notified about our Latest update by Clicking the Bell Icon 🔔Paid Subscription #Zee5 click here: http://www.zee5.com/myaccount/subscription?plid=0-11-1503&utm_source=yt_zeetv&utm_medium=link_desc&utm_campaign=subscription_lpWatch tomorrow’s Premiere Episodes of ZEE TV serials today. Get the best of ZEE5 Originals, popular Alt Balaji shows, 1000+ superhit movies, favourite Zindagi shows, popular kids entertainment, Live TV channels and more.Kumkum Bhagya | कुमकुम भाग्य | Wedding Promo | Mon-Fri, 9 PM | Zee TVTo #Free #Download ZEE5 #Mobile app click the link below -Playstore: http://bit.ly/Zee5PlayStoreiTunes: http://bit.ly/Zee5ITunesConnect with Zee Tv on Social MediaFacebook - http://bit.ly/ZeeTvFBInstagram - http://bit.ly/ZeeTvInstaTwitter  - http://bit.ly/ZeeTVtwitterConnect with Zee5 on Social MediaFacebook : http://bit.ly/Zee5FBInstagram : http://bit.ly/Zee5HindiInstaTwitter : http://bit.ly/Zee5twitter","31S"
"wNG0W45iCHI","India celebrate a win for the ages at the Gabba | Vodafone Test Series 2020-21","2021-01-19T11:12:34Z","UCkBY0aHJP9BwjZLDYxAQrKg","cricket.com.au","17","21.20.01","[none]","8998312","444181","3995","21832","https://i.ytimg.com/vi/wNG0W45iCHI/default.jpg","False","False","Our camera was there as India completed a famous victory at the Gabba to seal a 2-1 series triumph over Australia and ensured the Border-Gavaskar Trophy stays with them.Fixtures, news, videos for the #AUSvIND Tests: https://cricketa.us/AUSvIND-Tests     Follow us on Facebook: https://www.facebook.com/cricketcomau      Follow us on Instagram: https://www.instagram.com/cricketcomau      Follow us on Twitter: https://www.twitter.com/cricketcomau","2M48S"
"JLi21ECy5Mc","ശിവന് അപർണ്ണ ഏടത്തിയുടെ വിശിഷ്ടമായ ഉപദേശം..","2021-01-19T14:00:35Z","UCp_r6Z-Oh0YTf-ym71z5Nqg","Asianet","24","21.20.01","Santhwanam|asianet|asianet serials|malayalam serials|new serial|chippy|Sandwanam|Sandhwanam|Santhwanam serial|Santhwanam asianet serial|Santhwanam hotstar|Santhwanam asianet|Santhwanam Hotstar|Popular serial Santhwanam|Watch Santhwanam Serial|Santhwanam Latest Episode|Santhwanam Full Episode|Santhwanam Serial Online|Chippy|Rajeev Parameshwar","1218067","27555","537","1358","https://i.ytimg.com/vi/JLi21ECy5Mc/default.jpg","False","False","ശിവന് അപർണ്ണ ഏടത്തിയുടെ വിശിഷ്ടമായ ഉപദേശം.. ചിരിയടക്കി ഹരിയും അഞ്ജലിയും..Santhwanam || Episode 105 || 19-01-21 (Watch Full Episode on Disney+ Hotstar)#Santhwanam #Chippy #Asianet #SisterLove #AsianetSerials #MalayalamSerials #RajeevParameshwar #Sreedevi #Shivanjali","1M31S"
"EFU2rbt4-IQ","Bruised, abused but conquered! India stun Australia 2-1. Harsha Bhogle reviews","2021-01-19T12:16:25Z","UCSRQXk5yErn4e14vN76upOw","Cricbuzz","17","21.20.01","Cricket|Live|Cricbuzz|Sports|AUS v IND|Highlights","891152","26638","351","1978","https://i.ytimg.com/vi/EFU2rbt4-IQ/default.jpg","False","False","Team India achieves the improbable, wins the series 2-1 by breaching ‘Fortress’ Gabba! Harsha Bhogle & Adam Collins summarise the 4th Test on #CricbuzzChatter#AUSvIND #RishabhPant #Pujara #Rahane #ShubmanGillWatch more cricket videos - https://www.cricbuzz.com/cricket-videosFor more cricket updates and content - https://www.cricbuzz.com/For more updates on cricket follow us on facebook - https://www.facebook.com/cricbuzz/Follow us on twitter to get cricket related news - https://twitter.com/cricbuzz","38M11S"
"81EFr7P2K5A","Emirates Flight Food is CLASSY - THE BEST AIRLINE - Trip to Dubai!!! | Irfan's View","2021-01-19T09:30:00Z","UCnjU1FHmao9YNfPzE039YTw","Irfan's view","22","21.20.01","dubai|dubai trip|international trip|trip guide|trip advisor|travel vlog|travel|uae|UAE|emirates|Emirates airline|breakfast|flight|dubai airport|airport|muffin|bun|water|omelette|beans|jam|tea|seat comfort|journey|happy","641603","37201","822","2048","https://i.ytimg.com/vi/81EFr7P2K5A/default.jpg","False","False","#Emirates #Dubai #TravelFinally the day has come where I can fulfill my wish. Going to Dubai is my long time wish and I am happy that I am blessed to visit this place. I went through Emirates Flight. Due to Covid situation they have introduced few rules in the Airport. But the check-in was easy for us. Telling about the Emirates flight it was beyond the world, seriously!! I didn't expect this much comfort in a flight, that too in economy class. They offered a very good break fast and it was tasty too. A very big thumbs to the whole team of Emirates as I loved flying.TIMELINE:0:39- Little talk in Waiting hall4:52- Entering Flight7:42- Break Fast16:34- Dubai AirportDubai Teaser: https://youtu.be/dUrSB8CKYUE_______________________________My Gaming Channel - https://www.youtube.com/channel/UCb6vzXTqQkUbErwUzVGq42gWebsite - https://www.irfansview.net/My Gadgets - https://amazon.in/shop/irfansview______________________________Follow me on,Instagram Official - https://www.instagram.com/irfansview.official/Instagram - https://www.instagram.com/irfansview/Facebook - https://www.facebook.com/irfansreview/Twitter - https://twitter.com/md_irfan10________________________________In Association with DIVO - Digital PartnerWebsite   - http://web.divo.in/http://www.Facebook.com/divomovieshttps://Instagram.com/divomovieshttps://Twitter.com/divomovies","22M45S"
"FWKw9mdvS9w","Vakeel Saab Teaser - Pawan Kalyan | Sriram Venu | Thaman S","2021-01-14T12:33:13Z","UCR-uD130PlXKww_J2Q63CMg","Dil Raju","24","21.20.01","vakeel saab|vakeel saab motion poster|pawan kalyan|pawan kalyan next movie|vakeel saab first look|vakeel saab teaser|dil raju|thaman s|vakeel saab latest|vakeel saab telugu|pink telugu|vakeel saab trailer|vakeel saab theatrical trailer|pawan kalyan in vakeel saab","13896807","883785","31464","172790","https://i.ytimg.com/vi/FWKw9mdvS9w/default.jpg","False","False","Power Star #PawanKalyan’s #VakeelSaabTeaser Cast - Pawan Kalyan, Shruti Haasan, Nivetha Thomas, Anjali, Ananya NagallaDirector - Sriram VenuBanners- Sri Venkateswara Creations, Bay View Projects Producers- Raju, ShirishCo-Producer - Harshith ReddyPresenter - BoneyKapoor DOP - P S VinodMusic - Thaman S ‬Production Design - RajeevanEditor - Prawin PudiDialogues - ThiruAction - Ravi Verma‪#VakeelSaab‪#PSPK26Full Telugu Movies - https://goo.gl/buaJpfFollow us on: Twitter: https://twitter.com/SVC_officialFacebook: https://www.facebook.com/DilRajuOfficialFacebook: https://www.facebook.com/SriVenkateswaraCreationsYouTube: http://goo.gl/dwcKmrInstagram: https://www.instagram.com/srivenkateswaracreationsTelegram: https://t.me/SVC_Official","1M2S"
"1OT4CyvXqA8","Looser Will Eat Jolo Chip Challenge | World's Spiciest Chip Challenge","2021-01-17T05:54:25Z","UCTLZ1jlmY-VogpQXng48iKQ","Hungry Birds","27","21.20.01","food challenge india|hungry birds channel|hungry birds travel|hungry birds challenge in hindi|hungry birds challenge new video|hungry birds new video|hungry birds new video 2020|hungry birds new video 2019|hungry birds new show|jolo chip chllenge|looser will eat jolochip challenge|jolo chips challenge🔥|jolo chip eating challenge","2926106","103691","10734","10084","https://i.ytimg.com/vi/1OT4CyvXqA8/default.jpg","False","False","For Latest Updates of Our Life Please FollowInstagram - https://www.instagram.com/the_hungry_birds_official/Facebook = https://www.facebook.com/hungrybirds4 Cast=Sanket,Akshada,Umesh,PritiEdited By=Saurabh SawantDirected By = Umesh,Sanket,PritiBackground Music By -Epidemic Sound#HungryBirds #FoodChallengeIndia #JoloChipChallenge","14M42S"
"Q1cOoT9NGns","Rishabh Pant’s skills allow him to hit the ball at will - Tim Paine","2021-01-19T10:51:44Z","UCSRQXk5yErn4e14vN76upOw","Cricbuzz","17","21.20.01","[none]","897417","11059","374","2008","https://i.ytimg.com/vi/Q1cOoT9NGns/default.jpg","False","False","#TimPaine admits to being outplayed by India after Australia suffered their first defeat at Gabba in three decades and lost the Border Gavaskar Trophy 2-1 to the visitors.#AUSvIND #RishabhPant #GabbaTest #BorderGavaskarTrophy #GabbaWatch more cricket videos - https://www.cricbuzz.com/cricket-videosFor more cricket updates and content - https://www.cricbuzz.com/For more updates on cricket follow us on facebook - https://www.facebook.com/cricbuzz/Follow us on twitter to get cricket related news - https://twitter.com/cricbuzz","6M36S"
"IZDAUcUh4pg","Dice Media | Firsts Season 4 | Web Series | Part 1 | The First Introduction","2021-01-18T09:30:13Z","UCC89oVFqenaffhBoyqxd6qw","Dice Media","24","21.20.01","Firsts|firsts trailer|Dice Media|Dice|Pocket Aces|Filter Copy|Pictures|Films|Dice Creator Network|web series trailer|web series|first romance|pocket aces|love story|firsts season 4|arrange marriage story|arranged marriage|wedding|indian wedding|matchmaking|netflix|girliyapa|tvf|the viral fever|arre|college romance|sony liv|amazon prime|prime video|voot|wedding outfit|tanmay bhatt|carry minati|operation mbbs|little things|trending|rohit saraf","368374","15355","450","332","https://i.ytimg.com/vi/IZDAUcUh4pg/default.jpg","False","False","Can love be arranged? 💑Find out to see if sparks will fly between Kabir and Janhavi ✨ We’re getting butterflies, what about you? 💓🦋Ft. #ShreyaMehta & #RohanKhurana#DiceFirsts4 with love from @cadburydairymilksilk #ScoopIntoChocolateHeavenScoop into chocolate heaven with your Silk Mousse. Get it here: http://bit.ly/SilkXDice PRODUCED BY ADITI SHRIVASTAVA PRODUCED BY ASHWIN SURESHANIRUDH PANDITA DIRECTOR PRANAY MANCHANDA WRITER  BHARAT MISRASHREYA AGARWAL CAST  ROHAN KHURANASHREYA MEHTA SUPPORTING CAST AJAY MEHRADEEPAK KRIPLANIKAVITA WAADHAWANSHITAL ANTANINIDHI SHETTY ASSOCIATE PRODUCER VIDYUTH BHANDARY CREATIVE DIRECTOR RIYA CHHIBBER  SUPERVISING PRODUCER POOJA WAGH DIRECTOR OF PHOTOGRAPHY VAIBHAV LONKAR EXECUTIVE PRODUCER PRACHI JOSHI EDITOR JAICY MATHEW POST PRODUCTION SUPERVISOR PRASHANT OBEROI  DESIGN & ANIMATION BRIJNANDINI JADEJAANUJ DABRAL  MUSIC COMPOSER  HARDIK DESAI  SOUND DESIGN HARSHVARDHAN SINGH CASTING CLOUT  CASTING DIRECTOR  SHRUTI DUTT PRODUCTION DESIGN RUPAL GANDHI COSTUME DESIGN CHAHAT BAWA WARDROBE COURTESY LABELVARSHA6DEGREE.STORE HAIR & MAKE UP  MOHD SHOAIB KHANSUVARNA SHAH PRODUCTION MANAGER JINAL MANDOT PRODUCTION ASSISTANT YOGESH BAJRANG CHIEF ASSISTANT DIRECTOR YASH SHAH 2ND ASSISTANT DIRECTOR YASH BAROT 2ND DOP SONIT BANSAL CAMERA ATTENDANT AADESH SIDDHUSANDEEP PRAJAPATI DRESSMAN YOGENDRA KUMAR SOUND RECORDIST ASHOK TIWARI COLOUR GRADING AJINKYA PANDIT  TRAILER EDITOR PRIYANKA DEY  SUBTITLES ANTARA ANAND SPOT TEAM PRITAM KUMARGOPAL RATHOD POCKET ACES TEAM   CONTENT PRODUCTION RAJKUMAR PATRA  BUSINESS DEVELOPMENT VISHWANATH SHETTYSHEVEETA HEGDEPRIYANKA PADODE SHETHKARISHMA NANDI MARKETINGJOANESCA MACHADOPRITIKA MATHURPULKIT KOCHARSIMRAN LULLA PR ANKITA TULSHYAN DISTRIBUTION SINDHU BISWAL   CONTENT SYNDICATION & PARTNERSHIPS JANAKI AMRITE  FINANCE  KUNAL LAKHARAPRABHAKAR MAURYASHAILESH KINJALESUJEET JAISWAL LEGAL GAYATHRI NAGENDRAAPOORV BHATNAGAR   COPYRIGHT © 2021 POCKET ACES PICTURES PVT. LTD.","4M6S"
"uJ6WU-u4i3w","Mehendi Wale Haath Song |Guru Randhawa |Sanjana S|Sayeed Q, Sachet-Parampara, Arvindr |Bhushan Kumar","2021-01-14T05:29:52Z","UCq-Fj5jknLsUf-MWSy4_brA","T-Series","10","21.20.01","hindi songs|2020 hindi songs|new hindi songs|2020 new songs|tseries|tseries songs|hit songs 2020|bollywood songs|hindi 2020 songs|mehndi wale hath song|guru randhawa new song|mehndi wale hath guru randhawa|mehndi wale hath guru randhawa song|guru randhawa new song 2021|guru randhawa all songs|guru randhawa|guru randhawa songs|mehendi wale haath|guru randhawa mehndi wale hath|sanjana sanghi|guru randhawa hit song|sachet parampara|sachet parampara songs","38984710","1557813","45056","64583","https://i.ytimg.com/vi/uJ6WU-u4i3w/default.jpg","False","False","Gulshan Kumar and T-Series presents Bhushan Kumar's Mehendi Wale Haath a brand new song in the voice of “Guru Randhawa” featuring Sanjana Sanghi lyrics by Sayeed Quadri & music by Sachet-Parampara. ♪Stream the Full Song Here♪ JioSaavn: http://bit.ly/MehendiWaleHaath--JioSaavnSpotify: http://bit.ly/MehendiWaleHaath--SpotifyHungama: http://bit.ly/MehendiWaleHaath--HungamaGaana: http://bit.ly/MehendiWaleHaath--GaanaWynk: http://bit.ly/MehendiWaleHaath--WynkApple Music: http://bit.ly/MehendiWaleHaath--AppleMusicAmazon Prime Music: http://bit.ly/MehendiWaleHaath--AmazonPrimeMusicResso: http://bit.ly/MehendiWaleHaath--RessoiTunes: http://bit.ly/MehendiWaleHaath--iTunesYouTube Music: http://bit.ly/MehendiWaleHaath--YouTubeMusicSong - Mehendi Wale HaathSinger - Guru RandhawaMusic Director - Sachet-ParamparaLyrics - Sayeed QuadriFeaturing - Guru Randhawa, Sanjana SanghiMusic Produced By - Sourav RoyGuitars - RolandShehenai - Omkar DhumalHarmonium - Akhlak HussainMixed & Mastered By - Eric PillaiMusic Supervision - Raj Chanana, Shivam Chanana, Sonal Chawla, Vivin SachdevaDirector :- Arvindr KhairaCreative director/ Steadicam Operator:- Amaninder singh Dop :- Anurag solanki AD’s :- Satnam Singh , Sukhman Sukhu , Jais Sivia Action Director :- VishalChoreography :- Sumit and JohnSupporting AD’s :-  Monty Syan, Karan Maini , Sagar Styling assistant :- Kavleen Editing :- Zipsi Production Head: RichaLine producer- Fateh film production and Sai Films Production Art director :- Karma arts Teaser And Promos- Himanshu MishraGuru Randhawa teamManager - Jassi SinghFitness trainer - Mouyie FitnessHair stylist - Ali KhanMake up Artist - Astha Agarwal Costume - Denish Hamirani_________Enjoy & stay connected with us!👉 Subscribe to T-Series: http://bit.ly/TSeriesYouTube👉 Like us on Facebook: https://www.facebook.com/tseriesmusic👉 Follow us on Twitter: https://twitter.com/tseries👉 Follow us on Instagram: http://bit.ly/InstagramTseries","3M40S"
"AgKtFB_hkcc","AMBANI'S ANTILIA: The Most Expensive House in the World | Reaction by Jaby Koay & Achara Kirk!","2021-01-18T06:30:01Z","UCwV_A5L1hhEVfld6Wbxn3jg","jaby koay","23","21.20.01","anthony alba|jaby koay|jabykoay|jaby|achara kirk|achara|trailer|reaction","448664","26276","755","2813","https://i.ytimg.com/vi/AgKtFB_hkcc/default.jpg","False","False","Intro song by DAVIS'Home' on Youtube:https://www.youtube.com/watch?v=FzGi0d1y3rgYoutube - http://bit.ly/30OK7RRSpotify - https://spoti.fi/2I3vRvEiTunes: https://apple.co/2KnvgYNSoundCloud: https://www.soundcloud.com/unofficialdavisFacebook: https://facebook.com/unofficialdavisTwitter: https://twitter.com/unofficialdavisInstagram: https://www.instagram.com/unofficialdavis___Jamazing Patrons of January: Avijit Singh, Madhan, Bhavya Singh, Sameer, Akash Dhanasekar, Piyush Paliwal, Riju Mahna and Shean Roldhan!Be a patron for Jaby and support more videos like this!http://www.patreon.com/jabykoay___________________________________________________Original Link:https://www.youtube.com/watch?v=IRRByVy8iVU___________________________________________________SOCIAL MEDIA:~ACHARA KIRK~Twitter & Instagram: @AcharaKirkhttp://youtube.com/Achara~JABY KOAY~YouTube, Twitter, Instagram: @jabykoay~VEERENDRA CHOWDARY~Veerendra Chowdary created the opening animation.Twitter: @NameisVeeru~MOOSA RAZA~Moosa Raza created additional background animation.Instagram: @syedraza7Twitter: @MoosaRaza27___________________________________________________Jaby WEST:https://youtube.com/GETJabyJaby ASIA:https://youtube.com/JabyTVJABY KOAY'S SHORT FILMS PLAYLIST:https://www.youtube.com/playlist?list=PL34B19BA788E18384Click here to subscribe and know when the next video drops:http://www.youtube.com/subscription_center?add_user=jabykoayThanks for watching!!!__________________________________________________Credit of my favorite movie reviews song:Highlight Reel Kevin MacLeod (incompetech.com)Licensed under Creative Commons: By Attribution 3.0 Licensehttp://creativecommons.org/licenses/by/3.0/","26M14S"
"XDa9b2AH62Q","Rewind 2020","2021-01-18T14:19:14Z","UCNrlHfYLo7s2eoeKEJiJi3Q","Priyanka Deshpande","10","21.20.01","YoutubeRewind2020|Rewind2020|HappyNewYear|NewYear|2021|Priyanka|Priyanka Deshpande","357927","28456","306","2046","https://i.ytimg.com/vi/XDa9b2AH62Q/default.jpg","False","False","Makkaley.. 2020 is finally over and I am really happy to share my best memories from Youtube with you all. This year, I promise that I will try to upload more often and entertain you all. My Youtube family, I love you! Happy New Year!!MORE VIDEOS ON MY CHANNEL:BFF:https://youtu.be/uneTeHt8sRgTrip to Kerala:https://youtu.be/lnv_imCx5RUBusy Day:https://youtu.be/wdVGQdfjSqkHappy Diwali:https://youtu.be/tepmdBB71AwDiwali Shopping:https://youtu.be/wPI5MfxJRCEHome Alone:https://youtu.be/4UwqqzBKQnMRoom tour:https://youtu.be/mQqr5tpx9cMWhat's in my handbag?https://youtu.be/b_C6_OjepooMy Handbag Collection:https://youtu.be/ta-l_dDirxATrip to Coimbatore:https://youtu.be/uzJXE34UwHULazy Day at Home:https://youtu.be/SBCo5gdOns0Silver Button Unboxing:https://youtu.be/z-d9rA4wHc4My Brother's Wedding: https://youtu.be/xNbJnP2kzAUWedding preparation:https://youtu.be/-HyuANsqfiwMy New Friend:https://youtu.be/QM1T-qio8-g Malai Cake:https://youtu.be/HDm7lCMl1ucRakhi Special:https://youtu.be/asydmO8PP1APaneer Ghee Roast:https://youtu.be/oWUaXKB2V3QSurprise Guest at Home:https://youtu.be/aPcSqSgGjsoEgg Bhejohttps://youtu.be/fYkuIlDSYygNamakku Soru Dhaan Mukkiyamhttps://youtu.be/B6Nps40-7EsMy childhood picshttps://youtu.be/8ZxR7AGtP0MMy skin care routinehttps://youtu.be/4W3M3SIAsIoEasy makeup routinehttps://youtu.be/4WVXmPOsqFk","8M48S"
"oHyxJ5c6aMI","രണ്ടും കല്പിച്ച് അഞ്ജലി.. 😜 വിട്ടുകൊടുക്കാതെ ശിവൻ.. 😝","2021-01-19T03:30:46Z","UCp_r6Z-Oh0YTf-ym71z5Nqg","Asianet","24","21.20.01","Santhwanam|asianet|asianet serials|malayalam serials|new serial|chippy|Sandwanam|Sandhwanam|Santhwanam serial|Santhwanam asianet serial|Santhwanam hotstar|Santhwanam asianet|Santhwanam Hotstar|Popular serial Santhwanam|Watch Santhwanam Serial|Santhwanam Latest Episode|Santhwanam Full Episode|Santhwanam Serial Online|Chippy|Rajeev Parameshwar","1654327","35093","779","1713","https://i.ytimg.com/vi/oHyxJ5c6aMI/default.jpg","False","False","രണ്ടും കല്പിച്ച് അഞ്ജലി.. 😜 വിട്ടുകൊടുക്കാതെ ശിവൻ.. 😝 ഇവരുടെ യുദ്ധം അത്ര പെട്ടെന്നൊന്നും തീരുന്ന മട്ടില്ല 🤣 Santhwanam || Today at 7 PM || Asianet#Santhwanam #Chippy #Asianet #SisterLove #AsianetSerials #MalayalamSerials #RajeevParameshwar #Sreedevi #Shivanjali","50S"
