video_id,title,publishedAt,channelId,channelTitle,categoryId,trending_date,tags,view_count,likes,dislikes,comment_count,thumbnail_link,comments_disabled,ratings_disabled,description,duration
"hg8qflddZrY","HIGHLIGHTS | Barça 2-3 Athletic Club | Spanish Super Cup Final","2021-01-17T23:22:28Z","UC14UlmYlSNiQCBe9Eookf_A","FC Barcelona","17","21.20.01","FC Barcelona|برشلونة،|Fútbol|FUTBOL|soccer|FUTEBOL|Sepakbola|サッカー|كرة القدم|football|FCB|Barça|Sport|Club|Barcelona|CAMP NOU|ter stegen|busquets|messi|goat|leo messi|dembele|lenglet|griezmann|antoine griezmann|yt:cc=on|riqui puig|koeman|trincao|pedri|athletic club|super cup|supercopa|inaki williams|messi sending off|messi red card|griezmann goals|highlights|barça goals|barça final|ucl|goles|resumen|villa|villalibre|final|2021|3-2|expulsión|tarjeta roja|2-3|bilbao","1631046","25295","3230","3264","https://i.ytimg.com/vi/hg8qflddZrY/default.jpg","False","False","Watch the highlights of Barça’s hard fought clash against Athletic Club in the Spanish Super Cup Final at the Estadio de La Cartuja in Seville.SUBSCRIBE NOW:▶ https://www.youtube.com/user/fcbarcelona ⚽ BARÇATV+: http://barca.link/wT1w30qMyQO🌐 Site: http://www.fcbarcelona.com🔵 Facebook: http://www.facebook.com/fcbarcelona🙌 Facebook Supporters: https://www.facebook.com/becomesupporter/fcbarcelona📸 Instagram: http://www.instagram.com/fcbarcelona🐦 Twitter: http://twitter.com/FCBarcelona🎶 Tiktok: https://www.tiktok.com/@fcbarcelona 📱 Viber: http://chats.viber.com/fcbarcelona🛍 Get all official Barça apparel from FC Barcelona's online store: http://barca.link/j8QH30qQh4Y 🔵🔴 #FCBarcelona","2M53S"
"pA7uGfyKGMs","Vellam Official Trailer | Jayasurya | Prajesh Sen | Samyuktha Menon | Bijibal Official","2021-01-15T12:30:11Z","UCQIta0DKrajL3WisaA2KULg","Bijibal Official","1","21.20.01","vellam movie trailer|jayasurya|Prajesh Sen Director|Captain movie director|Jayasurya|Samyuktha Menon|Samyukta Menon|Jayasoorya new movie 2020|oru kuri kandu naam|vellam orukuri|prajesh sen oru kuri|singer viswanathan|marriage song|kallu shap song|Vellam the essential drink|Malayalam film music 2020|Bijibal New release|Bijibal 2020|Bijibal YouTube channel|Vellam movie trailer|Vellam 2021 movie Jayasurya|Vellam movie|vellam trailer","893645","58513","527","3226","https://i.ytimg.com/vi/pA7uGfyKGMs/default.jpg","False","False","Here comes the official Trailer of the movie 'Vellam - The Essential Drink', directed by Prajesh Sen, starring Jayasurya, Samyuktha Menon in lead roles.Cast & Crew :                                                                                                                                                                                                                    Movie : Vellam - The Essential DrinkLead actors : Jayasurya, Samyuktha Menon Directed by : G. Prajesh SenProduced by : Josekutty Madathil, Yadu Krishna, Ranjith ManambarakkattCo Producer : Biju ThoranathelBanner : Friendly Productions LLPDOP : Roby VargheseMusic & BGM : BijibalLyrics : B.K. Hari Narayanan, Nidheesh Nadery, Fouzia AboobakerCo-writers : Vijesh Viswam, Shamsudheen KuttothEditing : Bijith BalaArt : Ajay MangadAction : Mafia SasiCostume Design : Aravind. K. RSound Design : Arun VarmaAudio Mixing : Ajith A GeorgeMake up : Libin Mohanan, Kiran RajChoreography : Sajna NajamProject design : BadushaProduction Controller : Sudharman VallikkunnuChief Associate Director : Gireesh MararAssociate Director : Jibin johnStills : Lebison GopiDesign : Thamir OkeyPRO : A. S. DineshMusic Label : Inlight Creations Digital Partner : Avenir Technology Bodhi Silent Scape's Instagram : http://bit.ly/2kwhhoQBodhi Silent Scape's FB page : http://bit.ly/2lWg3DBFollow Bijibal on Facebook  : http://bit.ly/2lzsZ2j#Vellam_Movie #Jayasurya #Samyuktha_Menon #Prajesh_Sen|| ANTI-PIRACY WARNING ||This content is Copyrighted to INLIGHT CREATIONS.Any unauthorized reproduction, redistribution or re-upload is strictly prohibited. Legal action will be taken against those who violate the copyright of the same","2M6S"
"3b4I6LgiD1c","Kumkum Bhagya | Premiere Episode 1749 Preview - Jan 20 2021 | Before ZEE TV | Hindi TV Serial","2021-01-18T08:30:00Z","UCXOgAl4w-FQero1ERbGHpXQ","ZEE5","24","21.20.01","zee5|web series trailer|zee5 originals|latest web series 2020|zee5 original movies|hindi web series|tamil web series|bengali web series|upcoming movie trailer|ZEE Marathi|ZEE Marathi tv serial|zee telugu|zee telugu serial|zee bangla|zee bangla serial|zee kannada|zee kannada serial|zee tamil|zee tamil serial|zee tv|zee tv serial|And tv|And tv serial|before tv|spoilers|tv show spoilers|tv serial updates","1697826","17966","740","277","https://i.ytimg.com/vi/3b4I6LgiD1c/default.jpg","False","False","Watch tomorrow’s Premiere Episodes of ZEE TV serials today. Get the best of ZEE5 Originals, popular Alt Balaji shows, 1000+ superhit movies, favourite Zindagi shows, popular kids entertainment, Live TV channels and more.Join ZEE5 Club now - https://www.zee5.com/myaccount/subscription?plid=0-11-1503&utm_source=yt&utm_medium=ref&utm_campaign=subscriptionWatch All ZEE5 Originals Here ► http://bit.ly/ZEE5Originals","43S"
"vASieUp47I4","New Car In Haryanvi Family | Rakhi Lohchab |","2021-01-18T11:32:25Z","UCHQ68Wo2u3D-469QmOwRinQ","Rakhi Lohchab","24","21.20.01","Rakhi Lohchab|roadies rising|new car|comedy videos|funny videos|haryanvi family|family content|mummy|papa|beta|haryanvi maa|haryanvi papa|nayi gadi|mere dad ki maruti|haryanvi rituals|dance|2021|trending|haryanvi language|joint family|youtuber|indian youtuber|long drive","122342","11338","169","626","https://i.ytimg.com/vi/vASieUp47I4/default.jpg","False","False","Enjoy and Share this video!#rakhilohchab #newcar #haryanvifamily Contact for advertising and business enquiries :Email: Lohchabrakhi94@gmail.comFacebook: https://www.facebook.com/rakhilohchab94Instagram: https://instagram.com/rakhilohchabofficial?igshid=1eyi0ftugt9zwScheming Weasel (faster version) Kevin MacLeod (incompetech.com)Licensed under Creative Commons: By Attribution 3.0 Licensehttp://creativecommons.org/licenses/by/3.0/Sneaky Snitch Kevin MacLeod (incompetech.com)Licensed under Creative Commons: By Attribution 3.0 Licensehttp://creativecommons.org/licenses/by/3.0/Fluffing a Duck Kevin MacLeod (incompetech.com)Licensed under Creative Commons: By Attribution 3.0 Licensehttp://creativecommons.org/licenses/by/3.0/Manic Polka Kevin MacLeod (incompetech.com)Licensed under Creative Commons: By Attribution 3.0 Licensehttp://creativecommons.org/licenses/by/3.0/","12M14S"
"WLCcfleG7m4","തുറന്നു പറഞ്ഞ് അമൃത നായർ | Interview | Amritha Nair | Kudumba Vilakku","2021-01-16T03:54:39Z","UC37ZFSEeMD8dRbOUFgGTBdw","Rainbow Media","24","21.20.01","kudumba vilakku serial|kudumbavilakku serial|kudumbavilakku latest episode|kudumba vilakku|serial kudumba vilakku|kudumba vilakku serial episode|kudumba vilakku serial malayalam|kudumbavilakku latest episode promo|kudumba vilakku actress|amritha nair interview|asianet serials|zee keralam serial","486083","9543","376","455","https://i.ytimg.com/vi/WLCcfleG7m4/default.jpg","False","False","asianet serial Kudumbavilakku actress Amritha Nair InterviewKudumba vilakku serial actress Amritha Nair InterviewKudumbavilakku || Mon to Fri at 8 PM || Asianet","16M52S"
"ieHuz94ieRI","The Priest | Official Teaser | Mammootty | Manju Warrier | Jofin T Chacko | Nikhila Vimal","2021-01-14T13:30:10Z","UCAAufdrkoIXtfHQI9QE1tzA","Anto Joseph Film Company","24","21.20.01","the priest teaser malayalam|The Priest Movie Teaser|Priest Teaser|Mammootty|Manju Warrier|The Priest New Malayalam Movie|Priest Malayalam Short Film|The Priest|the priest trailer|the priest official trailer|the priest official teaser|mammootty|nikhila vimal|manju warrier|malayalam movie trailer|mammootty movie trailer|priest trailer|priest official trailer","2170981","173497","4461","27209","https://i.ytimg.com/vi/ieHuz94ieRI/default.jpg","False","False","Presenting Teaser Of New Malayalam Movie The Priest Directed By Jofin T Chacko Story & Direction :  Jofin T Chacko Produced By : Anto Joseph , Unnikrishnan B , V N Babu Screen Play & Dialogue : Deepu Pradeep, Shyam MenonDOP : Akhil George Editor : Shameer Muhammed Project Designer : Badhusha N M Music & Background Score : Rahul Raj Sound Design : Jayadevan ChakkadathSound Mixing : Sinoy Joseph Sync Sound : Arun KumarArt Director : Sujith Raghav Make Up : Amal Chandran , George Sebastian Costumes : Praveen VarmaChief  Associate : Baby Panicker Associate Director : Premnath Production Controller : Prasanth NarayananLyrics : Harinarayan B .K Stills : Sinat Sevier Design : Old Monk Opening Titles : Sarathavinu Trailer Cut : Donmax Trailer Score Mix : Harishankar  V ( Mystudio )Trailer Vocals : Baby Niya Charly#ThePriest #Mammootty #ManjuWarrier #NikhilaVimal  Subscribe us : https://bit.ly/2OTiJfyLike Us On Facebook : https://bit.ly/2G2BeLY|| ANTI-PIRACY WARNING || This content is Copyrighted to Anto Joseph Film Company. Any unauthorized reproduction, redistribution or re-upload is strictly prohibited. Legal action will be taken against those who violate the copyright of the same","1M17S"
"JgkcMpIZZU0","Molkki | मोलक्की  | Ep. 46 | Virendra Confronts Purvi","2021-01-19T08:13:23Z","UC55IWqFLDH1Xp7iu1_xknRA","Colors TV","24","21.20.01","colors tv serials all|colors tv promo|colors tv new serial|colors tv naagin|colors tv khatron ke khiladi|bigg boss|hindi shows|कलर्स टीवी|comedy show|horror show|crime show|reality show|Molkki|मोलक्की|Virender|widowed|sold bride|bride for sale|social evil|Haryana|Uttar Pradesh|Purvi|dignity|love|arrange marriage","630318","5341","232","33","https://i.ytimg.com/vi/JgkcMpIZZU0/default.jpg","False","False","Despite her efforts to escape his sight, Purvi ends up being caught by Virendra. Furious, he confronts her for lying to him, cheating his family and children! While Purvi refuses to reveal anything, Virendra asks the police to arrest her! How will Purvi prove her innocence to Virendra? Watch this episode to find out.#ColorsTV #MolkkiTo subscribe this channel go to: http://www.youtube.com/subscription_center?add_user=colorstvTo download the Voot app please click on the link :IOS: https://apps.apple.com/in/app/voot/id1011777157Android: https://play.google.com/store/apps/details?id=com.tv.v18.violaFire TV: https://www.amazon.in/Viacom18-Media-Pvt-Ltd-Originals/dp/B01N2PCGG3/ref=sr_1_1?dchild=1&keywords=voot+tv&qid=1595417708&s=mobile-apps&sr=1-1To go to the show playlist please click: https://www.youtube.com/playlist?list=PLcC6hSpO26KuHOl0qHTVJCjSJRfYXZ9skFollow us on: Facebook: https://www.facebook.com/ColorsTVInstagram: https://www.instagram.com/colorstv/Purvi, a Molkki Dulhan finds herself in an arranged marriage to Virender, a widowed man twice her age and still in love with his dead wife. Soon, she discovers that she has been “sold” by her father and is merely a clause for the inheritance of his uncle’s land. Will she stand up and fight for her dignity? Will her marital deal blossom into a loving relationship? The accuracy, completeness, currency and/or suitability of the above video description is not endorsed by its licensor or broadcaster or the Channel. They shall not be liable for loss and/or damage arising from the video description.","3M1S"
"uEfAaHYBlh0","New Punjabi Songs 2020 - 2021 Lamborghini Official Video | Khan Bhaini | Shipra Goyal Ft. Raj Shoker","2021-01-13T11:30:13Z","UCOo61v1PPAjoN2exxYAzdAw","Single Track Studio","10","21.20.01","Punjabi Songs|Latest Punjabi Songs|Pollywood|Artist|Actor|Actress|Models|Gabru|Sardar|Punjab|Hit|Superhit|Guru Randhawa|Honey Singh|Karan Aujla|Khan Bhaini|Himanshi Khurrana|Shehnaz Gill|Rappers|Rap|Hip Hop|balle balle|DJ|Party|romance|sad|love|best|No 1|number one|viral|2019|2020|2021|trending#1|New Punjabi Songs 2020|New Punjabi Song 2020|this week hit song|last week hit songs|Khan Bhaini New Song|Shipra Goyal|New Punjabi Songs 2021|Trending #1#2#3","14202327","439780","13755","11353","https://i.ytimg.com/vi/uEfAaHYBlh0/default.jpg","False","False","#Lahmborghini  #khanbhainiSingle Track Studios & Sajjan Duhan Presents the official full Song of Khan Bhaini's latest track LAMBORGHINI   New Punjabi Track 2021https://gaana.com/song/lamborghini-51Song : Lamborghini Singer/Lyrics/Composer : Khan Bhaini (https://instagram.com/khanbhaini)Female Vocal : Shipra Goyal Music: SycostyleStaring : Khan Bhaini & Raj ShokerMix & Master : Dense Project By : Jatinder Singh Sohal (https://instagram.com/jatindersingh_40)Director By : Teji SandhuEditor & Colorist : Mr EditorProducer : Sajjan Duhan (https://www.instagram.com/sajjanduhan/)Manage By : Scope Entertainment Online Promotion - Coin digital Management : Sahejpal  SidhuSp.Thanx : Gurpreet khetlaDigital distribution: Coin Digital  Digital Partner – Coin Digital (https://www.instagram.com/coin_digital)Online Promotion – Coin Digital (https://www.instagram.com/coin_digital)  Label :- Single Track StudioFor Digital enquiries:Coin DigitalSnapchat - https://www.snapchat.com/add/coindigital Youtube - https://www.youtube.com/coindigital Facebook - https://www.facebook.com/coindigital73Instagram - https://www.instagram.com/coin_digital Latest Punjabi Songs 2020, Punjabi Songs 2021, New punjabi Songs 2020, New Punjabi Song 2021This Week Punjabi Song 2020 Top 10, Release This Week All Platform ,song,new song 2020-21,song 2020-21,new song,  ,Lamborghini, Single Track Studio,Lamborghini, Single Track StudioEnjoy and stay connected with us!!Follow us http://www.dailymotion.com/smimusicchannelSubscribe for Latest Video ► http://www.youtube.com/user/hawkrecord?sub_confirmation=1Circle us on G+https://plus.google.com/+wesmirecordsLike us on Facebookhttps://www.facebook.com/wesmirecordsFollow ushttps://twitter.com/wesmirecordsEnjoy and stay connected with us!!Follow us http://www.dailymotion.com/smimusicchannelSubscribe for Latest Video ► http://www.youtube.com/user/hawkrecord?sub_confirmation=1Lyrics .... Ae Lamborghini waleya main kehni aanHun ki kehni aanVe Lamborghini waleya main kehni aanTere kamm ne puthe taanMain lad’di rehni aanTu side te gaddi laaVe main na behni aanHo rim car de chamkan balliyeTeri wadh gi kahton dhadkan balliyeHo rakhiyan asle naal botlanDiggi de vich khadkan balliyeJo bina gall to madkan balliyeHo akhan de vich radkan balliyeVe parson di akh fadak rahi aaNi daule jatt de fadkan balliyeAe saade pindan vall hun gall jehi phaili aaBhaini aala Khan taan kehnde vaili aaMummy nu loki kehn ke munda vaili aa oyeSycostyle!Ve milda tainu lad ke ki aaJatt lad’da yaaran karke hi aaVe eh taan tainu yaad nai honaDass phir mainu tadke ki aaHo tadke taan kujh khaas ni balliyeUthan di vi aas ni balliyeVe etki ghardeyan naal milaundeHo birthday tera kaashni ballyeHo happy birthday to youTainu jatt vallon diamond di ring miluAjj jatt vallon suneya ni hona kade tuAjj jatt vallon akheya jau I love youHar vaari karke kehne ve galti pehli aaHo jatti nu laike karda jatta angeli aaVe mere wargi naar da Bombay Delhi aaHo na jane khane naal na ladeya kar tuHo fikar na jattiye kareya kar tuEh next week ghar wali aa juGhare time naal wadeya kar tuJo lagne ghar ton bahar aa balliyeAahi taan din char aa balliyeVe main responsibility teriHo chakkan nu jatt tyaar aa balliyeOk listen to me baby baitho tussi car chMain milke Teji nu bas aaya minute char chNi kari involve na bhaiyan de pyar chNi aithe hi sabar bas hai ni tere yaar chTu kismat de vich likheya te katni paini aanHo fame paisa te car sada na rehni aanJinna chir jyonde yaar na tension laini aan","3M26S"
"5WxeKd_ZXKs","అమ్మ కుక్క కావాలి #3 | Amma Kukka Kavaali | Kannayya Videos | Trends adda","2021-01-15T02:59:10Z","UCDPW9ja3woKjP82QOwoTNEA","Trends Adda","23","21.20.01","Trends adda|Kannayya|Amma kukka kavaali 3|Kukka|Dog|Kannayya Videos|Kannayya Dog|Kanhaiya|Kanhaiya Videos|Kanhaiya Dog videos|Kannaiya|Kannaiya Videos|Kannaiya Dog|Kanhaiah|Kanhaiah Videos|Village dog|Village Dog Videos|Comedy dog videos|Kanni videos|Kanni Dog videos|Kukka kavaali|Kanhaiyah|Khannaiya|Khanhaiya|Trends|Adda|Gangavva|Kanni family videos|Amma Dog Kavaali|Kannaya|Kannaya Videos|Dog short films|Dog videos|Dog comedy|Kukka videos","2607174","16640","4870","0","https://i.ytimg.com/vi/5WxeKd_ZXKs/default.jpg","True","False","నమస్కారం అందరికి మా గ్రామం చెర్లకొండాపూర్ . మా గ్రామంలో ఉన్న యువకులం మరియు మా అమ్మ గుల్లపతమ్మ తో కలిసి అందరిని అలరించటానికి ఈ ఛానల్ ద్వార మీ ముందుకు వచ్చాము మీరు సబ్స్క్రయిబ్ చేసి మాకు సప్పోర్ట్ గ ఉండగలరు ఇట్లు ట్రెండ్స్ అడ్డా టీంమీ మనల వెంకటేష్మీ దగ్గర ఎమన్నా స్టోరీ లు ఉంటె మాకు కామెంట్ ద్వారా తెలుపగలరు ధన్యవాదాలుFacebook fanpage: https://www.facebook.com/Trends-Adda-..Morevideos: https://www.youtube.com/channel/UCDPW...our location :Trends AddaVillage : CherlaKondapoor Mandal : RaikalDist : Jagityal (Karimnagar)State : Telangana Pincode : 505460cell number : 9705-002-003( Whatsapp only","10M34S"
"_MymAVMn8g4","Taarak Mehta Ka Ooltah Chashmah - Episode 584 - Full Episode","2021-01-18T14:30:02Z","UC6-F5tO8uklgE9Zy8IvbdFw","Sony SAB","24","21.20.01","तारक मेहता|Ooltah Chashmah|sab tv channel|sab tv serials|taarak mehta latest episodes|taarak mehta ka ooltah chashmah|hindi comedy show|sab tv funny show|taarak mehta ka ulta chashma|taarak new episode|hindi tv serial|ulta chashma|tarak mehta ka ultah chashma|taarak full episode|jethalal|babita|taarak|champak chacha|anjali bhabhi|bhide|iyer|tapu sena|comedy show|jethalal funny|navratri in gokuldham|navratri special in taarak mehta|taarak mehta 584","1481457","14614","1677","374","https://i.ytimg.com/vi/_MymAVMn8g4/default.jpg","False","False","Click here to Subscribe to SAB TV Channel: https://www.youtube.com/user/sabtv?sub_confirmation=1Click to watch all the episodes of Taarak Mehta Ka Ooltah Chashmah https://www.youtube.com/playlist?list=PL6Rtnh6YJK7Zfu1x9Bd1UqLwUxhZ1oBJhThe show is inspired by the famous humorous column 'Duniya Ne Undha Chasma' written by the eminent Gujarati writer Mr. Tarak Mehta. This story evolves around happenings in Gokuldham Co-operative Society and covers topical issues that are socially relevant. The show predominantly - Promoolves around 'Jethalaal' (Dilip Joshi) who is an uneducated Gujarati businessman. Your 'Taarak Mehta' (Sailesh Lodha), is his neighbor. 'Jethalaal' finds a friend and philosopher in 'Taarak Mehta' and often goes to him for advice whenever he is in trouble. Jethalaal's family includes his simpleton wife 'Daya Ben' (Disha Wakani) and a mischievous son 'Tapu' (Bhavya Gandhi). Tapu is a menace and a constant source of trouble to all the members of Gokuldham. They have often warned 'Jethalaal' to reform 'Tapu' or else be prepared to leave the premises. Lost hopes of being heard by his son push Jethalaal' to call his father 'Champaklal' (Amit Bhatt) from the village. This was his great idea of leashing some control over the mischievous Tapu. The opposite happens and the grandfather joins hands with the grandson to make life a roller coaster troublesome ride for Jethalaal.","20M24S"
"S1hVzhSgxWU","Poongaatru Puthithaanathu #NakkalitesFzone","2021-01-15T11:30:13Z","UCpnJuQkNm9j9R7LCqWtf56g","Nakkalites FZone","23","21.20.01","nakkalites|nakkalites fzone|nakkalites in tamil|nakkalites latest|nakkalites f zone|fzone nakkalites|f zone nakkalites|#nakkalitesfzone|nakkalites new episode|#nakkalites|f zone|fzone|nakkalites fzone in tamil|nakkalites new video|nakkalites channel|nakkalites video|nakkalites tamil|nakalities|nakkalites girls version|nakkallites|tamil comedy|tamil creators|nakkalites nakkalites|tamil web series|nakkalites fzone comedy|web series tamil","709608","32794","712","1711","https://i.ytimg.com/vi/S1hVzhSgxWU/default.jpg","False","False","This is a cute story portraying the bond between three siblings. Watch to experience their fun-filled and emotional moments.#NakkalitesFzone #Fzone #Nakkalites*****************************For Advertisement Please Contact - business@nakkalites.inDirectionSarath Script Elackia  Cinematography & DISainathEditingSundar SNDRLive Sound KumbeshSound DesignJothiAsst.cinematographyYogaAsst.DirectorGowthamDesignelankavinProduction ManagerDaniel SolomonCastNivedithaSmruthiSavithriVaidheeswariShivan MoorthiGowthamAneessh SivashanmugamKumbeshThanks ToVijayaScript HeadPrasanna BalachandranCreative HeadRajeshwar**********************************************************In Association with DIVO - Digital Partnerhttp://www.Facebook.com/divomovieshttps://Twitter.com/divomovieshttps://Instagram.com/divomovies","13M18S"
"mqMP11-4ceQ","Wish - Haan Karde Meri Moto | Dance Video | Diler Kharkiya","2021-01-17T11:24:10Z","UCi5g2Y4keAkIkEt8YvR5JoA","Nritya Performance","24","21.20.01","govind|mittal|nritya performance|nritya performance new dance video|wish song dance|wish song dance video|govind mittal dance|haryanvi dance haryanavi|haryanvi dance songs haryanavi|haryanvi dance 2020 haryana|renuka panwar dance|renuka panwar song|haan karde meri moto rakho raji raji re|haan karde meri moto dance video|haan karde meri moto dance|diler|diler kharkiya new song|diler kharkiya song|bollywood dance|bollywood dance workout|bollywood dance songs|np","262027","12171","457","776","https://i.ytimg.com/vi/mqMP11-4ceQ/default.jpg","False","False","Nritya Performance Present A Haryanvi Dance Video On Song #Wish #HaanKardeMeriMoto #DilerKharkiya #GinniKapoor #HaryanviSong​ #NrityaPerformance #Govindmittal #HaryanviDanceChoreography By Govind Mittal Cover By :- Govind Mittal                    Sneha SavitaDance Tutorial Step By Stephttps://youtu.be/p_OuaLZUaeo52 Gaj Ka Dance Tutorialhttps://youtu.be/lp5l78JIBLECoca Cola Dance Tutorialhttps://youtu.be/MOdJOiSaZwUHey Guys Plz Follow My Page On Instagramhttps://www.instagram.com/my_name_is_govind_/Song Credit -Title: WishSinger: Diler KharkiyaStarring: Diler Kharkiya & Ginni KapoorLyrics: Gulshan Baba JiMusic: Aman JajiProducer: Sumeet SinghDirector: Amarpreet G S ChhabraLabel: #SagaMusic​DOP: Prashant DandekarChoreographer: Richard BurtonAsst. Choreographer: UD & Urvashi ChauhanEditor: Harmeet S KalraAsst. Director: Vishal KathpalVisual Effects By: Sriniwas Rao & Gaurvendra SinghDress Designer: Noor AroraArt Director: Natasha GaubaArtist Co-ord: Harneet Dhillon MinhasEP: Sunil Sharma & Himanshu PrakashMakeup: Karan MakeoverProduction: Ishant Grover, Puneet Kudhaal, Baljinder Singh","2M29S"
"TMOCYg7vaqw","Just look at her🥺💕| #Karishmatanna #Ritwikbhowmik @Sony Music India","2021-01-16T10:02:55Z","UCJr0CA3SV4QkdTbwuC4O0pA","Anirudh Sharma","24","21.20.01","[none]","818767","30874","1344","411","https://i.ytimg.com/vi/TMOCYg7vaqw/default.jpg","False","False","Hey❤️My new YouTube shorts is here❤️Do like, share and comment ✨Hang on to my other social media❤️MY INSTAGRAM- https://instagram.com/anirudhh_sharma?igshid=1xlj6ojehywveSNAPCHAT👻- looklikemagic","16S"
"0E5tq6wwJqw","my brain is out","2021-01-18T15:12:27Z","UCx6F-rETGiz7xf_vkMmX2yQ","Mythpat","20","21.20.01","brain out mythpat|brain out funny|mythpat funny|brain game","3508295","484730","8437","37591","https://i.ytimg.com/vi/0E5tq6wwJqw/default.jpg","False","False","Today we play Brain out with brain outinstagram - https://www.instagram.com/mythpatAll songs by Kevin MacLeod (incompetech.com)Licensed under Creative Commons: By Attribution 3.0 Licensehttp://creativecommons.org/licenses/by/3.0/","6M15S"
"K7BMF0ozFS0","[TinyTAN | ANIMATION] - Dream ON","2021-01-15T14:57:12Z","UCLkAepWjdylmXSltofFvsYQ","BANGTANTV","10","21.20.01","방탄소년단|BTS|BANGTAN|HIPHOP|알엠|RM|슈가|SUGA|제이홉|jhope|지민|JIMIN|정국|JUNGKOOK|JIN","16126996","2781847","18220","171277","https://i.ytimg.com/vi/K7BMF0ozFS0/default.jpg","False","False","Keep your Dream ON, it will make a happier tomorrowTinyTAN inspired by BTShttps://twitter.com/TinyTANofficialCreative : Big Hit IP  Director : Moohyun Jang Chief Producer : Sejung Ha Producer : Yoon A Ko CG Supervisor : Min Kyu Lee  Line Producer : Soohyun Lee, Jeayoon Lee Assistant Director / Editor : Gyungjin Kim Storyboards : Ha Yan Park  Production Design Lead: Kibin Kim Character Design : Hye Lim Chun, Yeobeen Yun Set / Prop Design : Sugeun Eom, Yeobeen Yun, Sungho Lee, Youngjun Jeon, Juhyeon Han, Rosa GiHun HoungColor Keys: Minjeong Choe Matte Painting: Hyoju Ban, Rosa GiHun Houng  Modeling / Look Development Leads : Youngsam Kim, Yeree Kim, Hyunsub Kim, Hongseok Kim Layout / Animation Leads : Joongho Kum, Sunghee Cho, Sohyun Cho Character TD (Rig / Chr. FX) : Hun Back, Mina Choi FX: Jae Lyun LeeLighting / Compositing Leads: Jung Sun Kim, Ji Sub Park, Seo Hyun Jang, Hannah Jang, Seonil Hong Pipeline TD : Jonghwan Moon, Sangjin Lee  Co-production : Goldframe / 302Planet / Lennon / Primetime Music#TinyTAN #타이니탄","3M15S"
