video_id,title,publishedAt,channelId,channelTitle,categoryId,trending_date,tags,view_count,likes,dislikes,comment_count,thumbnail_link,comments_disabled,ratings_disabled,description
"8QcmHXWUoVc","【ホテル飲み】ロケ前日のリアルなADバッグの中身をご紹介！【ADの晩酌】","2020-10-17T10:00:03Z","UCuIXSjuuhsN_ZmL8cFcyAzw","サイボーグAD飯岡チャンネル","24","20.18.10","サイボーグad飯岡|ad|ad飯岡|ビール|晩酌|酒|サイボーグad|酒飲み|飲み|飯岡|ひとり呑み 女|酒飲み ユーチューバー女|1人飲み|adの晩酌|ハイボール|三井ガーデンホテル|ホテル飲み|ADバッグ|蒙古タンメン|ホテル","215064","3033","97","435","https://i.ytimg.com/vi/8QcmHXWUoVc/default.jpg","False","False","前乗りの際でもいつもお酒を飲んでます。普段は7000円くらいのホテルですが、Go TOトラベルキャンペーンでいつもより良いホテルに泊まれました。三井ガーデンホテル名古屋プレミアは夜景も良いですが、朝焼けがとても綺麗でした。ADバッグの中身は、ロケや収録によって毎回変わります。ご視聴宜しくお願い致します。#サイボーグAD飯岡　#晩酌　#飲み▼Twitterhttps://twitter.com/cyborg_iioka▼Instagramhttps://www.instagram.com/cyborg_iioka/...▼TikTokhttps://vt.tiktok.com/ZS5Dwt2g/▼贈り物等の宛先〒106-6131東京都港区六本木6-10-1六本木ヒルズ森タワー31F「サイボーグAD飯岡チャンネル」宛▼お仕事のご依頼はこちらまでinfo.cyborg.iioka@gmail.com"
"w5VHObSq-2s","【まさかの事態に】戎岡彰が沈黙を破り 一期生に斬りかかる！一期生にどうしても伝えたかった事とは…？","2020-10-17T12:00:09Z","UCHGYAdPGQAPAydcmkJ8hiKw","亀田史郎チャンネル","24","20.18.10","[none]","498992","3978","303","723","https://i.ytimg.com/vi/w5VHObSq-2s/default.jpg","False","False","いつも動画見てくれてありがとうございます！「3150ファイトクラブ / 第十二話」「一期生はまだまだ甘い」と現状の緊張感がないファイトクラブに警鐘を鳴らす男、戎岡彰。３１５０ファイトクラブ設立からその成長を見守って来た男が遂にその沈黙を破った。あの辰吉丈一郎と共に高みを目指し世界をその目で、拳で見て来た戎岡の思惑とは？いよいよ次回、脱落者が決まるが一体誰が落ちてしまうのか…。▼番組HPはこちらhttps://sangou.tokyo/kameda3150club- CAST -亀田史郎戎岡 彰- STAFF -ディレクター / 菊田参号  撮影編集 / Kawanavox ナレーション / 宮倉佳也 Web / 田中しおり 営業マネージャー / 中村慶寿【お問い合わせ】3150ファイトクラブ運営事務局 / info@sangou.tokyo"
"9gNOQaE5Vcc","新居ちゃんの購入品紹介‪✌︎","2020-10-17T11:00:02Z","UC7S0xhrVe5H5VGnQylAyKng","＠小豆","26","20.18.10","@小豆|小豆|あーずー|小豆ちゃん|ENG|vlog|ASMR|ブイログ|ヴィログ","166868","10345","89","867","https://i.ytimg.com/vi/9gNOQaE5Vcc/default.jpg","False","False","こんにちは、@小豆です。最近引越しをしました！かぶさん、これで沢山走れるね(TT)🐕オススメの日用品や家具ブランド？があれば教えてください〜◎twitter : https://twitter.com/azukin_tokiinstagram : https://www.instagram.com/pkpk_azsTik Tok : https://vt.tiktok.com/Uw9AJQ/Mildom : https://m.mildom.com/room/10904306┈┈┈┈┈┈┈┈┈┈┈┈┈┈┈┈┈┈┈┈˗ˋˏ  お洋服  ˎˊ˗tops : TINTINbottom : usedお手伝いくまちゃんかぶあずはうすのみんなご協力ありがとうございました💐musicvery good man : wonderfdul pianohttps://creators.uuum.jp/material/search/audio/2195◆本動画内の音楽については、DOVA-SYNDROMEの許可を頂いております。wonderfdul piano / very good man┈┈┈┈┈┈┈┈┈┈┈┈┈┈┈┈┈┈┈┈ファンレター・お仕事のご依頼はこちら〒107-6228 東京都港区赤坂 9-7-1 六本木ミッドタウン・タワー 28階UUUM株式会社　@小豆宛┈┈┈┈┈┈┈┈┈┈┈┈┈┈┈┈┈┈┈┈"
"Rsib98ce2UM","陣内智則【ニュース番組】","2020-10-17T09:00:05Z","UCCp9Q2JCLjOenDa63FJi_Ag","陣内智則のネタジン","23","20.18.10","陣内智則|ネタ動画|芸人|よしもと|ニュース|生放送","360787","7492","202","610","https://i.ytimg.com/vi/Rsib98ce2UM/default.jpg","False","False","ニュースの生放送を任されたディレクター陣内。失敗が許されない生放送だが様々なトラブルが発生。最後まで無事放送することはできるのか？#ニュース #生放送 #ネタジン YouTubeチャンネル【陣内智則のネタジン 】毎週水曜日は時間未定で配信！毎週土曜日は１８時ネタ動画配信！！◼️陣内智則Twitterhttps://twitter.com/jinnai_tomonori?lang=ja"
"vvXG_CsmeHE","【浦島坂田船歌ってみたツアー】曼珠沙華 - Cover / センラ","2020-10-17T09:45:05Z","UCGQg0ZjM_QQ2jvUd5j9Fp-Q","センラちゃんねる","10","20.18.10","センラ|SENRA|浦島坂田船|まふまふ|歌い手|歌ってみた|ニコニコ動画|utaite|utattemita|niconico|nicovideo|VOCALOID|初音ミク|Miku Hatsune|音楽|music|オリジナル曲|アニメ|中国|中華|中国風|mafumafu|まんじゅしゃげ|曼珠沙華|manjusyage|彼岸花","123928","21249","38","1148","https://i.ytimg.com/vi/vvXG_CsmeHE/default.jpg","False","False","你好おめでと～！（1日早い）原曲様:https://youtu.be/r_0HBRb8Uqs僭越ながら動画もお借りしました。■mix&Mastering / 牧内シンジ：@msmusicjapan■SpecialThanks / まふまふ：https://twitter.com/uni_mafumafu■SpecialThanks / うぃんぐ：https://twitter.com/wing_10センラ 　Twitter | https://twitter.com/sen_sen_sen_senセンラ 　Instagram | https://www.instagram.com/senra_snrセンラ　Twit Casting | https://twitcasting.tv/sen_sen_sen_senセンラ　公式LINE | https://page.line.me/senra_line"
"iVLjo0VHQsU","半妖の夜叉姫｜4話「過去への扉」｜予告","2020-10-17T09:00:24Z","UCmDLyFjSutfb1MK7F6cMVSA","サンライズ","1","20.18.10","半妖の夜叉姫|日暮とわ|とわ|もろは|せつな|松本沙羅|小松未可子|田所あずさ|半妖|夜叉姫|犬夜叉|かごめ|山口勝平|殺生丸|弥勒|珊瑚|yashahime|Princess Half-Demon","110885","0","0","0","https://i.ytimg.com/vi/iVLjo0VHQsU/default.jpg","True","True","第4話「過去への扉」あらすじ：せつなの記憶を取り戻すため、戦国時代へ戻る決意をするとわ。もろはは時代樹の力を取り込んだ根の首を欺し過去と繋ぐ通路を開かせる。そこに現れたのは一人の巫女だった。『半妖の夜叉姫』は、読売テレビ・日本テレビ系毎週土曜夕方5時30分～放送中！※一部地域を除く★★『半妖の夜叉姫』最新情報はこちら★★公式Twitterhttps://twitter.com/hanyo_yashahime公式サイトhttp://hanyo-yashahime.com/©高橋留美子／小学館・読売テレビ・サンライズ 2020"
"DkuDJ84Xm4g","【ホラー】過去の忘れていた記憶を思い出せるガチャに出会えたら・・・【peep】【寸劇】","2020-10-16T07:00:01Z","UC6VSFaHYbR-bhNer7DXxGNQ","ボンボンTV","26","20.18.10","ボンボン|BOMBOM|TV|チャンネル|番組|コミック|講談社|うーむ|ウーム|uuum|UUUM|よっち|ヨッチ|YOCCHI|yocchi|実験|あっちそっちよっち|えっちゃん|エッチャン|小河悦子|オガワエツコ|DIY|可愛い|ってみた|検証|りっちゃん|リッチャン|りっつ|ぐっぴん|リョウケン|りょうけん|どみちゃん|いっちー|なる|いちなる|peep|学校|ホラー|都市伝説|怖い話|殺人|強盗|ガチャガチャ|ガチャ|記憶キャッチャー|記憶","578320","5730","529","339","https://i.ytimg.com/vi/DkuDJ84Xm4g/default.jpg","False","False","・講談社コミックプラスhttps://news.kodansha.co.jp/8328・Amazonリンク（自殺投票）https://www.amazon.co.jp/gp/product/4065190711・peepリンクhttps://peep.jp・peep TVリンクhttps://www.youtube.com/channel/UCWrEMNi6Pg6bnNLX4SiP9PA※この撮影は消毒・換気を徹底して行っております。▽私たちに実験・検証して欲しいネタはこちらのフォームで送って下さい！https://docs.google.com/forms/d/e/1FAIpQLSdnIpclf6UGCcSOR_Z3d4ugWIbkQgYpcgWGCnmh3G4aa4tbFQ/viewformどみちゃんです！今回はDr.peepさんの「記憶キャッチャー」をガチャに変えて寸劇させていただきました！あなたにも子供の頃の忘れている大切な記憶があるかもしれない・・・！【この動画を見た人にオススメの動画！】▽【ホラー学園】付き合ったら死ぬ...伝染する彼女【peep】https://youtu.be/wFOLic4Wfs0▽【ホラー学園】アンタなんかいらない...友達売買-バイバイ-【peep】https://youtu.be/ni78yVqpNxA▽【ホラー】もしも嫌いな人を消せるカードがあったら、、、未来カードを寸劇で再現してみた！【peep】https://youtu.be/2smWqbFmrf4▽【ホラー】あなたには命を賭けれる友達はいますか・・・？【peep】【寸劇】https://youtu.be/8B4NgneQe-U◎更新がすぐわかる公式ツイッター https://twitter.com/bom2tv◎公式サイト http://bom2.tv◎公式Facebook https://www.facebook.com/bom2tvコミック【ボンボンTVのユーチューバーな日常】第１巻が無料で読めます！　https://comic.pixiv.net/works/3695ボンボンファミリーのツイッターアカウントはコチラよっち：https://twitter.com/yocchi5810えっちゃん：https://twitter.com/ecchan_bom2りっちゃん：https://twitter.com/ricchan_96どみちゃん：https://twitter.com/dmchan_bom2いっちー：https://twitter.com/kato_ichikaなる：https://twitter.com/kin_1122_ぐっぴん：https://twitter.com/guppin_pizzaリョウケン：http://bit.ly/32ofgf2■ボンボンTVの日常（サブチャンネル）https://youtu.be/sQxRZ1wjm-0■いちなるTVhttps://www.youtube.com/channel/UCFRbBdmVBHA7PeAuctRx1rQ/■えっちゃんねる/悦子https://youtu.be/5SCmJ7-vgI0■りっちゃんの個人チャンネルhttps://www.youtube.com/channel/UCQM1cEQpq2_593GHCPZGo-Q"
"dVH8RYnH_A4","「炭火の魔力」7話後編 | 美味しんぼ | [ENG sub]","2020-10-16T09:30:03Z","UCeyC9t-tByuko20fzMwXr4w","美味しんぼ 公式チャンネル【デジタルリマスター版】","22","20.18.10","[none]","331394","1830","101","694","https://i.ytimg.com/vi/dVH8RYnH_A4/default.jpg","False","False","▼美味しんぼ 公式チャンネル【デジタルリマスター版】登録はこちらhttps://www.youtube.com/channel/UCeyC9t-tByuko20fzMwXr4w?sub_confirmation=1#美味しんぼ #oishinbo #JapaneseCuisine＊＊＊あらすじ＊＊＊鰻の老舗「筏屋」も質より量重視でガス調理を。板前の金三だけがかたくなにガスで焼くことを拒んだが主人・木元は耳を貸さない。中松警部の協力で炭火調理の店を出した板前金三の心意気。＊＊＊作品概要＊＊＊ 東西新聞文化部の記者である山岡士郎と栗田ゆう子は、同社創立100周年記念事業として「究極のメニュー」作りに取り組むことになった。しかし、ライバル紙の帝都新聞が、美食倶楽部を主宰する海原雄山の監修により「至高のメニュー」という企画を立ち上げた。ここに「究極」対「至高」の、海原雄山と山岡士郎の間で繰り広げられる、料理を通じた親子対決が始まる！！＊＊＊美味しんぼ情報＊＊＊▼公式Twitterhttps://twitter.com/oishinbo_ch▼公開中のエピソードhttps://www.youtube.com/playlist?list=PLwibXpeALNjDcDwfDDmra6xRsIIYvsST6▼人気のエピソード https://www.youtube.com/playlist?list=PLwibXpeALNjDebo_P4E955OE7D6ZNKwgd＜ﾃﾞｼﾞﾀﾙﾘﾏｽﾀｰ版Blu-ray&DVD [BOX3]&ｵﾘｼﾞﾅﾙ･ｻｳﾝﾄﾞﾄﾗｯｸ･『ｱﾝﾃｨﾊﾟｽﾄ』17年6月21日同時発売!! ＞http://www.vap.co.jp/oishimbo/「炭火の魔力」7話後編 | 美味しんぼ | [ENG sub]https://youtu.be/dVH8RYnH_A4美味しんぼ 公式チャンネル【デジタルリマスター版】https://www.youtube.com/channel/UCeyC9t-tByuko20fzMwXr4w/©雁屋哲・花咲アキラ・小学館/シンエイ動画"
"2M3jN5VTsIY","ONE OK ROCK - Wasted Nights [Official Video from EYE OF THE STORM JAPAN TOUR]","2020-10-16T03:00:01Z","UCzycs8MqvIY4nXWwS-v4J9g","ONE OK ROCK","10","20.18.10","ONE OK ROCK|ワンオク|ワンオクロック|Taka|Toru|Ryota|Tomoya|バンド|OOR|ロック|Japan|J-Rock|rock band|Japanese Band","565144","47040","165","2067","https://i.ytimg.com/vi/2M3jN5VTsIY/default.jpg","False","False","The live DVD & Blu-ray is available for pre-order so get it now!LIVE DVD & Blu-ray EYE OF THE STORM JAPAN TOURRelease Date: 2020.10.28Product Number: [DVD] AZBS-1059 / [Blu-ray] AZXS-1033 Get it here: https://www.asmart.jp/oneokrock_store_ProductList.aspx?shop=0&cat=100112150&swrd=&sort=3&img=2&dcnt=12&search_kbn=&price_from=&price_to=&filter_new=&filter_reserve=&filter_privilege=&filter_fc=&saleable_kbn=0&genre=&sign=&campaign=&cicon=&filter_lmart=False&catg=Director: Naoto AmazutsumiFollow ONE OK ROCK on...Facebook: https://www.facebook.com/ONEOKROCK/Instagram: https://www.instagram.com/oneokrockofficial/Twitter: https://twitter.com/ONEOKROCK_japanMore to follow...Taka: https://www.instagram.com/10969taka/Toru: https://www.instagram.com/toru_10969/Ryota: https://www.instagram.com/ryota_0809/Tomoya: https://www.instagram.com/tomo_10969/Official Website: https://www.oneokrock.com/Official Web Store: https://www.asmart.jp/oneokrock_store_ProductList.aspx?shop=0&cat=100112&dcnt=12"
"-rI9klFwez8","SoftBank｜嵐 SNS「iPhone 12 Pro 登場②」篇","2020-10-16T11:59:54Z","UCcMKfz1n6L6erIlyyowlOOA","ソフトバンク（SoftBank）","19","20.18.10","[none]","139154","6639","83","0","https://i.ytimg.com/vi/-rI9klFwez8/default.jpg","True","False","さぁ、iPhone 12 Proを手に入れよう。初めての5GのiPhone Pro、予約受付中。  iPhone 12 Pro、iPhone 12の購入はこちら！https://www.softbank.jp/mobile/iphone/ ■□■━━━━━━━━━━━━━━━━━━━━━━━━見たこともない世界を見せたい嵐と、見たこともない世界を作りたいSoftBank。今、その両者が手を組む。5G LAB。あなたは、5Gを通して、これまでにない嵐を体感し、これまでにない世界を目撃することになるだろう。夢なら、嵐と一緒に叶えたほうが楽しい。誰も見たことのない世界へ、一緒に。SoftBank｜嵐━━━━━━━━━━━━━━━━━━━━━━━━■□■"
"nVTjPm1W1fk","マイクで声は変わるのか！？検証してみた！！！800円→1万円【にじさんじ/でびでび・でびる】","2020-10-16T13:36:36Z","UCjlmCrq4TP1I4xguOtJ-31w","でびでび・でびる","24","20.18.10","でびでび・でびる|debidebidebiru|ケモノ|furry|にじさんじ|nijisanji|Vtuber|anime|japan|切り抜き|雑談|game|asmr","194986","8131","131","242","https://i.ytimg.com/vi/nVTjPm1W1fk/default.jpg","False","False","800円マイクをついに卒業！？マイクによって声は変わって聞こえるといいますが……いったいどんな風に聞こえるでしょうか！？@Fairys Channel @グウェル・オス・ガール / Gwelu Os Gar 【にじさんじ】 @さなちゃんねる @加賀美 ハヤト/Hayato Kagami @樋口楓【にじさんじ所属】 @ジョー・力一 Joe Rikiichi でびる様のメンバーになると、素敵なスタンプ、限定配信やコミュニティの投稿がみれますよっ！先行で何かを見せてくださったりします♪ ぜひご登録をお願いします。👿♪メンバー登録はこちらです♪👿https://www.youtube.com/channel/UCjlmCrq4TP1I4xguOtJ-31w/join※スーパーチャットについて※でびる様は、スーパーチャットに反応されることもございますがゲーム中、コラボ中など総てに対応できるわけではございません。ご了承ください。でびる様は後ほどすべてのスーパーチャットを確認されていらっしゃいます。いつも、崇拝、応援をありがとうございます。🚪👿おそろしいついったー……https://twitter.com/debidebiru_sama🚪👿放送用タグ#でびでびるなま🚪👿でびる様デザイングッズ沢山てにいれて、でびる様の崇拝を高めよう！👿新作👿🚪👿白ロゴThttps://nijisanji.booth.pm/items/2122513🚪👿オリジナル心臓T🚪👿紋章アクリルキーホルダーhttps://nijisanji.booth.pm/items/2122511👿大人気すぎてずっと売ってるグッズ👿↓あくまのサコッシュ↓https://nijisanji.booth.pm/items/1271917↓あくまのスマホケース↓androidhttps://t.co/5mbb9fYhQZ?amp=1iPhonehttps://t.co/KaE1N2Jm9Q?amp=1↓あくまのクッションカバー↓https://booth.pm/ja/items/1271914↓でびる様の紋章入りマグカップ↓https://nijisanji.booth.pm/items/1180146おそろしいあくまへのてがみまた、ささげもののあてさき……〒101-0022　東京都千代田区神田練塀町300番地　住友不動産秋葉原駅前ビル10F　いちから株式会社  　でびでび・でびる様#にじさんじ"
"1A2nLSC6Z98","【盛れた！】ピューロランド行くから気合い入れてメイクしよっと☆【推しメイク】","2020-10-15T09:30:01Z","UC2656chrY5MdTQO2_II7yRg","まあたその「ほぼメインチャンネル」","22","20.18.10","[none]","998483","25984","965","1559","https://i.ytimg.com/vi/1A2nLSC6Z98/default.jpg","False","False","ピューロランドでイベントしたいなあ〜#アテレコ #ピューロランド"
"nB9opVMl7nA","【YouTuber抜き打ちテスト】おバカだらけで爆笑回答連発！ 1番おバカなのは一体誰？？","2020-10-16T09:00:11Z","UCUHI0nSrfN2mEszuyWAnqBg","CulTV / カルティービー","24","20.18.10","CulTV|せりしゅん|馬場海河|よき|VAZ|よきさん|かいくん|カルティービー|ばんばかいが|ティックトッカー|人気|ゲーム|TikTok|中学生|高校生|ゆな|ゆなたこ|ゆなチャンネル|かるてぃーびー|海河|男女|池田翼|いけつば|もか|モカ|もかちゃん|ゆなちゃん|ゆなコラボ|もかコラボ|せりつばかいが|カルティービー コラボ|tiktok|tiktoker|TikToker|ティックトック|抜き打ち|抜き打ちテスト|学力テスト|抜き打ち学力テスト|テスト|学校|テスト|おばか|おばか 決定|YouTuber抜き打ちテスト|おバカ|おバカだらけ|爆笑回答|爆笑|1番おバカ|一体誰|おバカ決定|mel 学力テスト|めるぷちコラボ|めるぷち|メルプチ|メルプチ コラボ|さくら コラボ|おさき コラボ|めるぷち研究生|学校 大型企画|cultv 大型企画|抜き打ちシリーズ|楠ろあ|大人数コラボ|大型企画|大型コラボ","272201","5561","177","638","https://i.ytimg.com/vi/nB9opVMl7nA/default.jpg","False","False","💕🏫YouTuber抜き打ちシリーズ🏫💕今日は、抜き打ちで学力テストを実施しました🥳📖教室でテストのはずが大暴れしてるしお話してるし大丈夫？？笑YouTuberのみんなは、もちろん勉強もできるよね？🤭そして、おばかだった人には罰ゲームが！！！是非最後まで観てください🙌🏻提供 : ペコカメラ（株式会社 不二家）価格：無料 対応OS：iOS/Androidhttps://bit.ly/2FzKWYe※ペコカメラは音声の録音はできません。本動画内の音声は編集で入れたものとなります🌈🏫抜き打ちシリーズラインナップ🏫🌈1限目：抜き打ちカバンの中身チェックhttps://youtu.be/HRoXvuj5koM2限目：抜き打ち学力テスト3限目：？？？？？4限目：即興ダンスバトル📺シリーズ予告動画📺https://youtu.be/f_RiyR4V3oE出演せりしゅん▶︎YouTube：https://www.youtube.com/channel/UCEEEOlXG09lb4pSr03QVhwQ▶︎Twitter：https://twitter.com/0208_31▶︎Instagram：https://www.instagram.com/shun.28/▶︎TikTok： http://vt.tiktok.com/SQBbv/　馬場海河▶︎YouTube： https://www.youtube.com/channel/UCUrZNkYO8SEEmuZwWdBRSzg▶︎Twitter：https://twitter.com/K33s44315▶︎Instagram： https://www.instagram.com/k33s44/▶︎TikTok： http://vt.tiktok.com/SHmuQ/　よきさん▶︎YouTube：https://www.youtube.com/channel/UCmO9leusy4SfdH1K2P4WP2w▶︎Twitter： https://twitter.com/oseeseaseen▶︎Instagram： https://www.instagram.com/yokisandesu/?hl=ja▶︎TikTok：http://vt.tiktok.com/dbC4o8/　池田翼▶︎YouTube：https://www.youtube.com/channel/UCxi2cV3NCvyNwGEWIhWKI7g▶︎Twitter：https://twitter.com/Wing_brz▶︎Instagram：https://www.instagram.com/wing_brz/▶︎TikTok：https://vt.tiktok.com/D3Q8Cr/　ゆな▶︎YouTube：https://www.youtube.com/channel/UCsTM1roCxoot1-03EO5zQxg▶︎Twitter：https://twitter.com/_yunachannel▶︎Instagram：https://instagram.com/_yunachannel?igshid=5sep29xb0nxt▶︎TikTok：https://vm.tiktok.com/JejRBkh/　もか▶︎Twitter： https://twitter.com/MocaYamazaki▶︎Instagram： https://instagram.com/moca.2812?igshid=1g9ypf3dgpx8o▶︎TikTok： https://vt.tiktok.com/U6NB6K/さくら▶︎YouTube：https://www.youtube.com/channel/UC6f1...▶︎Twitter：https://twitter.com/sakura08steez▶︎Instagram：https://www.instagram.com/sakura_0808_▶︎TikTok：https://www.tiktok.com/@0808sakuraおさき▶︎YouTube：https://www.youtube.com/channel/UCmoA...▶︎Twitter：https://twitter.com/tiktok_osaki▶︎Instagram：https://www.instagram.com/sakichanman...▶︎TikTok：https://www.tiktok.com/@osaki_tiktokこころ▶︎Twitter：https://twitter.com/ogiyama_kokoro▶︎Instagram：https://www.instagram.com/ogiyama_kokoro▶︎TikTok：https://www.tiktok.com/@ogiyama_kokoro　ありさ▶︎Twitter：https://twitter.com/arisa528_▶︎Instagram：https://www.instagram.com/ari_arisa528▶︎TikTok：https://www.tiktok.com/@arisa05280708　ほのか▶︎Twitter：https://twitter.com/honoka_0714_▶︎Instagram：https://www.instagram.com/honoka_0714_▶︎TikTok：https://www.tiktok.com/@honoka.714　このは▶︎Twitter：https://twitter.com/kkk_08_kkk▶︎Instagram：https://www.instagram.com/kkk.08.kkk▶︎TikTok：https://www.tiktok.com/@konochanman0808楠ろあ▶︎YouTube：https://www.youtube.com/channel/UCvS01-HQ57pnIjP4lkp58zw▶︎Twitter： https://twitter.com/_ROA666▶︎Instagram：https://www.instagram.com/roa666/NENE▶︎YouTube：https://www.youtube.com/channel/UCYE9921AsW-S7lk3BJcerkQ/featured▶︎Twitter： https://twitter.com/nenenene0731▶︎Instagram：https://www.instagram.com/nenesunnyday/▶︎TikTok：https://vt.tiktok.com/ZSfasBsS/🌸CulTVの公式ツイッター🌸 https://twitter.com/Cul_tokyo🏫CulTVの公式TikTok🏫https://vt.tiktok.com/yUqkrb/🏫おすすめの動画🏫🌷めるぷちのTikTok見て「可愛い」と思ったら貯金！大量コインで大変なことに？！【可愛い貯金】https://youtu.be/81q2VUv35ws🌷【大食い】さくみみとマック1万円に挑戦してみた！https://youtu.be/Kwn9QwghNq4🌷【ゆな】ホワイトデーのお返し渡したら、反応が可愛すぎたhttps://youtu.be/i5cSlRt8rWc🌷スーパーシロ体操踊ってみたゾ！【ねお×スーパーシロ×しんちゃん】https://youtu.be/jv4wxVS4zI0"
