video_id,title,publishedAt,channelId,channelTitle,categoryId,trending_date,tags,view_count,likes,dislikes,comment_count,thumbnail_link,comments_disabled,ratings_disabled,description
"9TIELbrDG-w","親友ラファエルのアルファード爆破してみた","2020-10-16T10:29:09Z","UCaminwG9MTO4sLYeC3s6udA","ヒカル（Hikaru）","24","20.18.10","ヒカル|Hikaru|トーク|ドッキリ|おもしろ|ラファエル|爆破|車|アルファード","1200262","25953","2184","1392","https://i.ytimg.com/vi/9TIELbrDG-w/default.jpg","False","False","この動画の続きはこちら！https://m.youtube.com/watch?v=lADJSpPTzzQラファさんのチャンネルはこちら！https://www.youtube.com/channel/UCgQgMOBZOJ1ZDtCZ4hwP1uQヒカル×ラファエルのシリーズをまとめてます！https://www.youtube.com/watch?v=fytyMTaF1x4&list=PLcxHm0kSGuECCttZycXpzT3070D7J_jZ-撮影協力　有限会社東京特殊効果https://www.tokyo-tk.com/株式会社　松井建設https://kantounoarizona.jimdofree.com/★チャンネル登録はこちらhttps://www.youtube.com/channel/UCaminwG9MTO4sLYeC3s6udA?sub_confirmation=1ヒカルが愛用してる洋服ReZARDの購入はこちらから！https://rezard.jp/?utm_source=twitter&utm_medium=post&utm_campaign=h1127「ReZARD」に関する情報は下のTwitterでお知らせします。それとDM解放してるので質問などあればそこでお願いします。https://twitter.com/Rezard_officialヒカルの公式サイトはこちらhttps://hikaruchannel.net/★プレゼントや手紙の送り先はこちらになります！〒100-0005 東京都千代田区丸の内 1-6-5      丸の内北口ビルディングWeWork 8階株式会社サムライパートナーズ　ヒカル宛曲をまとめて聞きたい方はこちらから！https://www.youtube.com/watch?v=yrXuKm6JtYA&list=PLcxHm0kSGuEBGW8gmYNOM-2Ah1B9t6Gax【Twitterアカウント】★ヒカルのTwitterhttps://twitter.com/kinnpatuhikaru★まえっさんのTwitterはこちらhttps://twitter.com/1chan_maessan★名人のTwitterはこちらhttps://twitter.com/1chan_meijin★ロケマサのTwitterはこちらhttps://twitter.com/1chan_rokemasa★ヒカルのゲーム実況チャンネルhttps://www.youtube.com/user/kinnpatuhikaru★ヒカルの公式Twitterはこちら（動画通知、お知らせ等）https://twitter.com/hikaru2nd1031★ヒカルのインスタグラムhttps://www.instagram.com/tadanokarisuma/★ReZARDの公式インスタグラムhttps://www.instagram.com/rezard.official/★ヒカルへの仕事のお問い合わせはこちらinfo@hikaruchannel.netマネージャー高橋のDMまでお願いします。https://twitter.com/takahashisan69#ヒカル#ラファエル"
"P8M13ml_rO4","いつも応援してくださっている皆様へ","2020-10-16T10:00:11Z","UC4-TMrb7Mm4KnYx1VsUgcJA","あいり","24","20.18.10","あいり|Airi|おすすめ|オススメ|アラサー|アラフォー|アラフィフ|20代|30代|40代|50代","191014","3466","710","322","https://i.ytimg.com/vi/P8M13ml_rO4/default.jpg","False","False","今日はいつも応援してくださっている皆様へご報告があります！私にとって本当に嬉しいことでいつか実現したいと思っていたことが実現できました。これもひとえにいつも応援してくださる皆様のおかげだと思っています。本当にありがとうございます！🌟ヤマダヤさん特設ページ🌟https://store.ymdy.co.jp/fs/ymdy/c/airi_collabo20商品はこちらから購入できます💁‍♀️↓↓↓💜アイテムページ(トップス)💜https://store.ymdy.co.jp/fs/ymdy/021281552商品名：GRANDTABLE × air grand あいりコラボ・グログランリボンコンパクトフーディ価格：15,000円（税込）サイズ：ワンサイズ💜アイテムページ(スカート)💜https://store.ymdy.co.jp/fs/ymdy/022181542商品名：GRANDTABLE × air grand あいりコラボ・エコレザーパネルスカート価格： 16,500 円（税込）サイズ：ワンサイズちなみに・・・私の身長は160センチです！🌿コラボ商品販売店舗一覧🌿https://store.ymdy.co.jp/fs/ymdy/c/collabo20_shoplist10/17より北海道から沖縄の店舗にアイテムが並ぶことが決定しました！10/17各店舗オープン時間より発売開始予定になります！コラボ取り扱い店舗はURLからチェックしてくださいね✨☝️ヤマダヤさんの全店舗一覧☝️https://store.ymdy.co.jp/fs/ymdy/c/shoplist_all全国に150店舗ほどあるので、お近くのヤマダヤさんの店舗でぜひお気軽にお取り寄せください！♡Instagram：@airi_happy♡https://www.instagram.com/airi_happy/🌟もし購入していただけましたらインスタグラムで私をタグづけ（@airi_happy）もしくは「＃あいりコラボ服」or「＃airgrand」のどちらかをつけて投稿していただけると嬉しいです！遊びに行かせていただきます！！〜〜〜〜〜〜〜〜〜〜〜〜〜〜〜〜〜〜〜〜〜〜〜〜〜〜〜改めまして、いつも応援してくださっている皆様、本当にありがとうざいます。皆様が応援してくださるおかげでここまで頑張ってくることができましたしこのような素敵なアイテムを作ることができました。今回のお洋服は丈感やサイズ感、デザインまで納得がいくまでとことんこだわりました。そんな思い入れと愛情が詰まったアイテムを皆様のお手に触れていただけたら幸いです。一緒にコーデを楽しみましょう！！そして今回一緒に商品を作り上げてくださったヤマダヤの皆様、UUUMの皆様ありがとうございました！💓楽天ROOM始めました！💓動画内に登場するコスメや服、インテリアなどなど、よくご質問いただくアイテムだったり私がリアルに欲しいなと思っているアイテムを楽天ROOMで紹介しているので、ぜひご覧ください！https://room.rakuten.co.jp/aaiirrii/items💓人気＆おすすめ動画💓〈笑いたいならこれ！〉・https://www.youtube.com/watch?v=DOPPA0u1ZMc・https://www.youtube.com/watch?v=1gGnzdKzH_8〈簡単にアイラインが引ける！〉・https://www.youtube.com/watch?v=l7TEqx7Vb4E〈鼻の黒ずみにはこれ！〉・https://www.youtube.com/watch?v=vm2H9ZLIviE今日もあなたがハッピーでありますように♡#ヤマダヤ*************************************************♡あいりのサブチャンネル〈編集なしのゆる動画〉https://www.youtube.com/channel/UCnlbMoZfyDXXirr-qGiIq2g♡Instagram：@airi_happy〈コーデをアップ！〉https://www.instagram.com/airi_happy/♡Twitter：@aaiirrii1110〈不慣れで気まぐれな呟き〉https://twitter.com/aaiirrii1110♡レター等の送り先はこちら！  〒107-6228東京都港区赤坂9-7-1　ミッドタウン・タワー 28階UUUM株式会社　あいり宛【お仕事のご依頼はこちらにお願いします】airi224.info@gmail.com *************************************************素材提供：PIXTA、OtoLogicOP曲：RetroVision - Campfire [NCS Release]"
"xYv5U5a4heg","総長直伝アクセルミュージック","2020-10-15T12:00:17Z","UCXw-7zNPhqafIR0o-vqXX3w","SATAbuilder's","26","20.18.10","[none]","586119","9816","520","1426","https://i.ytimg.com/vi/xYv5U5a4heg/default.jpg","False","False","XJを一刻も早く取りに行きたい総長。テレビの仕事にひがみ総長。そんなん言うならXJが来たら何がしたい？効果音作りたい⁉総長直伝バイクのコールとは？愛くるしい青春時代が明からかに‼最後まで見らんとくらさるーぜ‼夜露死苦‼#バッドボーイズ佐田#総長系YouTuber#作田【作田の自伝「漫画・デメキン」を読みたい方はコチラ↓】https://www.akitashoten.co.jp/comics/4253148263【バッドボーイズ佐田 twitter】https://twitter.com/kisamakono【バッドボーイズ佐田 instagram】https://www.instagram.com/satakisama/【★作田LINEスタンプ★】https://line.me/S/sticker/12818141【★作田LINEスタンプ海賊版★】https://line.me/S/sticker/12818145#バッドボーイズ#佐田正樹#佐田ビルダーズ#つくるた#XJ400D#YAMAHA#ペケジェー#classicbike#コール#チューリップ#鉄腕アトム#ウェディングマーチ#暴走族#特攻服#三段警棒【カルメラYouTube】https://www.youtube.com/user/calmera666【choptop_tokyo instagram】https://instagram.com/choptop_tokyo【ギャラップ公式Youtube】https://www.youtube.com/channel/UCOj3rUZSnfNXXc70WvB0EZQ【佐田工務店メンバーYouTube】杉本くんLIZE WORKShttps://www.youtube.com/channel/UCAahLL-980s_3OLoLjDJhcgタケトDIYhttps://www.youtube.com/channel/UC8YYp5KvStEEa-Rth2GELpwボンざわーるどTVhttps://www.youtube.com/user/bonmizoキクチウソツカナイ。https://www.youtube.com/channel/UCC_oco3nLaMYrkZBNLga1Bg武井ドンゲバビードンゲバビーチャンネルhttps://www.youtube.com/channel/UCEr1izjnMMAHhlwyMPyNHIw山田さんDIY365JPhttps://www.youtube.com/channel/UCqwlXb7HlS4KRfbZnntdclwあっしー辛子めんたいTVhttps://www.youtube.com/channel/UCGJMw_OCKvoP6lIaSYNKMVA/featured"
"ViYBPeW9wh8","デンを可愛がってくださった皆様へ。","2020-10-14T02:36:14Z","UCIDOHrFd4wl8P6pPyPKlG2A","タイピー日記/taipi","15","20.18.10","動物|生き物|タイピー 日記|animals|dog|cat|kitty|kitten|puppy|ネズミ捕り|接着剤|保護猫|米ぬか風呂|ケルピー|ボーダーコリー|黒猫|牧羊犬|ぶりりん|でぶりん","2555537","90339","1830","22700","https://i.ytimg.com/vi/ViYBPeW9wh8/default.jpg","False","False","この動画を上げるにあたってどう伝えたら良いか悩みましたがありのままの事をお伝えしたいと思います。＊この動画の収益は地元の困った動物達のために使わせていただきます。"
"tRITXtkh0BY","【爆爆爆買い】久しぶりのコストコ最高やん。","2020-10-15T11:02:22Z","UCmsA3A5_HKBwI9OktSttTFg","fukuse yuuriマリリン","26","20.18.10","[none]","215100","2676","194","129","https://i.ytimg.com/vi/tRITXtkh0BY/default.jpg","False","False","公式グッズのショップページはコチラ↓https://suzuri.jp/No5Marilynグッズに関するお問い合わせはコチラ↓https://suzuri.jp/contactグッズの着用画像はSNSからもチェックしてね♡Twitter　【https://twitter.com/No5yuurin?s=21 】Instagram【https://instagram.com/yuuri_fukuse?igshid=5d4yn7ypp183 】いつもご視聴、コメントありがとうございます！私の事を大切に思ってくれているファンの皆様にいつも感謝しています❤️私はいつも皆さんを大切に思ってます。楽しんで動画を観て頂ければ嬉しいです❤️ アイキャッチデザイン・hachaアシスタント・TSUKI ・hachaお仕事依頼はこちらから宜しくお願い致します。【https://marilynwm.com/  】メイクアップ動画を中心に、料理や掃除などライフスタイルの動画を出しています！福世優里 Yuuri Fukuse 25歳です。あだ名はマリリンなので是非そのように呼んでください♡昔からコンプレックスだった見た目を生かして皆さんにメイクの可能性、努力の楽しさ、人生の素晴らしさをお伝えしていけたらと思っています。楽しんでみていただけると嬉しいです♡是非フォローお願いします♡Twitter　【https://twitter.com/No5yuurin?s=21 】Instagram【https://instagram.com/yuuri_fukuse?igshid=5d4yn7ypp183 】"
"8AutHmDMGKA","GT攻撃性が高いので攻撃性下げた。ドレスアップ","2020-10-15T09:48:17Z","UCMYsBeSkjPLc05InKr_RyAA","グンマー民","22","20.18.10","GUNMA-17|ハイエース|ホイール|オフロード|DIY|レストア|改造|車|ロウニンアジ|GT","363174","7176","284","734","https://i.ytimg.com/vi/8AutHmDMGKA/default.jpg","False","False","デイトナに履かせたブロック、ロードノイズの凄さがグッドリッチを付けたことによって違いにビビった！スワンパーぐらい、あの7000円のブロックうるさいGUNMA-17 Twitter　★https://twitter.com/fw_3010お仕事、プレゼントのご連絡はこちらgunma17@kiii.co.jp★プレゼント、お手紙などの宛先はこちら(※生物、冷蔵便は受け取りができません)〒150-0031東京都渋谷区桜丘町20-1渋谷インフォスタワー17階「株式会社Kiii チャンネル名」宛"
"uef8orf4dBo","au PAY マーケット x 乃木坂46「賀喜遥香の驚愕」（ポイント交換）","2020-10-15T05:01:38Z","UCnHmD0XBFFMnA3zhL85zL3g","au","28","20.18.10","[none]","917893","7333","124","576","https://i.ytimg.com/vi/uef8orf4dBo/default.jpg","False","False","コンビニ、レストラン、ドラッグストア…。なんとな～くポイントためてる人、いませんか？au PAY マーケットなら、たまったポイントを「ポイント交換所」でPontaポイント（au PAY マーケット限定）に交換するだけで、誰でも50%増量！ね？ちゃっかりおトクでしょ？au PAY マーケットはコチラhttps://wowma.jp/はじめてご利用される方はコチラhttps://wowma.jp/tutorial/beginner/index.htmlお得なポイント交換所はコチラhttps://wowma.jp/event/ptexchg/index.html【出演者】齋藤飛鳥、久保史緒里、与田祐希、遠藤さくら、賀喜遥香"
"p4ntci4Sr8U","劇場版「美少女戦士セーラームーンEternal」《前編》予告映像60秒／/Pretty Guardian Sailor Moon Eternal The Movie Trailer","2020-10-15T19:00:04Z","UC7J1bN5V1kL6xJ42ue_W6Vg","sailormoon-official","10","20.18.10","[none]","537316","19599","107","1658","https://i.ytimg.com/vi/p4ntci4Sr8U/default.jpg","False","False","あの〈美少女戦士セーラームーン〉が２５年の時を超えて新たに映画化！～月の光は時を超えた愛のメッセージ～「どんな時でも絶対にあきらめない心」「仲間を信じ、守り抜く強さ」そして「恋のときめき」が、スクリーンに鮮やかによみがえる！☆劇場版「美少女戦士セーラームーンEternal」☆2021年 二部作連続公開！《前編》1月8日(金)《後編》2月11日(木・祝)☆全国ROADSHOW☆【映画公式サイト】sailormoon-movie.jp【映画公式Twitter】＠sailor_movie♪主題歌情報♪►Pre-order/予約:https://mcz-release.com/sound/tsukiiro_chainon/『月色Chainon』（劇場版「美少女戦士セーラームーンEternal」主題歌）発売日：2021年1月13日（水）作詞：白薔薇sumire　作曲：小坂明子　編曲：月蝕會議★★★★★★★★★★★★★★★★★★★★★★★★★★★★Pretty Guardian Sailor Moon Eternal The Movie【Part1】January 8, 2021【Part2】February 11, 2021ROADSHOW！！https://sailormoon-movie.jp　★★★★★★★★★★★★★★★★★★★★★★★★★★★★#美少女戦士セーラームーン #美少女戦士セーラームーンEternal#劇場版セーラームーン #Sailormoon #Prettyguardians #PrettyguardiansSailormoon#月の光は時を超えた愛のメッセージ #SailormoonEternal©武内直子・PNP／劇場版「美少女戦士セーラームーンEternal」製作委員会"
"6l5LYgfTVLo","【俺の激闘コラボ企画】蝶野正洋が安生洋二ヒクソン事件の新事実に迫る！","2020-10-15T10:00:02Z","UC_QmWAdFCquOuYHnp1FsuCQ","【蝶野チャンネル】CHONO Network","24","20.18.10","蝶野正洋|蝶野チャンネル|安生洋二|俺の激闘|ワールドプロレスリング|ヒクソン|プロレス|蝶野","176314","2833","52","418","https://i.ytimg.com/vi/6l5LYgfTVLo/default.jpg","False","False","蝶野さんがMCを務めるCSテレ朝ch2『ワールドプロレスリング 俺の激闘！ベスト5』の「安生洋二編」が10月25日（日）18:30に放送されます。今回、同番組とYouTube【蝶野チャンネル】がコラボし、蝶野正洋×安生洋二のトークを同一会場で収録。【蝶野チャンネル】では蝶野さんが「UWFの人間関係」「ヒクソン事件」の真相に迫っています。10月25日放送の『俺の激闘！ベスト5』では、安生洋二が、長州力の口から「キレてないですよ」発言が飛び出した試合等をプレイバックしています！是非、ご覧ください。★CSテレ朝ch『ワールドプロレスリング 俺の激闘！ベスト5』10月25日（日）18:30※都合により、番組内容が変更になる場合がございます。https://www.tv-asahi.co.jp/ch/contents/sports/0225/※チャンネル登録をお願いします。★蝶野正洋着用商品AT ラミー/リネンショートブレザーhttp://www.aristrist.com/shopdetail/000000000564/outer/page1/recommend/ATパンチエプロンシャツhttp://www.aristrist.com/shopdetail/000000000524/shirt/page1/recommend/＝＝＝＝＝＝＝＝＝＝★蝶野正洋 公式Twitter：https://twitter.com/masahirochono★蝶野正洋オリジナル アパレルブランドARIST TRIST（アリストトリスト）：http://www.aristrist.com/#蝶野正洋 #CHONONetwork #プロレス #黒のカリスマ#nWo #TEAM2000 #安生洋二 #UWF #ヒクソン #グレイシー"
"B2e--P3UI3A","【デート準備】1日に美容をたんまり詰め込んだ美容Dayに密着！可愛くなるって大変すぎ😭【脱毛/ヘアチェンジ/ネイル/食事】","2020-10-15T09:30:01Z","UChqgldmzFbug6EUBYabOYVQ","ひよんちゃんねる","26","20.18.10","ひよん|美容Day|美容デー|美容|イメチェン|ネイル|ヘアカラー|ひよん丼|ダイエットご飯|脱毛|ひよんちゃんねる|デート|デートメイク|デート準備","190463","4028","83","205","https://i.ytimg.com/vi/B2e--P3UI3A/default.jpg","False","False","今回は、久しぶりに美容の1日に密着したよ💅💇‍♀️🍽ひよんはできるだけ1日に詰め込んで美容系の事をするよ！1日で色々変わって可愛くなれるって最高だよね✨笑好きな人とデートに行けるように、いつでも可愛くいれるように頑張る😤💓笑*ー*ー*ー*ー*ー*サブチャンネル開設したよ😳❤️こちらからチャンネル登録してくれると嬉しいな😂！気ままにひよんhttps://www.youtube.com/channel/UCUUYmJ_vg6hcGzSMN23eJpw*ー*ー*ー*ー*ー*ひよん初の書籍、発売決定！！！2020年3月4日(水)発売❤️『つべこべ言わずにかわいくなりますか♡ひよん流バレずに盛れるあれこれ。』❤️アマゾン予約はこちらから❤️https://www.amazon.co.jp/dp/4299002229/ref=cm_sw_r_cp_api_i_I-woEb7TTJSKZ*ー*ー*ー*ー*ー*ー*ー*ー*ー*ー*ー*ー*ー*ー*良かったらSNSも見てみてね♡♡♡♡サブチャンネル 気ままにひよん→https://www.youtube.com/channel/UCUUYmJ_vg6hcGzSMN23eJpw♡Instagram @cchan_fee4→https://www.instagram.com/cchan_fee4/♡Twitter @cchan_fee4→https://mobile.twitter.com/cchan_fee4♡Tiktok @feeyong34→https://www.tiktok.com/@feeyong34*ー*ー*ー*ー*ー*ー*ー*ー*ー*ー*ー*ー*ー*ー*▶︎ファンレターはこちらにお願いします💌💓〒108-0073東京都港区三田１丁目４−１ 住友不動産麻布十番ビル４Fひよん 宛▶︎お仕事依頼はこちらにお願いします🙆‍♀️clipper.info@cchan.tvひよん担当者 宛*ー*ー*ー*ー*ー*ー*ー*ー*ー*ー*ー*ー*ー*ー*#美容Day #イメチェン #デート準備"
"0g84__z8r8w","【毎週金曜更新】牙狼 ＜GARO＞ HDリマスター 【公式】 第4話「晩餐」","2020-10-16T03:00:01Z","UC7AinGyPhqwSyhAmthw6Qfg","【公式】GARO PROJECT ー牙狼シリーズー","24","20.18.10","牙狼|GARO|月虹ノ旅人|雨宮慶太|小西遼生|肘井美佳|藤田玲|冴島鋼牙|京本政樹|ガロ","94629","1032","28","141","https://i.ytimg.com/vi/0g84__z8r8w/default.jpg","False","False","牙狼〈GARO〉シリーズ15周年記念シリーズ第１作目となる『牙狼＜GARO＞ HDリマスター』を毎週金曜12時に公開！最新作TVシリーズ「GARO -VERSUS ROAD-」2020年12月2日BD/DVD発売決定。https://garo-project.jp/VERSUS_ROAD/劇場版『牙狼〈GARO〉-月虹ノ旅人-』BD/DVD好評発売中。https://garo-project.jp/GEKKOU/GARO PROJECT公式サイト：https://garo-project.jp/公式twitter：https://twitter.com/GARO_PROJECT公式Instagram：https://www.instagram.com/garo_project_2020/牙狼ショップにてオリジナルグッズ販売中https://www.garoshop.jp/バンダイチャンネル：https://www.b-ch.com/Hulu：https://www.happyon.jp/など各種配信サイトにて全話配信中！【第4話「晩餐」】家賃を払えず、アパートを追い出されたカオルは亜佐美の家に押しかける。しかし、そのお礼にとカオルが作った特製の手料理を食べた亜佐美は腹痛を訴え、病院へ運び込まれてしまう。そこは、ホラーパズズに憑依された医師・立神亮一（加勢大周）の経営する危険な病院だった・・・。ホラーの気配を探知して病院を訪れた鋼牙だが、敷地内に張られた結界のせいで思うように戦えず、あえなく引き下がる。ホラーの結界には人間はおろか、魔戒騎士ですら近づけないが、鋼牙はホラーの血を浴びたカオルに封印を解かせ鎧を召還。自分に喰われる者は幸せだとうそぶくパズズに、憤怒を叩きつける。ガロは緑の魔導火を全身にまとい、烈火炎装でパズズを滅ぼす。#GARO#牙狼#牙狼15周年"
"rOcCPtdFDgs","Snow Man「Stories」倍速で踊ったらヤバかった！","2020-10-14T08:00:15Z","UCuFPaemAaMR8R5cHzjy23dQ","Snow Man","10","20.18.10","Snow Man|スノーマン|岩本 照|Hikaru Iwamoto|深澤 辰哉|Tatsuya Fukazawa|ラウール|Raul|渡辺 翔太|Shota Watanabe|向井 康二|Koji Mukai|阿部 亮平|Ryohei Abe|目黒 蓮|Ren Meguro|宮舘 涼太|Ryota Miyadate|佐久間 大介|Daisuke Sakuma|滝沢秀明|タッキー|アクロバット","1157695","0","0","8598","https://i.ytimg.com/vi/rOcCPtdFDgs/default.jpg","False","True","どうも！Snow Manです。今回は、僕たちの2ndシングル「Stories」の高速ダンスに挑戦！未知の領域に、少し行けた気がしました。。。2020.10.07 2nd Single Release！Snow Man「KISSIN’ MY LIPS / Stories」●初回盤A（CD+DVD）品番：AVCD-94848B価格：1,600（税抜） ￥1,760（税込）スリーブ仕様動画A視聴シリアルナンバー封入【CD収録内容】01. KISSIN' MY LIPS02.Stories【DVD収録内容】・「KISSIN‘ MY LIPS」 Music Video・「Stories」Music Video・「Stories」Dance Video・ジャケット/Music Videoメイキング映像●初回盤B（CD+DVD）品番：AVCD-94849B価格：1,600（税抜） ￥1,760（税込）スリーブ仕様動画B視聴シリアルナンバー封入 【CD収録内容】01. KISSIN' MY LIPS02. Stories【DVD収録内容】・「KISSIN’ MY LIPS」マルチアングル映像・ 撮り下ろし特典映像 真実を暴け！JOKERゲーム●通常盤（CD）品番：AVCD-94850X価格：1,000（税抜） ￥1,100（税込）初回仕様：スリーブケース、20Pフォトブック動画C視聴シリアルナンバー封入【CD収録内容】01. KISSIN' MY LIPS02. Stories03. 君の彼氏になりたい。04. ファンターナモーレ05.「KISSIN' MY LIPS」Instrumental06.「Stories」Instrumental07.「君の彼氏になりたい。」Instrumental08.「ファンターナモーレ」Instrumental09.ボイスドラマ2ndシングル「KISSIN’ MY LIPS / Stories」のご予約はこちら！ ◆初回盤Ahttps://avex.lnk.to/SnowManAVCD94848◆初回盤Bhttps://avex.lnk.to/SnowManAVCD94849◆通常盤https://avex.lnk.to/SnowManAVCD94850Snow Man オフィシャルサイトhttps://avex.jp/snowman/Snow Man on ジャニーズJr.チャンネル https://goo.gl/UXB2Ms Weibohttps://www.weibo.com/SnowManofficialJohnny's nethttp://www.johnnys-net.jp/ISLAND TVhttps://j-island.net/artist/group/id/4#SnowMan #くちびるものがたる #スノキッシン"
