video_id,title,publishedAt,channelId,channelTitle,categoryId,trending_date,tags,view_count,likes,dislikes,comment_count,thumbnail_link,comments_disabled,ratings_disabled,description
"4DxL6IKmXx4","LiSA 『炎』 -MUSiC CLiP-","2020-10-13T03:00:07Z","UCqEfdEvLG5oQWNYlDQrGlKw","LiSA Official YouTube","10","20.18.10","LiSA|LISA|Lisa|アニソン|アニメ|crossing|リサ|鬼滅|きめつのやいば|ベスト|ジャンプ|fgo|FGO|Fate|アニプレ|SAO|best|ソードアート|ソード|実況|アニサマ|水樹奈々|水樹|声優|小倉|スフィア|TrySail|トライセイル|WANIMA|Official髭男dism|ヒゲダン|ひげだん|髭男|米津|米津玄師|パプリカ|フーリン|Foorin|foorin|あいみょん|レモン|lemon|KINGGNU|キングヌー|スミカ|sumika|サチモス|suchmos|Suchmos|RADWIMPS|RADWINPS|ラッドウィンプス|ラドウインプス|EXILE|エグザイル|イグザイル|TWICE|トゥワイス|上白石|ReoNa|ANIMA|アニマ|ワニマ|紅白|NHK|歌合戦|紅蓮華|ぐれんげ|香水|瑛人|13|サーティーン|ドラゴンズ|名古屋|中日","8439248","296340","2312","19326","https://i.ytimg.com/vi/4DxL6IKmXx4/default.jpg","False","False","2020/10/14発売のLiSAの17th シングル「炎」、MV公開！TVアニメ「鬼滅の刃」主題歌「紅蓮華」に続き、LiSAが歌う 劇場版「鬼滅の刃」無限列車編 主題歌シングル！「炎」作詞：梶浦由記、LiSA作曲：梶浦由記編曲：梶浦由記「炎」ダウンロード&ストリーミングはこちらから！https://LiSA.lnk.to/homura_digital 「炎」CD購入はこちらから！https://LiSA.lnk.to/homura_pkg 2020/10/16公開『劇場版「鬼滅の刃」無限列車編』https://kimetsu.com/anime/　 2020.10.14 17th Single “Homura” Releasethe theme song for Demon Slayer: Kimetsu no Yaiba The Movie: Mugen Train.https://LiSA.lnk.to/homura_digital Lyrics by Yuki Kajiura, LiSAComposed by Yuki KajiuraArranged by Yuki KajiuraLiSA - 炎 / THE FIRST TAKEhttps://www.youtube.com/watch?v=4Q9DWZLaY2U LiSA 『紅蓮華』 -MUSiC CLiP YouTube EDIT ver.-https://www.youtube.com/watch?v=CwkzK-F0Y00　LiSA - 紅蓮華 / THE FIRST TAKEhttps://www.youtube.com/watch?v=MpYy6wwqxoo　【LiSA OFFiCiAL WEBSITE】http://www.lxixsxa.com/ 【New Album「LEO-NiNE」＆ New Single「炎」Special Web Site】https://www.lisa-leonine-homura-1014.com/【LiSA OFFiCiAL Twitter】https://twitter.com/LiSA_OLiVE【LiSA OFFiCiAL Instagram】https://www.instagram.com/xlisa_olivex/#LiSA #炎 #鬼滅の刃 #Homura #DemonSlayer"
"rrk9TJ3NY2w","物撮り","2020-10-15T11:13:52Z","UC9JqSO9LR3V6ljBXHv4E7qg","kouichitv","24","20.18.10","コウイチTV|kouichitv|コウイチ|ホラー","224444","14829","102","2264","https://i.ytimg.com/vi/rrk9TJ3NY2w/default.jpg","False","False","ホラーなので閲覧注意でTwitter@ko1529  https://twitter.com/ko1529notehttps://note.com/ko15292ndチャンネルhttps://www.youtube.com/user/kouichiTV2ndED曲『meme』配信　https://linkco.re/QFgGm55Tおだじんさん@odasoul2015 https://twitter.com/odasoul2015グッズhttps://muuu.com/users/84c262e4340c673bお問い合わせhttps://www.uuum.co.jp/inquiry_promotion"
"XFRHAp3Ar4Y","石橋貴明からみなさんへ大切なお知らせ","2020-10-14T12:00:08Z","UCbXUEjBdbrn4BEbLSKJuSpw","貴ちゃんねるず","22","20.18.10","石橋貴明|とんねるず|貴ちゃんねるず|マッコイ斉藤|みなさんのおかげでした|みなおか|みなさん","1767853","37219","1214","3204","https://i.ytimg.com/vi/XFRHAp3Ar4Y/default.jpg","False","False","チャンネル開設から早４か月。視聴者のみなさんからまだか、まだかと、ご待望の例のやつ、やっちゃいます🔥10月22日 21:00～　みなさんの予定を空けて待っていて下さい🔥くわとモンペも、出るってよ。ーーーーーーーーーーーーーーーーーーーーーーーーーー🔥B Pressure情報【CD情報】1st アルバム「Green Light」　11曲入りCD　3000円(税別)全国のCD・レコード店、amazon、楽天などのオンラインショップで販売中【LIVE情報】B Pressure LIVE「GreenLight」at 大阪 ROCK TOWN10月26日　19:30～starte+（イープラス）にてチケット販売中配信チケット: 2000円(税別)https://eplus.jp/bps/【オフィシャルグッズ情報】🔥B Pressureオフィシャルグッズオンラインショップhttps://official-goods-store.jp/bpressure/🔥石橋貴明Twitterhttps://twitter.com/ishibashi_desho🔥石橋貴明Instagramhttps://www.instagram.com/takaakiishibashi_official🔥貴ちゃんねるずTwitterhttps://twitter.com/takachannels_TN🔥貴ちゃんねるずInstagramhttps://www.instagram.com/takachannels_tn🔥マッコイ斉藤Twitterhttps://twitter.com/maccoi_saito🔥マッコイ斉藤Instagramhttps://www.instagram.com/maccoi_saito🔥音源協力松下俊彦(RABBITMOON)　http://www.rabbit-moon.com株式会社VSQ　https://vsq.co.jp🔥チャンネルロゴ / バナー制作: Chivo&Vochivo🔥ムービーロゴ制作: Kota Hanyu🔥各種問合せ先は以下のフォームhttps://forms.gle/apXdpt3xpp2EprtT8#10月22日#生でダラダラいかせて!!#石橋貴明#貴ちゃんねるず#マッコイ斉藤"
"wDMjdnbgsCw","こいつらのテストの回答がマジ草ＷＷＷＷＷＷＷＷＷＷＷＷＷＷＷＷＷＷＷＷ","2020-10-14T12:30:56Z","UCE0UZVTfvQ8jiNxdIlLeWeA","ジェルOfficial","24","20.18.10","ジェルボイス|すとぷり|ジェル|莉犬|ころん|さとみ|るぅと|ななもり|歌い手|遠井さん","996765","45105","376","1610","https://i.ytimg.com/vi/wDMjdnbgsCw/default.jpg","False","False","中学生の時英単語を全く覚えられなくて「baseball」を「バセバ１１」って覚えてたな。「yellow」も「イェイ！１１０番ダブリュ！」って覚えてた。まったく身に着かないから真似しないように毎日おもしろ動画を投稿してるジェルでーす！チャンネル登録よろしく！コメント、高評価もお願いします！ジェルのTwitterはこちら！【https://twitter.com/Jel__official  】 ツイキャスでも生配信してるぜ！【https://twitcasting.tv/c:jelvoice/ 】ジェルの公式ラインアカウント！【http://nav.cx/RXUW0Q 】エンディング曲『ポーカーダンス』　歌　ジェル【https://www.youtube.com/watch?v=IjqR0Jg_BXw】🍓すとぷりのおすすめオリジナル楽曲！🍓【MV】大好きになればいいんじゃない？／すとぷり【HoneyWorks】https://youtu.be/qwz9v5nCqm0【MV】おかえりらぶっ！／すとぷり【HoneyWorks】https://youtu.be/c3DazWbrI_Q【MV】僕らだけのシャングリラ／すとぷりhttps://youtu.be/GIaV8cGgQns🍓すとぷりめんばーのちゃんねる！🍓🍓莉犬 / 赤色担当！🍓https://www.youtube.com/channel/UCpcGAVuBSJEFs48MBxhf9eg🍓さとみ / ピンク担当！🍓https://www.youtube.com/channel/UC-1uvY3U4sMSGi52IcT_fWQ🍓ジェル / オレンジ担当！🍓https://www.youtube.com/channel/UCE0UZVTfvQ8jiNxdIlLeWeA🍓ななもり。/ ムラサキ担当！🍓https://www.youtube.com/channel/UClqEh59SFJVyKU0RIhFBJ3A🍓ころん / 水色担当！🍓https://www.youtube.com/channel/UCJtMfSSPKuW22GXfkaN7DOA🍓るぅと / 黄色担当！🍓https://www.youtube.com/channel/UC26AciTXULvcABdrWbaeL8Q"
"7PWncsmDBWY","映画『HoneyWorks 10th Anniversary “LIP×LIP FILM×LIVE”』本予告","2020-10-15T09:00:01Z","UCAaGaynFpku5cAx6OOSrW-w","HoneyWorks OFFICIAL","10","20.18.10","HoneyWorks","242088","23788","65","765","https://i.ytimg.com/vi/7PWncsmDBWY/default.jpg","False","False","HoneyWorks10周年記念プロジェクトバーチャルアイドル『LIP×LIP』が映画化！2020年12月25日公開！公式サイト：https://www.honeyworks-anime.jp公式Twitter：https://twitter.com/honeyworksmovie◆ イントロダクション関連動画総再生回数7億回を超えるクリエイターユニットHoneyWorksの10周年記念プロジェクト、始動！男子高校生2人組バーチャルアイドルユニット『LIP×LIP』。その知られざる結成秘話が、今、明かされる！勇次郎は、いつか歌舞伎の舞台に立つことを夢見て稽古に励んでいたが、後継者には選ばれず道が絶たれてしまう。一方、歌うことが好きな愛蔵は、一緒に暮らす母や兄の奔放な姿にイラだちを覚える日々を送っていた。そんな2人はある日、ふとしたキッカケでアイドルオーディションに応募する。会場で出会った勇次郎と愛蔵は、些細な事から言い争いに。最悪の出会いをした2人だったが、オーディションの結果は合格！しかし、喜ぶ2人に田村社長がデビューの条件を告げた──。「ユニットを組んでデビューしてもらいます」──これは、正反対の2人が、大人気アイドルになるまでの物語。◆ CAST-LIP×LIP-勇次郎：内山昂輝愛蔵：島﨑信長-Full Throttle4-IV：福山潤YUI：斉藤壮馬RIO：内田雄馬MEGU：柿原徹也DAI：増田俊樹田村レイ：沢城みゆき内田茉優：茅野愛衣柴崎裕子：堀江由衣染谷玉五郎：平田広明染谷多恵：桑島法子染谷光一郎：土岐隼一柴崎健：江口拓也成海聖奈：雨宮天成海萌奈：夏川椎菜◆ STAFF原作・音楽：HoneyWorks監督：室井ふみえ脚本：成田良美キャラクターデザイン：大島美和色彩設計：小宮ひかり美術監督・美術設定：二嶋隆文撮影監督：佐藤光洋編集：木村佳史子音響監督：長崎行男音楽：日向　萌制作プロデューサー：松尾亮一郎制作：ＣＬＡＰエグゼクティブプロデューサー：紀伊宗之企画・プロデュース：斎藤俊輔プロデューサー：小出大樹　配給：東映#HoneyWorks #LIPLIP©2020 LIP×LIP Movie Project"
"_5IqpDhX9vs","【大阪に新店舗オープン記念】200万円値引きの新車アルファード用意しました。｜KUHL Racing Osaka","2020-10-14T21:30:01Z","UCov1FK-OXedGePspB7oMK2A","KUHL Racing TV","2","20.18.10","kuhl|kuhl racing|クールレーシング|名古屋|さいたま|栃木|大阪|30系|アルファード|alphard|カスタムカー|customcar|コンプリートカー|激安|大特価|新店舗","239914","2120","141","206","https://i.ytimg.com/vi/_5IqpDhX9vs/default.jpg","False","False","10月17日（土）にいよいよKUHLの新店舗「クールレーシング大阪」が大阪府大東市にオープンします。今回はそのオープンを記念して、大特価車を用意しました。なんと総額200万円以上の値引きをさせていただいています。実質カスタム費用はほぼ全部サービスしている状態です。こちらの特価車は2台限定となりますので、希望者多数の場合は抽選販売となりますのでご了承ください。応募方法は下記のURLから専用サイトにアクセスしていただいて、規定のフォームに記入していただいてエントリーしてください。また、クールレーシング大阪ではオープニングイベントを多数用意しているので、ぜひ最後ご覧ください！▼アルファード特価車の応募はコチラ▼https://kuhl-japan.com【KUHL Racing OSAKA／クールレーシング大阪】◆住所：大阪府大東市南新田2-3-8◆TEL：072-800-7731◆営業時間：10:00～18:00◆定休日：水曜日、年末年始、GW◆URL：https://kuhl-japan.com/shop.html⬇KUHLグループの総合サイトはコチラ⬇https://kuhl-japan.com⬇各店舗スタッフブログはコチラ⬇https://kuhl-japan.com/blog.html⬇カタログのお問い合わせはコチラ⬇https://kuhl-japan.com/contact⬇各種お問い合わせはコチラ⬇＋コンプリートカーやカスタムのお問い合わせはコチラー＋【KUHL Racing SAITAMA／クールレーシングさいたま】◆住所：埼玉県さいたま市見沼区中川746-1◆TEL：048-812-4522◆営業時間：10:00～19:00◆定休日：水曜日、年末年始、GW◆URL：https://kuhl-japan.com/shop.html【KUHL Racing TOCHIGI／クールレーシング栃木】◆住所：栃木県鹿沼市茂呂1176-1◆TEL：0289-77-5857◆営業時間：10:00～19:00◆定休日：水曜日、年末年始、GW◆URL：https://kuhl-japan.com/shop.html【KUHL Racing NAGOYA／クールレーシング名古屋】◆住所：愛知県名古屋市緑区大根山2-503◆TEL：052-693-9805◆営業時間：10:00〜19:00◆定休日：水曜日、年末年始、GW◆URL：https://kuhl-japan.com/shop.html【KUHL Premium NAGOYA／クールプレミアム名古屋】◆住所：愛知県春日井市坂下町6丁目912番地1◆TEL：0568-93-0353◆営業時間：10:00～19:00◆定休日：水曜日、年末年始、GW◆URL：https://kuhl-japan.com/shop.html＋エアロパーツのお問い合わせはコチラ＋【KUHL JAPAN／クールジャパン】◆TEL：052-693-9893◆メール：japan@kuhl-racing.com◆URL：https://kuhl-japan.com/aeroparts.html＋KUHLのニュース記事サイトはコチラ＋【KUHL Fam!／クールファム】◆URL：https://kuhl-japan.com/kuhlfam/"
"3QjRBIYaH9M","【ゲスト：阪口大助】アジルス／スーパー生絞りストロング アフタートーク 2020年10月15日【杉田智和／ＡＧＲＳチャンネル】","2020-10-15T11:15:46Z","UCbPVSXP89cDlsiMf0jet1zQ","杉田智和/AGRSチャンネル","24","20.18.10","[none]","164082","5291","17","313","https://i.ytimg.com/vi/3QjRBIYaH9M/default.jpg","False","False","↓生放送本編のアーカイブはこちらよりご視聴ください！https://youtu.be/Ue3im-tNWJAチャンネルも登録よろしくお願い致します！杉田智和Twitter：https://twitter.com/sugitaLOVＡＧＲＳ公式Twitter：https://twitter.com/AGRS_staffＡＧＲＳ公式ホームページ：https://agrs.co.jp/#杉田智和ＡＧＲＳチャンネル　#杉田阪口"
"eT7p2rBUzFo","JO1 | Practice video [KCON:TACT season 2]","2020-10-14T15:40:36Z","UC2aul0Y3jUJ9sMzOhWPT9AA","KCON official","24","20.18.10","kcon|kcon official|케이콘|엠넷|mnet|케이팝|kpop|shorts|tiktok|틱톡|쇼츠|짧은동영상|cj|cjenm|씨제이|mama|마마","314248","17906","146","2527","https://i.ytimg.com/vi/eT7p2rBUzFo/default.jpg","False","False","[KCON:TACT season 2] MEMBERSHIP JOIN▶If you can not see the JOIN button, you can join through https://youtube.com/kcon/join▶유튜브 KCON official 채널에서 가입 버튼이 보이지 않는 경우 https://youtube.com/kcon/join 에서 가입이 가능합니다!  ▶ユーチューブKCON officialチャンネルで加入ボタンが表示されない場合  https://youtube.com/kcon/join で加入することができます！-KCON:TACT PLUS Tier members are only able to join via KCON official.-KCON:TACT PLUS 등급은 유튜브 KCON official 채널에서만 가입이 가능합니다.-KCON:TACT PLUS等級はユーチューブKCON officialチャンネルでのみ加入可能です。﻿---------공식적인  플랫폼 외 저작권자의 허락없이 [KCON:TACT season 2]를 서비스하는 행위는 명백한 불법 행위이며,  적발 시 민형사상 책임을 지게 되오니 합법적인 방법으로 콘텐츠를 즐겨주시기 바랍니다.Uploading or livestreaming the contents related to [KCON:TACT season 2] without permission or a license to do so clearly constitutes “copyright infringement”, and we may takedown unlawful contents without prior notice and take all appropriate legal action. Please enjoy KCON:TACT legally through official platforms.公式的なプラットフォーム以外の著作権者の許可無く[KCON:TACT season 2]をサービスする行為は明白な違法行為であり、摘発の際に民事・刑事上の責任を負うことになりますので合法的な方法でコンテンツを楽しむようお願い致します。---------Viewers in Thailand will be able to tune in only via AIS PLAY.Viewers in Philippines will be able to tune in only via gigafest.smart.Please check your region’s platform to watch KCON:TACT season 2."
"9kmsW_K68AI","「iPhone12」5つの注目ポイントと機種の選び方【5G対応】【10/16予約開始10/23発売】","2020-10-14T09:00:02Z","UCmWVwb1NqEe1PuVf199ii-w","かじがや電器店","26","20.18.10","かじがや|iPhone|かじがや卓哉|12|Pro|Max|iPhone12|5G|機種変更|比較","306515","4942","143","225","https://i.ytimg.com/vi/9kmsW_K68AI/default.jpg","False","False","↓チャンネル登録よろしくお願いします！https://www.youtube.com/c/kajigaya/?sub_confirmation=10:00 概要0:17 1、「5G」対応0:33 2、CeramicShield0:48 3、デザイン変更1:09 4、新色追加1:21 5、MagSafe1:59 iPhone12シリーズ機種比較今回は、iPhone12シリーズ 5つの注目ポイントと機種の選び方を紹介します！※この動画の内容は公開時点の情報を基にしています。＊【かじがや卓哉の本！】『iPhone&Android対応 簡単! 楽しい! はじめてのスマホアプリ完全ガイド』https://www.amazon.co.jp/dp/4299007808/『iPhone芸人かじがや卓哉の超スゴいiPhone』http://www.amazon.co.jp/dp/4295008087/『iPhone芸人 かじがや卓哉の 今度はスゴいスマホ』https://www.amazon.co.jp/dp/4295007293/＊【かじがや卓哉 公式Twitter】https://twitter.com/kajigayatakuya＊【かじがや卓哉公式 Instagram】https://www.instagram.com/kajigaya/お仕事や講演会･セミナーのご依頼はかじがや電器店事務局kajigayadenkiten@gmail.comまでお願いします。※世界への発信の為、字幕作成ご協力のお願いPlease help me with the subtitling※http://www.youtube.com/timedtext_cs_panel?c=UCmWVwb1NqEe1PuVf199ii-w&tab=2"
"jyXifD52Zis","【第２回】無茶振りオークションで片足セグウェイ１００秒チャレンジやったらまさかの神業成功した！？","2020-10-15T10:14:59Z","UCibEhpu5HP45-w7Bq1ZIulw","Fischer's-フィッシャーズ-","24","20.18.10","Fischer's|フィッシャーズ|野生児|MASAI.|無謀|自然|チャレンジ|シルクロード|マッチョ|マサイ|ザカオ|ンダホ|ダーマ|モトキ|おもしろ|挑戦|SilkRoad|Dama|Ndaho|Zakao|Motoki|Masai|シルクの部屋|毎日|動画|投稿|面白|面白動画|やってみた|ウケる|爆笑|大爆笑|コント|一発芸|ギャグ|ネタ|楽しい|お笑い|笑える|オススメ|商品紹介|YouTube|youtuber|Japan|japanese|Blog|Vlog|腹筋崩壊|抱腹絶倒|都市伝説|身体張る|スポーツ|講座|ビログ|ビデオブロガー|大学生|軍団|イケメン|ウオタミ|UUUM|ウーム|神業|スマブラ|新キャラ|マイクラ|ゲーム|クイズ|自分|好き|セグウェイ|片足|100秒|第２回|サメ|格闘技|種類|あー|世界|トップクリエイター|YouTuber|最も|再生|回数|球技|くしゃみ|必要|技術","1170380","23449","3510","3404","https://i.ytimg.com/vi/jyXifD52Zis/default.jpg","False","False","二代目のチャンネルもよろしく！☆Fischer's-セカンダリ-■https://goo.gl/QgBhjD☆チャンネル登録よろしくね！■https://goo.gl/lSy9St☆専用の絵文字や色々！チャンネルメンバーシップはこちら！■https://goo.gl/uJomwo☆Ｔシャツ、パーカーなどのフィッシャーズグッズ！■http://bit.ly/2pdgURz☆フィッシャーズメンバーのTwitterはこちら！ーシルクロード@RytoSle2（リーダー）■https://twitter.com/RytoSle2ーマサイ@MASAI_Fischers■https://twitter.com/MASAI_Fischersーンダホ@ndahoFischers■https://twitter.com/ndahoFischersーモトキ@Fs_hasninelives■https://twitter.com/Fs_hasninelivesーザカオ@fischerszakao■https://twitter.com/fischerszakaoーダーマ@M2DAMA■https://twitter.com/M2DAMA↓フィッシャーズ公式アカウントは下へ↓☆おすすめ動画はこちら！①第１回無茶振りオークションhttps://www.youtube.com/watch?v=tMjvRfT0MH4②動画タイトルモヤモヤかくれんぼ ンダホ実家編https://www.youtube.com/watch?v=E0piYofO354【Fischer's-フィッシャーズ-】出来そうで出来なさそう、くだらない事、好きなことをする…。中学三年の頃、「楽しい」を動画にすることから始まった古くて幼稚園、同い年の同級生からなるネットパフォーマー集団です。メンバーは全員で6人！[シルクロード] [ンダホ] [ダーマ] [ザカオ] [モトキ] [マサイ] 【公式アカウント】ーTwitter（動画公開時の通知＋告知など）■https://twitter.com/FischersHomeーFacebook（動画公開時の通知）■https://www.facebook.com/FischersHomeーInstagram（オフショット）■https://www.instagram.com/fischershomeーウェブサイト・メンバー紹介■http://fischers.web.fc2.com/【再生リスト】―すべて表示(西暦別もあります)■https://goo.gl/fB9HYY―アップロード順■https://goo.gl/TuFZ4W―再生数順■https://goo.gl/pw3hyy【音源・効果音使用元】様―DOVA-SYNDROME■http://dova-s.jp/―効果音ラボ■http://soundeffect-lab.info/―甘茶の音楽工房■http://amachamusic.chagasi.com/―魔王魂■http://maoudamashii.jokersounds.com/―Epidemic Sound■ http://www.epidemicsound.com【一部の動画・静止画素材提供元】 PIXTA※動画によって使用していない場合がございます。【お問い合わせ先について】※1 業界の皆様・ご依頼の方々・その他ご相談がある方は、UUUMウェブサイトにある「サービス」からお願い致します。※2 YouTubeメッセージ機能は、フィッシャーズでは利用していません。ご理解いただけると幸いです。【サービスに関するお問い合わせ（UUUM）】http://www.uuum.co.jp/#Fischers #フィッシャーズ#無茶振り"
"K8DjA2n1Yxg","【初公開】USJでナンパした時のDMの内容がヤバすぎたwww","2020-10-14T10:29:47Z","UC75NfjEdgZ3BvqJ2ssCyHdg","なこなこチャンネル","24","20.18.10","なこなこ|カップル|TikTok|関西|ファッション|メイク|ドッキリ","652986","12106","471","599","https://i.ytimg.com/vi/K8DjA2n1Yxg/default.jpg","False","False","こんちゃす！！なこなこカップルです🚺🚹今日もあそびにきてくれてありがとう！アパレルブランド　IF/IF公式HP➡︎https://ifif.official.ec/IF/IF公式Instagram➡︎ https://instagram.com/if_and_if?igshid=19yq87b3yeinfIF/IF公式Twitter➡︎ https://twitter.com/if__and__if?s=21【なこなこチャンネルをもっと楽しみたい方はこちら】➀サブチャンネル【なこなこのすっぴん。】不定期投稿➡https://www.youtube.com/channel/UCFCI0RjT2eAWe4ZEMI3YWnA➁なごみ、個人チャンネル始めました！【nagomiチャンネル】➡︎https://www.youtube.com/watch?v=x_xYm2IPeY8【TikTok】➡https://www.tiktok.com/@nakonako1005🚺nagomi🚺　Twitter➡http://twitter.com/NAGOMI3232　Instagram➡https://www.instagram.com/__nagomi32__🚹こーくん🚹　Twitter➡http://twitter.com/koki10181005　Instagram➡http://www.instagram.com/koki.hj.20#USJ#ナンパ#カップル-----------------------------------------------------------------------ファンレター・プレゼントの宛先はこちら〒150-0044東京都渋谷区円山町28-1 渋谷道玄坂スカイビル8階 なこなこカップル宛※冷蔵・冷凍が必要な、なま物の受付はできません。お仕事のご依頼等➡blanche20190915@gmail.com"
"NwSS7uh6RgA","でんちゃん　ありがとう。安らかに","2020-10-14T08:55:17Z","UC4J5fr7YznZI8HZ37Ge973A","清原チャンネル","22","20.18.10","[none]","746096","22397","385","1102","https://i.ytimg.com/vi/NwSS7uh6RgA/default.jpg","False","False","合掌"
"ASe2T6yRkBc","【ハイライト】日本代表vsコートジボワール代表｜国際親善試合 2020.10.13 スタディオン・ハルヘンワールト（オランダ／ユトレヒト）","2020-10-13T23:00:01Z","UCgIeUSV91-FfmCayG4lSBcw","JFATV","17","20.18.10","[none]","551326","2266","200","1806","https://i.ytimg.com/vi/ASe2T6yRkBc/default.jpg","False","False","国際親善試合⌚10/13（火）23:45KO（日本時間）🆚コートジボワール🇨🇮📍Stadion Galgenwaard▼大会情報はこちらhttps://www.jfa.jp/samuraiblue/20201013/【LINE-UP】GK23 #シュミットダニエルDF3  #室屋成16 #冨安健洋22 #吉田麻也MF4  #中山雄太6  #遠藤航7  #柴崎岳9  #鎌田大地14 #伊東純也17 #久保建英FW24 #鈴木武蔵(SUB)GK1  #川島永嗣12 #権田修一DF2  #植田直通13 #板倉滉 19 #酒井宏樹20 #安西幸輝21 #菅原由勢MF8  #原口元気10 #南野拓実11 #堂安律25 #三好康児監督 #森保一#daihyo #jfa #SAMURAIBLUE #新しい景色を2022"
