video_id,title,publishedAt,channelId,channelTitle,categoryId,trending_date,tags,view_count,likes,dislikes,comment_count,thumbnail_link,comments_disabled,ratings_disabled,description,duration
"Kyfz1aRD2fc","HENSY & Клава Кока - Костёр (Премьера клипа, 2020)","2020-10-26T09:00:19Z","UCbj1rZy7-qktxZTawl1S_nA","Клава Кока","10","20.28.10","Клава Кока|klava koka|костёр|текст песни костер|поболело и прошло|да подальше все пошло|покинула чат|краш|мне пох|хенси|хэнси|HENSY|klava|клава кока|нилетто и клава кока краш|новый клип клавы коки|поп музыка 2020|Только костер и тишина|руки твои греют меня|Тик ток|парень клавы Коки|Мне пох|зая клава кока караоке|клава кока краш|клава кока клава кока костёр|клава кока и моргенштерн|клава и хенси|лирик видео|караоке 2020|хиты 2020|клип костёр","1172331","87810","4705","4671","https://i.ytimg.com/vi/Kyfz1aRD2fc/default.jpg","False","False","Слушай и скачивай трек: https://band.link/FOujm------------------------------------------------------------------------Авторы Сценария: Клава Кока, Виктор Абрамов - @superbugzzz , Иван Шелаханов - @shelakhanov, Режиссёр: Дмитрий Климов - @dimanchik0Продюсер: Екатерина Канель - @kanelofficialЛинейный продюсер Артиста: Даша Весна @_dashavesna_VFX: Костя Евтухов @evtukhov.fxГаффер: Тимур Рымбаев @hemingway_17Аэросъемка: Глеб @otradnvСтилист: Лада Высокова @lada_vysokovaВизажист: Земфира Ахмедова @hello_zyomaАктеры: Татьяна Ерофеева @tatianaerofeevaaАртур Данияров @arthurdaniyarovФотобэкстейдж: Илья @perelude_photo Выражаем благодарность за предоставление локации для съёмок https://www.instagram.com/krasnaya_polyana_resort/А так же за помощь в организации съемок Дмитрию @evolutionsochi  и Елизавете @sosnovy_les------------------------------------------------------------------------Клава Кока в соц.сетях:Instagram: http://instagram.com/klavacoca/VK: http://vk.com/klavacoca/ТikTok: https://vm.tiktok.com/TsspWF/HENSY в соц.сетях:Instagram: https://www.instagram.com/madhensy/VK: https://vk.com/madhensyТikTok: https://vm.tiktok.com/ZS9a4o3r/------------------------------------------------------------------------Автор слов: HENSY, Клава КокаАвтор музыки: Бабаев Артур, Клава Кока------------------------------------------------------------------------#КлаваКока #HENSY #Костёр","3M14S"
"t-7dK7UQZRE","Milan 3-3 Roma | Roma fight back thrice to rescue a point! | Serie A TIM","2020-10-26T22:45:03Z","UCBJeMCIeLQos7wacox4hmLQ","Serie A","17","20.28.10","Ronaldo|Serie A|Dybala|highlights|Juventus|AC Milan|Inter Milan|Napoli|Roma|CR7|Cristiano Ronaldo|goals|full highlights|watch|stream|partita|migliori gol|migliori in campo|migliori al mondo|gol del mese|federcalcio|calcio|Italia|lukaku|Lazio|zlatan|ibrahimovic|Ribery|Milan Roma|San Siro|Pioli|Dzeko|Ibra goal|Ibra skills|Ibrav vs Roma|Milan 3-3 Roma|Draw|Ibrahimovic goals|Milan highlights|Roma Highlights|San Siro Milan|Veretout|Kombulla roma|roma goal","2598393","39116","1030","2775","https://i.ytimg.com/vi/t-7dK7UQZRE/default.jpg","False","False","Roma comeback thrice from behind to equalise as Milan dropped points for the first time this season | Serie A TIMThis is the official channel for the Serie A, providing all the latest highlights, interviews, news and features to keep you up to date with all things Italian football.Subscribe to the channel here! https://bit.ly/2OM2Eax Find out more about the Serie A at: http://www.legaseriea.it/en/ Questo è il canale ufficiale della Serie A, dove potrai avere accesso ai momenti salienti, alle interviste, alle notizie e alle funzionalità del momento per rimanere aggiornato sulle ultime novità del campionato.Iscriviti qui al canale! https://bit.ly/2OM2EaxPer maggiori informazioni sulla Serie A: http://www.legaseriea.it/it","4M14S"
"cs8ZoXjqcOg","Как сберечь НЕРВЫ: простые способы снижения стресса. Метод Берда.","2020-10-27T05:30:01Z","UCmyE72X4HsC7XD-z6QIQpzw","доктор Евдокименко","28","20.28.10","Как|сберечь|нервы|простые способы|снижения стресса|метод Берда|от информационного удара|уменьшить|снять стресс|волнение|настроение","111669","10789","133","1107","https://i.ytimg.com/vi/cs8ZoXjqcOg/default.jpg","False","False","Как сберечь НЕРВЫ: простые способы снижения стресса. Метод Берда: как уйти из-под информационного удара.Полезные ССЫЛКИ:1 простое ДЫХАНИЕ от давления, тревоги, волнения и панических атак:https://youtu.be/xltKeze0LEYДелать ежедневно минимум 1 месяц!Упражнение Снежинка для снятия стресса и нервного напряжения:https://youtu.be/29IkA7zcEBgДелать ежедневно минимум 1 месяц!Статья о влиянии гормонов стресса на наше здоровье:https://www.evdokimenko.ru/article24/Книги Доктора Евдокименко в электронном виде можно купить по этой ссылке:https://club.evdokimenko.ru/shop/Книга «Психосоматика: самые опасные эмоции»,В бумажном варианте:https://www.labirint.ru/books/753497/Видео про самые опасные эмоции:https://youtu.be/ojVA7Rs4gtIВидео: как сбросить опасные эмоции и избавиться от обиды:https://youtu.be/nEze36gBW18Видео: ЧУВСТВО ВИНЫ, как от него избавиться:https://youtu.be/bp-OFnkJFlQВидео: Нездоровье и неудачи - 1 простой способ, чтобы всё это изменить:https://youtu.be/QGjVTZM62-g*Музыка: композиция «Созвездие», автор и исполнитель – ДиДюЛя:https://www.youtube.com/user/didulamediaОператор и монтаж – Дмитрий Куракин:https://www.youtube.com/user/Mindk777***","8M15S"
"-nsKQLIAoFg","МОРГЕНШТЕРН открыл СВОЙ РЕСТОРАН. ДРИМ ТИМ в ГОСТЯХ у ПАЦАНОК","2020-10-27T15:30:01Z","UCXkqdE4Yi50wdMo5dlLfnNQ","Аня Pokrov","24","20.28.10","моргенштерн|алишер|алишер моргенштерн|ресторан моргенштерна|моргенштерн открыл ресторан|открытие ресторана|влад роули|роули и ХО тим|xo team|тим и мишель|скандал|слиппи принцесс|хайп хаус|катя адушкина|книга адушкиной|адушкина канал|хабиб|бой хабиба|пацанки|шоу пацанки|тимати|тимати ушел из блэк стар|блэк стар|black star|милоихн и бабич|бабич и милохин|милохин|милохин тик ток|артур бабич|покров|аня покров|горин|геннадий горин|дрим тим хаус","241265","31675","293","924","https://i.ytimg.com/vi/-nsKQLIAoFg/default.jpg","False","False","Даня Милохин & Артур Бабич - Детство: https://youtu.be/xaOQ4KYirUIМой клип Парень из села https://youtu.be/aETEDgDpRlA⭐️ Слушай и скачивай трек: https://band.link/parenizsela⭐️ Трек в ТикТоке: https://vm.tiktok.com/ZSaoRwJb/⭐️ Dream Team House - ДОМ, В КОТОРОМ ЖИВУТ ТИКТОКЕРЫ⭐️⭐️ Dream Team Family: https://www.youtube.com/channel/UC_5WQxfSgDfzLNjRB8aN_Tg?sub_confirmation=1⭐️ ТИК ТОК  https://vm.tiktok.com/7QaJPA/⭐️ Мы в ВК: https://vk.com/dreamteamhouseru⭐️ ИНСТАГРАМ https://instagram.com/dream_team_house⭐️ Наш игровой канал для Стримов: https://www.youtube.com/channel/UCMpwYbwjCommulwGZgoVbuA⭐️ Наш Твич канал: https://twitch.tv/dream_team_games💕 Мои социальные сети:ВК: https://vk.com/pokrovskaya_oneИнстаграм: https://www.instagram.com/POKROV90ТикТок: https://www.tiktok.com/@POKROV?langПо вопросам сотрудничества: reklama@dreamteamhouse.ru Пиар\СМИ: pr@dreamteamhouse.ruМОРГЕНШТЕРН открыл СВОЙ РЕСТОРАН. ДРИМ ТИМ в ГОСТЯХ у ПАЦАНОК","8M20S"
"UaM_mvxRuxQ","Марк Сергиенко «2020» | OUTSIDE STAND UP","2020-10-27T08:00:05Z","UCfh5QygBWbbRVXnfmIwKq5w","OUTSIDE STAND UP","22","20.28.10","ouside standup|аутсайд стендап|standup|стэндап|тнт|labelcom|stand up club|stand up club #1|hophead|hophead stand up|стендап|22 комика|medium quality|марк сергиенко|2020|марк сергиенко 2020|прожарка|сергиенко марк|ямарк|supermarket","139725","8585","452","556","https://i.ytimg.com/vi/UaM_mvxRuxQ/default.jpg","False","False","Марк Сергиенко о 2020-м году: карантин и пандемия коронавируса, Беларусь, поправки в конституцию и традиционные ценности, встреча с отцом, харассмент и многое другое. OUTSIDE STAND UP: каждый вторник новый стендап-сольник. Канал Марка: https://youtu.be/viYFbRfuMmgМарк инст: https://instagram.com/sergienkomarkOutside Instagram: https://instagram.com/outside.standupMedium Quality Production: https://instagram.com/mediumqualityСнято в Петербургском стендап-клубе: https://instagram.com/hophead_standupclubПо вопросам рекламы и сотрудничества: outside@mediumquality.ruО комике: Марк Сергиенко родился в Семикаракорске (Ростовская область) 27 сентября 1994 года. Воспитывался в бедной семье без отца, мама Марка -  кришнаитка, потому с детства он рос в атмосфере, где открыто обсуждались разные темы, в том числе и религиозные. В 12 лет Марк заболел сахарным диабетом и впал в кому, благодаря чему получил свой первый эфир на Первом канале. В 15 лет Марк занялся юмором, участвовал в различных проектах. Работает автором в «Женском стендапе», регулярно снимается в «Прожарке» на ТНТ4, недавно запустил своё шоу на ютубе «ЯМАРК».","30M9S"
"jSVzPcXJ7Ps","NILETTO - Дай мне","2020-10-27T09:00:12Z","UC7F98YYhXCW8tDQFo9owCXQ","NILETTO","10","20.28.10","niletto|нилетто|любимка|голос|клип|рэп|музыка|песни|танцы|танец|nilett|песня любимка|нилетто любимка|niletto любимка|данил хаски|niletto песни|niletto танцы","172338","14613","584","1191","https://i.ytimg.com/vi/jSVzPcXJ7Ps/default.jpg","False","False","Премьера нового трека NILETTO - Дай мнеСлушай и скачивай: https://band.link/daj_mneNILETTO - автор хита «ЛЮБИМКА», который покорил чарты России и Восточной Европы.Подписывайся на меня:VK: https://vk.com/nilettoInstagram: https://instagram.com/niletto_officialYouTube: https://www.youtube.com/nilettoTikTok: https://www.tiktok.com/@nilettoApple Music: https://apple.co/34ZcQnBBoom: https://vk.cc/8ExezkSpotify: https://spoti.fi/2PZ9YTnМузыка Энди Энди:VK: https://vk.com/vndyvndyofficialInstagram: https://www.instagram.com/vndyvndy/Концерты / Реклама: +7 (925) 1000-800 / nil@zionmusic.ru / ИринаСотрудничество: +7 (982) 6239-148 / vndyvndy@gmail.com / АндрейТЕПЛО, НО NILETTO","3M42S"
"DZ5uN_h6UEY","БОЛЬШОЕ ИНТЕРВЬЮ С LIL ME ALONE","2020-10-27T12:34:34Z","UCeUAjk5KFVTCS2K2jK51pMg","HellRaisers Dota2","20","20.28.10","dota2|hr|hellraisers|хеллрейзерс|lil me alone|lil dota 2|Илья Ильюк|Ilya Lil Ilyuk|lil|dota2 pro|dota 2|dota|дота 2|lil dota|хелрейзерс|киберспорт|highlights|дота|dota2stream|хайлайты|турниры дота|eSports|b2ru|be true|б2ру|Яна Химченко|Yana Khymchenko|mazda|mazdaukraine|mazdamx5|нави дота|navi dota|virtus pro dota|vp dota|вп дота|рамзес|ramzes","37672","2267","85","390","https://i.ytimg.com/vi/DZ5uN_h6UEY/default.jpg","False","False","В этом видео вы увидите, как B2RU совместно с LIL ME ALONE покатались на Mazda MX5, пообщались о причинах отсутствия Ильи на профессиональной сцене в уходящем году, о его образе и о том, почему Lil сменил никнейм.Также Яна покажет вам, где живет Илья и как он тренируется.#mazdaukraine #mazdamx5 Приятного просмотра! Содержание :00:00 Лучшие моменты00:20 Приветствие. Выбор машины3:33 Тест драйв4:23 Бонус каждому геймеру5:36 О переломном 20206:20 Без команды8:16 O тир-19:52 В гостях у Lil me alone11:14 О ливе из Navi12:06 О тир-3 сцене13:34 Как присоединился в HellRaisers16:10 Немного танцев17:15 О самовыражении20:53 Пускай моя игра говорит за себя22:50 Я найс гай 24:24 Только о позитивном25:00 О знакомстве b2ru26:40 Смена  ника29:15 Развитие медийки30:00 Фэны и хейтеры33:21 Про калибровку35:48 Устал от доты?37:17 Оптимальный состав38:00 Кто твой друг в СНГ?40:28 Про возраст в доте42:36 Воссоединение в HR + бонусПереходи на сайт Mazda Ukraine:https://mazda.ua/Подписывайтесь на наши социальные сети:ВК - https://vk.com/hellraisersInstagram - https://instagram.com/hellraisers_official/FB - https://facebook.com/HellRaisersEsportsTwitter - https://twitter.com/hellraisersggSteam - https://steamcommunity.com/groups/HR_CSGOTwitch - https://twitch.tv/team/hrTelegram - https://t.me/joinchat/BYiQxUDvQ-Zcpa8i5fBHFAСостав команды HR по Dota2: Alexander Nix LevinArslan xannii ShandjanovGleb Funn1k LipatnikovIlya Lil me alone Ilyuk","43M5S"
"RIPPel2umHU","КОГО ПОСЛЕДНЕГО ПОЙМАЮТ, ПОБЕЖДАЕТ !","2020-10-26T12:00:11Z","UC2tsySbe9TNrI-xh2lximHA","A4","24","20.28.10","КОГО ПОСЛЕДНЕГО ПОЙМАЮТ ПОБЕЖДАЕТ !|Кого последнего поймают|кто последний|кого последнего|кто первый|кто последний побеждает|кого поймают|челлендж|влад бумага|влад а4|а4|а4 кто последний|а4 кого последнего|а4 прятки|мистер х|мистер x|а4 мистер х","8170655","881555","15988","84935","https://i.ytimg.com/vi/RIPPel2umHU/default.jpg","False","False","Покупай новый Мерч А4 «Ламба&Гелик» на сайте - https://a4shop.ruМоя НОВАЯ ИГРА «А4 - Убеги от хейтеров» по ссылке - https://runawaychallenge.onelink.me/PmE5/b4c196deКанал ГЛЕНТА - https://bit.ly/2Gwxge4Качай МОЁ приложение «А4 Головоломки» по ссылке - https://a4logic.by/goКачай еще одно МОЁ приложение “А4 Колесо фортуны” по ссылке - https://a4roulette.onelink.me/v63S/go *****В этом ролике мы решили отдохнуть в частном доме, но вдруг неожиданно к нам в дом стал ломиться какой-то МИСТЕР Х в черном плаще и в белой маске ! Мы были напуганы и стали прятаться в доме от него, но ОН ловил нас по очереди и когда он всех нас поймал ... смотри до конца чтобы узнать !Этот ролик получился ОЧЕНЬ СТРАШНЫМ и ИНТЕРЕСНЫМ !!! Смотри ДО КОНЦА и поддержи нас ЛАЙКОМ !!!*****● Instagram - https://www.instagram.com/a4omgПОДПИСЫВАЙСЯ ЧТОБЫ УВЕЛИЧИТЬ МОЮ САМООЦЕНКУ !) ▶️ РЕКЛАМА, СОТРУДНИЧЕСТВО: a4a4a4a4pr@gmail.com▶️ПРОШЛОЕ ВИДЕО - https://youtu.be/HwoyV6zaPu0● Моя партнерская сеть MediaCube :  http://bit.ly/A4_mcn● Instagram - https://www.instagram.com/a4omg● VKontakte: https://vk.com/id240651878● Паблик VK : https://vk.com/a4_tv● TikTok - https://vm.tiktok.com/qwHt6j/","13M28S"
"Posca-3JeDs","Купленная реакция наставников Шоу Голос - Александра Будникова «Пьяное солнце»","2020-10-27T17:07:34Z","UChh_-u0cSfXC591tv-FaILg","Hellscream Academy","27","20.28.10","Шоу Голос|Первый Канал|Александра Будникова|Юлия Лунегова|Александра Болдарева|Валерий Сюткин|Сюткин|Полина Гагарина|Гагарина|твэнг|Баста|Сансара|Шнур|Сергей Шнуров|наставники|наставники шоу голос|оскар|скандал|клоунада|актеры|голос|пение|вокал|микрофон|зал|студия|публика|leos hellscream|hellscream academy|Диана Анкудинова|пьяное солнце","25660","2175","129","382","https://i.ytimg.com/vi/Posca-3JeDs/default.jpg","False","False","*** Самый крутой магазин АудиоТехники Dr.Headhttp://bit.ly/37MjxOQ - Наушники из видео (промокод hellscream)*** Видос про наушники на VLOG каналеhttps://www.youtube.com/watch?v=Gu8bKQ139lYМне закидали личку, комментарии вопросами на тему очередного скандала на #ШоуГолос У меня такое ощущение что кто-то на #ПервыйКанал не учится на своих ошибках. Облажались с дочкой Алсу - Микелла Абрамовой выиграла сезон голос дети с тупо купленными голосами. Зачем известные и богатые люди запихивают в такие шоу своих детей я не понимаю, ведь если есть деньги, КАКОЙ СМЫСЛ им участвовать в конкурсах талантов, если сразу можно вложить бабки в рекламу и запустить промо компанию и точно также сразу выступать на ТВ Шоу и разных Ток Шоу?! В данном случае, я не имею ничего против самой Александры Будниковой, так как выступление хорошее, все в рамках стиля, аккуратные партии, четкие мелизмы, интересный тембр, но композиция не для таких шоу, в данном случае я просто ОХРЕНЕВАЮ от поведения наставников. Им оскара надо за такую актерскую игру дать, это просто даже не смешно. Настолько палевное поведение, настолько резко все начинают нажимать кнопку, будто им за это нажатие сразу мешок денег падает, в чем я кстати не сомневаюсь...НО ЗАЧЕМ ТАК ОТКРЫТО?! Я сравню ее выступление с еще двумя участницами, которые по моему мнению - мнению преподавателя по вокалу, выступили куда более зажигательно и технично. Поговорим немного о расщеплении, миксте и певческой позиции у Александры Болдаревой и Юлии Лунеговой. Александра Болдарева обладает очень мощным и бархатным тембром, при этом отлично поставленная техника дала ей возможность на высочайшем уровне исполнить композицию Shallow из фильма Звезда Родилась, а Юлия Лунегова зажгла своим выступлением с композицией Highway To Hell группы ACDC, где практически во время всего выступления использовала расщепление. Ну и конечно же нельзя упустить из виду что она играет на барабанах. Подробнее в видео!)*** Про домашнее задание.1) Нужно удержать одну нотку ЛИПРОЛЛОМ https://youtu.be/uUgj9NoOoko2) Снять это на видео видео, должно быть видно лицо3) Выложить на youtube4) Название видео должно бытьДомашнее задание для Leos из Hellscream Academy - Липролл5) В описании обязательно написать хэштег #hellscreamдомашкалипролл6) Прислать видео в Предложить новость в паблике школы http://vk.com/hellscreamacademy7) Дождаться стрима с проверкой домашек через неделю после выхода этого видео.*** ДОНАТИКИ https://www.donationalerts.com/r/leos_hellscream*** Еще больше обучающего контента на Patreonhttp://www.patreon.com/leoshellscream*** Мои каналыhttp://youtube.com/leoshellscreamhttp://youtube.com/fiendbandhttp://youtube.com/airadeathstormhttp://youtube.com/maxflamebasshttp://youtube.com/alexnightmarehttp://youtube.com/pashredhttp://youtube.com/hellstreamshttp://youtube.com/magicambience*** Вся необходимая информация и контактыhttp://taplink.cc/leoshellscream*** Трипод для камерыhttp://bit.ly/2PIkxdG*** Музыка из видеоhttp://bit.ly/2Q8a0ck#Голос","26M29S"
"TcZFKbNwIdw","Самая НИЗКАЯ в мире ГАЗЕЛЬ готова","2020-10-26T14:59:00Z","UC7NdSlaer9fnPwUOPuebLBQ","iling show","2","20.28.10","илинг шоу|iling show|газель|стенс|дроп|низкая газель|занижение машины|бпан|самая низкая газель|занижение газели|пневма|занижение авто|stanse|drop|занижение грузовика|низкий грузовик|посаженный грузовик|посадка авто|посаженная машина|посаженный авто|посаженный газель|дропнутый газель|тюнинг газели|тюнинг авто|тюнинг|занижение","369463","28597","844","2739","https://i.ytimg.com/vi/TcZFKbNwIdw/default.jpg","False","False","Скачай приложение Mamba по ссылке и получи VIP СТАТУС НА 7 ДНЕЙ В ПОДАРОК: https://go.onelink.me/Edf4/4b0aca74*ссылка активна ровно месяц со дня публикации видеоПо вопросам рекламы и сотрудничества: ilingshow@mail.ruИнстаграм: https://www.instagram.com/iling_show/Группа ВК: http://vk.com/ilingshowВторой канал: https://www.youtube.com/c/ilinglife#ilingshow #илингшоу","10M19S"
