video_id,title,publishedAt,channelId,channelTitle,categoryId,trending_date,tags,view_count,likes,dislikes,comment_count,thumbnail_link,comments_disabled,ratings_disabled,description,duration
"tyywmzT42k0","Олег Тактаров: Хабиб как будто с войны вернулся! Сделал то, чего не смог Федор / ОГОНЬ!","2020-10-25T11:43:04Z","UCYRWYBFzbMhYVcCti081TFw","Разрешите вас перебить | ММА, UFC","17","20.28.10","хабиб нурмагомедов|джастин гейджи|хабиб гэтжи|олег тактаров|абдулманап|нурмагомедов|лютиков|интервью|ufc 254|тактаров","554771","8808","1025","1703","https://i.ytimg.com/vi/tyywmzT42k0/default.jpg","False","False","Олег Тактаров внимательно смотрел бой Хабиба Нурмагомедова с Джастином Гэтжи - и поделился наблюдениями с Александром Лютиковым: как Хабиб сломал Гэтжи, почему у Нурмагомедова получилось остановиться, а у Емельяненко нет и в чем величие Абдулманапа. 00:00 О чем скажет Тактаров00:20 «Гэтжи - испуганный заяц, над которым навис орел». Сравнивает Гэтжи с Лобовым02:30 Реакция на решение Хабиба уйти ради мамы04:05 Хабиб сделал то, чего не смог сделать Федор Емельяненко06:25 «Он же кабан - 86-90 килограммов». Почему Хабиб если и вернется, то на категорию выше06:54 Для Хабиба авторитет - Сен-Пьер. А Сен-Пьер удачно вернулся спустя 4 года простоя08:43 Хабиб ушел в 32. Федор дерется в 4409:38 Хабиб ушел, чтобы освободить место для Ислама Махачева?10:40 Про мечту Абдулманапа НурмагомедоваЛютиков в инстаграме: https://instagram.com/a_lutikovПодпишись на «Разрешите вас перебить»: https://www.youtube.com/channel/UCYRWYBFzbMhYVcCti081TFw?sub_confirmation=1Бой Хабиб Нурмагомедов vs Джастин Гэтжи за титул чемпиона UFC в легком весе прошел 24 октября 2020 года в Абу-Даби на турнире UFC 254. Хабиб одержал победу удушающим приемом во втором раунде. Сразу после боя Хабиб Нурмагомедов объявил о завершении карьеры. Хабиб Нурмагомедов, 32 года. Статистика в ММА: 29 побед, 0 поражений. Чемпион UFC в легком весе. Джастин Гэтжи, 31 год. Статистика в ММА: 22 победы, 3 поражения. До этого боя был временным чемпионом UFC в легком весе. Прямая трансляция боя Нурмагомедов - Гэтжи прошла на канале РЕН ТВ.#хабиб #тактаров #нурмагомедов","13M15S"
"mmH4eP-TnAs","비브라토에웃긴 영상 모음 2020! 틱톡에웃긴동영상 레전드 하이라이트 모음. 다시 한번보기 힘든 놀라운 순간 ! #3","2020-10-27T12:28:07Z","UCxuVZVNcvtHUNAeGbbuzwJw","Fun Life Channel","10","20.28.10","nhạc thiếu nhi|nhac thieu nhi|con heo đất|kids|nhạc hay cho bé|nhạc thiếu nhi remix|nhạc thiếu nhi hay nhất","105028","401","49","4","https://i.ytimg.com/vi/mmH4eP-TnAs/default.jpg","False","False","비브라토에웃긴 영상 모음 2020! 틱톡에웃긴동영상 레전드 하이라이트 모음. 다시 한번보기 힘든 놀라운 순간 ! #3","10M44S"
"egL8S94INLQ","Как водка Smirnoff покорила США- Академия Сэма О'Нэллы (Озвучка Broccoli)","2020-10-26T17:00:09Z","UCoxzz8MBxQd2_g6mV1bMz4g","Академия Сэма Онеллы и Брокколи","22","20.28.10","Как водка Smirnoff покорила США|водка smirnoff|водка|водка смирнофф реклама|водка смирнов история|водка смирнофф история|джеймс бонд|Россия|Америка|алкоголь|урок истории|чарльз дарвин|академия сэма онеллы|сэм онела|студия брокколи|сэм онелла на русском|сэм онелла русская озвучка|сем онелла|академия сэма онэллы|академия брокколи|анимация|сэм онелла|научпоп|академия сэма о'нэллы|озвучка брокколи|на русском|дарвин","144510","14388","234","406","https://i.ytimg.com/vi/egL8S94INLQ/default.jpg","False","False","Тот самый автомобиль-холодильник:в Украине https://ek.ua/u/S6DMglв России https://www.e-katalog.ru/u/S6DMglА холодильники смотрел здесь:в Украине https://ek.ua/u/LN30eQв России https://www.e-katalog.ru/u/LN30eQКанал mr beef  - https://www.youtube.com/channel/UCMn_R5YW0Ugl-w2x_rg70cg/Как водка Smirnoff покорила США- Академия Сэма О'НэллыВидео использовано по Лицензии CC: Attribution 3.0https://creativecommons.org/licenses/by/3.0/deed.ru- в видео использованы материалы создателя Академии Сэма О'Нэллы: https://www.youtube.com/channel/UC1DTYW241WD64ah5BFWn4JAи создателя статьи про водку Смирнофф - garik23:https://pikabu.ru/story/ssha_i_vodka_7705670- сделано и озвучено  Студией Брокколи              https://www.youtube.com/user/TCBROCCOLI- были внесены изменения по тексту, и некоторых картинках, так же изменена фоновая музыка- Композиция в видео: 1) Mozart Eine kleine Nachtmusik","11M41S"
"571S67D_hMQ","Обзор боя ХАБИБ-ГЭТЖИ | Слова после боя | UFC 254","2020-10-24T22:05:03Z","UCroAB1gAyQEpk1EDUPE65QA","FightSpace","17","20.28.10","хабиб|хабиб последний бой|хабиб нурмагомедов|хабиб гэтжи|khabib|гас|ufc 254|хабиб задушил|джастин гэтжи","1925740","23229","2936","1795","https://i.ytimg.com/vi/571S67D_hMQ/default.jpg","False","False","Хабиб Нурмагомедов в оличном стиле провел поединок на UFC 254 и победил Джастина Гэтжи. Смотрите обзор боя!18+https://allboxing.ru/ - Новости профессионального бокса и ММАМы в VK.com: https://vk.com/fight.spaceНаш Инстаграм: https://www.instagram.com/fight.space/Мы на FaceBook: https://www.facebook.com/fightspaceunitedИнтернет-магазин одежды и экипировки: http://FightStore.ru Подписывайтесь на наш канал: http://goo.gl/gPGoPiПоддержать канал: https://goo.gl/Fx1xENПо вопросам рекламы и сотрудничества на канале FightSpace: pr@fightspace.ru#Хабиб #Гэтжи #ufc254","3M46S"
"siNV9oVf_IA","İran'dan Karabağ Açıklaması! / A Haber","2020-10-27T11:30:06Z","UCKQhfw-lzz0uKnE1fY1PsAA","A Haber","25","20.28.10","iran|irandan karabağ|iran karabağ|karabağ iran|irandan karabağ açıklaması|karabağ açıklaması|irandan açıklama|irandan açıklama karabağ|karabağ iran açıklaması|karabağ iran sınırı|iran sınırı karabağ|İran'dan Karabağ Açıklaması|A haber|A haber canlı|a haber canlı izle|A haber izle|a haber son dakika|a haber canlı yayın|son dakika|son dakika haberleri|haberler|gündem|A haber son dakika|son dakika gündem|gündem de son dakika haberleri|Türkiye'de gündem","89498","1513","35","366","https://i.ytimg.com/vi/siNV9oVf_IA/default.jpg","False","False","İran'dan Karabağ Açıklaması! / A Haber Dünyanın gözü, Dağlık-Karabağ'da... Son dakika haberine göre Azerbaycan ve Ermenistan arasında 27 Eylül'de başlayan savaşta flaş gelişmeler yaşanıyor. Yeni ateşkesin dakikalar içinde bozulduğu cephe hattından patlama sesleri duyulurken, Azerbaycan lideri İlham Aliyev ulusa sesleniş konuşması yaptı. 17 köyün daha işgalden kurtarıldığını belirten Aliyev, Ateşkes isteyenler Ermenistan'a silahlar gönderiyor. Listesi bende var. Ateşkesi isteyen niye silah gönderir dedi. Öte yandan İran da, T-72M1 ve BHMP-2 tanklarını Dağlık Karabağ sınırına konuşlandırdı.Kanalımıza Abone Olmak İçin : https://bit.ly/2LXGALnSosyal Medyahttps://www.facebook.com/ahaber.com.tr/https://twitter.com/Ahaberhttps://www.instagram.com/tvahaber/#Haber #Sondakika #Ahaber","1M34S"
"8Mir1ZbUfj4","Хабиб ушёл, теперь я номер 1 / Слова Гэтжи после боя против Хабиба на UFC 254","2020-10-24T23:20:37Z","UCkrbi2bmw7DQuuC8k4TP-QA","TRUE GYM MMA","17","20.28.10","хабиб|хабиб нурмагомедов|джастин гэтжи|хабиб гэтжи|хабиб слова после боя против гэтжи|хабиб против|хабиб гэтжи бой|слова после боя|хабиб слова после боя|хабиб нурмагомедов джастин гэтжи|мма|хабиб гэтжи когда бой|ufc 254|гейджи|хабиб джастин гэтжи|хабиб нурмагомедов против джастина гэтжи|бой хабиб гэтжи|хабиб ufc|хабиб гейджи|хабиб против гэтжи|бой хабиба|гэтжи хабиб нурмагомедов|бой хабиб джастин гэтжи|бой хабиб нурмагомедов|гэтжи слова после боя","3946052","92868","2456","6738","https://i.ytimg.com/vi/8Mir1ZbUfj4/default.jpg","False","False","Хабиб ушёл, теперь я номер 1 / Слова Гэтжи после боя против Хабиба на UFC 254Понравился ролик, подпишись 👉🏻 http://goo.gl/JxoIQRНаш Инстаграм 👉🏻 https://www.instagram.com/truegyyym/Группа ВКонтакте 👉🏻 https://vk.com/truegym🥊 Залы для занятия боксом в Москве 👉 http://extrimpower.ru/Лучшая благодарность для нас - твой лайк, репост и комментарий под видео. Огромное спасибо за просмотр ﭢВсе права принадлежат TRUE GYMИспользование фрагментов видео разрешено только с согласия автора.","7M54S"
"zarQ6nIv6ls","Прибытие Хабиба Нурмагомедова в Дагестан после объявления о завершении карьеры","2020-10-27T11:53:31Z","UCaPUQ2WnmAxqdl8mbgIfzng","Ушатайка : Спорт-Экспресс","17","20.28.10","хабиб|гейджи|промо|бой|нельзя пропустить|этот бой нельзя пропустить|ufc|ufc 254|бои|нурмагомедов|джастин|хабиб нурмагомедов|хабиб гейджи|хабиб интервью|бой хабиба и гейджи|хабиб против гейджи|хабиб против|новый бой хабиба|мма|когда бой хабиба|пресс конференция хабиба|хабиб гэтжи|хабиб гэтжи бой|гэтжи|джастин гейджи|хабиб против гэтжи|джастин гэтжи|хабиб завершил карьеру|хабиб речь|хабиб после боя с гейджи|хавьер мендес|хабиб прибыл в дагестан","503792","7141","190","566","https://i.ytimg.com/vi/zarQ6nIv6ls/default.jpg","False","False","Чемпион UFC в легком весе Хабиб Нурмагомедов прибыл в Дагестан из ОАЭ. 24 октября он победил Джастина Гейджи на турнире UFC 254, после чего объявил о завершении бойцовской карьеры. Хабиб остановился на рекорде 29-0.","1M11S"
"Sc_-IuPTmvI","ХАБИБ: сильная речь в отеле после боя с Гейджи / разговор с Хавьером Мендесом","2020-10-25T06:26:47Z","UCaPUQ2WnmAxqdl8mbgIfzng","Ушатайка : Спорт-Экспресс","17","20.28.10","хабиб|гейджи|промо|бой|нельзя пропустить|этот бой нельзя пропустить|ufc|ufc 254|бои|нурмагомедов|джастин|хабиб нурмагомедов|хабиб гейджи|хабиб интервью|бой хабиба и гейджи|хабиб против гейджи|хабиб против|новый бой хабиба|мма|когда бой хабиба|пресс конференция хабиба|хабиб гэтжи|хабиб гэтжи бой|гэтжи|джастин гейджи|хабиб против гэтжи|джастин гэтжи|хабиб завершил карьеру|хабиб речь|дана уайт|хабиб после боя с гейджи|хавьер мендес","1857885","21955","1322","1365","https://i.ytimg.com/vi/Sc_-IuPTmvI/default.jpg","False","False","Видео о том, что делал Хабиб Нурмагомедов после боя с Джастином Гейджи: интервью Хавьеру Мендесу, торжественная встреча в отеле, мотивирующая речь, отъезд в Абу-Даби на вертолете.24 октября на турнире UFC 254 в Абу-Даби Хабиб победил Гейджи удушающим приемом (треугольник) во втором раунде. После поединка Нурмагомедов объявил о завершении бойцовской карьеры. Он остановился на рекорде 29-0.В материале использованы видео из инстаграмов:Хавьер Мендес - https://www.instagram.com/akajav/Антонио Родриго Ногейра - https://www.instagram.com/minotauromma/Усман Нурмагомедов -  https://www.instagram.com/abubakar_nurmagomedov/Зубайра Тухугов - https://www.instagram.com/zubairatukhugov/Андрей Громковский - https://www.instagram.com/gromko7_ufc/#Хабиб #UFC254 #ХабибНурмагомедов","2M38S"
"a-hoswvLWlM","Шлеменко В ШОКЕ от Хабиба - реакция на завершение карьеры и слезы после боя с Гэтжи на UFC 254","2020-10-24T22:08:41Z","UClk_DNP1t5fXhu9yBQRD6yg","Александр Лютиков","17","20.28.10","хабиб нурмагомедов|джастин гэтжи|александр шлеменко|хабиб гэтжи|ufc|хабиб гейджи бой|нурмагомедов|абдулманап нурмагомедов|хабиб завершил карьеру|ufc 254|khabib|gaethje|лютиков|шлеменко|завершил карьеру","1641258","33306","1726","2674","https://i.ytimg.com/vi/a-hoswvLWlM/default.jpg","False","False","Александр Шлеменко смотрит бой Хабиба Нурмагомедова с Джастином Гэтжи, реагирует на слезы Хабиба после боя и решение завершить карьеру в 32 года. Почему плакал Хабиб - уникальные кадры: https://youtu.be/hYU4ouTh3-w00:00 Прогнозы до боя02:17 Бой начался. «Что-то я нервничаю»05:14 Второй раунд: «Все, Гэтжи конец»05:56 Хабиб побеждает удушающим06:32 Хабиб Нурмагомедов плачет. Реакция Шлеменко07:13 Хабиб объявляет о завершении карьерыЛютиков в инстаграме: https://instagram.com/a_lutikovПодпишись на этот канал: https://www.youtube.com/channel/UClk_DNP1t5fXhu9yBQRD6yg?sub_confirmation=1Сильные истории про Хабиба и его отца Абдулманапа Нурмагомедова от дагестанского комментатора: https://youtu.be/eF9g9u9iaDEБой Хабиб Нурмагомедов vs Джастин Гэтжи за титул чемпиона UFC в легком весе прошел 24 октября 2020 года в Абу-Даби на турнире UFC 254. Хабиб Нурмагомедов, 32 года. Статистика в ММА: 28 побед, 0 поражений. Чемпион UFC в легком весе. Джастин Гэтжи, 31 год. Статистика в ММА: 22 победы, 2 поражения. Временный чемпион UFC в легком весе. Александр Шлеменко, 36 лет. Статистика в ММА: 59 побед, 13 поражений, 1 бой признан несостоявшимся. Бывший чемпион Bellator в среднем весе. Прямая трансляция боя Нурмагомедов - Гэтжи прошла на канале РЕН ТВ.#хабиб #шлеменко #ufc254","9M7S"
"BuoYVDlUUTA","Husan - Olma otdim (Official Music Video)","2020-10-27T15:00:13Z","UCkaUg9b9LplVoJdx1JwwyOg","NevoMusic","10","20.28.10","uzbek klip|uzbek|uzbekcha klip|yangi|yangi klip|uzbek klip new|uzbek klip 2018|new uzbek music|узбек клип|узбек|узбекча клип|янги|янги клип","61860","2179","62","137","https://i.ytimg.com/vi/BuoYVDlUUTA/default.jpg","False","False","Официальный сайт: https://nevomusic.net/Подпишись на канал http://bit.ly/nevotvNEVO @ Одноклассники https://ok.ru/nevotvNEVO @ Instagram https://www.instagram.com/nevomusic/NEVO @ Вконтакте https://vk.com/nevotvNEVO @ Facebook https://www.facebook.com/groups/nevomusic/NEVO @ Telegram https://telegram.me/nevotv","3M42S"
"T2NRI5lgImg","Ночь в страшном доме с МАМОЙ! **ЭКСТРЕМАЛЬНЫЙ КВЕСТ**","2020-10-26T13:00:00Z","UCUHQKxU-_DWsrwBxlKWgsew","ЕГОРИК","24","20.28.10","НОЧЬ В СТРАШНОМ ДОМЕ С МАМОЙ! **ЭКСТРЕМАЛЬНЫЙ КВЕСТ**|ВСЮ НОЧЬ В СТРАШНОМ ДОМЕ!|экстремальный челлендж|страшный квест|квест егорик|ночь в доме с паранормальными явлениями|ужасный дом|страшный квест с мамой|страшный дом с мамой|мама в ужастиках|мама егорика|с мамой в страшном доме|мистический квест|мистический дом|егорик страшилки|егорик а4|Егорик|Влад Бумага|Глент","1451088","265176","2187","11525","https://i.ytimg.com/vi/T2NRI5lgImg/default.jpg","False","False","НОЧЬ В СТРАШНОМ ДОМЕ С МАМОЙ! **ЭКСТРЕМАЛЬНЫЙ КВЕСТ**В этом видео я позвал свою маму в страшный квест! И это получилось очень страшно и весело! Она никогда подобного не испытывала и ей безумно понравилось. Уверен если ты досмотришь это видео до конца - тебе тоже понравится!Мой вк-https://vk.com/egorikshkredofficialМой инстаграм - https://www.instagram.com/egor_shkred...Инстаграм Вайса - https://instagram.com/mishawice?igshi...Мой ТИК ТОК- https://vm.tiktok.com/HHpHMn/Почта для сотрудничества - shkred@mediacube.in","22M47S"
"gAftJK1la-A","Когда нардепу от Слуг лучше зашить рот","2020-10-27T07:55:06Z","UCVPYbobPRzz0SjinWekjUBw","Анатолий Шарий","23","20.28.10","шарий|анатолий шарий|шарий анатолий|шарий новое|шарий видео|шарий блог|ifhbq","450861","44970","474","2305","https://i.ytimg.com/vi/gAftJK1la-A/default.jpg","False","False","","10M36S"
"jTN_gFoT63I","Emanet 37. Bölüm | Legacy Episode 37","2020-10-27T18:17:07Z","UCgzdfH1fq76l0YAZnoko4DQ","Legacy","1","20.28.10","telenovela|Turkish soap|watch Turkish Drama|Turkish Drama|Günlük Dizi|Yemin İzle|Emanet|Emanet izle|emanet fragman|emanet 1. bölüm|Berat Rüzgar Özkan|Sıla Türkoğlu|Halil İbrahim Ceyhan|Yaman|seher|the promise|Legacy|Legacy watch|Melih Özkaya|Emanet turkish drama|legacy turkish soap|Emanet turkish soap|emanet 37|legacy 38","383288","6896","276","1554","https://i.ytimg.com/vi/jTN_gFoT63I/default.jpg","False","False","Abone Ol / Subscribe: https://bit.ly/2TLyNnGYaman Kırımlı is a successful and young businessman who had a rough childhood but never gave up, on the contrary he even became stronger with every obstacle. He started his life from the bottom and became very wealthy. All he has in his world, is a family that he has to take care of after his father’s death. He closed his heart to all romantic feelings a long time ago and his only weakness is his 5-year old nephew… Little Yusuf is very well protected under his uncle’s arms, but he craves loves and sympathy. The only happy image in his mind is his aunt Seher.  Seher is a beautiful and humble girl living with her grandfather. Her life is shaken by the death of her sister who was the bride of the Kırımlı family. From now on, she has a legacy she has to take care at all costs: Her little nephew Yusuf. This adventure will arise the long hidden secrets of the Kırımlı mansion; while a whole another legacy will start to grow in Seher and Yaman's hearts. #Legacy#Emanet","55M40S"
"LSIMGfX6hMc","Видео: пьяные чеченские ОМОНовцы устроили перестрелку с СОБРом. Погибли люди","2020-10-27T13:00:09Z","UCu_sa2ZIHKkr5IXqUe7_VpQ","Телеканал 360","25","20.28.10","чечня|омон|собр|перестрелка|стрельба в чечне|чечня сегодня|стрельба|работает омон|спецназ|криминал|стрельба на поражение|убийство|огонь на поражение|жесть|стрельба на улице|уличная перестрелка|разборки|бандиты|собр работает|омон работает|грозный|стрельба в грозном|выстрелы|огнестрельное оружие|оружие|последние новости|новости 360|новости в россии|новости россии сегодня|новости|новости сегодня|политика|телеканал 360|360 подмосковье|канал 360|360tvru","235132","2969","170","2076","https://i.ytimg.com/vi/LSIMGfX6hMc/default.jpg","False","False","Два человека погибли, трое пострадали во время перестрелки сотрудников ОМОНа и СОБРа в Чечне. Об этом сообщает ТАСС со ссылкой на свои источники. Конфликт произошёл в селе Ачхой-Мартан. Телеграм-каналы пишут, что всё началось со словесной перепалки: якобы двое пьяных сотрудников ОМОНа ворвались в кафе и стали буянить. Управляющий вывел мужчин на улицу и попытался успокоить. А когда не получилось, позвонил знакомому росгвардейцу и попросил помочь с гостями.⭕️Подпишись на канал 360: https://www.youtube.com/360tvru?sub_confirmation=1 #360новости #чечня #омон #собр #перестрелка #александрвасильев #бригадаураган #аннакриволапова Подпишись на нас:✅Telegram -  https://tele.gg/tv360ru✅Instagram - https://www.instagram.com/mbn360tv/✅TikTok - https://www.tiktok.com/@360tv✅VК - https://vk.com/tv360✅FB - https://www.facebook.com/tv360/?fref=ts✅ОК -  https://ok.ru/tv360✅Twitter - https://twitter.com/360tvПриложение 360 Android: https://play.google.com/store/apps/details?id=ru.tv360.mobile.androidПриложение 360 iOS:  http://social.360tv.ru/SPUWПоследние новости - https://www.youtube.com/playlist?list=PLKlOceUfsEcxmgPap_a80MmCmazqkewUnГлавное видео дня - https://www.youtube.com/playlist?list=PLKlOceUfsEcwL3VwCgOWDlEAuEuF00VrsЛучшие истории - https://www.youtube.com/playlist?list=PLKlOceUfsEcyWlGN841OZdBJysV5ioaMfПроисшествия - https://www.youtube.com/watch?v=6FON2_FNbsI&amp;list=PLKlOceUfsEcwBhu7bdZhyLBG72MzIWFBl","52S"
