video_id,title,publishedAt,channelId,channelTitle,categoryId,trending_date,tags,view_count,likes,dislikes,comment_count,thumbnail_link,comments_disabled,ratings_disabled,description,duration
"NTyrnaTgIu8","Мой парень - Зомби｜23 серия (Webtoon комикс)","2020-10-27T13:00:54Z","UCV078E1mCeRS4blwnIlsK-w","Озвучки Чай TV","24","20.28.10","Comic|Comics|юмор|приколы|чай тв|комиксы на русском|смешные комиксы|Андертейл|Rus dub|Webtoon Comic Dub|Boyfriend of the Dead|Мой парень - Зомби|Мой мёртвый парень|вебтун комикс|комикс про зомби|видеокомикс|санс|видеоигры|комикс мой парень зомби|Отношения|Любовь|Чай|Озвучка комикса|на русском|Озвучка чай|анимация|comic dub|comics|комикс про любовь|любовь|отношения|Комикс на русском|мой парень зомби новая серия|мой парень зомби комикс|23 часть","65661","10156","40","742","https://i.ytimg.com/vi/NTyrnaTgIu8/default.jpg","False","False","Комикс - https://www.webtoons.com/en/comedy/boyfriend-of-the-dead/ep-1-the-girl/viewer?title_no=1102&episode_no=1Автор - https://www.facebook.com/ushio0o0/Комикс на русском - https://mangalib.me/boyfriend-of-the-deadПеревод предоставлен пабликом - https://vk.com/meduzamangaРолик создавался по примеру этого - https://www.youtube.com/watch?v=_ks7zKaEfzk&tМой канал - https://www.youtube.com/channel/UCDGDMFSoc7yLekMQFEAhHTwМой паблик в вк - https://vk.com/teattv============ПОДДЕРЖКА=============== Поддержать канал и попасть в титры роликов можно массой способов: QIWI - https://qiwi.me/teatv [Указывайте свой ник в сообщении или же пишите мне в лс] Cбербанк - 5469440020796729 WebMoney - R131277688203 Вы попадете в титры, даже если закинете всего 1 рубль!============ГОЛОСА====================Второстепенные парни - https://vk.com/vyacheslavnikitin99Эльза - https://vk.com/zerda_the_winged_oneКлэр - https://vk.com/o.miheyГлавный герой  - https://vk.com/skupeigoeyГлавный герой тян - https://vk.com/id63676242Малой 1 - https://vk.com/lovemarginalМалой 2 - https://vk.com/acep1lot427Лили - https://vk.com/medochan============ТОВАРЫ=====================Могу ченить озвучить, цена договорная Ну и рекламу в озвучку тоже могу вставитьВсе предложения в лс - https://vk.com/skupeigoey============МУЗЫКА=====================Alexander Nakarada - Stoned Barradeen - save my life again Jeremy Blake - Powerup! Barradeen - the girl i havent metDarren Curtis - Danger Around The Corner Aakash Gandhi - We Are the RainDan Lebowitz - Lazy River RagSonic The Hedgehog Passion & Pride  My Sweet Passion  (Instrumental)Kevin MacLeod - Pixelland Wayne Jones - Touching MomentKevin MacLeod - Cold FunkKim Kwang Min - BirdKevin MacLeod - Bridge Jeremy Blake - Powerup! Ты - мой личный сортKevin MacLeod - Cold FunkNintendo Wii - Mii Channel ThemeMonplaisir - Soundtrack DISCLAIMER FOR ARTISTSIf you see art in this video that you believe is improperly credited, or that you would rather not feature in a video, please do not hesitate to send me an email at skupeigoey2@gmail.com. I'm likely to respond within the same day, and I will work with you until you get exactly what you want for your art, be it different credit, financial aid, or the video being removed entirely.#чайтв #комикс #нарусском","10M46S"
"uAoQYbekxLk","Андрей Бебуришвили - Про новый интернет сериал и киноиндустрию в целом.","2020-10-27T15:00:13Z","UCt_G2oKQttzbKlWzkXzHk_Q","SHPENKOV!","23","20.28.10","Шпеньков|Интервью|Shpenkov|Юмор|шпеньков интервью|дмитрий шпеньков|шпеньков дмитрий|бебуришвили|камеди клаб|андрей бебуришвили|бебуришвили стендап|мёр тв|интернет сериал|бебуришвили камеди|четверо|кожома|пышненко|кожома и пышненко камеди клаб|станция спортивная|квн 2020|мёрTV","21517","1704","51","289","https://i.ytimg.com/vi/uAoQYbekxLk/default.jpg","False","False","Гость выпуска Андрей Бебуришвилли - https://www.instagram.com/hooba_bebur/МёрTV - https://www.youtube.com/watch?v=nL8uESCICxI***********************************************По вопросам рекламных интеграций: ad@colabmedia.ruПодписывайся на  мои социальные сети: Шпеньков в Инстаграм: https://www.instagram.com/dmitryshpenkovШпеньков в VK: https://vk.com/dmitryshpenkovШпеньков в Facebook: https://www.facebook.com/shpenkovdmitryПодписывайтесь на Instagram ребят: Дмитрий Кожома https://www.instagram.com/kozhoma/Иван Пышненко https://www.instagram.com/pyshnenkoivan/Дмитрий Колчин https://www.instagram.com/dimakolchin/Другие выпуски ЧЕТВЕРО! можно посмотреть здесь https://clck.ru/NSBL8Смотрите интервью видео на канале SHPENKOV!  Интервью 2019 https://clck.ru/JR3ESИнтервью 2020 https://clck.ru/Ms7VdSHPENKOV! - Канал о юморе и всё что с ним связано. Подписывайтесь будет интересно, будет неинтересно отпишитесь.#бебуришвилли #камедиклаб #четверо #шпеньков #кожома #пышненко #колчин #кожома","1H12M51S"
"1u4GuTh9mgI","Строим HUMMER H2 для OFFROAD. Первый выезд в ГОРОД!","2020-10-27T16:31:56Z","UC0fjAR82mBD-amoNuMEu6mA","ДЖИПЫ МОНСТРЫ","2","20.28.10","Hummer h2|Hummer h2 для OFFROAD|Хамер ш2 для оффроад|тюнинг хамера ш2|портальные мосты на хамер|установка портальных мостов|установка 44 богеров|изготовление силового бампера|оффроад хамер ш2|испытания хамера ш2 в оффроуде|первый выезд хамер ш2|покраска лайн х|хамер ш2 в лайн х|тест -драйв хамера ш2|хомяк на офроуде","42566","3022","54","478","https://i.ytimg.com/vi/1u4GuTh9mgI/default.jpg","False","False","Официальный и самый крупный представитель Copart - компания W8 ShippingУмный подбор на сайте -  https://w8shipping.ua/ ЧатБот с умным подбором авто - https://m.me/W8ShippingCarBotTelegram-канал - https://t.me/W8ShippingUkraineYouTube - https://www.youtube.com/watch?v=NgWHnqziOUk Мы закончили постройку хамера Ш2 на портальных мостах от Мерседес Унимог и 44 колёсах. Изготовили силовые бампера , установили 2 лебедки , сделали экспедиционный багажник , силовые пороги , лестницу. В этом видео Мы выехали в город и протестировали его на разных скоростях и всё рассказали как он себя ведёт ! наш сайт http://vip-lim.com.ua/СОТРУДНИЧЕСТВО и другие вопросы пишите на почту avtocrush@mail.ru INSTAGRAM https://www.instagram.com/limuzinshchik/Я вконтакте: https://vk.com/id60811354Я в Фейсбуке https://www.facebook.com/avtocrush","20M28S"
"U7E-bIBRQhM","НАОБЕЩАЛИ И ПРОПАЛИ! Первые робочие дни новых политиков | Политические приколы 2020","2020-10-27T12:35:03Z","UCkFOzI_AyvG7fhwvvzDG49A","Дизель Українські Серіали","23","20.28.10","политика|новини|новости украины|новости|выборы|вибори|выборы в украине 2020|результаты выборов в украине 2020|выборы в украине|результаты выборов|вибори 2020|мер|последние новости|новий мер|зе|україна|украина|слуга народа|зеленский|голосование|5 питань|депутат|приколи|приколы|приколы 2020|приколи 2020|тсн|выборы 2020|киев|местные выборы|результати виборів|смешные видео|дизель шоу|видео приколы|анекдоты|стендап|выборы мэра киева|5 вопросов зеленского|прикол","57565","849","56","32","https://i.ytimg.com/vi/U7E-bIBRQhM/default.jpg","False","False","Политические прокладки на новом робочем месте.Смешные видео и политические приколы 2020ДИЗЕЛЬ КОМАНДА: 1. https://bit.ly/Krytogolov2. http://bit.ly/Gashenko3. https://bit.ly/berezok4. https://bit.ly/yamo4ka5. http://bit.ly/Bulitko6. http://bit.ly/Smorigin 7. https://bit.ly/Nikishin8. https://bit.ly/Pisarenko9. https://bit.ly/Tankovich10. https://bit.ly/GritsukДРУГИЕ НАШИ КАНАЛЫ:http://bit.ly/DIZEL_SHOWhttp://bit.ly/DIZEL_FILM_SERIALhttp://bit.ly/DIZEL_UAПРИСОЕДИНЯЙТЕСЬ К НАМ В СОЦИАЛЬНЫХ СЕТЯХ:http://bit.ly/DIZEL_FACEBOOKhttp://bit.ly/DIZEL_INSTAGRAMЕЩЕ БОЛЬШЕ ИНТЕРЕСНОГО:http://bit.ly/DIZEL_SAITПо вопросам и предложениям: Elena.snytkova@gmail.comТеги: #дизельукраїнською #українськийгумор #дизельукраїнськісеріали","1H9M51S"
"EJVvJRKRj6M","Анатолій Шарій | Ток-шоу 19 | 26.10.20","2020-10-26T21:21:46Z","UCUOsDBuiB_1zkRixc33TgSg","Телеканал ZIK","25","20.28.10","телеканал ZIK|зік|зик|zik|шарий|анатолий шарий|шарий новое|шарий последнее|шарий ютуб|шарий на зик|шарий о зеленском|зеленский|владимир зеленский|зе президент|зе команда|слуга народа|зе депутаты|шарий зик|яшл|актуальное|новости|новости на зик|парламент|рада|вру|свобода слова|журналисты|свобода слова в украине|донбасс|шарий о донбассе|шарий о журналистах|журналистика|шарий о власти|шарий украина|украина|украина европа","160570","6136","429","815","https://i.ytimg.com/vi/EJVvJRKRj6M/default.jpg","False","False","Гостем ток-шоу 19 став лідер Партії Шарія Анатолій ШарійГостем ток-шоу 19 стал лидер Партии Шария Анатолий Шарий ➤ Прямий ефір: https://youtu.be/a_3eJgMMBsg➤ Підписатись на канал:  https://goo.gl/BUQcMr#ZIK  #НовиниZIK #НовиниZIKнаш сайт: http://zik.ua/Facebook: https://www.facebook.com/telekanalZIKTwitter: https://twitter.com/zik_iaІnstagram: https://instagram.com/zik_tv_channel/Telegram: https://t.me/zik_ua","16M25S"
"Vd9QkWsd5p4","TXT (투모로우바이투게더) '5시 53분의 하늘에서 발견한 너와 나' Official MV","2020-10-26T09:00:02Z","UC3IZKseVpdzPSBaWxBxundA","Big Hit Labels","10","20.28.10","투모로우바이투게더|TOMORROW X TOGETHER|TXT|수빈|연준|범규|태현|휴닝카이|YEONJUN|SOOBIN|BEOMGYU|TAEHYUN|HUENINGKAI|빅히트엔터테인먼트|빅히트|Boy band|minisode1|BlueHour|5시 53분의 하늘에서 발견한 너와 나|5시 53분|553","11497639","1892240","21132","231986","https://i.ytimg.com/vi/Vd9QkWsd5p4/default.jpg","False","False","TXT (투모로우바이투게더) '5시 53분의 하늘에서 발견한 너와 나' Official MVDirector : Guzza (Lumpens)Assistant Director : Hyunhee Lim, Kookki KimDirector of Photography : EumkoFocus Puller: Sangwoo Yun, Jaewon Jung 2nd :  Youngwoo LeeDIT :  Eunil Lee3rd : Yuntae KoGaffer : Junghyeok Jeong Lighting Crew. : Junmin Yang ,Seungho Baek , Hyeonseok  Kim , Duhyeon Han , Junseok Oh , Minseong Choi , Dowon Ahn, Gukjin Jeong Jimmy Jib Operator: Youngjung KimJimmy Jib Assistant : Hyunin Kim , Sung Hoon KimTechnocrane Operator: Taehyeon Choi Art Director: Jinsil Park, Bona Kim (MU:E)Assistant Art team: Yeri Kang (MU:E)Art-team Manager: ilho Heo (MU:E)Associate Producer : Emma Sungeun Kim (ge production)Location Manager : Jihoon HanAssitant Producer : Eunah- Seo VFX STUDIO: PLASTIC BEACHVFX Supervisor: OhzeonVFX Assistant Supervisor: JojeemVFX Project Manager: Chanyoung Song, Jieun JeongVFX Producer: Kyutae Jang3D Artist: Kwangwon Lee, Doyeon Kim, Jeonghwa Lee, Jiwon Jeon2D Artist: Gihoon Jang, Hyunjun LeeVisual Creative : Nu Kim, Lee Hyun Ju, Kang Sung Do, Jung Su Jung, Cha Yeon Hwa, RaktaArtist Management: Kim Shin Gyu, Yang Jun Hyeong, Kim Ji Soo, Shin Seung ChanPerformance Directing : Son Sung Deuk, Kim Su Bin, Kwon Yoo Jung, Hyewon ParkBigHit Entertainment. Rights are reserved selectively in the video.Unauthorized reproduction is a violation of applicable laws. Manufactured by BigHit Entertainment, Seoul, KoreaConnect with TOMORROW X TOGETHER:https://twitter.com/TXT_bighithttps://www.facebook.com/TXT.bighithttps://www.youtube.com/txt_bighithttps://www.instagram.com/txt_bighithttps://www.weibo.com/TXTbighithttp://i.youku.com/txtbighit#5시_53분의_하늘에서_발견한_너와_나 #BlueHour #minisode1 #TXT #투모로우바이투게더","5M4S"
"kiwUGNsLJ9U","Турнир Warface PRO.Masters. Day 7","2020-10-27T20:07:08Z","UCLfISex2d92tzfLKAOFPxeA","Warface","20","20.28.10","mygamestv|mail.ru studio|студия маил|warface|варфейс|турнир Warface|турнир варфейс|киберспорт|Решафлы|Турнир Warface PRO.Masters|Warface PRO.Masters|Турнир Warface PRO.Masters. Day 7","39713","2110","227","21","https://i.ytimg.com/vi/kiwUGNsLJ9U/default.jpg","False","False","В эфире седьмой день турнира Warface PRO.Masters. Давайте узнаем, какие нас ждут сражения в новом этапе Warface PRO!✅ Получи скидку до 99% от Связного: vk.cc/aBnyw8Наш новый партнер Связной запустил крутую акцию к 25-летию компании. Принимайте участие в праздничной игре и получайте щедрые подарки!✅ 19:00 – Amplified.Effex vs Infer✅ 21:00 – Repulse vs FleischTeam✅ Правила рестрима: трансляция защищена авторским правом, любое использование без согласования с правообладателем запрещено.✅ Игровые мониторы АОС: https://vk.cc/ay9pPlВыбери настоящий игровой монитор на свой вкус и бюджет.Подписаться на канал: http://vk.cc/5iYoDE.===========================================Наш официальный сайт:https://wf.mail.ru/Мы ВКонтактеГруппа игры — https://vk.com/warface_gameБлог команды — http://vk.com/warfacegameteamТурнирная группа — http://vk.com/warface_opencupДругие социальные сетиTwitter — https://twitter.com/OfficialWarfaceInstagram — http://instagram.com/warface_officialОдноклассники — http://ok.ru/warfacemailruFacebook — https://www.facebook.com/warfaceru?fref=nf===========================================Warface — это бесплатный многопользовательский онлайн-шутер.На нашем канале вы можете найти новости об игре, видео игрового процесса, отчеты с мероприятий, прямые трансляции и многое другое.Подписывайтесь на канал, комментируйте видео, ставьте лайки и, самое главное, оставайтесь с нами!","3H33M10S"
"h9VqQM1nOPk","ДЕВУШКА САМОУДОВЛЕТВОРЯЕТСЯ В ТАКСИ / Таксуем на майбахе","2020-10-26T12:40:33Z","UCn_Lgpi9I1Z6QpPqRj8vXYw","Таксуем на майбахе","22","20.28.10","самоудовлетворяется в такси|самоудовлетворяется в машине|пассажирка предлагает себя|пассажирка хочет таксиста|девушка в такси хочет|девушка в такси|треш в такси|приколы в такси|Таксуем на майбахе|такси на майбахе москва|майбах такси|такси майбах|такси на майбахе|неадекватные клиенты|неадекватные пассажиры такси|неадекватные пассажирки такси|пассажирка яндекс такси|пассажир|пассажиры такси|клиент|клиенты|пассажиры|пассажиры в такси|неадекватный пассажир","303607","12603","1731","637","https://i.ytimg.com/vi/h9VqQM1nOPk/default.jpg","False","False","Скачай приложение Mamba по ссылке и получи VIP СТАТУС НА 7 ДНЕЙ В ПОДАРОК: https://go.onelink.me/Edf4/a7576224 *ссылка активна ровно месяц со дня публикации видеоМой инстаграм: https://www.instagram.com/taksyem_na_maybache/Донаты: https://www.donationalerts.ru/r/evgeniymaybax1Мой инстаграм: https://www.instagram.com/taksyem_na_maybache/Помощь каналу :4276380036580228По вопросам сотрудничества https://vk.com/id163908565еvg.medvedeff2017@yandex.ru#виптакси #таксивмоскве #таксуемнамайбахе  #таксивезет #москва #yandextaxi #moscowdriver #maybach #viptaxi #wheely #gett #таксуемнамайбахе #клиенты #яндекс #bmw #maybach #мерседес #audi","8M6S"
"KJTTKL3snRI","ЛЕГЕНДЫ ВТОРОГО ПЛАНА (pt.1). Джон Дикон (Queen), Джон Бонэм (Led Zeppelin).","2020-10-27T15:30:22Z","UC5Cpx_68IC6M60JPjsbpW4Q","RESONANCE","10","20.28.10","queen|led zeppelin|rock|rock music|рок|рок-музыка|freddie mercury|фредди меркьюри|лед зеппелин|john bonham|джон бонэм|джон дикон|john deacon|resonance|резонанс|юмор|led zeppelin john bonham|queen john deacon|биографии великих людей|биография|фильмы про музыкантов|богемская рапсодия фильм|богемская рапсодия|bohemian rhapsody|jimmy page|robert plant|history of rock music documentary","40925","8195","34","791","https://i.ytimg.com/vi/KJTTKL3snRI/default.jpg","False","False","Канал - https://www.youtube.com/c/ChilloutManГруппа вк - https://vk.com/chillout_man ----------------------------------------------------------------------------------------------ЛЕГЕНДЫ ВТОРОГО ПЛАНА (pt.1). Джон Дикон (Queen), Джон Бонэм (Led Zeppelin). Хочу попробовать запустить новую рубрику, где чуть больше времени будет уделяться музыкантам, уступающим (в масштабах обсуждаемости в мейнстриме), своим коллегам. Мы нередко упоминаем культовые коллективы и, зачастую, львиная доля внимания достаётся самым ярким участникам: если Linkin Park, то Честер Беннингтон (Chester Bennington), если Queen, то Фредди Меркьюри (Freddie Mercury), если Раммштайн, то Тилль Линедманн (Till Lindemann). Да, не только, но зачастую. А тут можно будет больше времени уделять и остальным. А заодно и цеплять менее культовых исполнителей. Рубрика будет не только про рок-музыкантов (rock music), но и про хип-хоп (hip-hop) представителей, и про поп-музыку и не только. https://vk.com/resonance_of - паблик https://www.instagram.com/alan_resonance/ - инстаПриятного просмотра! Добровольное пожертвование на развитие канала.Яндекс - 410012859781229WebMoney - R141290923596Сбербанк - 4276 5500 4990 6178#Music#Музыка#Queen#LedZeppelin#RockMusic#РокМузыка#Rock","18M36S"
"ukvKimJwG5A","КАК Я СДАВАЛ ЭКЗАМЕНЫ","2020-10-27T15:51:47Z","UCiG3Xu73O6x8q6CRmTCp-SQ","SUKA","24","20.28.10","КАК Я СДАВАЛ ЭКЗАМЕНЫ|экзамены|огэ|егэ|истории егэ|баллы|100 баллов|сто баллов|СУКА|блоггер|история из жизни|жизнь|как сдать|боюсь экзаменов|экзамен|ем курагу|милота|блоггер в маске|suka|блоги|свет|вино|вечер|энергетики|энергосы|монстр обзор|егэ 2021|эмоции после экзаменов|эмоции после|егэ ответы|2021|высшие баллы|как хорошо сдать|что делать|ответы|2022|2023|живые реакции егэ|мем|огэ реакция","23718","6082","19","641","https://i.ytimg.com/vi/ukvKimJwG5A/default.jpg","False","False","Очередная история моей жизни о том, как я прошел через экзамены Очень поучительная, очень интереснаяМоя группа в ВК - https://vk.com/suka3banayaЯ в ВК - https://vk.com/suka_3banaya00:00 вступление00:47 егэ и огэ - мое представление02:52 как я сдавал русский07:40 как я сдавал историю10:58 как я сдавал английский13:35 итог","16M30S"
"x7hA0U2qn3U","ХИТЫ 2020 🔝 ТОП МУЗЫКА ОКТЯБРЬ 2020 ♫ РУССКАЯ МУЗЫКА ♫ ЛУЧШИЕ ПЕСНИ ♫ RUSSISCHE MUSIK 2020","2020-10-27T16:02:12Z","UCTvFkZQhjR3r5wj9oJllDnQ","МУЗЫКА","10","20.28.10","[none]","77918","465","52","7","https://i.ytimg.com/vi/x7hA0U2qn3U/default.jpg","False","False","✔Приятного вам дня и прослушивания!✔Делитесь этим видео с друзьями!✔Также не забудьте нажать на колокольчик чтобы знат о всех новинках!Подписка на мой канал - https://goo.gl/pGXWD9Мой второй канал - https://goo.gl/edbZhESUBSCRIBE TO MY NEW CHANNEL → https://goo.gl/vtnLDwThank you so much for all the support guys! I would LOVE it if you would Subscribe to my new channel! It's going to be a ton of fun I promise!!!!🔔 Turn on notifications not to miss any uploads!✪ Help Us to Get 100.000 Subscribers , PLEASE !!!: ►►► https://goo.gl/vtnLDw ◄◄◄►Follow МУЗЫКА◢Tracklist is in the comment!◢Please Share this Mix on Social sites (Facebook, Google +, Twitter etc.)to more person could listen it!► DON'T FORGET ＳＵＢＣＲＩＢＥ - ＬＩＫＥ - ＣＯＭＭＥＮＴ• Playlist Best Russian Music Mix 2020 - Лучшая Музыка 2020 - Клубная Музыка:https://goo.gl/pGXWD9• Playlist Лучшая Музыка 2020 - Зарубежные песни Хиты - КРУТАЯ МУЗЫКА КЛУБНАЯ 2020:https://goo.gl/edbZhE✉ Contact: emorybennett89@gmail.com➤ Best Russian Music is created to promote and support new Artists, (musicians/labels, composers, producers, photographers/filmmakers)Send your song or video on МУЗЫКА✉ Contact: emorybennett89@gmail.comIf any producer, label, artist or photographer has an issue with any of the music or video uploads please contact us and we will remove your work immediately. Thank You.Please do not flag my channel.Tag: русская музыка, russian music 2020, musik, russian music, musik 2020 russisch, musik 2020, russische musik 2020, russische musik, микс музыка, микс 2020 русский, new russian music mix 2020, russian music mix, русская музыка 2020, музыка 2020, russian dance 2020, russian club, russian club 2020, танцевальная музыка#russischemusik #музыка2020 #bestrussianmusic #russianmusic #русскаямузыка #хиты2020 #музыка 2020 #музыкавмашину #новаярусскаямузыка","11H46M56S"
