video_id,title,publishedAt,channelId,channelTitle,categoryId,trending_date,tags,view_count,likes,dislikes,comment_count,thumbnail_link,comments_disabled,ratings_disabled,description
"__4i6CIg82o","Should you upgrade to the iPhone 12 and iPhone 12 Pro?","2020-10-13T18:07:51Z","UC2fd4raC6fXobex-tWGubMA","Travis MCP","28","20.18.10","iphone 12|iphone 12 2020|iphone 12 cost|iphone 12 date of release|iphone 12 launch date|iphone 12 leaks|iphone 12 max|iphone 12 pro|iphone 12 pro max|iphone 12 release and price|iphone 12 release date|iphone 12 release date and price|iphone 12 rumors|apple iphone 12|apple iphone 12 design|apple iphone 12 max|apple iphone 12 pro max|new iphone 12|iphone 2020 leaks|iphone 2020 rumors|iphone 5g|2020 iphone|2020 iphone leaks|5g iphone|new iphone 2020","86357","1903","201","837","https://i.ytimg.com/vi/__4i6CIg82o/default.jpg","False","False","Apple released the iPhone 12, iPhone 12 Pro and Pro max today.  If you want to know if you should upgrade this video is for you!iPhone 12iPhone 12 MaxiPhone 12 ProiPhone 12 Pro MaxWhat you MISSED about the iPhone 12!  https://youtu.be/y8KiRDKH3yALatest Podcast episode: https://www.youtube.com/watch?v=_R8AYQGicLMiPhone 12 - Paying too much for too little? https://youtu.be/4cJFX1_aOdgIs the iPhone 12 too late? - iPhone 12 Release Date and Price https://youtu.be/C3LnfMhuYcIYou are WRONG about the iPhone 12 Rumors!  https://youtu.be/XdAeZLp9mUQThe iPhone 12  is not for YOU! It's for everybody else! https://youtu.be/eElnNKugjyUApple Is STEALING Android Users! https://youtu.be/igGHEmucCXw #2020iPhone #iphone #iPhone12ProMaxWant to save on your cell phone bill? Get a $25 credit by switching to Ting!  https://travis.ting.comYou NEED to clean your phone with this: https://www.phonesoap.com/?rfsn=3805713.d70b10  Links in the description are typically affiliate links. As an Amazon Associate I earn from qualifying purchases.Become a channel member!  Exclusive videos, badges and emojis you can use in live stream or in the comment section! https://www.youtube.com/channel/UC2fd4raC6fXobex-tWGubMA/joinCheck out my Podcast! https://www.gadgetcast.netSubscribe to the podcast channel: https://www.youtube.com/gadgetcastLike the music I use?  Sign up here: http://share.epidemicsound.com/MPn7VCheck out music I made on my iPad: https://soundcloud.com/travis-mcpBadges by Isaac from  isaacshea.com. Buy my merch!  https://teespring.com/stores/travis-mcpGrab my new Hat: https://www.etsy.com/listing/854764464/creators-merch?utm_source=OpenGraph&utm_medium=PageTools&utm_campaign=Share&variation0=1524340112All my music is from Epidemic sound!  I love it!  Get your subscription here: https://bit.ly/2CaGPgpCheck out my Amazon page of all of my favorite stuff! https://www.amazon.com/shop/travismcpJoin my Discord!  https://discord.gg/aTJuFRXYou need Amazon Prime.  Get it here for free! https://amzn.to/2LkLGijGet a free trial of my favorite music service.  Amazon Music: https://amzn.to/2LlFpTMAll of my logos  are by my good buddy Ted. You can check him out on instagram or on his website. rmbrclub.com @tedthechonnomI use the Canon 90D to shoot my videos.  Buy it here:  https://amzn.to/2D3dXr5Follow me on Twitter and instagram: Travis McPInstagram:  www.instagram.com/travismcpTwitter: www.twitter.com/travismcpCheck out the Facebook page: https://fb.me/TravisMcPTechTwitch - www.twitch.tv/travismcpIf you are new here, check out this playlist.  It should get you acclimated.  https://www.youtube.com/watch?v=dUv7q2UufYo&t=1sSubscribe here: https://goo.gl/LRxRL5COPPA COMPLIANCE: This channel and all of its videos arenot “directed to children” within the meaning of Title 16C.F.R. § 312.2 and are not intended for children under 13years of age. (Travis MCP and its owner(s),agents, representatives, and employees (hereinafter,“CHANNEL”) do not collect any information from childrenunder 13 years of age and expressly deny permission to anythird party seeking to collect information from childrenunder 13 years of age on behalf of CHANNEL. Further,CHANNEL denies any and all liability or responsibility for thepractices and policies of YouTube and its agents andsubsidiaries, or any other affiliated third party, regardingdata collection."
"xXgIdBnDnvs","SHE REGRETS THIS.. **PRAY FOR SHYLA**","2020-10-12T22:59:40Z","UC-rN2gfG9OhqitnrRPnPmHg","THIS IS L&S","22","20.18.10","she regrets this|the truth|this is l&s|l&s|the ace family|couples|boyfriend|girlfriend|family|vlog|lifestyle|love|happiness|hollywood|los angeles|california|surgery|im pregnant|we're having a baby","1383379","63327","975","4686","https://i.ytimg.com/vi/xXgIdBnDnvs/default.jpg","False","False","CHECK US OUT ON SOCIAL MEDIA💥*BABY SOUL*INSTA:  https://www.instagram.com/soulmcbroom*LANDON*INSTA: https://www.instagram.com/landonmcbroom_SNAP: Landon_mcbroomTWITTER: Landonmcbroom_*SHYLA*INSTA: https://www.instagram.com/shylaSNAP: Simply_shylaTWITTER: Shyla*JOSEPH* (VIDEOGRAPHER)INSTA: @Joethedirector"
"RUfKDgdBmf4","Best Amazon Prime Day Tech Deals! 🔥 (New Links Updated Day 2)","2020-10-13T14:26:08Z","UChnN9MPURwKV2PbEoT2vhTQ","randomfrankp","28","20.18.10","randomfrankp|2020|4k|amazon|amazon prime day|deals|amazon prime day tech deals|tech|pc|pc gaming|keyboard|mouse|cpu|amd|intel|tech deals|electronics|best tech deals|gifts for men|tech gifts for men|tech gifts|tech gadgets|cool tech|under $50|under $100|under $25|4k tv|4k tv deals|headphones|wireless|gaming pc|gaming laptop|amazon prime day tech|prime day tech deals","246428","8622","214","695","https://i.ytimg.com/vi/RUfKDgdBmf4/default.jpg","False","False","🔥🔥🔥It's Amazon Prime Day 2020, here are some good tech deals! NEW links updated below!• Sign up for Amazon Prime for FREE! http://amazon.com/tryprimefree?tag=randomfrankp-20🔥🔥Razer Huntsman TE: https://amzn.to/34NmlIw 🔥Razer Viper: https://amzn.to/36W8SAL  🔥Insignia 55” 4K Fire TV: https://amzn.to/2SPTi1k🔥Echo Dot: https://amzn.to/36VxJ7W 🔥🔥Echo Show 5: https://amzn.to/3iMpaP2 🔥Blink Mini Security cam: https://amzn.to/3dinfAK 🔥🔥HyperX Alloy Origins Core: https://amzn.to/33Tev0N 🔥HyperX Cloud MIX: https://amzn.to/2IpZMCi🔥ASUS ROG Strix Scar 15: https://amzn.to/34Ntvws🔥Acer Predator 27” Monitor: https://amzn.to/376Xsul 🔥LG Infinity Display 24” Monitor: https://amzn.to/30Zy1GU🔥Bose QuietComfort 35: https://amzn.to/3nIdtwu🔥🔥Fossil Smartwatch: https://amzn.to/34LHEdm🔥Cooler Master Hyper 212: https://amzn.to/34QFQ2R🔥CM Hyper 212 RGB Black Cooler: https://amzn.to/34TEtQV🔥AMD Ryzen 5 2600 CPU: https://amzn.to/2IirzV0🔥AMD Ryzen 9 3900X CPU: https://amzn.to/3146hRL--- NEW DEAL UPDATES BELOW ---🔥Intel i3-10100 CPU: https://amzn.to/30YGfz1🔥🔥5TB WD_Black Hard Drive: https://amzn.to/310WnAh🔥🔥1TB WD_Black NVMe Gaming SSD: https://amzn.to/2SUe2F6🔥🔥12TB WD_Black External HD: https://amzn.to/3jWBBZQ!🔥🔥🔥 ALIENWARE 34 120HZ ULTRAWIDE!!: https://amzn.to/2IsiWYb!🔥🔥🔥 SAMSUNG 49 144Hz ULTRAWIDE!!!!: https://amzn.to/372IxBm🔥Google Pixel 4 XL: https://amzn.to/30ZEJgo🔥AirPods Gen 1: https://amzn.to/3k8xz0V🔥SteelSeries Arctis 1 Wireless: https://amzn.to/358IjGj🔥Seagate Slim 2TB Hard Drive: https://amzn.to/34QUerT🔥🔥G.SKILL TridentZ RGB RAM: https://amzn.to/2GWMI6R🔥1080p Capture Card: https://amzn.to/3nWjDJE🔥Corsair HS60 PRO Headset: https://amzn.to/34V6A2e🔥Crucial 1TB SSD: https://amzn.to/3jW2Tjh🔥1-Year Nintendo Family Membership + 128GB Memory: https://amzn.to/3nLznyZ🔥Philips Fidelio X3 Headphones: https://amzn.to/3lHfzuF🔥Corsair K95 RGB Platinum: https://amzn.to/3dn5Kzj🔥Garmin vivoactive 4S: https://amzn.to/2T4SR3D🔥Garmin Instinct: https://amzn.to/313g4aC🔥Sony WHXB900N Headphones: https://amzn.to/3iXyiR5🔥Sony Noise Cancelling Headphones: https://amzn.to/3144Fas🔥Echo Show 5 + Blink Mini: https://amzn.to/3nLWWHS🔥Razer BlackWidow Elite Keyboard: https://amzn.to/3jXVr70🔥Blue Yeti Nano: https://amzn.to/34XSX2r🔥Topping DX3 Pro AMP: https://amzn.to/3dlTD5u🔥Philips SHP9500 Headphones: https://amzn.to/33VtGXt🔥Philips Audio Fidelio X2HR: https://amzn.to/3lLRSkO🔥Philips SHP9600 Headphones: https://amzn.to/36Z75Lr🔥Nintendo Switch Animal Crossing: New Horizons: https://amzn.to/372qXgx🔥Nintendo Switch Lite Turquoise: https://amzn.to/3lLWUhc🔥Mercury Razer Kraken: https://amzn.to/33VmACd🔥HyperX CloudX Flight Headset: https://amzn.to/2SRV8yS🔥ASUS ROG Strix Scar 17: https://amzn.to/3lLMwGC🔥Razer Viper Ultimate Mice: https://amzn.to/2Iw09eJ🔥Razer Tartarus Pro: https://amzn.to/374MXrs🔥Razer Tartarus v2: https://amzn.to/2FwW0WI🔥Bose Solo 5 TV Soundbar: Bose Solo 5 TV Soundbar🔥Bose SoundLink Speaker II: https://amzn.to/31212Sq🔥ELEGIANT 2.1 Speakers:https://amzn.to/3jXt3SG🔥RGB Govee Light Strip: https://amzn.to/314jWbi🔥Razer Basilisk Ultimate HyperSpeed: https://amzn.to/3716J6T🔥Samsung 970 EVO SSD 1TB M.2: https://amzn.to/3k8RaxC🔥Pudding Keycaps: https://amzn.to/3jXtWL0FTC Disclosure: Amazon links provided are linked to my Amazon Affiliate account & support the channel at no extra cost to you.My Setup Gear! https://www.amazon.com/shop/influencer-24d38060My Camera Gear: • BlackMagic URSA Mini Pro Camera: https://amzn.to/2DD1nSt• BMPCC 6k Camera: https://amzn.to/2R4ckAZ• Sigma 18-35 Lens: http://amzn.to/29vcOZD• Sigma 50mm: https://amzn.to/2YAKsVT• Manfrotto Tripod & Head: http://amzn.to/29vcRVi• Sennheiser MKH416 Mic: http://amzn.to/2iOo9bVMusic: Esbe - http://www.switchy.bandcamp.com"
"jEd29NY7Yvg","Eliminatorias | Chile vs Colombia | Fecha 2","2020-10-14T03:03:10Z","UCzU8-lZlRfkV3nj0RzAZdrQ","CONMEBOL","17","20.18.10","fútbol|pelota|gol|copa|libertadores|sudamericana|eliminatorias|mundial","1069612","0","0","3600","https://i.ytimg.com/vi/jEd29NY7Yvg/default.jpg","False","True","Chile 🇨🇱 y Colombia 🇨🇴 igualaron 2-2 en la segunda fecha de las #EliminatoriasSudamericanas.﻿Suscríbete I Inscreva-se I Subscribe: http://bit.ly/CONMEBOLFacebook: facebook.com/CONMEBOLInstagram: instagram.com/conmebol/Twitter: twitter.com/CONMEBOL"
"l2b02sUKf0I","Oculus Quest 2 | Break Free","2020-10-13T00:23:30Z","UC766vkQw0Mz3VtXX5XvXxGQ","Oculus","20","20.18.10","oculus quest 2|oculus|oculus quest|oculus rift|quest 2|oculus rift s|oculus store|oculus quest 2 pre order|oculus quest games|oculus go|oculus quest 2 games|occulus|oculus quest 2 release date|oculus quest store|oculus 2|oculus vr|oculus download|vr|oculus app|occulus quest 2|oculus software|vr headset|oculus link|rift s|oculus link cable|facebook horizon|quest 2 pre order|oculus games|quest 2 oculus|oculus rift 2|occulus quest","21995715","18610","9092","2318","https://i.ytimg.com/vi/l2b02sUKf0I/default.jpg","False","False","Why play the same old way when you can play for real? The new Oculus Quest 2 finally takes gaming to the next level. Learn more at Oculus.com"
"aXwB1BXCUko","Hozwal ❌ Jay Wheeler - Cual De Los Dos 🥀 ( VIdeo Oficial )","2020-10-12T22:00:17Z","UCYopTA1SG3KGd8riW4aQj5g","Hozwal","10","20.18.10","cual|los|dos|hozwal|wheeler|jay|🥀❌🥀|outlook hozwal|wheeler jay|hozwal outlook|cualdelosdos|jaywheeler|los burla|jay wheeler real name|hozwal freestyle|hozwal jay wheeler cual de los dos|Sold Out Entertainment|jay wheeler hozwal cual de los dos|cual de los dos|burla los|freestyle hozwal|jay wheeler ft. hozwal - cual de los dos|hozwal & jay wheeler|cual los dos|hozwal y jay wheeler|hozwal X jay wheeler|hozwal wheeler jay cual de los dos|cuallosdos","1044693","42157","392","491","https://i.ytimg.com/vi/aXwB1BXCUko/default.jpg","False","False","Sold Out Entertainment presenta a Hozwal ft Jay Wheeler Cual De Los Dos#HOZWAL #JAYWHEELER@Hozwal @Jay Wheeler Plataformas Digitales: https://song.link/mmwVft5TWQwzCSubscribete: https://www.youtube.com/channel/UCYop...Follow Me / Sigueme en:APPLE MUSIC: https://apple.co/2NzI3IEFACEBOOK: https://www.facebook.com/Hozwal/INSTAGRAM: https://www.instagram.com/hozwal_/TWITTER: https://twitter.com/Hozwal3SPOTIFY: https://spoti.fi/2JLdSfmSOUNDCLOUD: http://bit.ly/2r9P36kTIKTOK: https://vm.tiktok.com/po5MeP/PANDORA: https://pandora.app.link/SmHOSNOVY4Booking: soldoutmanagementpr@gmail.comMusic Video by Hozwal ft Jay Wheeler performing Cual De Los Dos © 2020 Sold Out Entertainment LLC#cuallosdos"
"7rXSXZLZNu0","SIDEMEN play AMONG US but Tobi gets his REVENGE (Sidemen Gaming)","2020-10-13T18:00:02Z","UCh5mLn90vUaB1PbRRx_AiaA","MoreSidemen","22","20.18.10","sidemen|moresidemen|miniminter|ksi|zerkaa|behzinga|tbjzl|vikkstar|wroetoshaw","3887751","225301","1237","5079","https://i.ytimg.com/vi/7rXSXZLZNu0/default.jpg","False","False","#SidemenGaming• Sidemen: http://www.youtube.com/Sidemen• Sidemen Clothing: http://www.sidemenclothing.com• Sidemen Twitter: https://twitter.com/Sidemen---------------------------------------------------------------------Sidemen:• Miniminter: http://www.youtube.com/Miniminter• Zerkaa: http://www.youtube.com/Zerkaa• Behzinga: http://www.youtube.com/Behzinga• Vikkstar123: http://www.youtube.com/Vikkstar123• TBJZL: http://www.youtube.com/TBJZL• Wroetoshaw: http://www.youtube.com/Wroetoshaw• KSI: http://www.youtube.com/KSIedited by https://twitter.com/chipfat_"
"O97dPDkUGg4","Replay - New Shepard Mission NS-13 Webcast","2020-10-13T13:56:07Z","UCVxTHEKKLxNjGcvVaZindlg","Blue Origin","28","20.18.10","[none]","227817","4986","212","772","https://i.ytimg.com/vi/O97dPDkUGg4/default.jpg","False","False","Blue Origin successfully completed the 13th New Shepard mission on October 13, 2020. New Shepard flew 12 commercial payloads to space on this mission, including the Deorbit, Descent, and Landing Sensor Demonstration with NASA’s Space Technology Mission Directorate under a Tipping Point partnership. This was the first payload to fly mounted on the exterior of a New Shepard booster rather than inside the capsule, opening the door to a wide range of future high-altitude sensing, sampling, and exposure payloads. Also on board were tens of thousands of postcards from students around the world from Blue Origin’s nonprofit, Club for the Future, some of which will include a special NASA Artemis stamp.  With this successful mission, New Shepard has flown more than 100 payloads to space across 10 sequential flights. All mission crew supporting this launch exercised strict social distancing and safety measures to mitigate COVID-19 risks to personnel, customers, and surrounding communities. Learn more about this mission and the payloads flown on New Shepard on BlueOrigin.com: https://bit.ly/367AcM3."
"va4P3RKW7T0","Television is a Confusing, Expensive Mess","2020-10-11T18:37:37Z","UCTSRIY3GLFYIpkR2QwyeklA","Drew Gooden","23","20.18.10","drew gooden|comedy|commentary|reaction|vine|drew gooden vine|road work ahead guy|parody|rant|cringe|television|tv|cable|fox|masked singer|i can see your voice|ken jeong|netflix|hulu|scam|rip-off|cable sucks|spectrum|comcast","1766293","163861","861","16817","https://i.ytimg.com/vi/va4P3RKW7T0/default.jpg","False","False","Use code 80IMALITTLESTINKER to get $80 off across 5 HelloFresh boxes, including free shipping on your first box at https://bit.ly/2WGF2dwAt first I was just confused, but now I'm mad.merch:https://www.drewgoodenshop.com/follow me:twitter - https://www.twitter.com/drewisgoodeninstagram - https://www.instagram.com/drewisgooden"
"1kpl3kcAQWg","Special Delivery - LTT Edition","2020-10-12T16:58:14Z","UCp3yVOm6A55nx65STpm3tXQ","Craft Computing","28","20.18.10","Linus|LTT|Linus Worst Trade|Oregon Wildfire 2020|Reddit fire PC","335646","44962","253","2565","https://i.ytimg.com/vi/1kpl3kcAQWg/default.jpg","False","False","Regular Redditors will undoubtedly have seen a picture of this PC, courtesy of the Oregon Wildfires. @Linus Tech Tips and @Craft Computing teamed up to make it right again. Check out their build video here: https://youtu.be/l8gcCn_AVfgAffiliate links when? https://www.lttstore.comCheck out the parts from /u/NeverLuckyChozo's new PCAMD Ryzen 5 3600X: https://amzn.to/33UIoOtAsus PRIME B450-Plus: https://amzn.to/33RoL9MGigabyte RTX 2080 Super: https://amzn.to/34Qt2JJSamsung 970 Evo 2TB: https://amzn.to/36RdmsyCorsair RM650x 80+Gold PSU: https://amzn.to/2GY9DhIGigabyte C200 Tempered Glass Case: https://amzn.to/36TBj2oLG 27GK750F-B 1080p/240hz Monitor: https://amzn.to/3lxa15OFind the parts I recommend on my Amazon store: https://www.amazon.com/shop/craftcomputingFollow me on Twitter @CraftComputingSupport me on Patreon and get access to my exclusive Discord server.  Chat with myself and the other hosts on Talking Heads all week long.  https://www.patreon.com/CraftComputingMusic:Leopard Print Elevator by Kevin MacLeodLink: https://incompetech.filmmusic.io/song/3974-leopard-print-elevatorLicense: http://creativecommons.org/licenses/by/4.0/"
"uCl-rOE2jA4","Stephen A. to LeBron: 'Consider yourself disrespected ... you'll never be my No. 1' over MJ | Get Up","2020-10-13T14:35:12Z","UCiWLfSweyRNmLpgEHekhoAg","ESPN","17","20.18.10","espn|#espn|lebron|lebron james|lebron espn|lebron james espn|lebron interview|nba|nba espn|espn nba|#nba|nba 2020|lakers|la lakers|los angeles lakers|lebron lakers|lebron james lakers|lakers lebron|lebron title|lebron james title|lakers title|los angeles lakers title|nba finals|nba finals espn|nba finals 2020|2020 nba finals|nba finals lakers|lakers nba finals|lebron lakers espn|get up|get up lebron|get up nba|#getup|espn get up|get up espn","977936","14198","2930","10615","https://i.ytimg.com/vi/uCl-rOE2jA4/default.jpg","False","False","Watch Part 2: https://youtu.be/F_cNRJj_EnMMike Greenberg makes the case that LeBron James should be included in the Mount Rushmore of the greatest players in NBA history after leading the Los Angeles Lakers to the 2020 NBA championship, then Stephen A. Smith and Marcus Spears have a heated debate about LeBron vs. Michael Jordan.#GetUp #NBA✔️Subscribe to ESPN+https://plus.espn.com/✔️ Get the ESPN App: http://www.espn.com/espn/apps/espn✔️Subscribe to ESPN on YouTube: http://es.pn/SUBSCRIBEtoYOUTUBE✔️ Subscribe to NBA on ESPN on YouTube: http://bit.ly/SUBSCRIBEtoNBAonESPN✔️ Watch ESPN on YouTube TV: http://es.pn/YouTubeTVESPN on Social Media:► Follow on Twitter: http://www.twitter.com/espn► Like on Facebook: http://www.facebook.com/espn► Follow on Instagram: http://www.instagram.com/espnVisit ESPN on YouTube to get up-to-the-minute sports news coverage, scores, highlights and commentary for NFL, NHL, MLB, NBA, College Football, NCAA Basketball, soccer and more. More on ESPN.com: https://www.espn.com"
"ff1GJHq5W2o","iPhone 12 and iPhone 12 Pro!  Can ANYTHING Else Compete?!","2020-10-13T19:54:23Z","UCqvULRRboZeXVezSm_XduLQ","The Everyday Dad","28","20.18.10","the everyday dad|iPhone 12 event|iPhone 12 pro event|new iPhone|brand new iPhone|apple phone","43461","1392","102","367","https://i.ytimg.com/vi/ff1GJHq5W2o/default.jpg","False","False","The Apple Event for the iPhone 12 and the 12 Pro just happened today so lets go through all the options and see what these new devices will bring in the days and weeks ahead.Will this be a total revolution in the cell phone market?Let's find out!YOU Should TRY the iPad Pro, And Here's Why!https://www.youtube.com/watch?v=0giLOGVtgqY&t=121sFollow me on Twitter!https://twitter.com/every_daydadFollow me on Facebook!https://www.facebook.com/theeverydaydad/Support us on Patreon!https://www.patreon.com/theeverydaydad———————What Gear I Recommend!——————————First MacBook (MacBook Pro 13)https://geni.us/lGYHZBest Macbook (MacBook Pro 16)https://geni.us/oqeQnBest Travel Professional Windows Laptop (XPS 15)https://geni.us/Ps1E4fBest Power Windows Laptop (Razer Blade 15)https://geni.us/ck9qCh3Best Thunderbolt 3 Dock (cal digit TS3 Plus)https://geni.us/kxHkrwBest Beginner YouTube Camera (Sony A6400)https://geni.us/D9Abwi2Best Overall YouTube Camera (Lumix GH5)https://geni.us/JOb6VBBest Advanced YouTube Camera (Blackmagic Pocket 4k)https://geni.us/8T1kJz—————What Gear I Use!————————————————Main Camerahttps://geni.us/8T1kJzMain Lenshttps://geni.us/OaxjTSecondary Camerahttps://geni.us/JOb6VBSecondary Lenshttps://geni.us/1teeRRMain Computerhttps://geni.us/oqeQnDISCLAIMER: This video and description contains affiliate links, which means that if you click on one of the Amazon product links, I’ll receive a small commission."
"m0eKn7wsCaQ","Amy Coney Barrett's Supreme Court confirmation hearings | Day 2","2020-10-14T02:35:11Z","UCXIJgqnII2ZOINSWNOGFThA","Fox News","25","20.18.10","Fox News|Judge Amy Coney Barrett|Trump SCOTUS|Supreme Court Justices|Trump SCOTUS pick|Donald Trump|Amy Coney Barrett nomination|US Supreme Court|Amy Coney Barrett|Barrett confirmation hearings|Senate Judiciary Committee|Judge Amy Coney Barrett hearings|SCOTUS confirmation hearing|Supreme Court nominee|Amy coney barrett confirmation hearing|fox live stream|Amy Coney Barrett live|amy coney barrett opening statement|amy coney barrett hearing|Supreme Court","1532912","26721","2931","1097","https://i.ytimg.com/vi/m0eKn7wsCaQ/default.jpg","False","False","The Senate Judiciary Committee hearings for Supreme Court nominee Amy Coney Barrett continue Tuesday morning.Subscribe to Fox News! https://bit.ly/2vBUvASWatch more Fox News Video: http://video.foxnews.comWatch Fox News Channel Live: http://www.foxnewsgo.com/FOX News Channel (FNC) is a 24-hour all-encompassing news service delivering breaking news as well as political and business news. The number one network in cable, FNC has been the most-watched television news channel for 18 consecutive years. According to a 2020 Brand Keys Consumer Loyalty Engagement Index report, FOX News is the top brand in the country for morning and evening news coverage. A 2019 Suffolk University poll named FOX News as the most trusted source for television news or commentary, while a 2019 Brand Keys Emotion Engagement Analysis survey found that FOX News was the most trusted cable news brand. A 2017 Gallup/Knight Foundation survey also found that among Americans who could name an objective news source, FOX News was the top-cited outlet. Owned by FOX Corporation, FNC is available in nearly 90 million homes and dominates the cable news landscape, routinely notching the top ten programs in the genre. Watch full episodes of your favorite showsThe Five: http://video.foxnews.com/playlist/longform-the-five/Special Report with Bret Baier: http://video.foxnews.com/playlist/longform-special-report/The Story with Martha Maccallum: http://video.foxnews.com/playlist/longform-the-story-with-martha-maccallum/Tucker Carlson Tonight: http://video.foxnews.com/playlist/longform-tucker-carlson-tonight/Hannity:  http://video.foxnews.com/playlist/longform-hannity/The Ingraham Angle: http://video.foxnews.com/playlist/longform-the-ingraham-angle/Fox News @ Night: http://video.foxnews.com/playlist/longform-fox-news-night/ Follow Fox News on Facebook: https://www.facebook.com/FoxNews/Follow Fox News on Twitter: https://twitter.com/FoxNews/Follow Fox News on Instagram: https://www.instagram.com/foxnews/om/"
"yR6SMtkujOU","Wow..We're like..Parents Now...","2020-10-12T01:16:05Z","UCormlWaYQuDM-ieQ49aUDNA","SLICE n RICE","22","20.18.10","Slice N Rice|slice and rice|slice n rice baby|jerekaius|honest diapers|diapers|baby|new parents|newborn","1317264","147610","828","10624","https://i.ytimg.com/vi/yR6SMtkujOU/default.jpg","False","False","Our Baby will have strong abs from laughing so much hahahah!Subscribe or Matt has to use dirty diapers as pillows.----------------------------------------------------------------Follow us or Glory will get socks for Christmas.www.facebook.com/itzslicenricewww.instagram.com/slicenricewww.twitter.com/itzslicenrice----------------------------------------------------------------Send us Mail!10999 Red Run Blvd STE 205 #344 Owings Mills, MD 21117"
"FxqLVeR-s84","Explaining Naruto's Third Great Ninja War","2020-10-12T23:22:40Z","UCeo3JUEsPIaeowbIkdu9AXg","Swagkage","24","20.18.10","naruto|naruto shippuden|naruto explained|naruto shippuden explained|swagkage|swagkage naruto|swagkage naruto shippuden|top 5 naruto fights|rinnegan explained|eight gates explained|naruto great ninja wars|first great ninja war|first great ninja war explained|naruto first great ninja war|uchiha vs hokage|third great ninja war|3rd great ninja war|naruto 3rd great ninja war|3rd great ninja war explained|naruto third great ninja war explained","227253","21320","112","2275","https://i.ytimg.com/vi/FxqLVeR-s84/default.jpg","False","False","Finally done with all of these! Unless you guys want a fourth war video for some reason, lol.Check out my webcomic: https://www.webtoons.com/en/challenge/high-art/list?title_no=389424Support the webcomic on Patreon: https://www.patreon.com/highartcomic?fan_landing=trueCheck out the artist on Instagram: https://www.instagram.com/jacobnobleart/?hl=en-------------------------------------------------------------------Follow me on Twitter: https://www.twitter.com/swagkageSubscribe to the channel: https://www.youtube.com/channel/UCeo3JUEsPIaeowbIkdu9AXg?sub_confirmation=1Outro music: https://www.youtube.com/watch?v=sQ8vyQkkItk"
"NgIIHCmyiRY","SEC Shorts - Alabama, Florida, and LSU are forced to attend after-school defensive tutoring","2020-10-12T13:00:08Z","UCUOZvgB9Q8AgZjjLYcLWztQ","SEC Shorts","23","20.18.10","florida gators|alabama crimson tide|lsu tigers|sec shorts","420704","9028","176","1365","https://i.ytimg.com/vi/NgIIHCmyiRY/default.jpg","False","False","After a Saturday of historically bad SEC defensive performances, some of the top teams in the league are forced to attend an after-school defensive tutoring class to see if they can fix some of their issues."
