video_id,title,publishedAt,channelId,channelTitle,categoryId,trending_date,tags,view_count,likes,dislikes,comment_count,thumbnail_link,comments_disabled,ratings_disabled,description
"1V_03efSkg0","$300,000 Influencer Trivia Tournament!","2020-10-18T00:19:57Z","UCX6OQ3DkcsbYNE6H8uQQuVA","MrBeast","24","20.18.10","Creator Games|MrBeast|Mr Beast|Creator Games 2","13385663","979800","15429","52952","https://i.ytimg.com/vi/1V_03efSkg0/default.jpg","False","False","A trivia elimination tournament to see who is the smartest creator in the world! Last one standing receives $300,000 to give to their subscribers. Competitors: Addison Rae vs. GeorgeNotFound KSI vs. Rosanna Pansino Mark Rober vs. Gibi   Safiya Nygaard vs. Kwebbelkop Charli & Dixie D'Amelio vs. Preston Arsement Yes Theory vs. Bretman Rock Typical Gamer vs. Lexi Rivera  Dream vs. MatPat & Steph   Alex Warren vs. Lazarbeam  Matt Stonie vs. Marques Brownlee  Laurenzside  vs. ZHC  Swoozie vs. Jaiden Animations"
"yyLxPpCi5Bk","Mixing Every Nail Polish in My Brand Together (What Colour Will It Be?👀)","2020-10-17T15:29:50Z","UCGCVyTWogzQ4D170BLy2Arw","Simply Nailogical","24","20.18.10","nails|nail art|nail tutorial|beauty tutorial|nail art tutorial|diy nails|diy nail art|simply nailogical|cristine|mixing|mixing all my|mixing nail polish|holo taco|birthday|simply birthday|simplynailogical bday|got cake|mixing makeup|Frankenstein|frankenpolish|what happens when you mix","1451446","82682","1618","16425","https://i.ytimg.com/vi/yyLxPpCi5Bk/default.jpg","False","False","Happy Birthday to ME, who wants some Got Cake? Shop➡️ http://holota.co/simplybdayGot boring nails? Just add a Holo Taco 💿🌮 Sign up for email updates to be notified about restocks ➡️ http://holota.co/holothere1 ♡ Subscribe to never miss n̶e̶w̶ ̶n̶a̶i̶l̶ ̶a̶r̶t̶ ̶t̶u̶t̶o̶r̶i̶a̶l̶s̶! http://bit.ly/subsimply♡ Subscribe to Holo Taco (for nail videos lol): http://bit.ly/SubHoloTaco♡ Subscribe to the Podcast to hear me have adult conversations: http://bit.ly/SubSimplyPodLogical_ _ _ _ _ _ _ _ _ _ _ _ _ _ _ _ _ _ _ _ _ _ _ _ _ _ _ _ _ _ _ _ _ _♡PRODUCTS USED IN THIS VIDEO:♡💿🌮💅🎂H O L O  T A C O  S I M P L Y  B D A Y  P O L I S H:Got Cake? NOW AVAILABLE➡️ http://holota.co/simplybday$13 (USD) multi-dimensional icy nail polish packed with holo flakies, silver foil flakes, and purple iridescent shimmer🥳***This is a LIMITED EDITION polish in a custom lilac holo box. We made one big birthday bash batch which I hope is enough for everyone who wants one to enjoy! Once it sells out, we will not be restocking it.***...this video also included every single other nail polish we've ever made at Holo Taco but I'll spare myself the typing😂Follow the holo:https://www.instagram.com/holotaco/https://twitter.com/holotacohttps://www.facebook.com/holotaco/Other Simply mixing videos:http://bit.ly/MixingTeashttp://bit.ly/Mixing500Holoshttp://bit.ly/MixingNailPowders_ _ _ _ _ _ _ _ _ _ _ _ _ _ _ _ _ _ _ _ _ _ _ _ _ _ _ _ _ _ _ _ _ _Stalk me on all the social medias!http://instagram.com/simplynailogicalhttps://www.snapchat.com/add/simplynailogicahttps://twitter.com/nailogicalhttps://www.facebook.com/simplynailogicalhttp://www.simplynailogical.com (archival materials)My other YouTube channels:https://www.youtube.com/simplypodlogicalhttps://www.youtube.com/holotacohttps://www.youtube.com/simplynotlogical_ _ _ _ _ _ _ _ _ _ _ _ _ _ _ _ _ _ _ _ _ _ _ _ _ _ _ _ _ _ _ _ _ _I film my nail videos with this camera: http://amzn.to/1MgznhtThis 105mm macro lens: http://amzn.to/1Pi8PM3I filmed my face in this video with this camera: https://amzn.to/327OB7bThis lens: https://amzn.to/38HnBgUAudio recorder: https://amzn.to/3dbtg1wExternal mic: https://amzn.to/32AnO3gRing light for face-cams: http://amzn.to/2cU7cNOI edit my videos with: http://bit.ly/videoeditor1I get some cool editing filters from: https://motionvfx.sjv.io/Ze3bRCheck out my personalized Amazon page with stuff I like! https://www.amazon.com/shop/simplynailogicalMusic: http://share.epidemicsound.com/SIMPLY_ _ _ _ _ _ _ _ _ _ _ _ _ _ _ _ _ _ _ _ _ _ _ _ _ _ _ _ _ _ _ _ _ _Disclaimer cause I love you guys: I didn't pay myself specifically to make this video for Holo Taco but I do benefit from Holo Taco sales😊 Some other links above are affiliate links."
"4t8UEWrOWsY","Teofimo Lopez Upsets Vasiliy Lomachenko to become Undisputed Lightweight Champion | FIGHT HIGHLIGHTS","2020-10-18T05:35:32Z","UCbzRzJNHx7ZLlJML9BjZQVQ","Top Rank Boxing","17","20.18.10","vasyl lomachenko|vasiliy lomachenko|vasyl lomachenko highlights|vasiliy lomachenko highlights|vasiliy lomachenko vs teofimo lopez full fight|vasiliy lomachenko vs teofimo lopez highlights|vasiliy lomachenko vs teofimo lopez|teofimo lopez highlights|teofimo lopez knockouts|teofimo lopez vs vasiliy lomachenko full fight|teofimo lopez vs vasiliy lomachenko|loma vs lopez|loma vs lopez highlights|#LomaLopez|teofimo lopez|teofimo lopez vs vasiliy lomachenko highlights","795164","9764","1066","4183","https://i.ytimg.com/vi/4t8UEWrOWsY/default.jpg","False","False","Watch #highlights from the main event of #LomaLopez featuring #TeofimoLopez and 3VasiliyLomachenko. In the fight Lopez dominated early and finished strong late to become the undisputed lightweight champion. Next up for Top Rank Boxing, the lightweight unification showdown between WBC Franchise/WBA/WBO world champion Vasiliy Lomachenko and IBF kingpin Teofimo Lopez will take place Oct. 17 on ESPN.The Lomachenko vs. Lopez telecast begins at 10 p.m. ET/7 p.m. PT and airs on ESPN and ESPN Deportes. The 10-round junior welterweight co-main features former world title challenger Alex Saucedo against unbeaten contender Arnold Barboza Jr.In the eight-round ESPN-televised opener, super middleweight knockout sensation Edgar Berlanga tests his perfect record against veteran Lanell Bellows. Berlanga (14-0, 14 KOs) has won all 14 of his professional fights by first-round stoppage.  Try ESPN+ For Free: https://watch.espnplus.com/toprank/Subscribe to our YouTube channel to get notified about the latest highlights, free full fights, and fight week content as it's posted.Follow Top Rank on Twitter: http://www.twitter.com/trboxingFollow Top Rank on Instagram: http://www.instagram.com/toprankLike Top Rank on Facebook: http://www.facebook.com/trboxing"
"9ZZzfrapNvo","Watch ABC News Joe Biden Town Hall in Philadelphia Moderated by George Stephanopoulos","2020-10-16T03:13:51Z","UCBi2mrWuNuyYy4gbM6fU18Q","ABC News","25","20.18.10","election|2020 election|presidential election|joe biden|joe biden voters|joe biden town hall|joe biden debate|joe biden trump|trump debate|joe biden virtual debate|trump virtual debate|biden abc news|bident abc news town hall|abc news town hall|vice president and the people|abc news special|biden election|trump election|biden polls|trump polls|philadelphia|biden philadephia|philadelphia town hall|news|abc news|us news|politics|politics news","5399128","65223","28960","0","https://i.ytimg.com/vi/9ZZzfrapNvo/default.jpg","True","False","#JoeBiden #BidenTownHall #Election2020 #Vote2020 #VicePresidentAndThePeople #ABCNewsLATEST UPDATES: https://abcn.ws/2H2PV4BSchedule of events: 7pm ET: ABC News Prime8p ET: Town hall9:30p ET: Post-showSUBSCRIBE to ABC NEWS: https://bit.ly/2vZb6yPWatch More on http://abcnews.go.com/LIKE ABC News on FACEBOOKhttps://www.facebook.com/abcnewsFOLLOW ABC News on TWITTER:https://twitter.com/abc"
"VDBc1etieAA","Brawl Stars: Brawl Talk! LEGENDARY Brawler, Brawl-o-ween, and MORE!","2020-10-17T08:00:13Z","UCooVYzDxdwTtGYAkcPmOgOw","Brawl Stars","20","20.18.10","brawl stars|mobile game|mobile strategy game|mobile rpg|mobile battle royale|battle royale|supercell game|legendary|brawl talk|brawloween|haloween|brawler","10550919","669231","7949","59941","https://i.ytimg.com/vi/VDBc1etieAA/default.jpg","False","False","Download NOW!! ►► https://supr.cl/playbrawlBe a BRAWLER! Subscribe! ►► https://supr.cl/subscribeFast-paced 3v3 multiplayer and battle royale made for mobile! Play with friends or solo across a variety of game modes in under three minutes.Unlock and upgrade dozens of Brawlers with powerful Super abilities, Star Powers and Gadgets! Collect unique skins to stand out and show off. Battle in a variety of mysterious locations within the Brawliverse!BATTLE IN MULTIPLE GAME MODES- Gem Grab (3v3): Team up and out-strategize the opposing team. Collect and hold 10 gems to win, but get fragged and lose your gems.- Showdown (Solo/Duo): A battle royale style fight for survival. Collect power ups for your Brawler. Grab a friend or play solo - be the last Brawler standing in the rowdiest battle royale yet. Winner take all!- Brawl Ball (3v3): It's a whole new Brawl game! Show off your soccer/football skills and score two goals before the other team. There are no red cards here.- Bounty (3v3): Take out opponents to earn stars, but don’t let them pick you off. The squad with the most stars wins the match!- Heist (3v3): Protect your team’s safe and try to crack open your opponents’. Navigate the map to sneak, blast and blow your way clear to the enemies treasure.- Special Events: Limited time special PvE and PvP game modes.- Championship Challenge: Join Brawl Stars' esports scene with in-game qualifiers!UNLOCK AND UPGRADE BRAWLERSCollect and upgrade a variety of Brawlers with powerful Super abilities, Star Powers and Gadgets! Level them up and collect unique skins.BRAWL PASSComplete quests, open Brawl Boxes, earn Gems, pins and an exclusive Brawl Pass skin! Fresh content every season.BECOME THE STAR PLAYERClimb the local and regional leaderboards to prove you’re the greatest Brawler of them all!CONSTANTLY EVOLVINGLook out for new Brawlers, skins, maps, special events and games modes in the future.PLEASE NOTE! Brawl Stars is free to download and play, however, some game items can also be purchased for real money. If you don't want to use this feature, please disable in-app purchases in your device's settings. Also, under our Terms of Service and Privacy Policy, you must be at least 9 years of age to play or download Brawl Stars.Features:- Team up for real-time 3v3 battles against players from across the world- A fast-paced multiplayer battle royale mode made for mobile- Unlock and collect new, powerful Brawlers - each with a signature attack and Super ability- New events and game modes daily- Battle solo or with friends- Climb to the top of the leaderboards in global and local rankings - Join or start your own Club with fellow players to share tips and battle together- Customize Brawlers with unlockable skins- Player-designed maps offer challenging new terrain to masterFrom the makers of Clash of Clans, Clash Royale and Boom Beach!Support:Contact us in-game via Settings, Help and Support — or visit http://supercell.helpshift.com/a/brawl-stars/Privacy Policy:http://supercell.com/en/privacy-policy/Terms of Service:http://supercell.com/en/terms-of-service/Parent's Guide:http://supercell.com/en/parents/???:https://www.youtube.com/wkbrl"
"rjwWG6kJ6io","NBC News hosts town hall with President Trump — 10/15/2020","2020-10-16T01:41:38Z","UCvJJ_dzjViJCoLf5uKUTwoA","CNBC","25","20.18.10","CNBC|business|news|finance stock|stock market|news channel|news station|breaking news|us news|world news|cable|cable news|finance news|money|money tips|financial news|Stock market news|stocks","3390446","41385","19426","54124","https://i.ytimg.com/vi/rjwWG6kJ6io/default.jpg","False","False","“TODAY” anchor Savannah Guthrie hosts a live discussion with President Donald Trump in an NBC News town hall event in Miami on Thursday. Trump and Democratic presidential nominee Joe Biden were supposed to hold their second debate on Thursday night but it will instead take place on Oct. 22. » Subscribe to CNBC: https://cnb.cx/SubscribeCNBC» Subscribe to CNBC TV: https://cnb.cx/SubscribeCNBCtelevision» Subscribe to CNBC Classic: https://cnb.cx/SubscribeCNBCclassicAbout CNBC: From 'Wall Street' to 'Main Street' to award winning original documentaries and Reality TV series, CNBC has you covered. Experience special sneak peeks of your favorite shows, exclusive video and more.Connect with CNBC News OnlineGet the latest news: https://www.cnbc.com/Follow CNBC on LinkedIn: https://cnb.cx/LinkedInCNBCFollow CNBC News on Facebook: https://cnb.cx/LikeCNBCFollow CNBC News on Twitter: https://cnb.cx/FollowCNBCFollow CNBC News on Instagram: https://cnb.cx/InstagramCNBCSubscribe to CNBC PRO: https://cnb.cx/2NLi9AN#CNBCNBC News hosts town hall with President Trump — 10/15/2020"
"PoNCG3PZKII","The Eerie Vanishing Of The Flannan Isles Lighthouse Keepers","2020-10-16T22:00:02Z","UCKijjvu6bN1c-ZHVwR7-5WA","BuzzFeed Unsolved Network","22","20.18.10","BuzzFeed|BuzzFeed Unsolved Network|BuzzFeed Unsolved|Unsolved|Mystery|investigation|Ryan bergara|Shane madej|Mini doc|Cold case|Creepy|theories|unsolved mysteries|cold case|unsolved|PL-Unsolved|bizarre|unsolved true crime|PL-UnsolvedTrueCrime-S7|shane madej|buzzfeed unsolved network|PL-UnsolvedTrueCrime|unexplained mysteries|unsolved mystery|unsolved network|ryan and shane|mystery|true crime|The Eerie Vanishing of the Flannan Isles Lighthouse Keepers","1162161","94356","793","8959","https://i.ytimg.com/vi/PoNCG3PZKII/default.jpg","False","False","What happened to the three lighthouse keepers of Flannan Isles?Watch ALL-NEW episodes of Unsolved: True Crime every Friday at 3pm here!: https://www.youtube.com/playlist?list=PLD8iUdp33PqTsix2sGblEQZ8m5FQycC5DCredits: https://www.buzzfeed.com/bfmp/videos/113089MUSICSFX Provided By AudioBlocks(https://www.audioblocks.com)Licensed via Audio NetworkWelcome to the BuzzFeed Unsolved Network! This channel is your one-stop destination for all things mystery, conspiracy, supernatural, true crime, and everything in between. Subscribe here: http://bit.ly/2zuaR06.STILLSVintage poster for magic performance - Magician tricks show retro flyer designlukeruk/Getty ImagesBearded fisherman on his ship.Tina Terras & Michael Walter/Getty ImagesPortrait of confident surfer standing at beachCavan Images/Getty ImagesFaces of Business - Confident Colour ImageJohnnyGreig/Getty Imagesconcrete polished texture backgroundchingraph/Getty ImagesMid twenties British male stood on a beachJamie Garbutt/Getty ImagesSouth Africa, portrait of white haired man wearing turtleneck standing on beach dunes before sunriseWestend61/Getty ImagesPortrait of mature man on the beachOliver Rossi/Getty ImagesMan At Helm of Yacht During a Sydney Stormdavidf/Getty ImagesDiverse People SmilingJohnnyGreig/Getty ImagesWe're all special in our own wayYuri_Arcurs/Getty ImagesSustainability portraitRichard Drury/Getty ImagesLondon Antique Viewnicoolay/Getty ImagesChevy Impala Grillxydous/Getty ImagesLighthouse on the Isle of Ornsay seen from Isle of Skye in Scotland. Exposed seaweed and mudflat at low tidehopsalka/Getty ImagesBusiness Forecastingguvendemir/Getty ImagesRed door in old stone lighthouse - squareJohn Fader/Getty ImagesMens Waterproof Winter JacketKypros/Getty ImagesEilean Musdile Lighthouse, in the West Coast of Scotland, seen from the sea with clouds in the skyEduardoRM/Getty ImagesBarbaria Lighthouse in formentera Islan in spain with a cloudy sky before an stormVictor Fernandez/Getty ImagesAntique photo: Tantallon Castle shipilbusca/Getty ImagesSailship in the open sea on a sunny summer dayalekseystemmer/Getty ImagesLighthouse on sand dunes in Cape Cod beachlucky-photographer/Getty ImagesRustic Wooden Door on Adobe Building Wallsanfel/Getty ImagesScotland blue loch reflecting green mountainsEasyturn/Getty ImagesUnited Kingdom Country 3D Render Topographic MapFrankRamspott/Getty ImagesDramatic stormy dark cloudy sky over seaeugenesergeev/Getty ImagesFingerprint on white backgroundPeter Dazeley/Getty ImagesVintage light bulbschoness/Getty ImagesRustic Cabin InteriorTimAbramowitz/Getty ImagesSet of various paint splattersitchySan/Getty ImagesLighthouse in MenorcaSensorSpotVIDEOflight over a water surface to green screenvitanovski/Getty Imagesman on the boat at sunsetUgreen/Getty Imagescrashing waves on pier docks, sea spray, hurricane gale force wind storm, bird coasting, Icelandhumanizr_AV/Getty ImagesKnocking on Wooden Doortavi_repede/Getty ImagesRescue flight over the stormy ocean HD loopbaska8777/Getty ImagesCoastal lighthouse. Lindesnes Lighthouse is a coastal lighthouse at the southernmost tip of Norway.cookelma/Getty ImagesWaves breaking on the pier,stones.Vladislav Pavlenko/Getty ImagesGreen screen of moving white clouds with 4K resolution.Bubball/Getty ImagesSLOW MOTION: Carefree man dives off a rocky cliff and into the deep blue sea.helivideo/Getty ImagesWalking in transparent water of mountain river. Undewater viewHotFlash/Getty ImagesSlow motion of a cold dark sea wave beating against an ancient concrete breakwater late in the eveningIVAN ZHURAULIOU/Getty ImagesHeavy seas spray mist as they crash into rocks on the shore.Discovery Access/Getty ImagesMountain trail in the mountains Old Man of Storr in ScotlandShaiith/Getty ImagesDepressed Sad Young Man Sitting on Rock By The Beach While Staring at OceanYuriFineart/Getty ImagesThe man running on a beautiful mountain and doing exercise. slow motionArtem Peretiatko/Getty ImagesLarge Crashing Waves Hit Taiwan Coastline During Tropical Storm BailuJames Reynolds - Footage/Getty ImagesFurious aggressive man beats with his fists the lying person outdoor at forestmagicmore/Getty ImagesClose Up of Two Male Hands Gently Touching and Holding Each Other. Cute Queer Relationship Concept. Gay Couple are Casually Dressed. Room is Bright and Sunny.gorodenkoff/Getty ImagesSignal Flare Held Up In SnowstormRockfordMedia/Getty ImagesDepressive man in dark room standing by the windowstevanovicigor/Getty ImagesA hand in the water calling for help.otofx/Getty ImagesHigh wave breaking on the rocks of the coastline. Extremely Big Wave crushing coast , Large Ocean Beautiful Wave. Super Slow Motion.volkovslava/Getty ImagesMan jumping off cliff into the ocean.grdenis/Getty ImagesSLOW MOTION: Powerful ocean wave splashes across a big rock in the middle of seahelivideo/Getty ImagesTeenager boy swimming"
"G2CS57pGmWM","Live stream: Save Our Stages Fest Day 2","2020-10-18T06:59:53Z","UCtsSxxdIo3jwfo-1RQ0itPg","NIVA National Independent Venue Association","10","20.18.10","save our stages|saveourstages|niva|national independent venue association|sosfest|sos fest|save our stages fest|saveourstages fest|saveourstagesfest|save our stages festival|niva festival|sos festival|sosfestival|saveourstagesfestival|live concert|stream concert|music festival live|live music festival|streaming music|streaming concert|streaming festival|niva fest|festival niva","259773","3668","208","23","https://i.ytimg.com/vi/G2CS57pGmWM/default.jpg","False","False","Welcome to Day 2 of Save Our Stages Fest - a three-day virtual benefit festival with artists and organizations rallying to the aid of independent music venues at risk of closing their doors permanently. Featuring original performances and commentary from diverse talent across genres and shot live at iconic indie stages, #SOSFEST aims to preserve our nation’s independent live music scene. The festival is raising funds for the NIVA Emergency Relief Fund, where any member organization can apply for support - please consider helping by clicking the blue Donate button.  Saturday October 17th (all times PT) 1:00pm - Jason Mraz at Belly Up Tavern 1:40pm - Adam Melchor at The Hotel Cafe2:10pm - Kelsea Ballerini at Exit/In2:40pm - JP Saxe at Troubadour 3:15pm - Cautious Clay at World Cafe Live3:55pm - Bea Miller at Teragram Ballroom4:35pm - Gus Dapperton at (Le) Poisson Rouge5:15pm - Phoebe Bridgers at Troubadour 6:00pm - Rise Against at Metro6:25pm - Brittany Howard at Ryman Auditorium 6:55pm - Leon Bridges at Troubadour 7:15pm - Miley Cyrus at Whisky a Go Go7:35pm - Foo Fighters at Troubadour 8:10pm - The Roots at Apollo Theater 9:20pm - Portugal. The Man at Crystal Ballroom10:10pm - Major Lazer at Gramps Sunday October 18th (all times PT)watch here: https://youtu.be/hhdfLh6bCLM2:00pm - Little Big Town at Exit/In2:35pm - Brothers Osborne at Mercy Lounge 3:05pm - Dave Matthews (Solo) at The Jefferson Theater3:40pm - Monica at Center Stage3:55pm - Black Pumas at The Parish4:10pm - Nathaniel Rateliff at Boulder Theater4:50pm - Reba McEntire at Ryman Auditorium 5:30pm - The Revivalists at Tipitina's 6:05pm - The Lumineers at Boulder TheaterAbout NIVA: Formed at the onset of the COVID-19 shutdown, National Independent Venue Association (NIVA), now represents more than 2,800 members in all 50 states and Washington, D.C. These independent venues and promoters were the first to close and will be the last to fully reopen. NIVA's mission is to preserve and nurture the ecosystem of independent live venues, promoters and festivals throughout the United States. To learn more about NIVA’s quest to gain federal funding for independent venues, visit https://www.nivassoc.org/take-action. To learn more about the NIVA Emergency Relief Fund, visit https://www.nivassoc.org/erf.  Merch: https://www.nivassoc.org/merch#SaveOurStages"
"d56cdV8yZNQ","A DAY IN THE LIFE WITH CATHERINE","2020-10-16T00:55:14Z","UCWwWOFsW68TqXE-HZLC3WIA","The ACE Family","22","20.18.10","a day in the life with Catherine|the ace family a day in the life with Catherine|ace family a day in the life with Catherine|a day in the life|the ace family|ace family|Catherine Paiz|Catherine McBroom|ace family day in the life","3754348","218000","6903","5494","https://i.ytimg.com/vi/d56cdV8yZNQ/default.jpg","False","False","A DAY IN THE LIFE WITH CATHERINELAST VIDEO: https://www.youtube.com/watch?v=fcz31UkJk4kJOIN THE ACE FAMILY & SUBSCRIBE: http://bit.ly/THEACEFAMILY *TURN ON OUR POST NOTIFICATIONS FOR SHOUTOUTS IN OUR VIDEOS****BUSINESS INQUIRIES : INFO.THEACEFAMILY@GMAIL.COMMAKE SURE YOU LIKE, COMMENT, SHARE & SUBSCRIBE TO OUR YOUTUBE CHANNEL AND FOLLOW US ON OUR FAMILY ADVENTURES!WATCH MORE VIDEOS!!! VLOGS: https://youtube.com/playlist?list=PLq...PRANKS: https://youtube.com/playlist?list=PLq...CHALLENGES: https://youtube.com/playlist?list=PLq...POPULAR VIDEOS: https://youtube.com/playlist?list=PLq...LATEST VIDEOS: https://youtube.com/playlist?list=PLq... STALK US :)"
"mLxd2eU9L8o","(Eng sub) [환불원정대] 환불원정대 쇼! 음악중심 데뷔 무대! (Hangout with Yoo - refund sisters)","2020-10-17T10:45:03Z","UCx6jsZ02B4K3SECUrkgPyzg","놀면 뭐하니?","24","20.18.10","유재석|김태호|무한도전|유플래시|유산슬|뽕포유|라섹|유르페우스|놀면 뭐하니|놀뭐|무도","4846713","187051","2861","24889","https://i.ytimg.com/vi/mLxd2eU9L8o/default.jpg","False","False","★★★More 'Hangout with Yoo' clips are available★★★iMBChttp://www.imbc.com/broad/tv/ent/hangoutwithyoo/vod/WAVVEhttps://www.wavve.com/player/vod?programid=M_1004711100000100000&page=1"
"dUuJDv4VdYA","Miley Cyrus ft. Noah Cyrus Perform “I Got So High That I Saw Jesus” | Miley Cyrus Backyard Sessions","2020-10-17T01:00:04Z","UCxAICW_LdkfFYwTqTHHE0vg","MTV","24","20.18.10","noah cyrus|i got so high that i saw jesus|Miley Cyrus|Adore You|bangerz|2013|miley cyrus album|miley cyrus joe rogan|miley cyrus rogan|miley cyrus bangerz|wrecking ball|billy ray cyrus|miley cyrus arctic monkeys cover|miley cyrus midnight sky|miley cyrus when i look at you|miley cyrus jolene cover|miley cyrus cover|miley cyrus vma 2020|miley cyrus party in the usa|miley cyrus we cant stop|miley cyrus live|miley cyrus slide away|hannah montana","977993","58749","1619","3022","https://i.ytimg.com/vi/dUuJDv4VdYA/default.jpg","False","False","Miley Cyrus, along with Noah Cyrus, performs “I Got So High That I Saw Jesus” unplugged on Miley Cyrus Backyard Sessions. More at https://www.mtv.com/shows/emabjy/mtv-unplugged#MTVUnplugged #MileyCyrus #NoahCyrus #MTVSubscribe to MTV: http://goo.gl/NThuhCMore from MTV:Official MTV Website: http://www.mtv.com/Like MTV: https://www.facebook.com/MTVFollow MTV: https://twitter.com/MTVMTV Instagram: http://instagram.com/mtv#MTV is your destination for the hit series WNO, VMA, Jersey Shore, The Challenge, MTV Floribama Shore, Teen Mom and much more!"
