video_id,title,publishedAt,channelId,channelTitle,categoryId,trending_date,tags,view_count,likes,dislikes,comment_count,thumbnail_link,comments_disabled,ratings_disabled,description
"EdB8iiDG9K4","HALLOWEEN TRANSFORMATION • OH MY Gandhi WITH LIZA","2020-10-15T00:49:05Z","UChoTvF02Cv74FF72OaJtTMA","Liza Koshy Too","23","20.18.10","liza|lizza|lizzza|lizzzavine|lizzzak|lizzzako|koshy|lizakoshy|wednesdays","376874","39831","502","2035","https://i.ytimg.com/vi/EdB8iiDG9K4/default.jpg","False","False","Finding peace during this scary time of year/this whole damn year. Watch me transform into the OG, Gandhi G, in this little peace of content from Halloween 2019. Also, Gandhi vlogs... check him out here: https://www.instagram.com/tv/B4TiLhqFwbK/?hl=en AND thanks to Faina Rudshteyn for my outer peace and her masterpiece: https://www.instagram.com/p/B4VXjCWDOp3/?igshid=17inw2q2x54m9••••••••••••••••••••••••••••••••••••••••­­­•••••••••••Enjoyable music brought to you by:• Soul Prod - Powerful Indian Beat: https://www.youtube.com/watch?v=AcCHA_o24MU••••••••••••••••••••••••••••••••••••••••­­­•••••••••••KEEP UP WITH KOSHY: INSTAGRAM: http://instagram.com/lizakoshyTIKTOK: https://www.tiktok.com/@lizzza?lang=enTWITTER: http://twitter.com/lizakoshy••••••••••••••••••••••••••••••••••••••••­­­•••••••••••Why did I keep tagging @bylizakoshy? Solve the mystery here: www.instagram.com/bylizakoshy••••••••••••••••••••••••••••••••••••••••­­­•••••••••••PLEASE SUBSCRIBE (please):www.youtube.com/lizakoshywww.youtube.com/lizakoshytoo••••••••••••••••••••••••••••••••••••••••­­­•••••••••••Keep on keeping on, y'all. Thank you my G's. All my lovin',Liza"
"mnPU7_iff8Y","[OFFICIAL VIDEO] Be My Eyes - Pentatonix","2020-10-14T19:00:09Z","UCmv1CLT6ZcFdTJMHxaR9XeA","PTXofficial","10","20.18.10","Pentatonix|Penatonix|PTX|PTXofficial|Mitch Grassi|Kirstie Maldonado|Scott Hoying|Avi Kaplan|Matt|Sallee|Kevin|Olusola|K-O.|Cello|Cellobox|Beatbox|A Cappella|Harmony|Acapella|Acappela|Choir|Singing Competition|The Sing-Off|Sing-Off|Reality TV|Sing|Singing|Chorus|Sara Bareilles|Shawn Stockman|Ben Folds|The Voice|Voice|Pitch Perfect|holiday|pentatonix be my eyes|be my eyes|be my eyes pentatonix|pentatonix new music|pentatonix original song|the lucky ones","767714","63940","1007","4060","https://i.ytimg.com/vi/mnPU7_iff8Y/default.jpg","False","False","BE MY EYES AVAILABLE NOW - https://smarturl.it/PTXBEMYEYESTHE LUCKY ONES THE NEW ORIGINAL ALBUM WITH 11 NEW SONGS INCLUDING HAPPY NOW & BE MY EYES. AVAILABLE 2.12.21. PRE-ORDER NOW https://smarturl.it/PTXTHELUCKYONESMAD WORLD AVAILABLE NOW -https://smarturl.it/MADWORLDptx NEW EP ‘AT HOME’ AVAILABLE NOW! BUYhttps://smarturl.it/PTXATHOME?IQid=yt STREAMhttps://smarturl.it/PTXATHOME?IQid=yt JOIN OUR PATREON FAN PAGE!!http://www.patreon.com/pentatonix GO BEHIND THE SCENES OF OUR WORLD TOUR IN OUR PTXPERIENCE VIDEOS:https://smarturl.it/PTXperience GET PTX PRESENTS: TOP POP, VOL. 1 BUYhttp://smarturl.it/PTXTPV1?IQid=yt STREAMhttp://smarturl.it/PTXTPV1?IQid=yt GET PENTATONIX THE ALBUM BUYhttp://smarturl.it/PTXalbum?IQid=yt STREAMhttp://smarturl.it/PTXalbumS?IQid=yt GET PTX VOL. 4 - CLASSICS EP BUYhttp://smarturl.it/PTXVol4iT?IQid=yt STREAMhttp://smarturl.it/StreamPTXVol4?IQid=yt GET PTX VOL III BUYhttp://smarturl.it/PTXVol3?IQId=yt STREAMhttp://smarturl.it/PTXVol3Spot?IQid=yt GET PTX VOL II BUYhttp://smarturl.it/PTXVolume2?IQid=yt STREAMhttp://smarturl.it/PTXV2Spotify?IQid=yt GET PTX VOL I BUYhttp://smarturl.it/PTXVol1?IQid=yt STREAMhttp://smarturl.it/PTXV1Spotify?IQid=yt GET THE BEST OF PENTATONIX CHRISTMAS BUYhttps://smarturl.it/bestofPTXmas?IQid=yt STREAMhttps://smarturl.it/bestofPTXmas?IQid=yt GET CHRISTMAS IS HERE! BUYhttp://smarturl.it/pTXmasIsHere?IQid=yt STREAMhttp://smarturl.it/pTXmasIsHere?IQid=yt GET A PENTATONIX CHRISTMAS (DELUXE) BUYhttp://smarturl.it/APTXmasDlxD?IQid=yt STREAMhttp://smarturl.it/APTXmasDlxD/spotif... GET THAT'S CHRISTMAS TO ME (DELUXE) BUYhttp://smarturl.it/TCTMDlxiT?IQid=yt STREAMhttp://smarturl.it/TCTMDlxS?IQid=yt GET PTXMAS BUYhttp://smarturl.it/PTXmas?IQId=yt STREAMhttp://smarturl.it/PTXmas1Sp?IQid=yt GET PTX PRESENTS: TOP POP, VOL. 1 BUYhttp://smarturl.it/PTXTPV1?IQid=yt STREAMhttp://smarturl.it/PTXTPV1?IQid=yt ON MY WAY HOME THE DOCUMENTARY | AVAILABLE NOW! ITUNES:http://smarturl.it/PTXOMWHi?IQid=yt AMAZON:http://smarturl.it/PTXOMWHDVD?IQid=ythttp://www.ptxofficial.com http://www.twitter.com/ptxofficial @ptxofficial http://www.facebook.com/Pentatonix http://www.instagram.com/ptxofficial @ptxofficial http://www.snapchat.com/add/PTXsnap #Pentatonix #BeMyEyes #TheLuckyOnesDirector: Naomi ChristieProduction Company: Green Glow FilmsExecutive Producer: Stephen Wayne MallettHead of Production: Brooklynn Reeves Mallett Producer: Hans BoysenDirector of Photography: Chris Hadland1st AC: Jared Wennberg2nd AC: Melanie AdamsDIT: Earl FulcherGaffer: Genevieve EvansKey Grip: Danny ValentineBest Boy Electric: Chelsea PetitBest Boy Grip: Philip WoolridgeProduction Designer: Heather DrouillardSet Dresser: Lindsay MinnichCovid Compliance Officer: Patrick SandersonProduction Assistant: Denise DoradoProduction Assistant: Louis SantibanezProduction Assistant: Austin EngemannZoom Tech: Davis MansmannDirector Rep: Laure ScottVideo Commissioner: Melinda KellyArtist Hair: Sami KnightArtist Hair Assist: Alex HenrichsArtist Stylist: Candice Lambert McAndrewsArtist Stylist Assist: Morgan ChelednikArtist Make Up: Anthony NguyenArtist Make Up Assist: Karsen RichardsonEditor: Jonas ThorhallssonVFX Artist: Narendra MoodColor: Loren White – Lookwell"
"BeON-bSbrL4","MONSTER HUNTER – International Trailer","2020-10-14T18:45:00Z","UCz97F7dMxBNOfGYu3rx8aCw","Sony Pictures Entertainment","24","20.18.10","Monster Hunter|Monster Hunter Trailer|Monster Hunter Movie|Milla Jovovich|Ron Perlman|Tony Jaa|Milla Jovovich Monster Hunter|Meagan Good|Diego Boneta|Action Movies|Adventure Movies|New Trailers|New Movie Trailers|Sony|Sony Pictures|Black Diablos|Captain Artemis|Monster Hunter Game|Monster Hunter Video Game|Monster Hunter Scenes|Monster Hunter Movie Clips|Video Game Movies|HD Trailer|#InternationalTrailer|Monster Hunter International Trailer","262506","8885","3544","2251","https://i.ytimg.com/vi/BeON-bSbrL4/default.jpg","False","False","Watch the #MonsterHunterMovie international trailer now - see these big monsters on the big screen, only in cinemas December.Behind our world, there is another: a world of dangerous and powerful monsters that rule their domain with deadly ferocity. When an unexpected sandstorm transports Captain Artemis (Milla Jovovich) and her unit (TI Harris, Meagan Good, Diego Boneta) to a new world, the soldiers are shocked to discover that this hostile and unknown environment is home to enormous and terrifying monsters immune to their firepower. In their desperate battle for survival, the unit encounters the mysterious Hunter (Tony Jaa), whose unique skills allow him to stay one step ahead of the powerful creatures. As Artemis and Hunter slowly build trust, she discovers that he is part of a team led by the Admiral (Ron Perlman). Facing a danger so great it could threaten to destroy their world, the brave warriors combine their unique abilities to band together for the ultimate showdown.Based on the global video game series phenomenon MONSTER HUNTER.www.facebook.com/MonsterHunterMoviewww.instagram.com/MonsterHunterMoviewww.twitter.com/Monster_HunterSubscribe to Sony Pictures for exclusive content: http://bit.ly/SonyPicsSubscribe#MonsterHunter #InternationalTrailer #SonyPictures"
"ihMYnsipT5E","Our Room Tour! - Merrell Twins","2020-10-13T16:40:48Z","UCwtnkRZcvL4bfopzJ-Von8Q","merrelltwins","23","20.18.10","Merrell Twins|Twins|Merrell|Veronica Merrell|Vanessa Merrell|Twin|Comedy|Family Friendly|my room tour|room tour|room makeover|bedroom makeover|bedroom|bedroom tour|my room|our room|rooms|house tour|merrell twins live|room makeover 2020|extreme room makeover|twinner","1724907","78124","1136","9881","https://i.ytimg.com/vi/ihMYnsipT5E/default.jpg","False","False","Many of you have requested a room tour, so here it is!SUBSCRIBE TO OUR CHANNEL ▶ http://bit.ly/2dSP9Fg MERRELL TWINS LIVE ▶ https://www.youtube.com/merrelltwinsliveOUR MERCH ▶ https://fanjoy.co/collections/merrell-twinsFOLLOW US ON SOCIAL MEDIAMERRELL TWINSINSTAGRAM:▶ http://instagram.com/MerrellTwinsTWITTER: ▶https://twitter.com/MerrellTwinsFACEBOOK: https://www.facebook.com/MerrellTwinsWEBSITE: www.merrelltwins.com VANESSA MERRELLINSTAGRAM: ▶http://instagram.com/vanessamerrellTWITTER: ▶https://twitter.com/VanessaMerrellTIKTOK: @vanessamerrell VERONICA MERRELLINSTAGRAM:▶http://instagram.com/veronicamerrellTWITTER: ▶https://twitter.com/veronicamerrellTIKTOK: @veronicamerrell WATCH MORE VIDEOSGUACAMOLE SONGhttps://youtu.be/y8tAO3Ov8gsWRONG TWIN PARODYhttps://youtu.be/RXSowM29eKg7 RINGS PARODY https://youtu.be/n4qMVGox6moNORMAL PEOPLE vs INFLUENCERShttps://youtu.be/CCi_H6s5ZKETHE THIRD WHEELhttps://youtu.be/uHYI42E8TKYTHAT ONE FRIENDhttps://youtu.be/aeOpNraDKy8Merrell Twins Exposed ep1https://youtu.be/mWXurqWRA742 Sets of Twins Drive Thru Prankhttps://youtu.be/p15SVRulr58Fans Write our Videohttps://youtu.be/WI0LYRZErjUThe Break Uphttps://youtu.be/MyS8AjVj9FQIF FOOD BABIES WERE REALhttps://youtu.be/joMRNv0SlYETHIS COULD BE YOUhttps://youtu.be/U9v_bUMqFHgFIRST DATEhttps://youtu.be/IydaRQClUBYWe’re identical twin sisters who have been consistently making videos since 2013. We post videos showcasing our range in both comedy and music such as original comedy sketches, original scripted series, original songs, original music videos, gaming videos, weekly live streams, weekly gaming livestreams, twin swaps, twin sister vs twin sister, popular song parodies, popular song covers, original funny songs, 24 hour challenges, popular challenges, popular trends, lifestyle, fashion, and much more! twinner room makeover#roomtour #makeover #twins"
"a0xr5bEW1mo","Telling Our Family We Are Pregnant! *Emotional*","2020-10-13T23:27:17Z","UCccdWvs4Ynr3fbsaFxMW5pg","Capron & Rydel","22","20.18.10","capron funk|rydel lynch|rydel funk|capron and rydel|funk family|pregnant|funk|capron|rydel|funk bros|corey funk|r5|ross lynch|rocky lynch|r5 songs|telling family i'm pregnant|telling friends i'm pregnant|telling parents i'm pregnant|telling parents they are going to be grandparents|pregnancy|pregnancy test","837989","47628","537","3756","https://i.ytimg.com/vi/a0xr5bEW1mo/default.jpg","False","False","Telling Our Family & Friends We Are Pregnant! *Emotional* @Capron Funk @Rydel Funk"
"iJ6aNluurvY","iPhone 12 vs 12 Pro - 37 THINGS You NEED to KNOW!","2020-10-14T20:15:02Z","UCr6JcgG9eskEzL-k6TtL9EQ","ZONEofTECH","28","20.18.10","iPhone 12 vs 12 Pro|iPhone 12 vs 12 Pro Max|iPhone 12 Pro vs 12 Pro Max|iPhone 12 before buying|iPhone 12 things you need to know|iPhone 12 things you didn't know|iphone 12 pro max|iphone 12|iphone 12 pro|iphone 12 mini|iphone 12 camera|iphone 12 price|iphone 12 release date|apple iphone 12 pro max","263462","6336","291","765","https://i.ytimg.com/vi/iJ6aNluurvY/default.jpg","False","False","iPhone 12, 12 mini, 12 Pro & 12 Pro Max - 37 Things You Didn't Know!▶ iPhone 12 Fast Charger - https://geni.us/ZoTankerFastCharger▶ Braided Lightning Cable - https://geni.us/ZoTbraidedLightning▶ iPhone 11 Pro Max deal - https://geni.us/ZoTiPhone11ProMax▶ iPhone 11 deal - https://geni.us/ZoTiPhone11▶ Support ZONEofTECH when shopping through Amazon - https://geni.us/ZoTAmazon*As an affiliate we earn a small commission from qualifying purchases made using the links above*▂ ▂ ▂ ▂ ▂ ▂ ▂ ▂ ▂ ▂ ▂ ▂ ▂ ▂ ▂ ▂ ▂ ▂ ▂ ▂ ▂ ▂ ▂🍿 Support ZONEofTECH and get Exclusive Rewards! - https://youtube.com/zoneoftech/join😁 Subscribe (It's FREE) - https://goo.gl/yMWV8c🤳 Instagram - http://instagram.com/ZONEofTECH🐤 Twitter - http://twitter.com/ZONEofTECH📘 Facebook - http://facebook.com/ZONEofTECH🌎 ZONEofTECH Articles - https://www.zoneoftech.com/articles📱 Concepts - https://instagram.com/ZONEofCONCEPTS❤️ Team - https://twitter.com/ZONEofTECH_TEAMBusiness Enquiries: business@zoneoftech.com▂ ▂ ▂ ▂ ▂ ▂ ▂ ▂ ▂ ▂ ▂ ▂ ▂ ▂ ▂ ▂ ▂ ▂ ▂ ▂ ▂ ▂ ▂Intro Song 1:A New Way - Lesion X https://soundcloud.com/lesionxbeatsCreative Commons — Attribution 3.0 Unported — CC BY 3.0Free Download / Stream: https://bit.ly/_a-new-wayMusic promoted by Audio Library https://youtu.be/KT6TzepZ3LAOutro Song:Bisiesto by Hiracutch https://soundcloud.com/hiracutchCreative Commons — Attribution 3.0 Unported — CC BY 3.0Free Download / Stream: https://bit.ly/bisiesto-hiracutchMusic promoted by Audio Library https://youtu.be/3Lf7LuhwI5o#iPhone12 #ZONEofTECH"
"X57R-iF36E8","Party Tray Pizza Hoax | Matty Matheson | Just A Dash | S2 EP1","2020-10-14T15:05:19Z","UCpqH8-BBNTsluhcOzFKWLuw","MATTY MATHESON","23","20.18.10","retired bolt ears|matty|matty matheson|just a dash|just a dash season 2|matty matheson just a dash|jad|pizza|pizza party|tray pizza|how to make pizza|cooking pizza|matty matheson pizza|party tray pizza|pizza recipe|pizza dough|pizza dough recipe|dough|dough recipe|pizzagate|pepperoni pizza|pepperoni|cheese pizza|fermented dough recipe|vegetable pizza|vegetable|how to make pepperoni pizza|how to make pizza dough|easy pizza recipe|best pizza dough","382625","19043","379","2095","https://i.ytimg.com/vi/X57R-iF36E8/default.jpg","False","False","SEASON FUCKING TWO!!!! I DONT EVEN KNOW WHAT I COOKED!!!! ITS ALL OVER!!!! JUST A DASH RETURNS WITH I THINK PARTY TRAY PIZZAS!!!!! LETS GO!!!!! THIS SEASON ALMOST DESTROYED US ALL!!!! MORE CHAOS LESS FOOD MORE MICHELLE MORE YELLING MORE MICHELLE ITS ALL ABOUT MICHELLE!!!!! SHE IS MY LORD AND SAVIOUR!!!!!Ingredients - Pizza Dough(makes 1 13 x18 inch pizza,  or 2 9x13 inch pizza ) 8g Dry active Yeast1 3/4 cups warm water1/3 cup olive oil, plus more for greasing bowl and pans1 tbsp salt 4 cups all purpose flourTomato Sauce1/4 cup olive oil1 onion, finely diced3 clove garlic, finely sliced2 28 oz can whole tomato8 basil leaves1 tbsp dried oregano2 tbsp sugarSalt and pepperFor the Garden Vegetable Pizza (makes 1 9x13 inch pizza)1/4 parmesan cheese, finely grated1/4 cup olive oil, divided plus more for garnish 1 cup grated mozzarella cheese1/2 cup cherry tomatoes3 Squash flowers 3-4 kale leaves, torn3-4 spigarello leaves, torn 2-3 green onion, cut into thirds1/2 cup ricotta 4-5 fresh basil leaves Salt and pepperZest of one lemon*use whatever vegetables that are available to you For the pepperoni pizza (makes 1 9 x13 inch pizza)2 tbsp olive oil1/2 cup parmesan cheese, divided 1 cups grated mozzarella 1 cup tomato sauce2 cups pepperoniDirections:- In the bowl of a stand mixer fitted with the hook attachment, Dissolve yeast in warm water. Let stand until frothy, about 10 minutes- Pour in olive oil, salt and gradually add the flour. Mix on low speed until combined scraping down the sides as needed. - Increase speed to medium-high. Knead in a mixer until dough is smooth and pliable. The dough should be tacky, but If very wet sticky, add more flour 1 tablespoon at a time. - Form dough into a smooth ball. Grease a bowl with olive oil and place dough in the bowl. Cover with plastic wrap and allow to rise until ball doubles in size, about 1 hour. - Place dough in the refrigerator to ferment for 24 hours. - Remove dough from refrigerator and place on a sheet pan greased with olive oil. Using your fingertips gently stretch dough over the surface of the pan.  The dough does not need to reach rim to rim in this step. Cover with plastic and place in the refrigerator for another 24 hours. - Meanwhile, to make the tomato sauce, heat olive oil in a pot over medium. Add in onion and garlic and cook until soft and fragrant, about 5 minutes- Add in tomatoes, crushing each one in your hand before adding to the pot. Pour in the residual liquid from the can. - Stir in basil, oregano, and sugar then season with salt and pepper- Simmer sauce until it becomes thick and pasty, about 20 minutes. Set aside to cool.- Remove dough from refrigerator 15 minutes before assembling..- Gently stretch the dough on a baking sheet so it reaches rim to rim. If the dough is pulling back, let rest for 2-3 minutes then continue to stretch again.- Preheat oven to 500F- Cover with a dish towel and let the dough rest for 20 minutesTo make the Garden Vegetable Pizza:- Sprinkle parmesan cheese over pizza dough then drizzle with half the olive oil.- Sprinkle Mozzarella cheese over the parmesan. - Arrange cherry tomatoes over dough, breaking them as you go, allowing their juices to fall on the pizza.- Arrange remaining vegetables over dough. Then drizzle remaining olive oil and season with salt and pepper- Bake until crust is golden, about 20 minutes- Remove from oven and arrange  dollops of  ricotta over pizza- Garnish with basil leaves, a drizzle of olive oil, and lemon zest- Let rest 10 minutes before slicing and serving To make Pepperoni Pizza:- Drizzle olive oil over the dough and then sprinkle half the parmesan cheese- Sprinkle with mozzarella over and then arrange dollops of sauce over mozzarella- Sprinkle the remaining parmesan cheese over pizza and then top with pepperoni- Bake in the preheated oven until crust is golden, about 20 minutes- Let rest 10 minutes before slicing and serving https://mattymatheson.store/https://twitter.com/mattymathesonhttps://www.instagram.com/mattymathesonhttps://www.facebook.com/MATTYMATHESON1"
"BhC-QTs-kns","Amy Coney Barrett's Supreme Court confirmation hearings | Day 4","2020-10-15T19:01:50Z","UCXIJgqnII2ZOINSWNOGFThA","Fox News","25","20.18.10","Fox News|Judge Amy Coney Barrett|Trump SCOTUS|Supreme Court Justices|Trump SCOTUS pick|Donald Trump|Amy Coney Barrett nomination|US Supreme Court|Amy Coney Barrett|Barrett confirmation hearings|Senate Judiciary Committee|Judge Amy Coney Barrett hearings|SCOTUS confirmation hearing|Supreme Court nominee|Amy coney barrett confirmation hearing|fox live stream|Amy Coney Barrett live|amy coney barrett opening statement|amy coney barrett hearing|Supreme Court","995636","15136","1315","1293","https://i.ytimg.com/vi/BhC-QTs-kns/default.jpg","False","False","The Senate Judiciary Committee hearings for Supreme Court nominee Amy Coney Barrett continue Thursday morning.Subscribe to Fox News! https://bit.ly/2vBUvASWatch more Fox News Video: http://video.foxnews.comWatch Fox News Channel Live: http://www.foxnewsgo.com/FOX News Channel (FNC) is a 24-hour all-encompassing news service delivering breaking news as well as political and business news. The number one network in cable, FNC has been the most-watched television news channel for 18 consecutive years. According to a 2020 Brand Keys Consumer Loyalty Engagement Index report, FOX News is the top brand in the country for morning and evening news coverage. A 2019 Suffolk University poll named FOX News as the most trusted source for television news or commentary, while a 2019 Brand Keys Emotion Engagement Analysis survey found that FOX News was the most trusted cable news brand. A 2017 Gallup/Knight Foundation survey also found that among Americans who could name an objective news source, FOX News was the top-cited outlet. Owned by FOX Corporation, FNC is available in nearly 90 million homes and dominates the cable news landscape, routinely notching the top ten programs in the genre. Watch full episodes of your favorite showsThe Five: http://video.foxnews.com/playlist/longform-the-five/Special Report with Bret Baier: http://video.foxnews.com/playlist/longform-special-report/The Story with Martha Maccallum: http://video.foxnews.com/playlist/longform-the-story-with-martha-maccallum/Tucker Carlson Tonight: http://video.foxnews.com/playlist/longform-tucker-carlson-tonight/Hannity:  http://video.foxnews.com/playlist/longform-hannity/The Ingraham Angle: http://video.foxnews.com/playlist/longform-the-ingraham-angle/Fox News @ Night: http://video.foxnews.com/playlist/longform-fox-news-night/ Follow Fox News on Facebook: https://www.facebook.com/FoxNews/Follow Fox News on Twitter: https://twitter.com/FoxNews/Follow Fox News on Instagram: https://www.instagram.com/foxnews/om/"
"ul703kdcUUE","RWBY: Volume 8 - Official Trailer | Rooster Teeth","2020-10-14T17:00:04Z","UCII0hP2Ycmhh5j8lS4cexBQ","Rooster Teeth Animation","1","20.18.10","Rooster Teeth|RT|television|filmmaking|games|video games|comics|austin|texas|production|movies|web series|RWBY|anime|Camp Camp|RVB|red vs blue|Fan Service|cartoon|comedy|genLOCK|animated|animation|2d|3d|RWBY Chibi","220999","15810","363","2687","https://i.ytimg.com/vi/ul703kdcUUE/default.jpg","False","False","With the lantern in her grasp, Salem’s power is reaching daunting new heights; Atlas, and the entirety of Remnant, have never been in more grave danger. Is there any hope of Team RWBY prevailing, or is Salem’s influence truly too great to be defeated?Join FIRST to watch episodes early: http://bit.ly/2wf5zPJ» Get your Rooster Teeth merch: http://bit.ly/2uRi44x» Subscribe: http://bit.ly/RT_Animation_YTMore Rooster Teeth:» Rooster Teeth Live Action: http://bit.ly/RoosterTeethYT» Achievement Hunter: http://bit.ly/AchievementHunterYT» Let's Play: http://bit.ly/Lets_Play_YT» Funhaus: http://bit.ly/Funhaus_YT» Death Battle: http://bit.ly/DeathBattle_YThttps://www.youtube.com/roosterteethanimation"
"kcwkURkuLxw","Grupo Firme & C-Kan - Se Te Acabó La Suerte (Video Oficial) 2020","2020-10-13T17:00:35Z","UCFlC8U0Uif2hF0FIgsSIIYQ","Grupo Firme","10","20.18.10","Firme MixFirme Exitos|Firme Covers|Firme music|Firme nuevo video|Firme Video|Firme video oficial|Firme new video|Firme official video|Firme video nuevo|new single Firme|C-Kan MixC-Kan Exitos|C-Kan Covers|C-Kan music|C-Kan nuevo video|C-Kan Video|C-Kan video oficial|C-Kan new video|C-Kan official video|C-Kan video nuevo|new single C-Kan|Grupo Firme Mix|Grupo Firme exitos|Grupo Firme nuevo video|Grupo Firme video|Grupo Firme video oficial","2761396","151578","5233","5490","https://i.ytimg.com/vi/kcwkURkuLxw/default.jpg","False","False","Music video by Grupo Firme & C-Kan performing  © 2020 Isael Gutierrez & Evert Gutierrez , Exclusive License To Music Vip Entertainment .Suscribete Aqui https://bit.ly/333fXenAutor:  José Luis Maldonado RamosProductor Ejecutivo: Isael Gutiérrez , Evert Gutiérrez & José AcevedoDisquera: Music VIP Entertainment & Mastered TraxGénero: Regional Mexicano Editora: Music VIP Entertainment ℗ 202000:00  Inc.00:07 Se Te Acabó La SuerteProvided to YouTube by  Music VIP Entertainment Inc. ℗ 2020Released on: 2020-10-13 Auto-generated by YouTube."
"3uK-27Dm0HM","Apple's entire iPhone 12 event in exactly 12 minutes (supercut)","2020-10-13T18:29:22Z","UCOmcA3f_RrH6b9NmcNa4tdg","CNET","28","20.18.10","CNET|Technology|News|Tech|Review|mobile phone|apple|smartphone|apple iphone|iphone|iphone 12|iphone 12 mini|iphone 12 pro|iphone 12 pro max|homepod mini|5g iphone|iphone 2020|new iphones|new iphone|iphone 12 event|apple event|live stream|highlights|supercut|tim cook|apple announcement|new apple products|apple lineup|new iphone 12|2020 iphone|iphone 12 pro announcement|iphone 12 pro max announcement|apple news|apple event highlights","1101789","13892","2107","4512","https://i.ytimg.com/vi/3uK-27Dm0HM/default.jpg","False","False","Apple today revealed a slew of new products, including 3 new iPhones, the new iPhone 12, the 12 mini, and the 12 pro, as well as a new Homepod Mini. You're watching CNET's supercut, an edited recap of the event, in 12 minutes, so you don't have to watch the whole hour-long event, just every product that was announced, back-to-back. For all this and more, be sure to subscribe for continued iPhone 12 news.Subscribe to CNET: https://www.youtube.com/user/CNETTVCNET playlists: https://www.youtube.com/user/CNETTV/playlistsDownload the new CNET app: https://cnet.app.link/GWuXq8ExzGLike us on Facebook: https://www.facebook.com/cnetFollow us on Twitter: https://www.twitter.com/cnetFollow us on Instagram: http://bit.ly/2icCYYm#iPhone12 #CNETiPhone12"
"qJf8Ef4pqQk","CHEN 첸 '안녕 (Hello)' MV","2020-10-15T09:00:21Z","UCEf_Bc-KVd7onSeifS3py9g","SMTOWN","10","20.18.10","[none]","5209760","1137550","8042","373610","https://i.ytimg.com/vi/qJf8Ef4pqQk/default.jpg","False","False","CHEN's new single 'Hello' is Out!🎧Listen and download on your favorite platform: https://smarturl.it/CHEN_HELLOCHEN Officialhttp://chen.smtown.comhttp://www.youtube.com/CHENhttp://www.youtube.com/weareoneEXOhttp://www.facebook.com/weareoneEXOhttp://www.instagram.com/weareone.exohttp://twitter.com/weareoneEXO#CHEN #첸 #안녕 #Hello CHEN 첸 '안녕 (Hello)' MV ℗ SM Entertainment"
