video_id,title,publishedAt,channelId,channelTitle,categoryId,trending_date,tags,view_count,likes,dislikes,comment_count,thumbnail_link,comments_disabled,ratings_disabled,description
"Bw3Wt5o4VZw","LES PREGUNTÉ SI SON NOVIOS Y NO CREERÁS LO QUE PASÓ...","2020-10-12T19:00:11Z","UCQ8TuCvcDMepleXFyOQfyOQ","YOLO","23","20.18.10","yolo|yolo aventuras|yoloaventuras|yoloaventura|nando|mariana|panda|coloridas|vecinas|lila|poli|soni|mia|novios|ex|novia|ex novia|kimberly loaiza|jukilop|juan de dios pantoja|yoloriana|nanlila|skabeche|mas skabeche|polinesios|los polinesios|fede|fede vigevani|dosogas|vecibanda|vecinos|reto|retos|24 horas|novio|bromas|broma|broma pesada|TIKTOK|preguntas|tendencias|colombia|mexico|argentina|amor|pareja|VIRAL|BADABUN|risas|diversion|funny|videos diarios|antrax|team|team leyenda","2633558","344836","9305","31970","https://i.ytimg.com/vi/Bw3Wt5o4VZw/default.jpg","False","False","Les pregunté a mi hermano y mi vecina si son novios. Nando recibe una llamada de Lila y no creerás lo que pasó.MI INSTAGRAM: https://www.instagram.com/medicenyoloMI TIKTOK: https://vm.tiktok.com/x7jjrHMI TWITTER: https://twitter.com/YoloAventurasSuscríbete a mis otros canales:YOLO AVENTURAS: https://youtu.be/uwSPrIxG0vkCRACKS: https://youtu.be/p49YL_3rFNsTITANES: https://youtu.be/IC2aZxcu2qwSuscríbete a los canales de mis amigos:COLORIDAS: https://youtu.be/F5mafxCLMGMNANDO: https://youtu.be/FtsTlEYQYGcSigue a mis amigos en Instagram:Lila: https://www.instagram.com/lilacoloridasMía: https://www.instagram.com/miacoloridasPoli: https://www.instagram.com/policoloridasSoni: https://www.instagram.com/sonicoloridasNando: https://cutt.ly/PyvFHnxYamit: https://cutt.ly/GfHlWuNJota: https://cutt.ly/sfHlQvsCONTACTO/PUBLICIDAD: yolo@yolodigital.com"
"ERMXXIN3UQM","Nicki Nicole – Plegarias (Acústico Premios Gardel 2020)","2020-10-12T19:00:03Z","UCEMoAW9Qk0HrZqLxV5BFhDw","nicki nicole","10","20.18.10","Nicki Nicole|Plegarias|Nicky|Nicki bizarrap|bizarrap|Plegarias acustico|plegarias gardel|nicki plegarias|nicki trueno|Recuerdos|argentina|musica latina|trap|R&B|soul|Nicky Nicole|premios gardel 2020|Plegarias Nicky|españa|Nicole trapera|trueno|plegarias version","3290685","285100","2821","11198","https://i.ytimg.com/vi/ERMXXIN3UQM/default.jpg","False","False","Nicki Nicole – Plegarias (Acústico Premios Gardel 2020) Spotify: http://open.spotify.com/album/63FCLdOda9dZy1SzHVYwASApple Music: https://itunes.apple.com/album/id1534395478Deezer: https://www.deezer.com/album/177315322 NICKI NICOLE:  https://www.instagram.com/nicki.nicole/ PRODUCIDO POR:https://www.instagram.com/maurodetommaso/ARREGLOS POR: https://www.instagram.com/damianmahler/https://www.instagram.com/juangimenezkuj/DIRIGIDO POR: https://www.instagram.com/jesspraznik/PRODUCCIÓN GENERAL POR:https://www.instagram.com/daleplayrecords/ #NickiNicole #Plegarias #Acústico #PremiosGardel2020 CONTACTO:contacto.nicki@lauriaweb.com ® 2020 DALE PLAY Records"
"CJAGc6GSiFc","Mau y Ricky - La Grosera (Official Video)","2020-10-12T21:57:50Z","UCCws9e4Tnl73Mg08e_tuF3w","MauyRickyVEVO","10","20.18.10","mau|ricky|mau y ricky|montaner|mau montaner|ricky montaner|la grosera|papa video oficial|La Grosera letra|La Grosera lyrics|mau y ricky letra|mau y ricky lyrics|mau y ricky La Grosera|mau y ricky La Grosera video oficial|la grosera video oficial|official video la grosera|letra la grosera|La Grosera|Latin Pop|Mau y Ricky|Sony Music Latin","3814578","168011","10487","7694","https://i.ytimg.com/vi/CJAGc6GSiFc/default.jpg","False","False","Mau y Ricky – La Grosera (Official Video) Music: Apple: https://smarturl.it/LaGrosera/applemusic Spotify: https://smarturl.it/LaGrosera/spotify YouTube: https://smarturl.it/LaGrosera/youtube Amazon: https://smarturl.it/LaGrosera/az iTunes: https://smarturl.it/LaGrosera/itunes Deezer: https://smarturl.it/LaGrosera/deezer Letra:Me rompiste el corazón No pensé que me dolierasi te digo la verdad Me dolió que jodeSi esa no fue tu intenciónduele como si lo fueraDicen que te escriba una canción Ay cállense la jetaNo soy huevón aunque a veces parece Subo posts muchos posts pa’ que creas que fue breve olvidarte y superarte Voy a pegarme en la radio para perseguirte Y decirte Ey la cagaste Porque me rompiste el corazónY soy la verga Juro que te vas a arrepentirYa lo verásQue voy a estar con alguien más guapa que tú.Yo quiero tener una casa grande Muchos perros un aviónY el “pipí” gigante o por lo menos que parezca Pa’ que todas tus amigas se aparezcan Yo sé que eso no está bien Pero me hace sentir bien Yo sé que eso no está bienPero me hace sentir bien Lávenme la boca con agua y jabón Que se me soltó la lengua y se siente cabrónCuando quieras volver y te diga que no Voy a estar saliendo en la televisiónAyyy como tú ex ya no hay Como este man ya no hayya no hay no hay no hayInstagram: https://www.instagram.com/mauyrickyTwitter: https://twitter.com/MauYRickyFacebook: https://www.facebook.com/MauyRicky#MauyRicky #LaGroseraOfficial Music Video by Mau y Ricky performing “La Grosera” © 2020 Sony Music Entertainment US Latin LLC"
"gc7tZKM7NBo","CUANDO NOS CASAREMOS? PREGUNTAS Y RESPUESTAS CON MI NOVIO JEANKI | Princess X","2020-10-13T16:42:41Z","UC7okxQd1i2GZSyT8kBldJUw","Princess X","20","20.18.10","[none]","263722","42559","465","1734","https://i.ytimg.com/vi/gc7tZKM7NBo/default.jpg","False","False","GRACIAS POR EL MILLOOOOON LOS AMOInstagram - princessberex"
"38UCi75dJZg","RepliK - Tristes Tricksters (Prod. HashFinger)","2020-10-13T22:00:12Z","UClVZaYP6oZSp9n6yoGLQ7eA","RepliK","10","20.18.10","replik|replika|manucho conflicto|manucho|replica|replic|replik free|replik fms|replik red bull|replik redbull|manucho conflicto free|rap|productor|beat rap|tristes tricksters|tristes|tricksters|trickters|tristers|replik batallas|replik freestyle|replik batallas de freestyle|manu vainstein|manuel vainstein|rubies rubios|rapero replika|rap argentino|hip hop argentino|raperos argentinos|raperos de argentina","325099","58173","512","3145","https://i.ytimg.com/vi/38UCi75dJZg/default.jpg","False","False","#RepliK #ManuchoConflicto #TristesTricksters Spotify: http://open.spotify.com/album/1UGpZYYFxy9YpyxpHTQ72fApple Music: https://itunes.apple.com/album/id1534395607Deezer: https://www.deezer.com/album/177311862Lyrics & Voz:RepliK | https://instagram.com/replikProducción:HashFinger | https://instagram.com/HashfingerMix & Master:Mariano Bilinkis | https://instagram.com/marianobilinkis✉ Booking | Comercial | Contacto Abianvainstein@hotmail.com®️ 2020 DALE PLAY Records"
"hZZd189biKs","Ninja, ¿Jugamos con MI SKIN a Fortnite? - TheGrefg","2020-10-13T20:13:21Z","UCCEmjNPpJYhGDgaEqeeA4HA","TheGrefg","20","20.18.10","ninja|fortnite|jugamos|skin|thegrefg|grefg","3454069","372224","6032","14734","https://i.ytimg.com/vi/hZZd189biKs/default.jpg","False","False","🔴 ¡Sígueme para ver mis Directos! https://www.twitch.tv/thegrefg★ ¡Mi Libro! https://www.planetadelibros.com/libro-los-secretos-de-youtube/279938➜ ¡Mi Mando Oficial! https://xcontrollers.es/➜ Remotto Battery https://es.remottobattery.com/➜ ¡Mi Silla! https://xchairsco.com/➜ ¡Mis Cascos! https://astro.family/grefgEMEA● ¡Último vídeo de Heretics! https://youtu.be/BPHRmAoLaBE► ¡Sígueme!• Miembro del canal https://youtube.com/thegrefg/join• Suscríbete al Canal! https://goo.gl/alqmWP• Instagram! https://instagram.com/grefg_official/• Tik Tok! https://vm.tiktok.com/ZS5rpcqQ/• Twitter! https://twitter.com/TheGrefg• Facebook! https://www.facebook.com/TheGrefg► Team Heretics• YouTube https://www.youtube.com/teamheretics• Twitter https://twitter.com/TeamHeretics• Instagram https://www.instagram.com/teamheretics/?hl=es• Discord https://discord.gg/teamheretics• Gfuel 10% dto. Código HERETICS https://gfuel.com/teamheretics★ Gracias por la Miniatura!! Miguez https://goo.gl/WrEwDT---Vídeo creado y subido por TheGrefg."
"eoYI8c5ud1g","Eliminatorias | Ecuador vs Uruguay | Fecha 2","2020-10-14T01:06:40Z","UCzU8-lZlRfkV3nj0RzAZdrQ","CONMEBOL","17","20.18.10","fútbol|pelota|gol|copa|libertadores|sudamericana|eliminatorias|mundial","1327713","0","0","3710","https://i.ytimg.com/vi/eoYI8c5ud1g/default.jpg","False","True","Ecuador venció 4-2 a Uruguay este martes en la altura de Quito en partido de la segunda fecha de las Eliminatorias Sudamericanas al Mundial de Catar-2022.Suscríbete I Inscreva-se I Subscribe: http://bit.ly/CONMEBOLFacebook: facebook.com/CONMEBOLInstagram: instagram.com/conmebol/Twitter: twitter.com/CONMEBOL"
"ZxKdu-a520I","Exclusive Look At Marvel's Spider-Man: Miles Morales' First Boss (4K)","2020-10-13T22:13:46Z","UCK-65DO2oOxxMwphl2tYtcw","Game Informer","20","20.18.10","miles morales|marvel's spider-man: miles morales|spider-man miles morales|spider man miles morales|spiderman miles morales|miles morales boss battle|miles morales gameplay|marvel's spider-man miles morales trailer|spider-man miles morales trailer|spider-man miles morales trailer 4k|spiderman miles morales trailer|miles morales ps5|miles morales 4k gameplay|Spider man 4k gameplay|spider man ps5|ps5 gameplay|miles morales ps5 gameplay|playstation 5 games","1445049","37431","710","4537","https://i.ytimg.com/vi/ZxKdu-a520I/default.jpg","False","False","As part of our month of exclusive coverage, we're giving you a quick look at the first boss battle players will encounter in Marvel's Spider-Man: Miles Morales! If you're looking to go into the game clean, know that there are some very early game spoilers in this video. You have been warned!If you enjoyed this quick video, we'll be diving into more of Insomniac's open-world PlayStation 5 experience all month long. So be sure to check out the playlist below if you can't get enough of everyone's favorite web-slinger: https://www.youtube.com/playlist?list=PLoAFmgzYW18I1UFTzFYXceJFZy_7EnJb1"
"vDcMYJhdR9E","ROBERTO PALAZUELOS, una vida MUY INTENSA | La entrevista con Yordi Rosado","2020-10-11T23:00:05Z","UCpYlZ6IrsXW_OBrt5ugKkmA","Yordi Rosado","24","20.18.10","Yordi Rosado|roberto palazuelos|roberto palazuelos entrevista|roberto palazuelos 2020|entrevista|la entrevista con yordi rosado|roberto palazuelos y yordi rosado|roberto palazuelos y su mamá|roberto palazuelos y su papá|roberto palazuelos adicción|roberto palazuelos balacera|el diamante negro|el diamante negro entrevista|el diamante negro 2020|el diamante negro con yordi rosado|exclusiva|espectaculos|yordi rosado entrevista","1538746","59189","1336","4559","https://i.ytimg.com/vi/vDcMYJhdR9E/default.jpg","False","False","En esta entrevista Roberto Palazuelos nos cuenta algunos de los momentos más oscuros de su vida. ¿Cómo lo separaron de su madre? ¿Fue difícil la relación con su padre? ¿Cuál fue su relación con las drogas? Sigue a Roberto Palazuelos en:Instagram: https://www.instagram.com/robertopalazuelosbadeaux/Twitter: https://twitter.com/robpalazuelosSigue a Yordi Rosado en:Facebook: http://www.facebook.com/YordiRosadoInstagram: https://www.instagram.com/yordirosadooficial/Twitter: https://twitter.com/YordiRosadoTikTok: https://www.tiktok.com/@yordirosadoo"
"KZYFsfQ2fzc","Matando el tiempo de la cuarentena decorando mi cuarto 🤠🌿","2020-10-13T18:06:18Z","UC172EgfGGY5T8YEbjXlIZ4g","Karla Canseco","22","20.18.10","[none]","96613","10864","163","991","https://i.ytimg.com/vi/KZYFsfQ2fzc/default.jpg","False","False","REDES SOCIALES 💗Instagram personal: https://instagram.com/karla.canseco?igshid=4n90inqjqerbInstagram apuntes bonitos:  https://instagram.com/karlasnotes?igshid=1omi7xsvgqnw7TikTok personal: https://vm.tiktok.com/ceVAku/TikTok apuntes bonitos: https://vm.tiktok.com/ce4G2L/Twitter: https://twitter.com/karlasnotessFacebook: https://www.facebook.com/karlasnotesoficial/ 💌 NEGOCIOS Y COLABORACIONES:    negocios.karlasnotes@outlook.comPREGUNTAS FRECUENTES:¿Qué edad tienes? Tengo 19 años¿Qué estudias? Derecho en la Universidad Veracruzana y Comunicación en la Universidad  Anáhuac Xalapa 🧡¿Con qué grabo y edito? iMovie - Nikon D3200 & Cañón g7xmark ii 🤠 + CANON M50✨ MÚSICA DEL VIDEO ✨Music by frumhere, kevatta - warm feeling - https://thmatc.co/?l=910EFE6FMusic by Mark Generous - Earl Grey - https://thmatc.co/?l=AF3883E6Music by Mark Generous - Luscious - https://thmatc.co/?l=7C59B1CCMusic by Suriel Hess - Don't Wanna Know - https://thmatc.co/?l=9E2FA76CMusic by Mr. Thibs - Fallen - https://thmatc.co/?l=F778EDF6Music by Mark Generous - Orange And Pomegranate - https://thmatc.co/?l=CDB3EB86Music by Mr. Chase - Wild Cherry - https://thmatc.co/?l=B79B477CMusic by Mikayla Geier - Deja You - https://thmatc.co/?l=EA9D5048Music by VALNTN - Mona Lisa - https://thmatc.co/?l=DAE83239"
"qkLTsJXn-0M","Apex Legends Champion Edition Trailer","2020-10-13T15:00:11Z","UC0ZV6M2THA81QT9hrVWJG3A","Apex Legends","20","20.18.10","Apex Legends|Champion Edition|Apex Legends Champion Edition|Apex Legends Switch|Apex Legends Steam|Apex Legends Aftermarket|Apex Legends crossplay|Apex Legends gameplay|Apex Legends Battle Pass|Season 6 Battle Pass|Apex Legends game|Respawn Apex Legends|Battle Royale game|Battle Royale shooter|Apex Games|squad play|multiplayer shooter|Respawn Entertainment|Electronic Arts|Titanfall 2|EA|Respawn|fun battle royale","1939944","92485","1525","8405","https://i.ytimg.com/vi/qkLTsJXn-0M/default.jpg","False","False","Make your name with the Champion Edition, packed full of character unlocks and exclusive items to get you started right. http://x.ea.com/65702Ready to become an Apex Champion? You could be, with all the incredible items stuffed into the Champion Edition. You’ll get every Legend up to Season 7, plus over $100 worth of exclusive cosmetics, including Legendary character and weapon skins and a Legendary gun charm, along with a thousand Apex Coins. Play who you want, dress how you want, and show those other Legends there’s a new champ in town. Starting Season 7, you can find the Champion Edition on Xbox One, PlayStation 4, and Origin on PC or get a download card at your favorite retailer soon for $39.99. Here’s everything you’ll find inside:The Champion Edition- 9 character unlocks (all Legends up to Season 7):Caustic, Mirage, Octane, Wattson, Crypto, Revenant, Loba, Rampart, and the Season 7 Legend - 7 Exclusive Legendary items:- “Risen Queen” Wraith skin- “Forged Knight” Revenant skin- “Hallowed Spirit” Crypto skin- “Curse of the Awaken” Triple Take skin- “Slayer’s Lancer” Flatline skin- “Jaded Myth” Sentinel skin- Emperor Nessy XIV Gun Charm- 1,000 Apex CoinsApex Legends™ is a free-to-play battle royale game where legendary characters battle for glory, fame, and fortune on the fringes of the Frontier. Play for free now on Xbox One, PS4, and Origin for PC. Learn more about Apex Legends Season 6 – Boosted: http://x.ea.com/64060 Check out our YouTube channel: http://x.ea.com/56710.Follow us on Twitter: https://twitter.com/playapex.Follow us on Instagram: https://www.instagram.com/playapex/.#PlayApex #ApexSeason6 #ChampionEdition #ApexLegends"
"a-4CiNfkW_A","Limpias, libres y con sana distancia, elecciones en Hidalgo y Coahuila. Conferencia presidente AMLO","2020-10-14T14:11:26Z","UCxEgOKuI-n-WOJaNcisHvSg","Andrés Manuel López Obrador","25","20.18.10","AMLO|amlo|AMLO hoy|mañanera|mañanera amlo|conferencia de prensa|conferencia en vivo|conferencia matutina|Miércoles 14 de octubre 2020|AMLO en vivo hoy|AMLO informe hoy|AMLO en vivo|amlo hoy|Andrés Manuel López Obrador|amlo en vivo|López Obrador|AMLO canal|Andrés Manuel canal|AMLO youtube en vivo|AMLO youtube hoy|AMLO canal oficial|amlo mañanera de hoy|amlo noticias|conferencia presidente","341567","33509","449","1593","https://i.ytimg.com/vi/a-4CiNfkW_A/default.jpg","False","False","Conferencia de prensa matutina, desde Palacio Nacional. Miércoles 14 de octubre 2020. Presidente AMLO.0:00 Inicio de transmisión04:44 Comienza la conferencia de prensa del presidente Andrés Manuel López Obrador15:35 Sesión de preguntas y respuestasLlamamos a la ciudadanía de Hidalgo y Coahuila a participar en la jornada electoral del domingo 18 de octubre. Cuiden que los comicios sean limpios y libres, sin intervencionismo, compra de votos, presiones, acarreos, fraude electoral.La Cuarta Transformación es, también, que haya democracia. Actuemos con legalidad. Debido a que las elecciones se realizarán durante la emergencia sanitaria por el #COVID19, hacemos un exhorto a mantener sana distancia y medidas de higiene para evitar contagios.Reafirmamos nuestro propósito de presentar una iniciativa de reforma a la Ley del Infonavit para que las y los trabajadores puedan recibir, sin intermediarios, sus créditos para la vivienda. Queremos que sin ningún condicionante puedan utilizar el dinero para construir sus casas, comprar terreno y autoconstruir o comprar una casa usada; lo que decidan.Terminaremos con malas construcciones o pequeños departamentos costosos de apenas 40 metros cuadrados. Que el trabajador reciba su dinero y decida qué va a hacer. Ayer nos reunimos con los miembros del Consejo de Administración del Infonavit, institución tripartita con representantes del sector obrero, empresarios y gobierno, para que llegar a un acuerdo o que se explique cuál es el motivo de la iniciativa.Si se logra, expondremos dónde tienen que hacer el trámite, hasta cuánto pueden recibir de crédito, en fin, toda la información.Anunciamos que en los próximos días entregaremos los premios del sorteo del avión presidencial. Las escuelas y hospitales ganadores recibirán el dinero y decidirán en qué lo utilizarán. Hacemos un respetuoso llamado a integrantes del Poder Legislativo a que hagan un debate ordenado en las Cámaras de Diputados y Senadores. Si invitan a servidores públicos del gobierno federal a comparecer, permítanles hablar.Más información: https://bit.ly/2GOTmMF Sigue las actividades del presidente de México: Sitio web:http://presidente.gob.mxYouTube:https://www.youtube.com/lopezobradorFacebook:https://facebook.com/lopezobrador.org.mxTwitter:https://twitter.com/lopezobrador_Instagram:https://www.instagram.com/lopezobrador/Telegram: https://t.me/PresidenteAMLOSpotify:https://spoti.fi/2C7jUmx"
"6zjyDCa0rYs","The King Of Ice - (Detras De Camaras) - T3R Elemento y Lenin Ramirez - DEL Records 2020","2020-10-14T00:00:14Z","UCucxqba8ReybE6oIs9D1_sg","T3R Elemento","10","20.18.10","king of ice|t3r elemento|lenin ramirez|nuestra ola|our wave|disco nuevo|detras de camaras|nuevo disco|nuevo disco t3r elemento|tercer elemento|regional mexican|regional mexicano|latin|mexico|corridos|corridos 2020|del records 2020|corridos nuevos|angel del villar|musica|lo mas nuevo|Regional Mexicana","142499","8606","121","506","https://i.ytimg.com/vi/6zjyDCa0rYs/default.jpg","False","False","Descarga The King Of Ice de T3R Elemento y Lenin Ramirez https://delrec.io/thekingoofice | Suscribete al canal oficial de DEL Records https://goo.gl/7BcbxRSíguenos:Pandora: https://goo.gl/pb57i8Spotify: https://goo.gl/nbrx8nInstagram: https://goo.gl/RFknFrFacebook: http://goo.gl/dDPjE1Twitter:  https://goo.gl/Z6IVhF http://DelRecords.comDEL Records, es la empresa líder independiente de entretenimiento de la música Regional Mexicana en Estados Unidos y México. Desde su lanzamiento en el 2009 la compañía ha creado un sin número de exitosos e innovadores artistas y canciones. Sus cantantes redefinen el género y se posicionan en los primeros lugares de las listas de popularidad, generando gran impacto en las redes sociales. DEL Records, DEL Publishing y DEL Entertainment, es la casa de grandes estrellas internacionales como Gerardo Ortiz, Regulo Caro, Ulices Chaidez y Sus Plebes al igual que otros grandes talentos como Lenin Ramirez, T3R Elemento, Los del Arroyo, Banda Culiacancito, Jaziel Avilez, Cheli Madrid, entre otros. La compañía fue establecida en el 2008.#T3RElemento #LeninRamirez #KingOfIce #DELRecords"
"JoLZgfXALNc","La tribu africana que vive de fabricar armas | Tribu Datoga - Tanzania","2020-10-13T21:26:10Z","UCECJDeK0MNapZbpaOzxrUPA","Luisito Comunica","23","20.18.10","luisitocomunica|luisitocomunicaa|luisito comunica|luisito comunicaa|luisito|comunica|comunicaa|tribu|africa|africana|tanzania|herrera|datoga|masai|hadzabe|viaje|travel|trip|viajar|documental|reportaje|informativo|educativo|educational|informative|datogas|hadzabes|masais","1473165","81766","1303","4318","https://i.ytimg.com/vi/JoLZgfXALNc/default.jpg","False","False","Nos adentramos en una pequeña comunidad de la tribu Datoga, al norte de Tanzania, para documentar su peculiar estilo de vida.¡SUSCRÍBETE!- Twitter https://www.twitter.com/LuisitoComunica- Facebook http://www.facebook.com/LuisitoComunica- Instagram http://www.instagram.com/LuisitoComunica"
"GY2xWbsy1ME","AMONG US - Dead Body Reported Sound GUITAR TABS | Cover Christianvib","2020-10-14T00:22:13Z","UC2VKCoZND5PENxAXLl8r6Jw","christianvib","27","20.18.10","Dead Body Reported Guitar Tutorial|Among Us|Dead Body Reported|Sound|Guitar|Guitar Tutorial|Dead Body Reported Guitar|Among Us Dead Body Reported|Among Us Dead Body Reported Guitar|Among Us Dead Body Reported Guitar Tutorial|Dead Body Reported Sound|Dead Body Reported Sound Guitar|Among Us Guitar|Among Us Guitar Tutorial|Theme|Among Us Theme|Among Us Theme Guitar|Among Us Theme Guitar Tutorial|among us dead body reported guitar tutorial|among us|christianvib","47747","3041","295","316","https://i.ytimg.com/vi/GY2xWbsy1ME/default.jpg","False","False","Descarga  TAB y Backing Track en  http://christianvib.com/paquetes/Compra la guitarra o el instrumento que deseas tanto aquí  https://www.falymusic.com/ y obtén un descuento usando mi cupón : vibSígueme https://www.instagram.com/christianvib/Micrófono :  Shure Beta 27Quieres un micrófono para grabar tus cover, pregúntame aquí cual es el indicado para ti   http://bit.ly/2cgBt51SUSCRÍBETE: http://bit.ly/161Gww7Que pacho!!! Hoy les traigo AMONG US - Dead Body Reported Sound   aquí podrás encontrar la tablatura TABS para que puedas aprenderlo a la perfección ...Disfruta !!"
"tyrVtwE8Gv0","NCT U 엔시티 유 'Make A Wish (Birthday Song)' MV","2020-10-12T09:00:15Z","UCEf_Bc-KVd7onSeifS3py9g","SMTOWN","10","20.18.10","NCT|NCT U|NCT 127|NCT DREAM|Make a wish|RESONANCE|엔시티","56483280","1900416","28531","492799","https://i.ytimg.com/vi/tyrVtwE8Gv0/default.jpg","False","False","NCT's 2nd album NCT - The 2nd Album RESONANCE Pt. 1 is out!🎧Listen and download on your favorite platform: https://nct2020.lnk.to/resonanceID🎁Official store: https://nct2020official.com[Tracklist]01 Make A Wish (Birthday Song)02 Misfit03 Volcano04 백열등 (Light Bulb)05 Dancing In The Rain06 Interlude : Past to Present07 무대로 (déjà vu; 舞代路)08 月之迷 (Nectar)09 Music, Dance10 피아노 (Faded In My Last Song)11 From Home12 From Home (Korean Ver.)13 Make A Wish (Birthday Song) (English Ver.)NCT Officialhttp://www.nct2020.comhttp://www.youtube.com/nctsmtownhttp://www.facebook.com/NCT.smtownhttp://www.instagram.com/ncthttp://twitter.com/NCTsmtown#NCT #RESONANCE #MakeAWish #RESONANCE_Pt1NCT U 엔시티 유 'Make A Wish (Birthday Song)' MV ℗ SM Entertainment"
"Zz2Hn7oHbys","NOS VAMOS A TWITCH! (Mi nuevo setup)","2020-10-12T21:30:01Z","UCqnFo90nZIcOxbfMekqnKiQ","JUCA","2","20.18.10","tuning|modificaciones|juca|jucaviapri|echando desmadre|coches|fiesta|diversion|el coche de juca|el 135 de juca|el bmw de juca|JUCA|modificaciones automotrices|vlog","812814","66571","3424","4733","https://i.ytimg.com/vi/Zz2Hn7oHbys/default.jpg","False","False","GRACIAS POR TODO EL APOYO!!!  Nos vamos a divertir a lo grande en esta nueva etapa!!!!JUCA 2.0 - https://www.youtube.com/channel/UCkiskB1l4Y7_EICxdAiGqqgTWITCH: https://twitch.tv/jucaviapriAcá conseguí todo lo del setup: https://crackedzonegaming.com/Acá te dejo mis otras redes sociales para que me sigas por allá también! Instagram: @jucaviapri -http://instagram.com/jucaviapriTwitter: @jucaviapri - http://twitter.com/jucaviapriFacebook: https://www.facebook.com/jucaviapri¿Quieres la merch más perrona del mundoooooo?Aquí merengues: www.shopjuca.com¿Qué tal beber un delicioso mezcal Alerón?- www.mezcalaleron.com- https://amzn.to/2S5zgQK"
"6lfSzcjGPtk","Pasteles INCREIBLEMENTE Reales...","2020-10-13T19:20:20Z","UCYiGq8XF7YQD00x7wAd62Zg","JuegaGerman","24","20.18.10","juegagerman|juega|german|holasoygerman|hola soy german|juega german|pasteles reales|realisticos|pasteles que parecen cosas|tortas que parecen cosas|torta","2905137","629028","2704","64235","https://i.ytimg.com/vi/6lfSzcjGPtk/default.jpg","False","False","⭐️ Escucha PLAN B en Spotify: https://bit.ly/PLANBGG ⭐️🏆 Unete a mi servidor en Discord: https://discord.gg/GermanGarmendia🔹Tik Tok: https://www.tiktok.com/@germangarmendia🔹Instagram: http://bit.ly/2rLMFRD 🔹Facebook: https://www.facebook.com/germangarmendia🔹Twitter: https://twitter.com/germangarmendia🔥Tengo una Playlist con las canciones que escucho en Spotify, si la quieres seguir y escucharla click aqui: https://spoti.fi/33yFjS4 🔥👑Usa en Fortnite mi código: JUEGAGERMAN ABRAZOOOOOS!!!:'D"
