video_id,title,publishedAt,channelId,channelTitle,categoryId,trending_date,tags,view_count,likes,dislikes,comment_count,thumbnail_link,comments_disabled,ratings_disabled,description,duration
"dnlxkGOSffE","Задержание юриста ФБК Любови Соболь в прямом эфире DW у дома предполагаемого отравителя Навального","2020-12-21T18:00:10Z","UCXoAjrdHFa2hEL3Ug8REC1w","DW на русском","25","20.23.12","Deutsche Welle|DW|Дойче велле|новости|dw russian|dw на русском|DW Новости|Зедержание соболь|любовь соболь задержание|соболь dw|задержание в прямом эфире|фбк|навальный|отравление навального|кто отравил навального|фсб навальный|путин навальный|расследование отравления навального|соболь навальный|навальный пранк|константин кудрявцев|автозак|соболь задержали в прямом эфире|соболь дв|сергей дик|новичок|спецслужбы путина","490583","27922","943","6475","https://i.ytimg.com/vi/dnlxkGOSffE/default.jpg","False","False","21 декабря было опубликовано продолжение расследование дела о покушении Алексея Навального. Сам оппозиционер побеседовал по телефону из одних из предполагаемых отравителей, связанных с ФСБ. Речь идет о Константине Кудрявцеве, который стал одним из центральных фигурантов расследования. У его дома дежурила юрист ФБК Любовь Соболь. Она была задержана в прямом эфире DW Новостей. Смотрите ключевой отрывок включения с московским корреспондентом DW Сергеем Диком.#Навальный #Соболь #расследование #ФБКБольше новостей на нашем сайте http://www.dw.com/russianв Facebook https://www.facebook.com/DWrussianTwitter https://twitter.com/dw_russianи Telegram https://t.me/dwglavnoe","4M47S"
"Imanmw3_lJQ","Провал спецслужб: Навальный позвонил предполагаемому убийце","2020-12-21T18:03:14Z","UC101o-vQ2iOj9vr00JUlyKw","varlamov","25","20.23.12","Навальный|отравление|фсб|навальный позвонил|расследование|кто отравил навального|спецоперация|провал|спецслужбы|bellingcat|Беллингкэт|Bellingcat|navalny|омск|томск|новичок|как отравили навального|отравление навального|путин","1021228","96892","4612","10332","https://i.ytimg.com/vi/Imanmw3_lJQ/default.jpg","False","False","Навальный позвонил своему предполагаемому убийце. Он признался.Наше ФСБ внезапно оказалось голым. Похоже, его сотрудник, много месяцев пытавшийся убить Навального, оказался не способным даже отличить его голос! Он не понимает, что ему звонят по обычному телефону, он просто рассказывает все своей жертве. Если ФСБ не может защитить себя, может ли она защитить Россию?Что посмотреть ещё:В интересах Родины я доверяю британцамhttps://youtu.be/1ZBUhR0rGegНавальный в коме: его отравили? | Пётр Верзилов о своём отравлении в 2018 году и его последствияхhttps://youtu.be/279WUaMoRfcНе разговаривайте с полициейhttps://youtu.be/shhyeIrvJAEКак меня задержала ФСБhttps://youtu.be/20Swva3WaaU#Навальный  #ФСБ Лучшие новогодние ёлочки: https://vrlmv.com/yolkaЕсли хотите сделать наши города лучше, присоединяйтесь к нашему общественному движению! Есть чаты по всей стране, регистрируйтесь в вашем городе: https://vrlmv.com/city4peopleКупить книгу 100 советов мэру: https://vrlmv.com/100Поддержать фонд «Внимание»: https://fondvnimanie.ru/donateСтаньте спонсором канала, и вы получите доступ к эксклюзивным бонусам. Подробнее: https://www.youtube.com/channel/UC101o-vQ2iOj9vr00JUlyKw/joinДля тех, кто хочет помочь с субтитрами или переводом этого ролика: https://goo.gl/Tcv863 ___Канал для стримов: https://www.youtube.com/channel/UChccvlH7O3ch8cfc221rAXAСайт: https://varlamov.ru/Телеграм-канал: https://t.me/varlamovНовостной телеграм-канал: https://t.me/varlamov_newsИнстаграм: https://instagram.com/varlamov/Твиттер: https://twitter.com/varlamov/ВК: https://vk.com/varlamovФейсбук: https://facebook.com/varlamov/Вайбер: https://vrlmv.com/viberПодкасты:Apple Podcasts: https://vrlmv.com/podcastappleЯндекс.Музыка: https://vrlmv.com/podcastyandexGoogle Podcasts: https://vrlmv.com/podcastgoogleВконтакте: https://vrlmv.com/podcastvkSoundCloud: https://vrlmv.com/podcastscMixcloud: https://vrlmv.com/podcastmixcloudAnchor: https://vrlmv.com/podcastanchorПредложения по поводу коллабораций, развития канала и сотрудничеству (кроме рекламы): mayavolf@varlamov.ruРеклама: reklama@varlamov.meТрек-лист:Оbi Sin - RаvenStigmata - Davis AbsoluteLights Go Down - Duce WilliamsОbi Sin - PlаtinumОbi Sin - Сhill FаctоrTrapped Nameless Servant","13M39S"
"GXSxsI2VKj0","15 Способов Пронести СЛАДОСТИ в КИНОТЕАТР ! **4 Часть**","2020-12-21T11:05:59Z","UC2tsySbe9TNrI-xh2lximHA","A4","24","20.23.12","15 Способов Пронести СЛАДОСТИ в КИНОТЕАТР ! **4 Часть**|15 Способов Пронести СЛАДОСТИ в КИНО|15 Способов Пронести СЛАДОСТИ|15 Способов Пронести ЕДУ в КИНОТЕАТР|как пронести сладости|как пронести еду в кинотеатр|как пронести сладости в кинотеатр|как пронести закуски в кинотеатр|в кино|кино|лайфхак|как есть свою еду в кино|протащил закуски в кино|проносим в кино сладости|пронести закуски в кино|еда в кино|в кинотеатре|челлендж|Влад Бумага|Влад А4|А4|кинотеатр","11339079","1441101","24301","264052","https://i.ytimg.com/vi/GXSxsI2VKj0/default.jpg","False","False","Покупай Мерч А4 «Ламба&Гелик» на официальном сайте - https://a4shop.ruКанал ГЛЕНТА - https://bit.ly/2Gwxge4Скачивай МОИ ИГРЫ:● А4 Пол это лава! - https://a4lava.page.link/go● А4 Аквапринт Челлендж - https://a4aquaprint.page.link/go● А4 - Убеги от хейтеров по ссылке - https://rac.l1nk.in/Y● А4 Головоломки  - https://a4logic.by/go● А4 Колесо фортуны  - https://a4roulette.onelink.me/v63S/go *****В этом ролике мы показали 15 способов пронести сладости в кинотеатр ! На входе в зал кино стоит внимательный билетер, через которого нам предстоит пронести свою еду, чтобы с комфортом посмотреть фильм !!! Этот ролик получился ОЧЕНЬ НЕОБЫЧНЫМ и СМЕШНЫМ !!! Смотри ДО КОНЦА и поддержи нас ЛАЙКОМ !!!*****● Instagram - https://www.instagram.com/a4omgПОДПИСЫВАЙСЯ ЧТОБЫ УВЕЛИЧИТЬ МОЮ САМООЦЕНКУ !) ▶️ РЕКЛАМА, СОТРУДНИЧЕСТВО: a4a4a4a4pr@gmail.com▶️ПРОШЛОЕ ВИДЕО - https://youtu.be/XEy2Rqs5EAs● Моя партнерская сеть MediaCube :  http://bit.ly/A4_mcn● Instagram - https://www.instagram.com/a4omg● VKontakte: https://vk.com/id240651878● Паблик VK : https://vk.com/a4_tv● TikTok - https://vm.tiktok.com/qwHt6j/","26M52S"
"1bvNbOQyenc","SnowПати | НОВЫЙ ГОД С НОВОЙ СТРОЧКИ| Егор Шип| Даня Милохин| MIA BOYKA|Валя Карнавал| Юля Гаврилина","2020-12-22T10:04:42Z","UCp-0p5RaTj_IZaBLNJLEqQQ","Музыка Первого","10","20.23.12","Музыка Первого|звезды|выступления|концерт|музыка|артисты|хиты 2019 года|хиты|плейлист 2019 года|плейлист с треками|концерт музыки первого|сборный концерт|молодежная музыка|музыка для молодежи|выпускной|выпускной 2020|выпускной в парке горького|выпускной музыка первого|выпускной москва|песни","169426","14026","392","1150","https://i.ytimg.com/vi/1bvNbOQyenc/default.jpg","False","False","#Концерт  #SnowПати ТЕЛЕВЕРСИЮ шоу смотри 31 декабря в 23:30 на телеканале Музыка ПервогоЕгор Крид • Artik & Asti • Zivert  • Клава Кока • Лёша Свик • Даня Милохин • Jony • Rauf & Faik • Мари Краймбери • NILETTO • Дина Саева • Валя Карнавал • Юля Гапврилина • Ramil' • Мот • T-Killah • MIA BOYKA • MARUV • GAYAZOV$ BROTHER$ • ST • Elvira T • Kara Kross • RASA • Тима Белорусских • Фогель • Артур Бабич • Аня POKROV • Mitchel • Ханза & OWEEK • Катя Адушкина и RUS • Миша Марвин • Володя ХХL • Tenderlybae • Ганвест • Mary Gu • DAVA • HENSY • Xcho & MACAN • Konfuz • Dabro • Егор Шип • Filatov & Karas • Natan • Просто Лера • ANDRO • Gafur • ELMAN • Kagramanov • NIKITA ZLATOUST • Юлианна Караулова • Roully • Кучер • Перфе • Мы в сетях:Instagram https://www.instagram.com/musiconetvVK https://vk.com/musiconetvСайт http://www.muz1.tvInstagram https://www.instagram.com/vecherniylike#МузыкаПервого","3M43S"
"vMYsmpHXzGY","В ШКОЛЕ притворился ДЕДОМ МОРОЗОМ c подарками!","2020-12-22T12:05:19Z","UCUHQKxU-_DWsrwBxlKWgsew","ЕГОРИК","24","20.23.12","В ШКОЛЕ притворился ДЕДОМ МОРОЗОМ c подарками!|ПРИТВОРИЛСЯ ДЕДОМ МОРОЗОМ|ПРИТВОРИЛСЯ САНТОЙ|ДЕД МОРОЗ В ШКОЛЕ|ШКОЛЬНЫЙ ЧЕЛЛЕНДЖ|видео с подписчиками|дед мороз в школе дарит подарки|блогер оделся в деда мороза и подарил подарки|школьные пранки|24 часа в школе|24 часа дедом морозом|Егорик дед мороз|Егорик А4|Влад А4|Влад Бумага|оделся как дед мороз в школе|школьный дед мороз|пранк над подписчиками|новый год","1283249","163226","2429","14174","https://i.ytimg.com/vi/vMYsmpHXzGY/default.jpg","False","False","Качай Game of Khan бесплатно - https://bit.ly/shkredВ ШКОЛЕ притворился ДЕДОМ МОРОЗОМ c подарками!В этом видео я претворился дедом морозом в ШКОЛЕ, мне очень захотелось узнать сколько школьников смотрит наши видео и смогут ли они узнать нас по голосу. Видео получилось очень новогодним и классным. Надеюсь у  вас появиться новогоднее настроение. Досмотри это видео до конца чтобы узнать  сколько людей нас узнало.Мой вк-https://vk.com/egorikshkredofficialМой инстаграм - https://www.instagram.com/egor_shkred...КАНАЛ ЯНЫ - https://clck.ru/RVDCQИнстаграм Миши Вайса - https://instagram.com/mishawice?igshi...Мой ТИК ТОК- https://vm.tiktok.com/HHpHMn/Почта для сотрудничества - shkred@mediacube.in","24M8S"
"XhvP4WwX2NU","РАЗБОР ЗВОНКА НАВАЛЬНОГО ПРО ТРУСЫ И НОВИЧОК - КТО В ЭТО ПОВЕРИТ?","2020-12-22T11:28:22Z","UCDbsY8C1eQJ5t6KBv9ds-ag","kamikadzedead","22","20.23.12","kamikadzedead|камикадзе видео|камикадзе канал|kamikadzedead канал|телефонный разговор навального с одним|навальный позвонил своему|навальный пранк|навальный трусы|навальный отравление телефонный разговор|расследование навального|расследование the belling cat","400638","0","0","0","https://i.ytimg.com/vi/XhvP4WwX2NU/default.jpg","True","True","Беспроводные наушники CGPods от тюменского Илона Маска. С влаго-защитой и в 4 раза дешевле «яблок»! Скидка 200 рублей по коду KAMIKADZE1220: https://bit.ly/3mC4QllПослушал полную версию разговора Навального с сотрудником ФСБ, который признался в покушении. На кого рассчитан этот пранк и что он вообще доказывает? Видео Навального - Я позвонил своему yбийцe. Он признался https://youtu.be/ibqiet6Bg38 . Телефонный разговор Навального с одним из его yбийц. Полная версия https://youtu.be/HlJbwUhIBxEВсе видео на моём сайте https://kamikadze-d.net/ [ ЕСЛИ YouTube НЕ ПРИСЫЛАЕТ УВЕДОМЛЕНИЯ О НОВЫХ ВИДЕО ]Помощь автору канала рублём: 1) https://www.donationalerts.com/r/kamikadzedead (куча способов перевода)3) PayPal - ivanov.kamikadzedead@yandex.ruНа странице Андрея Паневина https://www.facebook.com/panevin.books опубликованы новые еще более увлекательные приключения Муси. Рекомендую!Прямые трансляции и ответы на вопросы каждый понедельник в 19.00 по Москве на https://www.youtube.com/user/kamikadzeliveМой инстаграм - https://www.instagram.com/kamikadze_dead/Новости в телеграме https://t.me/satirabezpozitivaРеклама, сотрудничество https://goo.gl/ddnKhN Паблик Сатира без Позитива в ОК https://ok.ru/satirabezpЯ в Ватноклассниках - http://www.ok.ru/profile/566798658882Я в контакте - http://vkontakte.ru/kamikadzedeadПаблик Эксперты Знатоки https://vk.com/realproblemsrussiaМой Twitter - http://twitter.com/kamikadze_dЯ на ФБ http://www.facebook.com/dmitry.ivanov.9634?ref=tn_tnmn","13M39S"
"Ssggw0w8h_0","КАРКАСНЫЙ ДОМ / ПОСЛЕДНИЙ ГВОЗДЬ В КРЫШКУ / СТРОЙХЛАМ","2020-12-22T15:55:48Z","UCq04tnZGXkeQE8VkxI1OXDg","СтройХлам","22","20.23.12","каркасный дом|строительство|каркасный дом своими руками|каркасник|стройка|строительство дома|строительство каркасного дома|строительство дома из газобетона|стройхлам|построить дом|как построить каркасный дом|каркасный дом проект","56693","5082","248","1119","https://i.ytimg.com/vi/Ssggw0w8h_0/default.jpg","False","False","канал Тима Керби https://www.youtube.com/channel/UCIIb50QilCTRnONBk4M1CLAЕще один канал Тима Керби :))) https://www.youtube.com/user/RBTHvideoМалоэтажная страна интервью с Тимомhttps://youtu.be/BWLrVrG-1U0Поддержать канал: https://teespring.com/stores/stroihlamНа этот раз нас пригласил в гости Тим Керби (Tim Kirby), истинный американец, соведущий шоу Стилавина на радио Маяк. Тим построил себе по сути небольшой каркасный дом в Чеховском районе Московской области. Тим попросил нас сделать дефектовку этого дома, как мы обычно делаем при покупке дома в сервисе Домоподбор.ру (domopodbor.ru) Если  честно, то дефектовки толком не было, потому что дом был ужасный. Но самое важное, что мы вынесли  из это встречи - это интервью с Тимом, который рассказал нам, что строительство каркасных домов в США - это просто вынужденная мера и что данная технология среди состоятельных людей даже не рассматривается всерьез. Люди, у которых есть выбор, никогда в США не строят каркасные дома, потому что у них слишком много недостатков. Так почему же в России продавцы навязывают нам эту технологию в условиях того, что каменный дом стоит абсолютно равноценно? Стройхлам поставил жирную точку в аргументах продавцов по поводу того, что каркасное домостроение  - это локомотив, который дает людям возможность построить недорогие и качественные дома. Ваш Стройхлам","41M52S"
"sv9zSKPQT54","Мурат Тхагалегов - Я с ней кайфую | Премьера трека 2020","2020-12-22T16:00:15Z","UC1-CSlW88o-ge88ELumtuHg","ZVUKM TV","10","20.23.12","Премьера трека|zvukm|Премьера|новинки музыки|музыка песни|лучшие песни|песни для души|zvukmtv|русская музыка|русские песни|лирика|кавказские песни|Музыка|Кавказская музыка|песни|ТОП|Хит|2019|музыка 2019|zvukm tv|Мурат Тхагалегов|Я с ней кайфую","105556","5870","89","144","https://i.ytimg.com/vi/sv9zSKPQT54/default.jpg","False","False","«Я с ней кайфую» - новый сингл Мурата Тхагалегова!Слушать: https://zvuk-m.com/UMZCBДолгожданная новинка от Мурата Тхагалегова! С тех пор, как артист анонсировал песню «Я с ней кайфую» в своем аккаунте в социальной сети, подписчики с нетерпением ждали выхода трека на цифровых площадках. И вот релиз состоялся!Композицию о счастливых взаимоотношениях написала Замира Жабоева.#ЗвукМ #ПесниЗвукМ _______________________________________ Сайт: http://zvuk-m.com/Instagram: https://www.instagram.com/zvukm/Vkontakte: https://vk.com/zvukmcomОдноклассники: http://ok.ru/zvukm Twitter: https://twitter.com/ZvukMcomFacebook: https://www.facebook.com/zvuk.mОна женщина моей мечты,Ей дарю шикарные цветы.Она бальзам моей души,Воплощенье всей красоты.Я с ней живу, я с ней кайфую.Хочу люблю, хочу целую.Ее всегда-всегда ревнуюЯ с ней живу, я с ней кайфую.Я с ней живу, я с ней кайфую.Хочу люблю, хочу целую.Ее всегда-всегда ревнуюЯ с ней живу, я с ней кайфую.Я с ней кайфую.Ее невозможно разлюбитьБез нее ни дня мне не прожить.Я с ней не ведаю преградКак же в этой жизни тебе я рад.Я с ней живу, я с ней кайфую.Хочу люблю, хочу целую.Ее всегда-всегда ревнуюЯ с ней живу, я с ней кайфую.Я с ней живу, я с ней кайфую.Хочу люблю, хочу целую.Ее всегда-всегда ревнуюЯ с ней живу, я с ней кайфую.Я с ней кайфую.Я с ней живу, я с ней кайфую.Я с ней кайфую.","2M42S"
"Uy3CvVFx4xc","СМЕРТЕЛЬНАЯ ГОНКА НА ПОЛЮС","2020-12-23T07:30:04Z","UCyjf5CxCNEc9ALYlalBiKDQ","GEO","24","20.23.12","#НАРЕАЛЬНЫХСОБЫТИЯХ|гонка на северный полюс|южный полюс|арктика и антарктика|мороз|самое холодное место|история|выжить|гео|geo","93893","13822","94","758","https://i.ytimg.com/vi/Uy3CvVFx4xc/default.jpg","False","False","Выбирай Связь Z и получай минуты и мегабайты без срока действия и абонентской платы: https://clcr.me/Z_GEOСегодня я расскажу не одну, а сразу две истории. Как рекордсмены и любители острых ощущений наперегонки пытались добраться до крайних точек планеты. И как первая история превратилась в детективное ток-шоу в стиле “скандалы, интриги, расследования”, а вторая - в античную трагедию с пафосными речами и героическими смертями.● Instagram: https://Instagram.com/thegeoshows ● VKontakte: https://vk.com/iashvili1 ● Телеграм: https://t.me/GEOSHOW ● Патреон: https://www.patreon.com/GEOSHOW Второй запасной канал - https://www.youtube.com/channel/UC3yjMTYgk-OUslwfq6J2Jog Сотрудничество / Реклама : thegeoshows@gmail.com Материалы к выпуску - https://cutt.ly/Ph1s9CK","38M59S"
