video_id,title,publishedAt,channelId,channelTitle,categoryId,trending_date,tags,view_count,likes,dislikes,comment_count,thumbnail_link,comments_disabled,ratings_disabled,description,duration
"RSANFoYQJLk","Дмитро Гордон на #Україна24 // ЧАС ГОЛОВАНОВА – 22 грудня","2020-12-22T21:23:09Z","UCMp5Buw-6LpbbV9r9Sl_5yg","Україна 24","25","20.23.12","україна 24|україна 24 прямий ефір|Гордон|Дмитро Гордон|Дмитрий Гордон|Час Голованова|Голованов|кризис|криза|карантин|карантин выходного дня|карантин вихідного дня|локдаун|Верховна Рада|парламент|праздник|новий рік","66452","1057","247","289","https://i.ytimg.com/vi/RSANFoYQJLk/default.jpg","False","False","В ефірі програми #ЧасГолованова Василь Голованов та Дмитро Гордон обговорять такі теми:1. Резонансні інтерв'ю: які наслідки розмови Гордона з терористом Гіркіним?2. ВООЗ стурбована новим штамом коронавірусу: чи мала б Україна припинити польоти у Велику Британію?00:00 Час Голованова.02:13 Яка ситуація в Лондоні, де знайшли новий штам коронавірусу.06:14 Інтерв'ю Гордона з Ходорковським у Великій Британії.12:03 Ходорковський дав свою характеристику Путіну.22:21 Російський репер Монгерштерн запланував три концерти в Україні.32:38 Белінгкет знімає фільм про спецоперацію щодо захоплення вагнерівців.42:14 Нову форму ковіду виявили у шести країнах світу.57:19 Вакцинація Джо Байдена може призвести до глобальної економічної кризи.01:02:08 Інтерв'ю Гордона із російським терористом Ігорем Стрєлковим-Гіркіним.01:09:24 Які заслуги у Кернеса перед мешканцями Харкова.01:19:00 Які імена потрібно дати вулицям Києва?01:30:28 В Україні можуть ввести накопичувальну пенсійну систему.-------------------------------------------------------------------------------------------------------------Напиши в коментарях, що думаєш про цеПідпишись на Telegram: https://t.me/ukraina24tv Коментуй у Facebook: https://bit.ly/Ukraina24TV Дивись на YouTube: http://bit.ly/Ukraine24TVЧитай на сайті: https://ukraine24.tv#україна24 #u24 #новини #Гордон #Голованов #Час_Голованова","1H59M20S"
"n3MUhkO_dhE","Дьявол в деталях — Русский трейлер (2021)","2020-12-22T15:13:53Z","UCs9tHGGpNjOMiCnbqTGA1PQ","iVideos","1","20.23.12","Дьявол в деталях|Дьявол в деталях фильм|Дьявол в деталях русский трейлер|Дьявол в деталях трейлер на русском|Дьявол в деталях 2021|русский трейлер|2021|фильм|трейлер на русском|дублированный трейлер|трейлеры 2021|ivideos|трейлер фильма|фильмы 2021|ivideos трейлеры|The Little Things|ензел Вашингтон|Джаред Лето|Софья Васильева|Рами Малек","202586","11121","80","431","https://i.ytimg.com/vi/n3MUhkO_dhE/default.jpg","False","False","► Русский трейлер фильма «Дьявол в деталях»  (2021) года |Русские трейлеры к фильмам, сериалам и играм! Интересные ролики о фильмах и их съёмках! Подпишись на канал ► http://bit.ly/Subscribe_ivideos ◄ Новости,промо,трейлеры,даты выходов фильмов и сериалов только у нас: ► http://vk.com/iVideos ◄• Telegram: https://t.me/ivideosnews• Facebook: http://fb.com/ivideosnews▬▬▬▬▬▬▬▬▬▬▬▬▬▬▬▬▬▬▬▬▬▬▬▬▬▬▬▬Дата выхода - ►28 января 2021◄• Оригинальное название: The Little Things• Страна: США• Дистрибьютор: Warner Bros. Russia• Режиссер: Джон Ли Хэнкок• Жанр: триллер• В главных ролях: Дензел Вашингтон, Джаред Лето, Софья Васильева, Рами Малек, Натали Моралес, Том Хьюз, Кристофер БауэрМолодой талантливый детектив Бакстер объединяется с изможденным помощником шерифа Диком, чтобы поймать опасного серийного убийцу. У Дика талант находить важные для дела мелочи, но его привычка игнорировать правила ставит Бакстера перед сложным выбором.▬▬▬▬▬▬▬▬▬▬▬▬▬▬▬▬▬▬▬▬▬▬▬▬▬▬▬▬• Трейлеры к фильмам: https://goo.gl/EXV9vM• Трейлеры к мультфильмам: https://goo.gl/Xn4Q13• Игровые трейлеры: https://goo.gl/HPACDp• Видео о съёмках фильмов: https://goo.gl/wc5MTh#Мелочи #iVideosTrailers #Трейлеры2021 #Фильмы2021 #Фильмы #iVideos #Movie #Trailer #Трейлер #Онлайн #Смотреть","2M35S"
"hOQ7U6qWzhc","Полиция и оппозиция: ФСБ зовёт на помощь | УТРО | 22.12.20","2020-12-22T08:36:39Z","UCBG57608Hukev3d0d-gvLhQ","Настоящее Время","25","20.23.12","навальный|россия|фсб|отравление|расследование|прямой эфир|утро|патрушев|кудрявцев","120216","3632","165","332","https://i.ytimg.com/vi/hOQ7U6qWzhc/default.jpg","False","False","30:10 – Геннадий Гудков, бывший офицер ФСБ, политик – о звонке Навального.36:28 – Андрей Остапович, основатель инициативы ByPol – о поведении белорусских силовиков и Книге регистраций преступлений.42:05 – Димаш Алжанов, политолог из Алматы – о высказывании российских депутатов о Казахстане.51:34 – Алексей Барановский, доцент кафедры информационной безопасности КПИ – о крупнейших кибератаках на госструктуры США.1:00:48 – Артем Сытник, директор Национального антикоррупционного бюро Украины – о подозрении заместителю главы Офиса президента Украины.","1H9M43S"
"ISqjwU_Frds","Любовь Соболь задержали // Прямое включение RTVI","2020-12-21T16:30:00Z","UCPU28A9z_ka_R5dQfecHJlA","RTVI Новости","25","20.23.12","константин кудрявцев|алексей навальный|отравление навального|любовь соболь|фбк|расследование отравления навального|новичок|расследование|омск|фсб|rtvi онлайн|rtvi прямой эфир|задержание соболь","280850","11628","611","2073","https://i.ytimg.com/vi/ISqjwU_Frds/default.jpg","False","False","Юриста ФБК Любовь Соболь задержали у дома одного из предполагаемых отравителей Алексея Навального. Сегодня днем он опубликовал видео, в котором заявил, что в телефонном разговоре добился признания в покушении на него от одного из фигурантов расследования о своем отравлении. Корреспондент RTVI ведет прямую трансляцию от дома К.К.","7M31S"
"pdP9mQAQnQU","Eşkıya Dünyaya Hükümdar Olmaz 177. Bölüm","2020-12-22T21:18:38Z","UCeLBNGSG9w5qEbzQqZjqjuw","Eşkıya Dünyaya Hükümdar Olmaz","24","20.23.12","eşkıya dünyaya hükümdar olmaz|eşkiya dünyaya hükümdar olmaz|eşkiya dunyaya hukumdar olmaz|edho|eşkıya dünyaya hükümdar olmaz yeni sezon|eşkıya dünyaya hükümdar olmaz 6. sezon|edho yeni sezon|edho 6. sezon|oktay kaynarca|yunus emre yıldırımer|ozan akbaba|sabina toziya|kenan çoban|turgay tanülkü|yalçın hafızoğlu|haydar şişman|atv dizisi|atv|edho izle|edho tek parça|قطاع الطرق لن يحكموا العالم|Eşkıya Dünyaya Hükümdar Olmaz 177. Bölüm|edho 177|eşkıya 177","1722114","0","0","3783","https://i.ytimg.com/vi/pdP9mQAQnQU/default.jpg","False","True","Eşkıya Dünyaya Hükümdar Olmaz 177. Bölüm Özeti: Alpaslan Çakırbeyli için masada yapılan oylamada, yediye beş infaz kararı çıkar. Alınan bu karara rağmen intikamından vazgeçmeyen Alpaslan Çakırbeyli, ihanet eden herkesin peşine düşer. İnfazına el kaldıranlara yaptığı saldırıyla âleme adını bir kez daha duyuran Alpaslan Çakırbeyli, amacına bir adım daha yaklaşır. Karşısında kim olursa olsun silahını indirmeyen Alpaslan Çakırbeyli’ye en büyük desteği ise ters düştüğü amcası Hızır Çakırbeyli verir. Tipi ise masada Alpaslan’ın ölümüne el kaldıran Rafet’in peşine düşer.Hamdi Korkmaz, oğulları ve kayınbiraderine yapılan saldırının faturasını Avni’ye keser. Alpaslan’ın ölmesini isteyen Hamdi Korkmaz, intikamının alınması için Avni’yi tehdit eder. İdris Reis’in oğlu Kaya için Haşmet Façalı’nın kızı Didem’i istemesi aileler arasında gerginliğe yol açar. Bu sürtüşmenin bitmesi için plan yapan Hayriye Çakırbeyli, planını uygulamak için ilk adımı atar. Oğlu Hızır Çakırbeyli’nin yuvasını yıkmasına da kayıtsız kalamayan Hayriye Çakırbeyli, Bahar Sincanlı’nın karşısına geçerek tehdit eder.Eşkıya Dünyaya Hükümdar Olmaz Kanalından ÖnerilerEşkıya Dünyaya Hükümdar Olmaz Bölümleri İçin Tıklayınhttps://bit.ly/2HVjRzZEşkıya Dünyaya Hükümdar Olmaz En Sevilen Sahneler İçin Tıklayınhttps://bit.ly/36J1Or8Eşkıya Dünyaya Hükümdar Efsane Sahneler İçin Tıklayınhttps://bit.ly/33CdZUCKuruluş Osman Full Bölümler İçin Tıklayınhttps://bit.ly/36DYLQXEşkıya Dünyaya Hükümdar Olmaz Youtube Kanalına Abone Olmak İçin; https://bit.ly/2uzVwcwatv Resmi YouTube Kanalına Abone Olmak İçin; https://goo.gl/dmrDLNAyrıcalıklardan yararlanmak için bu kanala katılın:https://www.youtube.com/channel/UCeLBNGSG9w5qEbzQqZjqjuw/join","2H23M12S"
"3RlUsjce9E0","Прощай, ДРЯБЛАЯ кожа! От морщин НИЧЕГО не останется! Маска-пилинг с хлоридом кальция.","2020-12-22T15:00:03Z","UCwQuU87UGijmClBG1z4ny1w","Позитиff ММ","22","20.23.12","позитифф мм|позитиффмм|от морщин|маска от морщин|как убрать морщины|морщины|маска для лица|как избавиться от морщин|убрать морщины|уход за лицом|красота|омоложение|борьба с морщинами|маска против морщин|средство против морщин|омоложение лица|мимические морщины|народные средства|купила в аптеке|за копейки|советы|полезные советы|народные рецепты|уход за кожей лица|антивозрастной уход|хлористый кальций|хлорид кальция|пилинг|раствор кальция хлорида","40160","1433","20","42","https://i.ytimg.com/vi/3RlUsjce9E0/default.jpg","False","False","Такое недорогое #аптечноесредство как #хлоридкальция может помочь избавиться #отморщин на лице, подтянет кожу, придаст личику холеный, свежий вид! Применяйте такие #маскидлялица курсом, чтобы ваша кожа выглядела идеально! Приятного просмотра! Перед применением необходима консультация специалиста. АПТЕЧНЫЕ препараты, про УДИВИТЕЛЬНЫЕ свойства которых вы НЕ ЗНАЛИ: https://goo.gl/Husy6q От МОРЩИН. Самое ЭФФЕКТИВНОЕ https://clck.ru/FqHc3 ♡ Получай МАХ доход от своего Ютуб канала: https://yoola.app/r/6115825276655♡ Инстаграм https://www.instagram.com/million_poleznostei/♡ Текстовые отзывы http://goo.gl/I8y2jVПриглашаю ВАС на мой канал #позитиффмм !!!!!Здесь вы найдете лучшие #народныерецепты для здоровья и красоты, они помогут вам исцелиться от многих болезней и недугов, отрастить длинные волосы и ресницы, укрепить ногти, избавиться от прыщей и пигментных пятен.  Мы будем готовить самые эффективные маски для лица с мумие, крахмалом, желатином и другими бюджетными народными средствами. Я поделюсь с вами полезными советами, которые помогут любой хозяйке сделать дом чистым и уютным, а также простыми, быстрыми в приготовлении рецептами для здорового питания. Видео на канале выходят 2 раза в неделю.","5M50S"
"lS0M7KQPBMY","СОЛОВЬЁВ ПРО ТРУСЫ НАВАЛЬНОГО - ЛЮБОВЬ И ВЕСЕЛЬЕ","2020-12-23T09:28:00Z","UCDbsY8C1eQJ5t6KBv9ds-ag","kamikadzedead","22","20.23.12","kamikadzedead|камикадзе видео|камикадзе канал|kamikadzedead канал|соловьёв про трусы навального|трусы навального фсб|расследование|расследование навальный|варламов беларусь|варламов freebelarus|пивоваров редакция|пивоваров про выборы|пивоваров про путина|редакция пивоваров про путина|бабушка про путина|бабуля про путина","156726","0","0","0","https://i.ytimg.com/vi/lS0M7KQPBMY/default.jpg","True","True","Владимир Соловьёв про трусы Навального! Эпичное и очень смешное выступление Соловьёва. Такая страсть к трусам Навального заслуживает Оскара! Оскара Соловьёву в новом видео. Изделия ручной работы из эпоксидной смолы для дома и в подарок - https://www.instagram.com/inkvizitorart/ и магазин изделий из эпоксидной смолы https://www.etsy.com/shop/InkVisitorArt/Все видео на моём сайте https://kamikadze-d.net/ [ ЕСЛИ YouTube НЕ ПРИСЫЛАЕТ УВЕДОМЛЕНИЯ О НОВЫХ ВИДЕО ]Помощь автору канала рублём: 1) https://www.donationalerts.com/r/kamikadzedead (куча способов перевода)3) PayPal - ivanov.kamikadzedead@yandex.ruНа странице Андрея Паневина https://www.facebook.com/panevin.books опубликованы новые еще более увлекательные приключения Муси. Рекомендую!Прямые трансляции и ответы на вопросы каждый понедельник в 19.00 по Москве на https://www.youtube.com/user/kamikadzeliveМой инстаграм - https://www.instagram.com/kamikadze_dead/Новости в телеграме https://t.me/satirabezpozitivaРеклама, сотрудничество https://goo.gl/ddnKhN Паблик Сатира без Позитива в ОК https://ok.ru/satirabezpЯ в Ватноклассниках - http://www.ok.ru/profile/566798658882Я в контакте - http://vkontakte.ru/kamikadzedeadПаблик Эксперты Знатоки https://vk.com/realproblemsrussiaМой Twitter - http://twitter.com/kamikadze_dЯ на ФБ http://www.facebook.com/dmitry.ivanov.9634?ref=tn_tnmn","13M17S"
"KtqvQzIPL4Q","КОБЯКОВ - ПУШКА (Премьера песни)","2020-12-22T08:00:10Z","UCPei3YaN1LJGAt1wKB3IWlw","Головной Рис","10","20.23.12","Премьера|Премьера песни|Кобяков|А4|Кобяков А4|Музыка|Попса|Новинки|Тренды|Чарт|Пушка|Песня|Трек","143416","15763","1236","2272","https://i.ytimg.com/vi/KtqvQzIPL4Q/default.jpg","False","False","Премьера песни!Кобяков - ПУШКАСлушать песню: https://band.link/pushkaaКОБЯКОВ В СОЦИАЛЬНЫХ СЕТЯХ:Инстаграмм – https://instagram.com/kobyakov_offcialТик-ток – https://vm.tiktok.com/XHDuRH/ВКонтакте – https://vk.com/kobyakov_official","3M47S"
"39Uk4V7qs_U","«Великое соединение» Юпитера и Сатурна: редчайшее явление можно наблюдать несколько дней","2020-12-21T17:29:09Z","UCnAFKvDuqBGkIfV8Vn0J_CQ","Телеканал Хабар 24","25","20.23.12","Хабар 24|Қазақстан жаңалықтары|новости Казахстана|Басты жаңалықтар|бүгінгі жаңалықтар|новости на сегодня|хабар 24 казакша|хабар 24 прямой эфир|мировые новости|әлем жаңалықтары|эфир","164473","2088","151","285","https://i.ytimg.com/vi/39Uk4V7qs_U/default.jpg","False","False","Сегодня жители Северного полушария планеты наблюдали редчайшее астрономическое явление - «великое соединение» Юпитера и Сатурна. Уникальность его в том, что ранее аналогичное сближение двух планет-гигантов произошло почти 800 лет назад, 4 марта 1226 года. На небе Юпитер и Сатурн в момент максимальной фазы соединения выглядели, как очень яркая двойная звезда. Можно ли увидеть это явление ещё раз в ближайшие дни у нас, в Казахстане? Об этом расскажет корреспондент «Хабар 24».Подписывайтесь на канал «Хабар 24»: http://bit.ly/31WnObWНаш сайт - https://24.kz Facebook - https://www.facebook.com/tvkhabar24Instagram - https://www.instagram.com/tvkhabar24Telegram - https://t.me/tvkhabar24Twitter - https://twitter.com/tvkhabar24 Vkontakte - https://vk.com/tvkhabar24","2M55S"
"vrerHefkUbM","Я ПОТЕРЯЛАСЬ...","2020-12-22T12:00:15Z","UCyGszKjNudY6hOhUlB9W8VQ","Sveta Sollar","22","20.23.12","я устала|дрим тим|даня милохин|милохин новый клип|милохин клип|бабич|покров|карнавал|тик ток|тикток|тикток россия","23370","4675","66","548","https://i.ytimg.com/vi/vrerHefkUbM/default.jpg","False","False","💕 ТИК ТОК https://vm.tiktok.com/xbgGkb/💕INSTAGRAM: https://instagram.com/svetasollar💕VK: http://vk.com/svetasollarСотрудничество: svetasollar@wildjam.rusvetasollar@gmail.com","8M13S"
"gWDSZQzYT_4","Яков Кедми ЖЕСТКО о разговоре Навального с отравителем","2020-12-23T09:00:30Z","UC5Z2ZmwAJhPLRIBUVkQljMg","Россия - Украина","25","20.23.12","Россия Украина|срочные новости|Зеленский|Путин|новости|последние новости|политика сегодня|россия сша|украина сша|украина сша новости|россия украина новости|политика новости|Россия 24|Лукашенко|Слуга народа|выборы","50795","2684","119","712","https://i.ytimg.com/vi/gWDSZQzYT_4/default.jpg","False","False","НОВЫЙ инвестиционный проект по Доверительному УправлениюРегистрация https://is.gd/HUjq5JУже более 5000 инвесторов!!! Регистрируйся https://vk.cc/bWon8lПОДДЕРЖАТЬ канал http://www.donationalerts.ru/r/russiaukraine-----------------------------------------------------------------------------------------------------------------------------------------Подписаться на канал https://www.youtube.com/channel/UC5Z2ZmwAJhPLRIBUVkQljMg?sub_confirmation=1-----------------------------------------------------------------------------------------------------------------------------------------Лучший кэшбэк сервисВозвращайте до 50% за покупки в Интернете — https://goo.gl/nfZ0BV [Premium-аккаунт в подарок]Более 10 млн участников, более 2200 магазиновРегистрируйтесь и начинайте экономить — https://goo.gl/nfZ0BV #РоссияУкраина #Новости #Политика #Политикасегодня #Россия #Украина","28M32S"
