video_id,title,publishedAt,channelId,channelTitle,categoryId,trending_date,tags,view_count,likes,dislikes,comment_count,thumbnail_link,comments_disabled,ratings_disabled,description,duration
"4qz8fktl4_Y","КРАСАВА в Киеве - Миля с Кентом/ подхалимство Газзаева и угрозы жизни/ распил бабла в футболе","2020-12-22T11:00:26Z","UCTzmVEDQcuzma3-tGAwQXYA","Бомбардир","17","20.23.12","Красава|Жека Савин|Миля|Кент|Красава в Киеве|Сава Красава|Евгений Савин|Милевский|Алиев|Красава Бомбардир|Александр Зинченко|Динамо Киев|Красава интервью|Газзаев|Юрий Семин|сборная Украины|Ракицкий|Тимощук|Юрий Дудь|Павел Яковенко|Мхитарян|ФК Красава|2drots|дудь|красава и газзаев|красава в украине|милевский|милевский красава|красав и милевский|бомбардир|роман бебех","68106","5656","217","645","https://i.ytimg.com/vi/4qz8fktl4_Y/default.jpg","False","False","😱 Лучший спортивный блоггер восточной Европы #Красава впервые в Украине!🇺🇦 Что он здесь делает, как пересекал границу и какие первые впечатления от Киева?⚡️ В этом видео Жека Савин откровенно расскажет о главных трудностях в истории своего канала, цензуру и отношение к украинским командам, футболистам и блоггерам.🔥 Как #Газзаев принимал и общался с Савой в Госдуме, как с одного из лучших российских тренеров превратился в подхалима Кремля, и вся разница между ним и Юрием Семиным.💣 Футбол и политика. Почему из украинских футболистов Красава записал только Зинченко? А кто из наших топ-игроков отказался от съемки на канале по политическим причинам?🤔 Поговорили и о наших клубах. За какими украинскими командами следит Сава и есть ли любимый клуб в Украине?🌟 Рассказал Женя и о звездных гостях на канале. Как удалось взять интервью у Хави, Джерарда и Мхитаряна и кто из легендарных испанских игроков не пожал ему руку?😅 А напоследок Сава попытается перевести непростые украинские слова, признается, с кем мечтает записать видео в 2021-м и кто для него лучше: #Миля или #Кент?🔝 Такого контента вы еще не видели!✅ Подписывайся на канал #Бомбардир, смотри это видео до конца и пиши свои впечатления!📸 Инста Сани Панкова - https://www.instagram.com/pankov_agent/🔴 Канал Красавы - https://www.youtube.com/channel/UCoRAnB8KixJiszlSpMHa-SA📸 Инстаграм Жеки - https://www.instagram.com/sava9/🔴 Миля - https://www.youtube.com/channel/UCnugA8U6PREOU6o9Rq8gP5g🔴 Кент - https://www.youtube.com/channel/UCRJBCggIfCryOlqs2JgwQWw📸 Мой инстаграм - https://www.instagram.com/rbebekh/ 📱 Телеграм - https://t.me/bombardyr_ua🐦 Твиттер - https://twitter.com/roman_bebekh 🔷 Фейсбук - https://www.facebook.com/roman.bebekh❗️ Sportarena! Все новости спорта на – https://sportarena.com/ 💙  Инста Sportarena – https://www.instagram.com/sportarena_com/🔝 FB SPORTARENA – https://www.facebook.com/sportarenacom/ ⚽️ Телеграм Sportarena – https://t.me/sportarena_com00:00 - Анонс03:25 - Что Красава делает в Украине?05:25 - Миля или Кент?07:00 - Почему в России нет таких персонажей?08:15 - Разница между ТВ и Ютубом?09:10 - О цензуре в видосах12:30 - Какие клубы закрыты для Красавы?13:30 - Видео и диалог с Газзаевым в Госдуме14:55 - Что с Газзаевым сейчас?16:35 - Чем Семин отличается от Газзаева?17:30 - Челлендж! Сава угадывает украинские слова.21:30 - Насколько тяжело искать героев на канал?22:40 - С какими украинскими топ-футболистами Сава не смог снять видео из-за политических причин?26:00 - Отношение к Ракицкому в России?27:30 - Знает ли об украинских ютуб-каналах?28:18 - Почему к Дудю не ходят футболисты?30:20 - Как пересек границу с России в Украину?32:43 - Когда закроет канал?33:33 - О работе с Павлом Яковенко35:50 - Какой украинский клуб поддерживает и за кем следит?36:20 - Конкуренция и крутые истории про Яна Коллера38:45 - Как создавался рэп-клип Зинченко в программе Культ Тура?40:17 - Миля и Кент о Красаве41:35 - Об интервью с Хави и Джерардом. Какая испанская легенда не пожал руку Саве?43:18 - Менталитет и профессионализм Мхитаряна44:45 - Кого Сава мечтает записать?45:40 - Чем Красава отличается от 2Drots?47:35 - Сколько человек в команде Красавы? 51:25 - Конкурс! Магические тапки Жеки Савина","52M58S"
"-BDQmaMlb2g","Porsche Cayenne против столба.","2020-12-21T16:37:40Z","UC0lT9K8Wfuc1KPqm6YjRf1A","AcademeG","2","20.23.12","AcademeG|Академег|Академик|Тест|драйв|обзор|Test|drive|auto|авто|Костя|заруцкий","1576155","107404","3195","5786","https://i.ytimg.com/vi/-BDQmaMlb2g/default.jpg","False","False","Узнай о всех преимуществах Тинькофф Оплаты — https://l.tinkoff.ru/academegoplataСупротек Апрохим со скидками до 25%https://suprotec.ru/news/961/101348/Все-на-Ёлку-скидок/Мероприятие проведено на территории Кросс Парголово СПбhttps://instagram.com/crosspargolovospbСтроительная техника предостсвлена компанией ASTpargolovohttps://instagram.com/astpargolovoМузыка из этого видео:https://vk.com/academegostПО вопросам рекламы и сотрудничества:academeg@a-proved.ruМой канал стримов:https://www.youtube.com/c/AcademeGDailyStreamInstagram:https://instagram.com/academegВконтакт:http://vk.com/AcademeGAcademeG тру ориджинал групп:http://vk.com/academeg_reviewsФтарой канал:https://www.youtube.com/user/AcademeG2ndCHСувениры Academeg Store: https://vk.cc/5UNsQJАвтохимия Suprotec-Aprohim:https://suprotec.ru/","18M13S"
"xbyOnz3RdEk","ПОТРЯСАЮЩИЕ ЛАЙФХАКИ ДЛЯ ШКОЛЫ! || Веселые идеи со школьными принадлежностями от 123 GO LIKE!","2020-12-22T17:00:21Z","UCorhUBtMmNHJH3byA9cz_3Q","123 GO LIKE! Russian","24","20.23.12","123Go!|123GO|Like|123GO!|сделай сам|забавные ситуации из жизни|школа|лайфхаки для школы|снова в школу|ученик|забавные провалы|эпичные провалы|лайфхаки для контрольной|как сдать контрольную|школьные принадлежности|лайфхаки со школьными принадлежностями|ожидание и реальность","135652","3208","240","127","https://i.ytimg.com/vi/xbyOnz3RdEk/default.jpg","False","False","Школа — это так скучно!🤓  Как думаете, можно ли сделать ее веселее? Оставайтесь с нами, и мы покажем вам умные лайфхаки, с которыми вы произведете фурор в классе!🤘Вы узнаете, как упростить себе жизнь с помощью скотча и другой канцелярии, как преодолеть небольшие провалы и как хорошо написать контрольную! Еще вернемся!#123GoLike #забавныевидео #123GOЭто видео создано для развлекательных целей. Мы не даем никаких гарантий относительно полноты, безопасности и надежности представленной в нем информации. Любые действия, предпринимаемые вами на основе информации из данного видео, выполняются исключительно на ваш страх и риск, и мы не несем ответственности за любые повреждения или убытки. Зритель обязан использовать критическое мышление и принимать меры предосторожности, если он планирует повторить увиденное. В данном видео могут быть показаны действия наших актеров в контролируемой обстановке. Пожалуйста, будьте разумны, аккуратны и принимайте меры предосторожности, если планируете повторить эти действия.Подписывайтесь на наш канал: http://bit.do/123-GO-Like-Russian_____________________________________Музыка — Epidemic Sound: https://www.epidemicsound.com/Материалы со стоков: https://www.depositphotos.com https://www.shutterstock.com","11M2S"
"C4xTIBt9BNw","Deep Fake Навального | Протесты в Армении | Лабиринт Карнаухова","2020-12-22T20:38:27Z","UCQ4YOFsXjG9eXWZ6uLj2t2A","Соловьёв LIVE","25","20.23.12","[none]","131178","11278","2308","773","https://i.ytimg.com/vi/C4xTIBt9BNw/default.jpg","False","False","📺 «Лабиринт Карнаухова» в эфире! В студии — Сергей Карнаухов. 1️⃣Deep Fake Навального2️⃣Протесты в Армении🎙️Поговорим об этом в нашем стриме с экспертами.📲Пишите в WhatsApp и Viber +7 922 800-00-65☎Звоните по телефону +7 495 149-39-39✉️Подписывайтесь на канал «СОЛОВЬЁВ» в Telegram — https://teleg.one/SolovievLive✉️Подписывайтесь на канал «Карнаухов» в Telegram — https://t.me/sskarnaukhov📺Подписывайтесь на YouTube-канал — http://soloviev.liveЧитай нас на Telegram: https://teleg.one/SolovievLiveЧитай нас в Twitter https://twitter.com/VRSolovievЧитай нас в Instagram https://www.instagram.com/vrsolovievЧитай нас в VK https://vk.com/solovievlive#карнаухов #армения #навальный","1H55M6S"
"ssAxTBooVes","Сегодня вечером. Ледниковый период. Выпуск от 19.12.2020","2020-12-21T10:00:16Z","UCfLiQGxAixc4HorawqQWk3g","Сегодня вечером","24","20.23.12","сегодня вечером|Максим Галкин|первый канал|peredachi perwiy kanal|peredachi pervy kanal|Ледниковый период|Илья Авербух|Наталья Бестемьянова","154399","1875","142","621","https://i.ytimg.com/vi/ssAxTBooVes/default.jpg","False","False","Осенью на телеэкраны вернулось захватывающее шоу «Ледниковый период». Юбилейный десятый сезон уже окрестили самым зрелищным, страстным, скандальным и непредсказуемым за всю историю проекта! Обо всём, что происходило на льду и за его пределами, в студии программы «Сегодня вечером» расскажут участники и ведущие шоу, а также продюсер шоу Илья Авербух и поклонники и критики проекта.","1H45M9S"
"6ccnFHeYz4Y","Այն ինչ տեղի ունեցավ խանութում Դա զարմացրեց բոլոր ներկաներին","2020-12-21T16:30:03Z","UCxGT5mOPlF5r3n9NigFL7sg","Arm Show","22","20.23.12","#բացահայտում|#առեղծվածներ|#նորություններ|#ռուբենեսայան|#հանելուկներ|#bacahaytum|#rubenesayan|#paster","31101","844","44","51","https://i.ytimg.com/vi/6ccnFHeYz4Y/default.jpg","False","False","Բարև բոլորին, ձեզ հետ է Arm show ալիքը.Այս տեսանյութում ես կպատմեմ հետաքրքիր պատմություն մի մարդու մասին որը դուրս էր եկել խանութ սուրճ գնելու համար, բայց նա խանութում հերդի մեջ հանդիպեց մի տատիկի որի գումարը չէր հերիքում, գնելու համար իր վերցրած ապրանքները. Այն ինչ տեղի ունեցավ հետո դա հուզեց միլիոնաոր մարդկանց սրտեր.Եթե ձեզ հետաքրքիր է ավելի շատ հետաքրքիր և ուսուցողական պատմություններ, հիմնված փաստերի վրա ապա բաժանորդագրվեք ալիքին ու եղեք տեղեկացված.Ձեզ մաղթում ենք հաճելի ժամանց!Տեսանյութ Այն ինչ տեղի ունեցավ խանութում Դա զարմացրեց բոլոր ներկաներինՀղում. https://youtu.be/6ccnFHeYz4YՄիացեք մեզfacebook - https://www.facebook.com/groups/2700274160241032/Youtube - https://www.youtube.com/channel/UCxGT5mOPlF5r3n9NigFL7sgВКонтакте -  https://vk.com/arm_show","3M19S"
"gJwTQ6J0SWY","Выпуск №169 Синие трусы не помешают достроить Северный Поток-2","2020-12-23T09:22:03Z","UCARiiZ_Yoj5TFHBsBX6e7PQ","Шах и Мат - Михаил Шахназаров","22","20.23.12","Михаил Шахназаров|Новости|Москва|Россия|Слева молот справа серп|поэзия|проза|Миша Шах|сатира|юмор|пародии|Новости Эстонии|Шах|коррупция|Армения|Азербайджан|Обзор новостей|стрим|видеоблог|о жизни|радио|телевидение|новости сегодня|новости|шах и мат|шах и мат михаил шахназаров|Миша Шахназаров|канал Шах и мат|футбол|грудинин|рынска|белоника|белоцерковская ника|путин|альбац|манский|навальный|новости ютуюа|последние новости|трендовые новости|обзор последних новостей","32806","5616","47","644","https://i.ytimg.com/vi/gJwTQ6J0SWY/default.jpg","False","False","Насыщенный новостями день. Флешмобы с трусами Навального и вступление сына Грудинина в Единую Росссию. Российские футболисты и светские львицы. Кот Костян - https://www.youtube.com/c/КотКостян111/Поддержка канала Шах и Мат по ссылке: https://www.donationalerts.com/r/shakhimatСтаньте спонсором канала, и вы получите доступ к эксклюзивным бонусам: https://www.youtube.com/channel/UCARiiZ_Yoj5TFHBsBX6e7PQ/join#МихаилШахназаров  #новостиАвторский канал Михаила Шахназарова. Короткие новости с комментариями, поэзия, проза. михаил шахназаров шах и мат михаил шахназаров новости сегодня","17M43S"
"gASdF-M7nnI","Персонально ваш / Евгений Чичваркин // 22.12.20","2020-12-22T13:06:21Z","UCo4GExFphiUnNiMMExvFWdg","Эхо Москвы","25","20.23.12","[none]","184868","9052","413","788","https://i.ytimg.com/vi/gASdF-M7nnI/default.jpg","False","False","В эфире Евгений Чичваркин, бизнесмен, инвестор Hedonism Wines и ресторана Hide. Эфир ведет Евгений Бунтман. https://www.facebook.com/evgeny.buntmanhttps://twitter.com/EvgenyBuntmanРАСШИФРОВКА: https://echo.msk.ru/programs/personalnovash/2761670-echo/02:00 - Дискредитировано ли ФСБ тем, что вчера произошло06:30 - Опасно ли возвращаться Навальному в Россию12:27 - Мир все еще удивляется всему, что происходит в России13:25 - Будут ли ужесточаться санкции против России17:09 - Новый вид коронавируса в Великобритании22:36 - Закрыты ли перелеты в Великобританию28:22 - Помогает ли правительство Англии своему бизнесу33:30 - Новые законопроекты, Россия движется к тому, чтобы стать полицейским государством34:50 - Закон об инагентах35:20 - Прекрасная Россия будушего36:29 - Способы борьбы с коронавирусом42:38 - Как Brexit повлияет на экономику Великобритании45:50 - Блокировка YouTube46:50 - Выборы в Государственную думУПодписывайтесь на наш канал ➤➤  https://goo.gl/YJ528PСетка вещания — http://echo.msk.ru/scheduleПодпишитесь на другие каналы Эха Москвы:Эхо Общество — https://goo.gl/Pb2BkdЭхо Культура — https://goo.gl/4oSHPYЭхо Авто — https://goo.gl/pgkXNWЭхо Спорт — https://goo.gl/R69Uw3Детское Эхо — https://goo.gl/Q6ybofДилетант — https://goo.gl/AoS8H9","53M52S"
"k1ePUBIqg_g","РУДОМЁТОВ приехал в DiMaTyArIk SCHOOL/САМАЯ ЛЮТАЯ ТРЕНИРОВКА ГОДА","2020-12-22T13:00:26Z","UCzUlOC_6IEjpvI8c0aja6vg","DiMaTyArIk SCHOOL","17","20.23.12","Воркаут|Рудомётов|Диматярик скул|Коллаборация|Заруба|Тренировка|Элементы|Сложные|Средние|Мотивация|Тренд|Топ|Зож|Спорт|Турник|Трюки|Workout|Motivation|Versus|Hard|Elements|Top|Bar|Sport","47996","7329","57","640","https://i.ytimg.com/vi/k1ePUBIqg_g/default.jpg","False","False","Спасибо, что досмотрел ролик до конца и подписался на канал! Поделись нашим роликом с друзьями! И нажми на КОЛОКОЛ! АРТУРОН: https://fazze.cc/DIMA_SCHOOL_GLSКанал МАКСА РУДОМЁТОВА: https://www.youtube.com/channel/UCmMHMlsUG0bPZ08COExu0uAКанал УГРЮМЫЧА: https://www.youtube.com/channel/UCZIjP9CqZB7OyELuGNI2frAКанал КИРЮХИ: https://www.youtube.com/channel/UCPhZOUxoIDjlkS5PB50_ziQМой ВК с БИТАМИ: https://Vk.com/DiMaTyArIk Группа ВК: https://vk.com/dimatyarik_workoutИнстаграм: https://instagram.com/dimatyarik_school?igshid=n3hsmn.. Поддержи наших ребят подпиской на Инстаграм: Макс: https://instagram.com/madman_maxx?igshid=1gvprdyimo8wvСаня: https://instagram.com/sanya_kabir?igshid=c4a2c5otw1rcДаня: https://instagram.com/danil_sevostyanov?igshid=1464cjrtnwvc4Гошан: https://instagram.com/shumakovgeorgii?igshid=12y96oqcml3erТренер: https://www.instagram.com/dimatyarik_workout/?hl=ru ПО ВОПРОСАМ РЕКЛАМЫ И СОТРУДНИЧЕСТВА ПИСАТЬ: Akhirenno@gmail.comVk.com/DiMaTyArIkТОПовый и НЕ ДОРОГОЙ монтаж как у нас в ТРЕЙЛЕРАХ можно заказать здесь: https://instagram.com/bugaievskiy.roman?igshid=81906la85qqsДизайнер нашего канала (создатель превью, шапки и главного фото): https://vk.com/id14750374","25M35S"
"1YAAP564Eq8","Настоящий фильм про бывшего спецназовца [ Выживший Необитаемый остров ] Русские детективы","2020-12-21T12:04:17Z","UCbCkUIZMUTtBxmXhn4ofdZQ","КиноВолк","1","20.23.12","детективы|русский детектив|Сериалы детективы|фильм|фильмы детективы 2020|Русские детективы|новинки|Кино детективы|Русское кино|лучшие фильмы|фильмы про|новинка|хорошие фильмы|Фильмы 2020|Криминал 2020|Криминальный детектив|Криминал фильм|Бывший спецназовец|Выживший","354391","1064","408","72","https://i.ytimg.com/vi/1YAAP564Eq8/default.jpg","False","False","В городе появилась новая мафия, занимающаяся контрабандой. Товар переправляется с помощью различных морских судов. Конечно, у полиции нет людей, чтобы досконально проверять каждый отправляемый груз. Поэтому принимается решение о внедрении одного из детективов в мафию.","1H28M4S"
"ZbxU87YUqMw","Stop motion Cooking 🍑🍑 How To make FOOD  Mukbang 🍑 Funny Videos Oddly Satisfying","2020-12-21T11:07:47Z","UC0V7DKJLEzJwufvjgLxt95w","Crazy Cooking Stop Motion","24","20.23.12","Crazy Cooking Stop Motion|crazy cooking stop motion cooking|stop motion cooking|stop motion|cooking|stopmotion cooking|crazy cooking|stop motion food|cooking asmr|stop motion cooking asmr|stop motion cooking 4k|crazy stop motion cooking|cooking food|stop motion 4k|motion cooking|cooking stop motion|slow motion cooking|stop motion asmr|asmr cooking|stop motion video|horror stop motion|asmr stop motion|stop motion animation|stop motion food 4k","2703784","6635","3448","145","https://i.ytimg.com/vi/ZbxU87YUqMw/default.jpg","False","False","Stop motion Cooking 🍑🍑 How To make FOOD #3 Mukbang 🍑 Funny Videos Oddly Satisfyinghttps://www.youtube.com/channel/UC0V7DKJLEzJwufvjgLxt95w/?sub_confirmation=1#Stopmotion#CookingThank you so much !","55S"
