video_id,title,publishedAt,channelId,channelTitle,categoryId,trending_date,tags,view_count,likes,dislikes,comment_count,thumbnail_link,comments_disabled,ratings_disabled,description,duration
"DoOOPelMaYY","Christmas Magic | MAGIC OF THE MONTH - December 2020","2020-12-23T15:13:06Z","UCq8DICunczvLuJJq414110A","Zach King","24","20.26.12","Vine|Best of Vine|Vine Comedy|Funny|comedy|hilarious|cute|magic|vine magic|vine compilation|vine fail|watch vines|vine 2013|cool vines|special effects vines|zachking|art illusions|zhc art illusions|magic of the month|christmas short film|christmas|holiday|home alone short film|magician|food tricks|funny|vine comedy","1378219","103441","1173","4941","https://i.ytimg.com/vi/DoOOPelMaYY/default.jpg","False","False","SUBSCRIBE HERE - http://bit.ly/SUBSCRIBE-ZACH_KINGIn this December episode, Zach King reacts to your Christmas Themed magic tricks. Have you seen my two Christmas Short Films Below - Watch Magician Home Alone - https://youtu.be/-w7bTb4qVPUThe Magical Night Before Christmas - https://youtu.be/9HizTLFDkl8Want to be notified for the next challenge for a chance to be featured? Fill out this form here - https://www.zachkingmagic.com/challengeMerry Christmas and have a happy new year!EXPERIENCE MORE MAGIC---------------------------------------👕New Merch - https://zachking.store/📚Read my 3 books - https://amzn.to/2Ecuh9E👑Join my VIP group - http://bit.ly/Royalty_VIP","9M18S"
"uxKxyF4zKxY","La coconut magique - Les histoires bizarres du professeur Zarbi","2020-12-23T15:26:04Z","UCAQhhizvcHJccDd2HaKzyqA","Têtes à claques","23","20.26.12","annoying orange|Têtesàclaques|salambo|salambo productions|benjamin|zarbi|professeur zarbi|les histoires bizarres du professeur zarbi|histoires bizarres|gorille|gorilla blanc|demon blanc|coconut|resort|coconut magic|coconut magique|magie|plage|mexique|fort boyard","100098","6979","92","388","https://i.ytimg.com/vi/uxKxyF4zKxY/default.jpg","False","False","Nouvel épisode tous les jeudis à 21h30 sur Télétoon la nuit.Épisode 25.Lors d’un tour de magie, l’esprit de Zarbi se retrouve coincé dans un petit chien. Pour récupérer son corps, il devra mettre la main sur la mystérieuse coconut magique. Clique ici pour t’abonner aux Histoires bizarres du professeur Zarbi! http://bit.ly/TACYouTubeSuit les histoires bizarres du professeur Zarbi surFacebook: https://facebook.com/tetesaclaques/Instagram: https://www.instagram.com/tetesaclaques/Twitter: https://twitter.com/tetesaclaquestvVisitez notre site web http://tetesaclaques.tvSuit notre studio Salambo surhttps://www.instagram.com/salamboproductions/ https://www.facebook.com/Salamboproductions/","10M53S"
"1R4_ktLCzlE","Yemi Alade - Deceive (Official Video) ft. Rudeboy","2020-12-23T14:00:00Z","UC1NlvNg7p6m1kFuudR2UZ0w","YemiAladeVEVO","10","20.26.12","Yemi|Alade|Deceive|(Official|Video)|Effyzzie|Music|Group|Afro|Beat|Pop|World","1020276","47504","473","2734","https://i.ytimg.com/vi/1R4_ktLCzlE/default.jpg","False","False","Download/Stream the album Empress here: https://smarturl.it/YemiAlade.EmpressEffyzzie Music Group presents the official video for the track Deceive by Yemi Alade featuring Rudeboy, off the album Empress...Directed by Clarence Peters.(C) 2020 Effyzzie Music Group#YemiAlade #Rudeboy #DeceiveJustJoJo Distrohttp://vevo.ly/Ag4scP","4M40S"
"sY8gUtyeAKE","Coming 2 America - Official Trailer","2020-12-22T14:59:46Z","UCQJWtTnAHhEG5w4uN0udnUQ","Amazon Prime Video","24","20.26.12","coming to america|coming 2 america|coming 2 america trailer|coming to america 2|coming to america 2 trailer|coming to america trailer|trailer|official trailer|official trailer 2021|trailer 2021|eddie murphy coming to america|eddie murphy coming to america 2|arsenio hall|arsenio hall coming to america|arsenio hall coming to america 2|james earl jones|james earl jones coming to america|james earl jones coming to america 2|amazon|amazon prime video|prime video","8984912","90351","3130","9038","https://i.ytimg.com/vi/sY8gUtyeAKE/default.jpg","False","False","Set in the lush and royal country of Zamunda, newly-crowned King Akeem (Eddie Murphy) and his trusted confidante Semmi(Arsenio Hall) embark on an all-new hilarious adventure that has them traversing the globe from their great African nation to the borough of Queens, New York – where it all began. Available March 5th on Prime Video. Starring: Eddie Murphy, Arsenio Hall, Jermaine Fowler, Leslie Jones, Tracy Morgan, KiKi Layne, Shari Headley, with Wesley Snipes and James Earl Jones. Also starring John Amos, Teyana Taylor, Vanessa Bell Calloway, Paul Bates, Nomzamo Mbatha, Bella Murphy Screenplay by: Kenya Barris and Barry W. Blaustein & David Sheffield Story by: Barry W. Blaustein & David Sheffield and Justin Kanew Directed by: Craig Brewer Based on characters created by: Eddie Murphy Produced by: Kevin Misher and Eddie Murphy Costumes by: Ruth E. Carter.» SUBSCRIBE: http://bit.ly/PrimeVideoSubscribe About Prime Video:Want to watch it now? We've got it. This week's newest movies, last night's TV shows, classic favorites, and more are available to stream instantly, plus all your videos are stored in Your Video Library. Over 150,000 movies and TV episodes, including thousands for Amazon Prime members at no additional cost. Get More Prime Video: Stream Now: http://bit.ly/WatchMorePrimeVideoFacebook: http://bit.ly/PrimeVideoFBTwitter: http://bit.ly/PrimeVideoTWInstagram: http://bit.ly/AmazonPrimeVideoIG Prime Videohttps://www.youtube.com/PrimeVideo","2M1S"
"wAEW0Azy0JI","Kevin Durant Joins Inside the NBA After His First Game With the Brooklyn Nets | NBA on TNT","2020-12-23T07:08:08Z","UCU7iRrk3xfpUk0R6VdyC1Ow","NBA on TNT","17","20.26.12","NBA on TNT|NBA|Inside the NBA|Charles Barkley|Shaq|Kenny Smith|Ernie Johnson|Kevin Durant|Kyrie Irving|Brooklyn Nets|Golden State Warriors","522485","6179","229","1005","https://i.ytimg.com/vi/wAEW0Azy0JI/default.jpg","False","False","Brooklyn Nets superstar Kevin Durant joins the show after making his Nets debut and playing in his first regular season game since tearing his Achilles. Watch highlights from Inside the NBA with Shaq, Charles Barkley, Kenny Smith and Ernie Johnson and more! Subscribe now to be updated on the latest videos: https://www.youtube.com/nbaontnt?sub_confirmation=1Connect with NBA on TNT:Follow NBA on TNT on Twitter: https://twitter.com/NBAonTNTLike NBA on TNT on Facebook: https://www.facebook.com/NBAONTNT/Follow NBA on TNT on Instagram: https://www.instagram.com/nbaontnt/?hl=en","7M36S"
"A9ywUzsSwRs","LA SUITE TANT ATTENDUE - DEVINE A QUI EST CE SECRET ! (ft. Michou, Inox et Riadh) #2","2020-12-23T16:30:01Z","UCUl7mwOyySfZzUkq4H29nug","LeBouseuh","24","20.26.12","[none]","1431631","261227","3136","3719","https://i.ytimg.com/vi/A9ywUzsSwRs/default.jpg","False","False","Mon insta : https://www.instagram.com/levraibouseuhCelui de Michou : https://www.instagram.com/michou_ytAbonne toi à ma chaîne ►  http://urlz.fr/4jF2N'hésite pas non plus à lâcher le petit pouce bleu des famillesChaîne de Michou : @Michou Chaîne d'Inox : @Inoxtag Chaîne de Riadh : @Just Riadh Premier épisode juste ici :►https://www.youtube.com/watch?v=BPynKKKhzJw&t=6s↓REJOINS MOI SUR LES RESEAUX↓◦ Instagram : https://www.instagram.com/levraibouseuh/◦ Twitter : https://twitter.com/lebouseuh◦ Twitch : https://www.twitch.tv/lebouseuh◦ Facebook : https://www.facebook.com/lebouseuh/","8M37S"
"XM5z6DSsQzU","Howie Did It - An Experiment in 3D Printing","2020-12-24T16:59:34Z","UCHvBHWBzzB7NyU5tIiEZHBg","Bad Obsession Motorsport","28","20.26.12","binky|project binky|bad obsession motorsport|mini|austin mini|mini 1000|toyota|toyota celica|gt4|4wd|gt-four|3sgte|turbo|turbocharged|restoration|shrewsbury|shropshire|episode 32|3d printing|ivan miranda|giant 3d printer|bodykit|wheel arches|experiment|body kit|arch extensions","152937","11983","73","1302","https://i.ytimg.com/vi/XM5z6DSsQzU/default.jpg","False","False","Faced with the reality of having to make a complete set of extended wheel arches for our turbo charged, 4WD monster mini, a chance meeting with a mad Spaniard gave us pause for thought. What if we could get someone else to do it? That was the main motivation behind this experiment in creating a bespoke body kit from 3D printed plastic.  Ivan's channel here: https://www.youtube.com/user/superazoteFind us on Twitter @badobsessionmspInstagram @badobsessionmspAnd on Facebook too: @badobsessionmotorsport#projectbinky","14M48S"
"kr0KFUaUvRY","Tayshia & Zac Get Engaged! 💍 | The Bachelorette","2020-12-23T03:30:02Z","UChnGFN2LRHBq-0PM6dOaq5A","Bachelor Nation","24","20.26.12","bachelorette|the bachelorette|bachelorette 2020|the bachelorette 2020|clare crawley|bachelor nation|clare crawley dale moss|bachelorette abc|clare crawley bachelorette|bachelorette clare|watch the bachelorette|dale and clare|watch bachelorette|clare and dale|bachelor|bachelor abc|bachelor live stream|Clare crawley interview|dale moss|tayshia adams|tayshia|bachelorette tayshia|tayshia bachelorette|tashia|taysha","597352","10322","504","1528","https://i.ytimg.com/vi/kr0KFUaUvRY/default.jpg","False","False","It's the moment we've all been waiting for, the grand finale of Tayshia's Bachelorette is here. Zac is the lucky guy who gets down on one knee and proposes to Tayshia. Congratulations to the happy couple. 🥰➤ Subscribe ➤ http://bit.ly/BacheIorNation#TheBachelorette #TayshiaAdams #BacheloretteSeason: 16  Episode: 13Bachelorette: Tayshia Adams➤ Watch #Tayshia's Bachelorette journey here ➤ http://bit.ly/TayshiaAdams➤ Want more #ClareCrawley? Watch her whirlwind romance here ➤ http://bit.ly/ClareCrawley➤ Check out The Bachelorette Australia right here  ➤ http://bit.ly/TheBacheloretteAUWelcome to Bachelor Nation! Here you'll find your favourite Bachelor, Bachelorette and Bachelor In Paradise moments from all around the world. Thought The Bachelor was just a US phenomenon? Think again! The romance, glamour and heart-ache may have started in the States, but the love-bug soon spread around the globe, from Australia and Canada, to the UK, New Zealand and beyond! Bachelor Nation is here to share the fan favourite and memorable moments from over 1000 episodes and 30 countries - Will you accept this rose? 🌹Head to http://www.bachelornation.com for news, photos, updates, and more from the Bachelor franchise.","5M17S"
"LP02BulYw3g","Christmas Prank | OT 22","2020-12-21T23:00:26Z","UCRijo3ddMTht_IHyNSNXpNQ","Dude Perfect","17","20.26.12","dude perfect|dude perfect stereotypes|dude perfect water bottle flip|bottle flip|water bottle flip|dude perfect bottle flip|dude perfect basketball|dp|dude perfect world record|edition|nerf|trick shots|trick shot|family|ping pong|bowling|clean|family friendly|bubble wrap|soccer|football|spinner|spinners|fidget spinners|dude|overtime|22|christmas|theme|episode|gingerbread|get crafty|cool not cool|animated fish|tow your car|dragon|city|reindeer|prank|snow|office","7068841","328548","4148","21693","https://i.ytimg.com/vi/LP02BulYw3g/default.jpg","False","False","BEST CHRISTMAS PRANK EVER! Plus a Christmas themed Get Crafty & Cool Not Cool! Special thanks to Dragon City for sponsoring this video! Click HERE to download the game for FREE! https://dragoncity.onelink.me/DDHl/DudePerfect► Thanks for subscribing! - http://bit.ly/SubDudePerfect► Click HERE to watch the Behind The Scenes of our December Overtimes: https://youtu.be/1hx_LdKeexkThanks for watching #Overtime22Intro: 0:00Get Crafty: 01:30Reindeer Prank: 07:50Sponsor: 10:26Wheel Unfortunate: 11:26Cool Not Cool: 17:07Terms & Conditions for Dude Perfect Basketball Giveaway! https://socialpoint.helpshift.com/a/dragon-city/?s=community&f=dude-perfect-giveaway---official-rules&l=enNEXT LEVEL STUFF -------------------------------------------🎒 NEW Merch - http://bit.ly/DPStore🎮 Play our FREE iPhone game! - http://smarturl.it/DudePerfect2📱 Text us - (469) 205-7005🔔 Hit the bell next to Subscribe so you don't miss a video!👨🏻‍💻 Watch our newest vids! - http://bit.ly/NewDPVids📕 Read our Book - Go Big - http://amzn.to/OYdZ2sFollow our Instagrams so we can be best friends -------------------------------------------🏆 http://Instagram.com/DudePerfect🧔🏻 http://Instagram.com/TylerNToney👱🏻‍♂️ http://Instagram.com/Cody_Jones_🙋🏻‍♂️ http://Instagram.com/CobyCotton👨‍🦰 http://Instagram.com/GarrettHilbert⛹🏻‍♂️ http://Instagram.com/CoryCotton-------------------------------------------Bonus points if you're still reading this! Comment: What's your favorite secret santa gift idea!?Click here to learn more about Dude Perfect:http://bit.ly/AboutDudePerfectAs always...Go Big and God Bless!- Your friends at Dude PerfectBusiness or Media, please contact us at: Dude@DudePerfect.com------------5 Best Friends and a Panda.If you like Sports + Comedy, come join the Dude Perfect team!Best known for trick shots, stereotypes, battles, bottle flips, ping pong shots and all-around competitive fun, Dude Perfect prides ourselves in making the absolute best family-friendly entertainment possible! Welcome to the crew! Pound it 👊🏻 Noggin 🙇🏻‍♂️ - Dude Perfect","26M19S"
"f9qN9LIChh4","VCARVE Branding / Logo Irons - SECRET SANTA 2020!","2020-12-23T17:24:15Z","UC5NO8MgTQKHAWXp6z8Xl7yQ","This Old Tony","28","20.26.12","[none]","413094","24878","212","1464","https://i.ytimg.com/vi/f9qN9LIChh4/default.jpg","False","False","#makerssecretsanta #YTsecretsantaSECRET SANTA BUILD!Kicking the tires on Vectric's VCARVE, building a little logo kit.Thanks to Allen Pan for my great gift!  Check out his channel and the build here: https://www.youtube.com/watch?v=dN2jhnWNyxsSee the logo kit in action on Colin's channel here: https://www.youtube.com/watch?v=bmqm4RQ_1P4Be sure to watch all the other great makers that've taken part!Look Mum No Computer https://youtu.be/7Zn7MasWpds Estefannie Explains It All https://youtu.be/AO4P768-GCo XRobots https://youtu.be/5SoGct1dts4 Hacksmith https://youtu.be/1xCPzOinZB8Kids Invent Stuff https://youtu.be/V28qsYqs0Rs ----Music: Hip Hop Christmas by Twin Musicom, Christmas Village by Aaron Kenny","19M55S"
"uuodbSVO3z0","POP SMOKE - WHAT YOU KNOW BOUT LOVE (Official Video)","2020-12-22T20:00:09Z","UCSaPKJpNd-Mkm6hhelIYSlQ","POP SMOKE","10","20.26.12","[none]","3451463","313557","1663","18446","https://i.ytimg.com/vi/uuodbSVO3z0/default.jpg","False","False","What You Know Bout Love - (Official Video) by Pop SmokeDownload here: https://popsmoke.lnk.to/SFTSAFTM Subscribe to Pop Smoke’s channel:https://PopSmoke.lnk.to/Subscribe   New Merch: shop.realpopsmoke.comFollow Pop Smoke:https://instagram.com/RealPopSmoke  https://instagram.com/ShootForTheStars  Director: Oliver CannonProducers: Shivam Pandya & Xiarra DiamondVideo Editor: Jasper GrahamProduction Company: Victor Victor WorldwideLyrics: Shawty go jogging every morning (every morning)And she make me breakfast almost every morning (every morning)And she take a naked pic' before she leave the doorI be waking up to pics' before a nigga yawningAnd every weekend my shawty comin' over (over)Shawty could Fendi out, but she like Fashion Nova (Nova)She ain't driving no Camry, she pullin' in a Rover (Rover)With her hair so curly, I love you, babyShe said, What you know 'bout love? (I'll tell you everything)I got what you need (oh)Walk up in the store and get what you want (go get it)You get what you pleaseWe 'bout to get it on, take off them drawers (I said I love you, baby)It's just you and meYou know what I be on, I'm about to go raw (love you, baby)'Cause I like what I seeLook, baby, I said I ain't gon' frontYou got my heart beating so fast to words I can't pronounceAnd I be getting the chills every time I feel your touchI be looking at the top and girl, it's only usAll I need is your trustAnd girl I told you once, don't make me tell you twiceI know you see this print through my pants that I know you likeAnd yo' ass be looking so fat when it be in them tightsAnd I'm going straight to the top, so hope you ain't afraid of heightsYou always treat me right, for a fact, you never leftThrough all the trials and tribulations, always had my bestSo here's 55 hunnid, go and get your breastsStart rubbin' on your butt, start kissing on yo' neckHey batter, batter, hey batter, batterNiggas know I had to swing, I had to make a playI had to apply the pressure, 'cause you my hidden treasureI think I'm falling in loveShe said, What you know 'bout love? (I'll tell you everything)I got what you need (oh)Walk up in the store and get what you want (go get it)You get what you pleaseWe 'bout to get it on, take off them drawers (I said I love you, baby)It's just you and meYou know what I be on, I'm about to go raw (love you, baby)'Cause I like what I see (oh)#PopSmoke #WhatYouKnowBoutLove #WYKBL","2M49S"
"78OjlZglWnM","She Snuck In & I Got Kicked Out","2020-12-23T19:43:21Z","UCRfg0SWjIHm_h95e4V8X5og","Young Don The Sauce God","1","20.26.12","young don the sauce god|animations|animated|story time|She snuck in and I got kicked out|she snuck in|i got kicked out|getting kicked out story time|high school storytimes|high school relationship|relationship storytime|storytime animated|storytime scary|animated stories|animated story time","530658","82813","335","3560","https://i.ytimg.com/vi/78OjlZglWnM/default.jpg","False","False","You never get caught the first time. Mobile Legends: Adventure here: https://bit.ly/MLA-YoungDonTheSauceGodGet your hands on Premium Summon Scroll*5 by using my special code: TMH8F42223MMust reach level 10 to redeem the code. Thanks to Moonton for making this video happenOutro Song - https://bit.ly/3mLjvL7Watch My Last Animation: https://youtu.be/_m_DjyuAm_gInstagram - https://www.instagram.com/ilovesaucegod/Outro Song 'Longer' - https://bit.ly/3mLjvL7The Team:Guedi Absiyeh - Lead AnimatorBea Battista - Background ArtistSamantha Duckworth - AnimatorEduardo 'Fez' Escalante - Animation DirectorMelodie Lapot - Storyboard ArtistTanja Hass Nielsen - Background Art DirectorMiriam Salib - Background ArtistKate Vaughn -  Storyboard Artist & Thumbnail Artist#SauceGod #KickedOut","17M26S"
"tITni_HY1Bk","Perseverance Arrives at Mars: Feb. 18, 2021 (Mission Trailer)","2020-12-21T20:59:33Z","UCryGec9PdUCLjpJW2mgCuLw","NASA Jet Propulsion Laboratory","28","20.26.12","NASA|Jet Propulsion Laboratory|JPL|space|exploration|planets|Mars|Perseverance rover|#CountdownToMars|Sky Crane|Perseverance Mars rover","181355","2649","28","211","https://i.ytimg.com/vi/tITni_HY1Bk/default.jpg","False","False","After nearly 300 million miles (470 million km), NASA’s Perseverance rover completes its journey to Mars on Feb. 18, 2021. But, to reach the surface of the Red Planet, it has to survive the harrowing final phase known as Entry, Descent, and Landing.Learn more: https://mars.nasa.gov/mars2020Credit: NASA/JPL-Caltech","59S"
"pEO2a7QzXqQ","KHYAAL RAKHYA KAR - Neha Kakkar ft. RohanPreet Singh | Anshul Garg | Babbu | Rajat Nagpal |","2020-12-22T05:30:04Z","UCLtNvbkqea8wN_kGtfgx_Mw","Desi Music Factory","10","20.26.12","tony kakkar|neha kakkar|sonu kakkar|music|song|desi music factory|Neha Kakkar songs|Nehu da vyah|Karan aujla|Sidhu moosewala songs|Latest punjabi songs 2020|Latest punjabi songs 2021|Punjabi hits|Chote hee change lagde|Shona Shona|Naach meri Laila|Guru randhawa new song|Jass manak new song","35820757","1852578","109825","84813","https://i.ytimg.com/vi/pEO2a7QzXqQ/default.jpg","False","False","Anshul Garg presents KHYAAL RAKHYA KAR by the Queen Neha Kakkar ft. RohanPreet Singh. Listen it on - 🎵iTunes: https://music.apple.com/in/album/khyaal-rakhya-kar-single/1545300108Gaana: https://gaana.com/song/khyaal-rakhya-kar-1Saavn: https://www.saavn.com/s/song/punjabi/Khyaal-Rakhya-Kar/Khyaal-Rakhya-Kar/BFofbiAGGgoSpotify: https://open.spotify.com/track/2RKGtM8v2JM72Gyo1wLmgg?si=gZeZ6u96SP2pwUnXNb4E1wApple Music: https://music.apple.com/in/album/khyaal-rakhya-kar-single/1545300108Wynk: https://wynk.in/u/1Y0tgtj97Singer - Neha Kakkar Music - Rajat Nagpal Lyrics - BabbuSarangi Harpinder kangRecorded by Rahul Sharma @AMV assisted by Samir DharapFeaturing - Neha Kakkar & Rohanpreet SinghProducer - Anshul GargDirectors - Agam Mann & Azeem MannConcept & Screenplay : Neha Kakkar Video Supervisor - Raghav SharmaDOP - Shinda SinghChoreographer - JohnProject Manager - Piyush Chandok Childhood Neha - Guddu Childhood Rohanpreet - AarushProduction - RahulDI - Onkar SinghArt Director - BlaccADs - Jogi, Ashish Uppal, Jass Panesar, Ravi GoyalChild Artist casting - Elvin Art Academy RajpuraChildren - Ghazal, Rihanna, Kashvi, Saanvi, Eshanya, Kayanna, Nitya, Deepali, Inayat, Vrinda, Komal, Kavya,Vanya, Tanishtha, Drishti, Prince, Samar, Harshit, Himanshu, Viraj, Kairav, Aarav, Morfin, Garv, Gurshan, Namish, KanishekCollege boy - Money RomanaArtwork - Vicky Sandhu DesignDistribution: Believe DigitalPromotions : Underdog DigitalLyrics :Tu trump de warga hainMain obame wargi hanTenu kyun lagda hai mainKise drame wargi hanTu cheez pyari hai ehnu sambhaal rakhya karMera tu hi tu tan hain tu apna khyaal rakhya karGallan wich laake tu taj mehal vikaa sakdanJinna tu jhootha hain politics ch jaa sakdanMethon na sach chupaaya karJithe jana daske jaya karMain fer tenu kuch nai kehndiKuch khaan nu laike aaya karTe ghanta ghanta waiting wich na call rakhya karMera tu hi tu tan hain tu apna khyaal rakhya karTu brad pitt vadda na geriyan laaya karJ kudi naal meeting hai Mainu naal lejaaya karTenu kudiyan nal milaunde neTere dost hi tenu pilaunde neAh kaisa rang karaaya haiTenu ki ki oh sikhaunde neChote hi changey lagde chote vaal rakhya karMera tu hi tu tan hain Tu apna khyaal rakhya kar#KhyaalRakhyaKar #NehaKakkar #RohanPreet","3M34S"
"1EfkVEBvB40","Do NBA Superstars Get Preferential Treatment? | NBA on TNT","2020-12-23T06:05:56Z","UCU7iRrk3xfpUk0R6VdyC1Ow","NBA on TNT","17","20.26.12","NBA on TNT|NBA|Inside the NBA|Charles Barkley|Shaq|Kenny Smith|Ernie Johnson","421709","6119","203","1226","https://i.ytimg.com/vi/1EfkVEBvB40/default.jpg","False","False","After the Lakers-Clippers game, Shaq, Chuck and Kenny debate if NBA stars get preferential treatment and the side effects that can cause in a locker room. Watch highlights from Inside the NBA with Shaq, Charles Barkley, Kenny Smith and Ernie Johnson and more! Subscribe now to be updated on the latest videos: https://www.youtube.com/nbaontnt?sub_confirmation=1Connect with NBA on TNT:Follow NBA on TNT on Twitter: https://twitter.com/NBAonTNTLike NBA on TNT on Facebook: https://www.facebook.com/NBAONTNT/Follow NBA on TNT on Instagram: https://www.instagram.com/nbaontnt/?hl=en","8M34S"
"7Zn7MasWpds","Musical Keyboard For Cats - Make Yours Cat A Musical Virtuoso - YOUTUBE SECRET SANTA","2020-12-23T16:01:04Z","UCafxR2HWJRmMfSdyZXvZMTw","LOOK MUM NO COMPUTER","28","20.26.12","cat|music|cat invention|secret santa|colin furze|diy|electronics|3d printing|how to|mucis|synth|cat synth|meow synth|science|look mum no computer|vlog|technology|arduino|sound|museum","276022","10918","277","447","https://i.ytimg.com/vi/7Zn7MasWpds/default.jpg","False","False","I MADE A #CAT THEMED SECRET SANTA FOR @Estefannie Explains It All AND ALSO GOT A SURPRISE SECRET SANTA GIFT OFF OF @colinfurze .. #youtubersecretsantaSEE ESTEFANIES CATS PLAY THE MEOWDESIZER :-https://www.youtube.com/watch?v=AO4P768-GCo&feature=youtu.beLINK TO THE SECRET SANTA PLAYLIST :-https://youtube.com/playlist?list=PLBsfTOjKcQe-duagTS5o2rx5vzthE5BZtFor extra vlogs! and audio check here! :Membership:-https://www.youtube.com/channel/UCafxR2HWJRmMfSdyZXvZMTw/joinSupport :-  https://www.patreon.com/lookmumnocomputerPaypal :- https://www.paypal.me/lookmumnocomputerMAREK LASER CAT:- https://www.youtube.com/watch?v=HDKAvm5FrGo3D PRINTER I ALWAYS USE. :- https://www.lulzbot.com/BARE CONDUCTIVE TOUCH BOARD :- https://www.bareconductive.com/0:54 THE PLAN1:39 THE BUILD2:47 TESTING4:43 COLIN's PRESENT7:51 CAT KEYBOARD MK2OTHER VIDS ON THE PLAYLISTColin Furze https://youtu.be/bmqm4RQ_1P4Estefannie https://youtu.be/AO4P768-GCo XRobots https://youtu.be/5SoGct1dts4 This Is Old Tony https://youtu.be/f9qN9lChh4Hacksmith https://youtu.be/1xCPzOinZB8Kids Invent Stuff https://youtu.be/V28qsYqs0Rs Alan Pan https://youtu.be/dN2jhnWNyxs SPOTIFY :- http://bit.ly/LMNCSpotifyFacebook :- https://www.facebook.com/LOOKMUMNOCOMPUTERWebsite :- https://www.lookmumnocomputer.comInstagram :-  https://www.instagram.com/lookmumnocomputer/Always looking for old gear! to mod or conserve in the museum of everything else one day https://www.lookmumnocomputer.com/donations/","9M43S"
