video_id,title,publishedAt,channelId,channelTitle,categoryId,trending_date,tags,view_count,likes,dislikes,comment_count,thumbnail_link,comments_disabled,ratings_disabled,description,duration
"TN6E1gyb4qQ","We Bought Each Other The Most UNRELIABLE Luxury Cars EVER MADE","2020-12-21T17:00:22Z","UCvAhDxNNUDhi78tMXVGBUaQ","Tavarish","2","20.26.12","aston martin|mercedes|amg|hyundai|bmw|lamborghini|ferrari|toyota|supra|mr2|sw20|3sgte|2jz|1jz|sl55|r230|r231|m113k|vantage|v8|v12|v10|v6|gallardo|turbo|cheap|budget|diy|wrench everyday|doug demuro|chrisfix|hoovies garage|tavarish|jalopnik|mightycarmods|motor trend|roadkill|hack|bendpak|tools|lift|4 post|2 post|quick jack|welding|how to|tutorial","1822540","57487","1836","3911","https://i.ytimg.com/vi/TN6E1gyb4qQ/default.jpg","False","False","Watch how it all started with Car Trek Series 1! ► https://youtu.be/Dom6bmnd_DcFind your DREAM car on AutoTempest!►http://bit.ly/CT3_1Thanks to AutoTempest.com for sponsoring this series!--------------------------------------------------------------------On today's episode of Car Trek, AutoTempest challenged us to find three of the world's cheapest and most unreliable luxury cars, to gift to each other. Unfortunately, Ed's reading comprehension skills took a vacation the day he got the text, so it may have been read slightly wrong...#CarTrek3 #FoundOnAutoTempest--------------------------------------------------------------------COMPLETE CAR TREK SERIES 3 PLAYLISTSeries 3, Episode 1►https://youtu.be/TN6E1gyb4qQSeries 3, Episode 2►https://youtu.be/h_YaBjx4P2QSeries 3, Episode 3 ►https://youtu.be/zQbERnh3atcSeries 3, Episode 4 ►https://youtu.be/zxP6fYvXR_oSeries 3, Episode 5(FINALE)►https://youtu.be/tmymr12wc84--------------------------------------------------------------------COMPLETE CAR TREK SERIES 2 PLAYLIST:Series 2, Episode 1 ►https://youtu.be/bDAiui-W79wSeries 2, Episode 2 ►https://youtu.be/ohRQjQ8AYh8Series 2, Episode 3 ►https://youtu.be/otvA_QLAl70Series 2, Episode 4 ►https://youtu.be/0Qt_ExrTx8ESeries 2, Episode 5(FINALE)►https://youtu.be/tqwd5VDEn88--------------------------------------------------------------------COMPLETE CAR TREK SERIES 1 PLAYLIST:Car Trek Episode 1 ► https://youtu.be/Dom6bmnd_DcCar Trek Episode 2 ►https://youtu.be/wPi1BJw-zscCar Trek Episode 3 ►https://youtu.be/SJGWk9nX49UCar Trek Episode 4 ►https://youtu.be/9Woe-PnI9qgCar Trek Episode 5 ►https://youtu.be/Ug_GRlGQ0_ACar Trek Episode 6 ►https://youtu.be/7me9z2Xt90UCar Trek Episode 7 (FINALE)► https://youtu.be/LbpHcd1pa8I--------------------------------------------------------------------The story of Tyler's Ferrari 360 Spider ►https://www.youtube.com/watch?v=IK0OKOPmFEMThe story of Ed's Lamborghini Gallardo►https://www.youtube.com/watch?v=2cjzI2M7eQc--------------------------------------------------------------------Car Trek on social media:Instagram ►https://www.instagram.com/cartrekofficialFreddy Tavarish Hernandez: Instagram ►https://www.instagram.com/therealtavarishYouTube► https://www.youtube.com/tavarishTyler Hoover:Instagram ►https://www.instagram.com/the_real_hoovies_garageYouTube ►https://www.youtube.com/channel/UCdEczn3MVkx_4PnMZ10MVFAEd Bolian: Instagram► https://www.instagram.com/vinwiki_officialYouTube ►https://www.youtube.com/channel/UCefl-5pmhZmljwZTE2KrcdA--------------------------------------------------------------------BIG Thanks to our amazing production crew: Thomas Durant►https://www.instagram.com/reheracte/Jordan Cole► https://www.instagram.com/trustinthemachine/Brent Baxter► https://www.instagram.com/sidebproductions/Vincent Monsaint►https://www.instagram.com/vmonsaint/Jared Pink► https://www.instagram.com/jaredpink/--------------------------------------------------------------------Special thanks to Andrew Howell for the intro narration!►https://www.instagram.com/heavymetalfl--------------------------------------------------------------------Questions? Comments? Business inquiries? Email me at asktavarish@gmail.com--------------------------------------------------------------------Thanks to the companies that support this channel!Advance Auto Parts - Enter 'TAVARISH2020 at checkout to get up to 25% off!►https://bit.ly/AdvanceTavGet the Advance Auto Parts App►https://bit.ly/AdvanceAppTavValvoline - The Original Motor Oil►https://www.valvoline.com/Find your dream car on AutoTempest!►https://bit.ly/foundonautotempest----------------------------------------------------------------------------------------------------------------------------------------","30M59S"
"Ty-CHgmCeKw","Lil Durk - Backdoor (Official Music Video)","2020-12-21T05:00:10Z","UCaxOQZrF5llUMp-JjesUz1A","Lil Durk","10","20.26.12","lil durk|lil durk music|lil durk music video|just cause yall waited 2|lil durk 2020|just cause y'all waited 2|durkio|smurkio|lil durk official|drill|drill music|chicago hip hop|only the family|OTF|backdoor|back door|king von|von","7577930","244876","6476","21640","https://i.ytimg.com/vi/Ty-CHgmCeKw/default.jpg","False","False","Stream The Voicehttp://smarturl.it/TheVoiceDurkFollow Lil Durk:https://instagram.com/lildurkhttps://twitter.com/lildurkhttps://www.tiktok.com/@lildurkhttps://soundcloud.com/lildurkhttps://fb.com/lildurkhttps://otfgear.com/Subscribe: http://bit.ly/Subscribe-to-Durk#lildurk #thevoice #doit4von","3M33S"
"ZQueTXby2SA","Recreating Marcus Samuelsson's Swedish Meatballs From Taste | Bon Appétit","2020-12-22T17:00:09Z","UCbpMy0Fg74eXXkvxJrtEn3w","Bon Appétit","26","20.26.12","reverse engineering|chris|chris morocco|chris bon appetit|chris makes|chris reverse engineering|blind cooking|blindfood cooking|cooking challenge|blindfold cooking challenge|taste testing|swedish meatballs|swedish meatball|swedish meatball recipe|make swedish meatballs|making swedish meatballs|how to swedish meatballs|how to make swedish meatballs|chris makes swedish meatballs|chris swedish meatballs|marcus samuelsson|meatballs|meatball|food|bon appetit","277241","9207","620","744","https://i.ytimg.com/vi/ZQueTXby2SA/default.jpg","False","False","We challenged resident Bon Appétit super taster Chris Morocco to recreate Marcus Samuelsson's Swedish meatballs using every sense he has other than sight. Was he up to the challenge?Want Bon Appétit shirts, hats and more? https://shop.bonappetit.com/?utm_source=youtube&utm_brand=ba&utm_campaign=aud-dev&utm_medium=video&utm_content=merch-shop-promoStill haven’t subscribed to Bon Appétit on YouTube? ►► http://bit.ly/1TLeyPnWant more Bon Appétit in your life? Subscribe to the magazine! https://bit.ly/313UWRuABOUT BON APPÉTITBon Appétit is a highly opinionated food brand that wants everyone to love cooking and eating as much as we do. We believe in seasonal produce, properly salted pasta water, and developing recipes that anyone can make at home. Recreating Marcus Samuelsson's Swedish Meatballs From Taste | Bon Appétit","24M22S"
"XrRcfaWutLQ","LIVE! See the Great Conjunction (Christmas Star) of 2020","2020-12-22T02:45:05Z","UC4zmFY211sXfEamwmsJcrYA","Lowell Observatory","28","20.26.12","Lowell Observatory|Giovale Open Deck Observatory|astronomy|stargazing|telescopes|Stargazing|Live|Leonids|Leonids Meteor Shower|ChristmasStar","2284836","32096","674","576","https://i.ytimg.com/vi/XrRcfaWutLQ/default.jpg","False","False","*Update 12/21: Skies are perfectly clear here in Flagstaff, Arizona! Below is tonight's Great Conjunction Program Schedule (all times MST; schedule subject to change).0:00:00 | Dr. Jeff Hall, Lowell Observatory Director: Welcome00:04:31 | Dr. Michael West, astronomer: Winter and Summer Solstice Around the World 00:24:24 | Jos Schindler, educator: Introduction to the 2020 Great Conjunction00:46:08 | Dr. Jennifer Hanley, planetary scientist: The Icy Moons of Jupiter and Saturn01:07:45 | Dr. Larry Wasserman, planetary scientist: Thoughts on This (and Other) Great Conjunctions01:23:42 | Jos Schindler, educator: Recap of the 2020 Great Conjunction01:32:10 | Dr. Joe Llama, astronomer: Conjunctions in Other Planetary Systems01:49:09 | Kevin Schindler, historian: Historic Conjunctions and the Christmas Star 02:09:37 | Dr. Nick Moskovitz, planetary scientist: Ursids Meteor Shower02:28:21 | Dr. Jeff Hall, Lowell Observatory Director: Closing RemarksOnce every 20 years, the two largest planets in our solar system—Jupiter and Saturn—appear to meet in Earth’s skies. This “Great Conjunction” happens next on December 21, 2020, but this time, Jupiter and Saturn will be closer than they’ve been in nearly 400 years.  December 21 also happens to be the night of the winter solstice, and the peak of the Ursid meteor shower. For most Great Conjunctions, Jupiter and Saturn are separated by about 1 degree, which is the width of two full moons in the sky. This year, they will be separated by just one-tenth of a degree, which is one-fifth the size of the full moon. A Great Conjunction happens every 20 years, but the last time Jupiter and Saturn were this close was the year 1623.Join Lowell Observatory at 5pm MST on Monday, December 21, 2020, to celebrate the Great Conjunction with an evening of telescope viewing and commentary from Lowell's own astronomers and educators.#ChristmasStar","2H32M10S"
"_NGQfFCFUn4","Ed Sheeran - Afterglow [Official Performance Video]","2020-12-21T11:00:28Z","UC0C-w0YjGpqDXGB8IHb662A","Ed Sheeran","10","20.26.12","Ed Sheeran|Afterglow|Ed Sheeran Afterglow|Ed Sheeran Official Video|Afterglow Official Video|Ed Sheeran performance video|afterglow performance video|Ed Sheeran music|Ed Sheeran Lyrics|Afterglow Lyrics|No. 6 Collaborations Project|Ed Sheeran 4th album|Ed Sheeran songs|Pop|Pop Music|Ed|Sheeran|Ed Sheerin|EdSheeran|Ed Sheran|English Songs|English Song|Ed Sheeran 2020|Ed Sheeran New Song","13916940","568744","5467","28584","https://i.ytimg.com/vi/_NGQfFCFUn4/default.jpg","False","False","The official performance video for Ed Sheeran - Afterglow Listen on Apple Music: https://apple.co/2WJw8vsDownload or stream at: https://EdSheeran.lnk.to/AfterglowDirected by Nic Minns and Zak Walters.Subscribe to the Ed Sheeran channel for all the best and latest official music videos, behind the scenes and live performances.  http://bit.ly/SubscribeToEdSheeran See more official videos from Ed Sheeran here: https://www.youtube.com/watch?v=ryJgDL9jzKk&list=PLjp0AEEJ0-fGKG_3skl0e1FQlJfnx-TJz Follow Ed Sheeran on: Instagram: http://instagram.com/teddysphotos TikTok: https://www.tiktok.com/@edsheeran Facebook: http://www.facebook.com/EdSheeranMusic Official Website: http://edsheeran.com Lyrics:Stop the clocks it’s amazingYou should see the way the light dances off your hairA million colours of hazel, golden and redSaturday morning is fadingThe sun’s reflected by the coffee in your handMy eyes are caught in your gaze all over againWe were love drunk waiting on a miracleTrying to find ourselves in the winter snowSo alone in love like the world had disappearedOh I won’t be silent and I won’t let goI will hold on tighter ‘til the afterglowAnd we’ll burn so bright ‘til the darkness softly clearsOh I will hold on to the afterglowOh I will hold on to the afterglowThe weather outside’s changingThe leaves are buried under six inches of whiteThe radio is playing, Iron & WineThis is a new dimension This is a level where we’re losing track of timeI’m holding nothing against it, except you and I We were love drunk waiting on a miracleTrying to find ourselves in the winter snowSo alone in love like the world had disappearedOh I won’t be silent and I won’t let goI will hold on tighter ‘til the afterglowAnd we’ll burn so bright ‘til the darkness softly clearsOh I will hold on to the afterglowOh I will hold on to the afterglowAbout Ed Sheeran: Ed Sheeran is an internationally acclaimed, multi-award winning singer/songwriter who seems to acknowledge no boundaries between styles or eras with elements of folk, hip-hop, pop, dance, soul, and rock woven throughout his music. His incredible catalogue includes the studio albums ‘+’ (plus), ‘x’ (multiply) and ‘÷’ (divide) which spawned hit singles such as ‘The A team’ , ’Lego House’, ‘Sing', ‘Thinking Out Loud’, ‘Photograph’, ‘Shape Of You’, ‘Castle on The Hill’ and ‘Perfect’. In 2019, Ed Sheeran released the genre-spanning ‘No.6 Collaborations Project’ which featured a wide-range of artists including ‘Justin Bieber’, ‘Camilla’ Cabello’, ‘Travis Scott’, ‘Eminem’, ‘Cardi B, ‘Paulo Londra’, ‘Bruno Mars’ and ‘Stormzy’ amongst many others, producing hits such as ‘I Don’t Care’, ‘Beautiful People’, ‘South of The Border’ and ‘Take Me Back To London’. #EdSheeran #Afterglow","3M19S"
"0cMLZ1hLLEY","What It's Like To Be A Twin On Christmas - Merrell Twins","2020-12-22T17:00:18Z","UCwtnkRZcvL4bfopzJ-Von8Q","merrelltwins","23","20.26.12","Merrell Twins|Twins|Merrell|Veronica Merrell|Vanessa Merrell|Twin|Comedy|Family Friendly|what it's like|what it's like to be a twin|being twins|what having a twin is like|what its like to be a twin|what|it's|like|Veronica|Vanessa|Merrell Twins Live|paul merrell|what it's like being a triplet|twinner|twinners are winners|surprising my boyfriend|boyfriend|Christmas|christmas gifts|Christmas Fails|twin sisters|identical twins|sketch","720790","45072","443","6161","https://i.ytimg.com/vi/0cMLZ1hLLEY/default.jpg","False","False","Ever wondered what it’s like to be a twin on Christmas? Let us know if you can relate!SUBSCRIBE TO OUR CHANNEL ▶ http://bit.ly/2dSP9Fg MERRELL TWINS LIVE ▶ https://www.youtube.com/merrelltwinsliveOUR MERCH ▶ https://fanjoy.co/collections/merrell-twinsFOLLOW US ON SOCIAL MEDIAMERRELL TWINSINSTAGRAM:▶ http://instagram.com/MerrellTwinsTWITTER: ▶https://twitter.com/MerrellTwinsFACEBOOK: https://www.facebook.com/MerrellTwinsWEBSITE: www.merrelltwins.com VANESSA MERRELLINSTAGRAM: ▶http://instagram.com/vanessamerrellTWITTER: ▶https://twitter.com/VanessaMerrellTIKTOK: @vanessamerrell VERONICA MERRELLINSTAGRAM:▶http://instagram.com/veronicamerrellTWITTER: ▶https://twitter.com/veronicamerrellTIKTOK: @veronicamerrellAARON BURRISSSUBSCRIBE TO AARON▶ https://bit.ly/2MJrStOINSTAGRAM:▶http://instagram.com/aaronburrissTWITTER: ▶https://twitter.com/aaronburrissTIKTOK: @Aaronburriss  MORE VIDEOS!!!!!OUR ROOM TOURhttps://youtu.be/ihMYnsipT5EGUACAMOLE SONGhttps://youtu.be/y8tAO3Ov8gsWRONG TWIN PARODYhttps://youtu.be/RXSowM29eKg7 RINGS PARODY https://youtu.be/n4qMVGox6moNORMAL PEOPLE vs INFLUENCERShttps://youtu.be/CCi_H6s5ZKETHE THIRD WHEELhttps://youtu.be/uHYI42E8TKYTHAT ONE FRIENDhttps://youtu.be/aeOpNraDKy8Merrell Twins Exposed ep1https://youtu.be/mWXurqWRA742 Sets of Twins Drive Thru Prankhttps://youtu.be/p15SVRulr58Fans Write our Videohttps://youtu.be/WI0LYRZErjUThe Break Uphttps://youtu.be/MyS8AjVj9FQIF FOOD BABIES WERE REALhttps://youtu.be/joMRNv0SlYETHIS COULD BE YOUhttps://youtu.be/U9v_bUMqFHgFIRST DATEhttps://youtu.be/IydaRQClUBYWe’re identical twin sisters who have been consistently making videos since 2013. We post videos showcasing our range in both comedy and music such as original comedy sketches, original scripted series, original songs, original music videos, gaming videos, weekly live streams, weekly gaming livestreams, twin swaps, twin sister vs twin sister, popular song parodies, popular song covers, original funny songs, 24 hour challenges, popular challenges, popular trends, lifestyle, fashion, and much more!@Merrell Twins Live @Aaron Burriss @Paul Merrell","9M14S"
"IKKbboquS9s","Katy Perry - Not the End of the World","2020-12-21T14:00:10Z","UC-8Q-hLdECwQmaWNwXitYDw","KatyPerryVEVO","10","20.26.12","Katy|Perry|Not|the|End|World|Capitol|Records|Pop|katy perry|katy perry 2020|new katy perry|katy|capitol records|smile|resilient|katy perry cozy|katie parry|katie perry|not the end of the world|daisy|daisies|dark horse|last friday night","6748226","353513","11419","43127","https://i.ytimg.com/vi/IKKbboquS9s/default.jpg","False","False","Katy Perry's new album Smile out now - http://katy.to/smileIDListen to “Not The End Of The World” - http://katy.to/smileIDKaty Perry Complete Collection on Spotify: http://katy.to/SpotifyCompleteYDKaty Perry Essentials on Apple Music: http://katy.to/AMEssentialsYDWatch your favorite Katy videos on YouTube: http://katy.to/MusicVideosYDFollow Katy Perry: Website: http://katy.to/WebsiteYDInstagram: http://katy.to/InstagramYDTwitter: http://katy.to/TwitterYDFacebook: http://katy.to/FacebookYDWeibo: http://katy.to/WeiboYDVK: http://katy.to/VKPageYD#katyperry #smile #nottheendoftheworldMusic video by Katy Perry performing Not the End of the World. © 2020 Capitol Records, LLC","3M54S"
"1HZAnkxdYuA","THE LITTLE THINGS – Official Trailer","2020-12-22T14:00:00Z","UCjmJDM5pRKbUlVIzDYYWb6g","Warner Bros. Pictures","1","20.26.12","The Little Things|Detective|Crime|Criminal|Sheriff|Deputy|Person of Interest|FBI|Los Angeles|Kern County|Fargo|The Snowman|Seven|The Bone Collector|Warner Brothers|WB|Warner Bros|Warner Media|Warner|Film Warner|Trailer|Official Trailer|Movie|Film|Film Trailer|Coming Soon|Crime Thriller|Thriller|Drama|Jared Leto|Rami Malek|Denzel Washington|John Lee Hancock","730415","19465","373","2736","https://i.ytimg.com/vi/1HZAnkxdYuA/default.jpg","False","False","Watch the trailer for The Little Things, bringing Denzel Washington back to screen alongside fellow Academy Award® winners Rami Malek and Jared Leto. Coming to theaters and streaming exclusively on HBO Max on January 29. #TheLittleThingsMovieAcademy Award winners Denzel Washington (“Training Day,” “Glory”), Rami Malek (“Bohemian Rhapsody”) and Jared Leto (“Dallas Buyers Club”) star in the psychological thriller “The Little Things.” John Lee Hancock (“The Blind Side,” “Saving Mr. Banks,” “The Founder”) directed the film from his own original screenplay.Kern County Deputy Sheriff Joe “Deke” Deacon (Washington) is sent to Los Angeles for what should have been a quick evidence-gathering assignment. Instead, he becomes embroiled in the search for a killer who is terrorizing the city. Leading the hunt, L.A. Sheriff Department Sergeant Jim Baxter (Malek), impressed with Deke’s cop instincts, unofficially engages his help. But as they track the killer, Baxter is unaware that the investigation is dredging up echoes of Deke’s past, uncovering disturbing secrets that could threaten more than his case.The main cast also includes Natalie Morales (“Battle of the Sexes”), Terry Kinney (“Mile 22,” TV’s “Billions”), Chris Bauer (“Sully,” TV’s “The Deuce”), Joris Jarsky (TV’s “Bad Blood”), Isabel Arraiza (TV’s “Pearson”) and Michael Hyatt (“Crazy Ex-Girlfriend”).“The Little Things” is produced by Oscar- and Emmy-winning producer Mark Johnson (“Breaking Bad,” “Rain Man”) and Hancock, with Mike Drake and Kevin McCormick serving as executive producers.Behind the scenes, Hancock reunited with several longtime collaborators, including Oscar-nominated director of photography John Schwartzman (“Seabiscuit,” “The Founder,” “Saving Mr. Banks”), Oscar-nominated production designer Michael Corenblith (“Apollo 13,” “The Founder,” “The Blind Side”) editor Robert Frazen (“The Founder”), and costume designer Daniel Orlandi (“The Founder,” “The Blind Side”). The music is by multiple Oscar-nominated composer Thomas Newman (“1917,” “Bridge of Spies,” “Saving Mr. Banks”).Warner Bros. Pictures presents A Gran Via Production, “The Little Things” will be distributed worldwide by Warner Bros. Pictures. The film has slated for release on January 29, 2021 in theaters and on HBO Max and has been rated R for violent/disturbing images, language and full nudity.","2M25S"
"UocEGvQ10OE","The Beatles:  Get Back - A Sneak Peek from Peter Jackson","2020-12-21T07:45:00Z","UCc4K7bAqpdBP8jh1j9XZAww","The Beatles","10","20.26.12","[none]","2684966","102391","842","11139","https://i.ytimg.com/vi/UocEGvQ10OE/default.jpg","False","False","PETER JACKSON REVEALS SNEAK PEEK OF HIS UPCOMING MUSIC DOCUMENTARY“THE BEATLES: GET BACK” ONLINE AND STREAMING ON DISNEY+ Feature-Length Film Opens in Theatres August 27, 2021Acclaimed filmmaker Peter Jackson has released an exclusive sneak peek of his upcoming documentary “The Beatles: Get Back” for fans everywhere to enjoy. The 5-minute special look is available to fans worldwide on TheBeatles.com and streaming on Disney+. Jackson said, “We wanted to give the fans of The Beatles all over the world a holiday treat, so we put together this five-minute sneak peek at our upcoming theatrical film ‘The Beatles: Get Back.’ We hope it will bring a smile to everyone’s faces and some much-needed joy at this difficult time.”Acclaimed filmmaker Peter Jackson’s “The Beatles: Get Back” is a unique cinematic experience that takes audiences back in time to The Beatles’ intimate recording sessions during a pivotal moment in music history... Read more at https://www.thebeatles.com/news/beatles-get-back-sneak-peek-peter-jackson#TheBeatlesGetBackPhoto by Linda McCartney / © Paul McCartney","5M52S"
"BPynKKKhzJw","DEVINE A QUI EST CE SECRET ! (ft. Michou, Inox et Riadh) #1","2020-12-21T16:30:01Z","UCUl7mwOyySfZzUkq4H29nug","LeBouseuh","24","20.26.12","michou|inox|inoxtag|riadh|just riadh|bouzi","1949232","186981","2607","4836","https://i.ytimg.com/vi/BPynKKKhzJw/default.jpg","False","False","Abonne toi à ma chaîne ►  http://urlz.fr/4jF2N'hésite pas non plus à lâcher le petit pouce bleu des famillesChaîne de Michou : @Michou Chaîne d'Inox : @Inoxtag Chaîne de Riadh : @Just Riadh Pour savoir quel matériel j'utilise je te conseille de regarder ma vidéo Setup►https://www.youtube.com/watch?v=mi63Qx3bsjw↓REJOINS MOI SUR LES RESEAUX↓◦ Instagram : https://www.instagram.com/levraibouseuh/◦ Twitter : https://twitter.com/lebouseuh◦ Twitch : https://www.twitch.tv/lebouseuh◦ Facebook : https://www.facebook.com/lebouseuh/","8M47S"
"dppy7tGQR-U","COBY TRICK SHOTS | BEHIND THE SCENES | CAN YOU DO ??","2020-12-18T18:45:38Z","UCIEk9Gpq2fe_TVUl6grnmrA","Dude Perfect Shorts","24","20.26.12","dude perfect Stereotypes|dude perfect net worth|dude perfect unbelievable trick shots|dude perfect|plus|shorts|behind|the|scene|overtime|trick shots","1271113","45414","995","877","https://i.ytimg.com/vi/dppy7tGQR-U/default.jpg","False","False","Thanks For Subscribing▶️https://bit.ly/DudePerfectShortsWatch Short PlaylistOvertime▶️https://bit.ly/OvertimeShortsSpeacial▶️https://bit.ly/SpecialShortsClick here to learn more about Dude Perfect:http://bit.ly/AboutDudePerfect5 Best Friends and a Panda.If you like Sports + Comedy, come join the Dude Perfect team!Best known for trick shots, stereotypes, battles, bottle flips, ping pong shots and all around competitive fun, Dude Perfect prides ourselves in making the absolute best family-friendly entertainment possible! Welcome to the crew! Pound it 👊🏻 Noggin 🙇🏻‍♂️ - Dude Perfect ShortsIF ANY CONTENT OWNER HAS SOME ISSUES WITH MY VIDEOS PLEASE DIRECT MESSEGE ME ON MAILl AND I WILL REMOVE MY VIDEO. But Please don't copyright claim/strike our video 🙏 bcoz there is lots of hardwork to create a one video, I think you understand it better ❤️Business maildudeperfectshortsofficial@gmail.com","53S"
"hu-3VwFAyd0","‘Bachelorette’ Tayshia Adams speaks out after marriage proposal l GMA","2020-12-23T16:01:27Z","UCH1oRy1dINbMVp3UFWrKP0w","Good Morning America","24","20.26.12","The|Bachelorette|Tayisha|Adams|marriage|proposal.|season|finale|Zac|Clark|fiance|Claire|Crawley|GMA|ABC|News|p_cmsid=2494279|p_vid=news-74875820|Taysha and Zac|are tayshia and zac still together|religion|bachelorette finale|bachelorette spoilers|good morning america","366228","4653","140","507","https://i.ytimg.com/vi/hu-3VwFAyd0/default.jpg","False","False","“The Bachelorette” star and her new fiancé Zac Clark join “GMA” live to discuss their engagement on the show’s season finale.READ MORE: https://gma.abc/2KRrvwZSubscribe to GMA's YouTube page:  https://bit.ly/2Zq0dU5 Visit GMA's homepage:https://www.goodmorningamerica.comFollow GMA:TikTok: tiktok.com/@gmaFacebook:facebook.com/GoodMorningAmericaTwitter: twitter.com/gmaInstagram: instagram.com/goodmorningamericaWatch full episodes:abc.go.com/shows/good-morning-americahulu.tv/2YnifTH#GMA #Bachelorette #BachelorNation #Tayishia #ZacClark #TayshiaandZac","6M26S"
"Mr5YmPWC9JQ","SHOCKING ULTRASOUND... TWINS?! | LAUREN & ARIE","2020-12-21T18:00:47Z","UCkoZyNqTZyBZ8nu8E_OSkWw","Lauren & Arie","22","20.26.12","Lauren and Arie|Arie and Lauren|Lauren Burnham|Lauren Luyendyk|Arie Luyendyk|Twins|Twin pregnancy|Natural Twins|Fraternal twins|Bachelor Twins|The Bachelor","817115","18102","265","2060","https://i.ytimg.com/vi/Mr5YmPWC9JQ/default.jpg","False","False","Many of you watched our journey through loss and our recent pregnancy announcement. We are so so grateful for all of the love and support from you guys! We feel so lucky. Follow along and subscribe to see this amazing part of our lives unfold.Watch our pregnancy announcement: https://youtu.be/2Up7Jbtg37ASubscribe to follow along on our pregnancy journey!Follow us on Instagram too!https://www.instagram.com/laurenluyendykhttps://www.instagram.com/ariejrhttps://www.instagram.com/alessiluyendykAs always, we love and appreciate every one of you!-Lauren and Arie Luyendyk","14M7S"
