video_id,title,publishedAt,channelId,channelTitle,categoryId,trending_date,tags,view_count,likes,dislikes,comment_count,thumbnail_link,comments_disabled,ratings_disabled,description,duration
"k4v6slOxxXs","Minecraft Speedrunner VS 4 Hunters FINALE REMATCH","2020-12-26T01:15:11Z","UCTkXRDQl0luXxVQrRQvWS6w","Dream","20","20.26.12","Dream Minecraft|dream Minecraft youtube|minecraft|dream|Speedrunner vs 3 hunters|Speedrunner vs 4 hunters|Speedrunner vs someone trying to stop them|Beating Minecraft but my friend tries to stop me|Minecraft but water rises every minute|minecraft but lava rises every minute|minecraft but challenge|minecraft challenge|challenge|minecraft 1.14|beating minecraft|rematch|finale|finale rematch|grand finale|grand|four hunters|4 hunters","8260167","868483","12013","93195","https://i.ytimg.com/vi/k4v6slOxxXs/default.jpg","False","False","Minecraft Speedrunner VS 4 Hunters FINALE REMATCH. You asked for it. This was insane.Patreon (Plugin): https://www.patreon.com/DreamWasTakenFollow my socials:➽ Twitter - @dreamwastaken➽ Instagram - @dreamwastaken➽ Snapchat - @dreampublicMerch: https://www.dream.shopBadBoyHalo:  @BadBoyHalo George:  @GeorgeNotFound Sapnap:  @Sapnap Antfrost: @Antfrost We decided to call this series Minecraft Manhunt. This video is a different rendition of it, where there are FOUR hunters instead of just one.This is a new Minecraft but, 1.16 challenge that we have decided to try. I try to beat the game, while my friend George AND my friend Sapnap AND my friend BadBoyHalo AND my friend Antfrost tries to prevent me from doing it. It's a race, and it's super intense and we had a lot of laughs. I love doing these challenges.If this video gets 1,000,000 likes we'll do something else.Not Minecraft, But Water Rises or Minecraft, But Lava Rises, or any other but challenge like that. This is a speed run / speed runner of Minecraft against a killer / assassin#MinecraftManhunt","49M48S"
"OZbCRN3C_Hs","The Queen's Christmas Broadcast 2020 👑🎄 📺 - BBC","2020-12-25T14:59:40Z","UCCj956IF62FbT7Gouszaj9w","BBC","24","20.26.12","BBC iPlayer|United Kingdom|British TV|British TV Shows|Watch UK TV Online|Watch British TV Online|Watch British TV Shows Online|the queens christmas message 2020|royal family|2020 queens speech|queens speech 2020|british queen speech|queen christmas speech 2020","847536","20886","1731","3966","https://i.ytimg.com/vi/OZbCRN3C_Hs/default.jpg","False","False","Subscribe and 🔔 to OFFICIAL BBC YouTube 👉 https://bit.ly/2IXqEInStream original BBC programmes FIRST on BBC iPlayer 👉 https://bbc.in/2J18jYJHer Majesty Queen Elizabeth II delivers her annual address in the Christmas Message to the Nation and Commonwealth.Presented in HDR UHD. The Queen | BBC#TheRoyalFamily #BBC #BBCiPlayerAll our TV channels and S4C are available to watch live through BBC iPlayer, although some programmes may not be available to stream online due to rights. If you would like to read more on what types of programmes are available to watch live, check the 'Are all programmes that are broadcast available on BBC iPlayer?' FAQ 👉 https://bbc.in/2m8ks6v.","7M20S"
"T3-WhikeOMk","OFFLINETV $10,000 WHITE ELEPHANT ft. Valkyrae Fuslie Myth Starsmitten","2020-12-25T23:00:14Z","UCDK9qD5DAQML-pzrtA7A4oA","OfflineTV","20","20.26.12","OfflineTV|Scarra|Poki|Pokimane|Lily|LilyPichu|DisguisedToast|Toast|TwitchTV|twitch|Streaming|Vlog|Fail|Epic|Gamers|Streamers|OTV|Lilypichu Voice|OTV Plays|OfflineTV plays|Michael Reeves|Michael|Reeves|OfflineTV white elephant|OfflineTV secret santa|secret santa|white elephant|OTV white elephant|OTV secret santa|OfflineTV christmas|OTV christmas|gift exchange|valkyrae|tsm myth|fuslie|starsmitten","1580086","164438","1001","9785","https://i.ytimg.com/vi/T3-WhikeOMk/default.jpg","False","False","NEW CHRISTMAS MERCH DROP!!🎄🎅❄️http://offlinetv.com/Special Thanks:Valkyrae | https://twitter.com/valkyraeFuslie | https://twitter.com/fuslieMyth | https://twitter.com/TSM_MythStarsmitten | https://twitter.com/starsmitten_OfflineTV Roster:Scarra | https://twitter.com/scarraPokimane | https://twitter.com/pokimanelolLilyPichu | https://twitter.com/LilyPichuDisguised Toast l https://twitter.com/DisguisedToastMichael Reeves l https://twitter.com/michaelreevesProduced / Directed by:Brodin | https://twitter.com/brodinplettShot by:Brodin | https://twitter.com/brodinplettEdited by:Dunois | https://twitter.com/DunoisKRYT Managed by:Dunois | https://twitter.com/DunoisKRArt by:LilyPichu | https://twitter.com/LilyPichuSongs by:Ludwig | https://www.youtube.com/watch?v=TtY9eRaysegcomfi beats | https://www.youtube.com/watch?v=q8iCL5CR5k0Social links:https://www.reddit.com/r/offlineTVhttps://www.instagram.com/OfflineTVhttps://www.twitter.com/OfflineTVhttps://www.facebook.com/OfflineTVggDiscord Server:https://discord.gg/EsrzUReGot free time? Translate our videos!http://www.youtube.com/timedtext_cs_panel?tab=2&c=UCDK9qD5DAQML-pzrtA7A4oA#OfflineTV #WhiteElephant #SecretSanta","21M17S"
"bpGUPI6O2ok","WORLDS BEST FAMILY CHRISTMAS GIFTS OPENING!! (NEW CAR SURPRISE)","2020-12-25T16:53:12Z","UCilwZiBBfI9X6yiZRzWty8Q","FaZe Rug","24","20.26.12","faze rug|rug|rugfaze|fazerug|christmas|christmas gifts|christmas gifts opening|family christmas|family christmas gifts opening|gifts opening|family gifts opening|best christmas gifts|best christmas gifts opening|worlds best christmas gifts|faze rug christmas|faze rug family|faze rug christmas gifts|faze rug christmas gifts opening","2667733","222402","2949","23090","https://i.ytimg.com/vi/bpGUPI6O2ok/default.jpg","False","False","THIS WAS THE BEST ONE YETMERRY CHRISTMAS EVERYONE!! Welcome to the 2020 family Christmas gifts opening video.. Yes, I gave away a CAR!🔴 SUBSCRIBE FOR LIT VIDEOS ► http://bit.ly/SubToRug🔵 Try my G FUEL Flavor!! ► https://gfuel.ly/use-code-rug GO SPAM MY OTHER PAGES!!Instagram ► https://www.instagram.com/fazerug/TikTok ► https://www.tiktok.com/@rugTwitter ► https://twitter.com/FaZeRugSnapchat ► thefazerug","25M41S"
"k5XukvUA1Nk","Kylie Jenner: Christmas Decorations 2020","2020-12-26T04:07:01Z","UCWkYXtnAuu7VTLPwUcRSB6A","Kylie Jenner","22","20.26.12","[none]","2733508","0","0","7500","https://i.ytimg.com/vi/k5XukvUA1Nk/default.jpg","False","True","Stormi and I take you on a tour of my Christmas decorations this year. Merry Christmas everyone!","4M27S"
"YPv43YYWLng","Among us - SECRET MINECRAFT MAP","2020-12-26T11:06:55Z","UCz091zMddKqqJNnOv6HhxDg","Almaz","20","20.26.12","Among Us|Almaz Among Us|Among Us Animation|Minecraft Among Us|Among Us Minecraft Map|Among Us Minecraft Animation|Funny Moments Among Us|Among Us Meme|Minecraft Survival|Among Us Zombie|Almaz Minecraft|Dream Minecraft|Among Us Fails|Among Us New Map|Minecraft Among Us Map","756845","23186","958","1503","https://i.ytimg.com/vi/YPv43YYWLng/default.jpg","False","False","Many players would like to play Among Us  Minecraft map, which is why I decided to create an Animation based on Among Us/Minecraft and show how the New Among Us Minecraft map might look like. I recreate an unusual tasks that could be performed in  Among Us Minecraft Secret Map. Let the survival begin. Inspiring by Among us Zombie, Pixel kingdom, Hornstromp Games, Among us Logic.Don't forget to subscribe with the bell, so you don't miss my new videos.Among usInnersloth LLC Action#AmongUs #Minecraft #Animation","4M23S"
"eqYG9P_SUEQ","on fait un château de cartes","2020-12-26T12:00:08Z","UCFtaxL-IZiZHJqzxvv1LmZQ","Des Cuts & Des Zooms","23","20.26.12","[none]","299500","42639","345","1082","https://i.ytimg.com/vi/eqYG9P_SUEQ/default.jpg","False","False","-10% sur tout le site de Rhinoshield avec le code DCDZNOEL : https://bit.ly/Noel-DCDZChaîne de Amixem : https://www.youtube.com/channel/UCgvqvBoSHB1ctlyyhoHrGwQMontage : Tom (Bonnes fêtes à tous !)","15M36S"
"0AKNxqOT8hw","KSI - DOMAIN","2020-12-25T10:54:58Z","UCVtFOytbRpEvzLjvqGG5gxQ","KSI","10","20.26.12","[none]","2243366","321661","5732","40938","https://i.ytimg.com/vi/0AKNxqOT8hw/default.jpg","False","False","Listen on Apple Music: https://apple.co/3mPpiPJA film by Konstantin x Guy. The sequel to ‘Killa Killa feat. Aiyana Lee (Part I)’ is here. KSI unveils the next chapter of the action packed short film with new visuals for ‘Domain’ (Warning: Video contains expletives and scenes of violence). THIS IS NOT REAL LIFE FAM","5M6S"
"zhGVWA-G-yo","방탄소년단, 한겨울 디스코 파티 ♬Dynamite♬ㅣ2020 SBS 가요대전 in DAEGU(sbs 2020 K-Pop Awards)ㅣSBS ENTER.","2020-12-25T14:32:11Z","UCmjNKt6kITwaZTqvWuaSPLg","SBS Entertainment","24","20.26.12","방탄소년단|BTS|Dynamite|가요대전|2020SBS가요대전|2020가요대전|가요대전하이라이트|가요대전핫클립|SBS가요대전다시보기|2020SBS가요대전다시보기|SBS|20201225","1991913","246692","2029","7906","https://i.ytimg.com/vi/zhGVWA-G-yo/default.jpg","False","False","SBS '2020 SBS 가요대전 in DAEGU'☞ 저녁 7시 30분 생방송#SBS가요대전 #BTS #Dynamite▶ Hompage : https://programs.sbs.co.kr/enter/2020daegu/main▶ Subscribe SBS Entertainment : https://bit.ly/2SpOhMC","3M28S"
"mO7DFPsNvSo","Authorities give update on Nashville explosion","2020-12-25T18:52:20Z","UCO6kzQ-7wcG0x8W5LpBA9RQ","NewsChannel 5","25","20.26.12","Metro Police give update on Nashville explosion","709922","6389","573","5730","https://i.ytimg.com/vi/mO7DFPsNvSo/default.jpg","False","False","Metro police and federal authorities provide an update on Friday morning's explosion in downtown Nashville.","10M44S"
"Sjttyj0gy3I","I decided to speedrun Duck Life and pleasantly annihilated every other duck","2020-12-25T23:00:12Z","UCQSEAbOs6vsJfy7WN7iYaGQ","EazySpeezy","20","20.26.12","EazySpeezy|duck life|duck life 1|speedrun|speedrunning|world record|wr|speedrun world record|duck life speedrun|duck life 1 speedrun|duck life world record|duck life 1 wr|speedrun duck life|duck life flash|flash|flash games|flash speedrun|flash game speedrun|duck life game|duck life flash game|duck game|duck racing|memeruns|memerun|meme speedrun|funny speedrun|speedruns|glitch|ezscape|any%|fail|agdq|gdq|games done quick|summoning salt|karl jobst|meme","442965","32859","289","2284","https://i.ytimg.com/vi/Sjttyj0gy3I/default.jpg","False","False","Duck Life is a game that I never thought I'd speedrun, but I definitely don't regret it. This game is in a class of its own.Watch live at: http://twitch.tv/EazySpeezy▶ Twitter: https://twitter.com/EazySpeezy▶ Discord: https://discord.gg/Fz6DtdqWatch the world record run here: https://youtu.be/jkwzJMapPeUMy channel generally focuses on a more casual side of speedruns. With these videos I want to show off cool speedruns, explain how they work, and entertain. Hopefully you enjoy the content and maybe even take up speedrunning yourself, because it is truly a lot of fun!#EazySpeezy #DuckLife #Speedrun","9M43S"
"M0dwbZccRIE","방탄소년단, 크리스마스를 팬들과 함께 ＜Life Goes On＞ㅣ2020 SBS 가요대전 in DAEGU(sbs 2020 K-Pop Awards)ㅣSBS ENTER.","2020-12-25T14:26:32Z","UCmjNKt6kITwaZTqvWuaSPLg","SBS Entertainment","24","20.26.12","방탄소년단|BTS|LifeGoesOn|가요대전|2020SBS가요대전|2020가요대전|가요대전하이라이트|가요대전핫클립|SBS가요대전다시보기|2020SBS가요대전다시보기|SBS|20201225","1515935","227317","1280","6923","https://i.ytimg.com/vi/M0dwbZccRIE/default.jpg","False","False","2020 SBS 가요대전 in DAEGUSBS '2020 SBS 가요대전 in DAEGU'☞ 저녁 7시 30분 생방송#SBS가요대전 #방탄소년단 #BTS▶ Hompage : https://programs.sbs.co.kr/enter/2020daegu/main▶ Subscribe SBS Entertainment : https://bit.ly/2SpOhMC","3M37S"
"dFlspSoW430","Tom MacDonald - Angels","2020-12-25T16:58:31Z","UCElGBUWDCa05jRzc2PfmGqQ","Tom MacDonald","10","20.26.12","Eminem|MGK|Token|NF|Hopsin|Machine Gun Kelly|Merkules|Chris Webby|Joyner Lucas|Tech N9ne|Krizz Kaliko|Yelawolf|Rittz|Strange Music|Slumerican|Jellyroll|Struggle|ICP|Twiztid|Violent J|Shaggy 2 Dope|Upchurch|Adam Calhoun|Ryan Upchurch|Madchild|Logic|Diss Track|Rap Beef|Juggalo|R.A. The Rugged Man|Mac Lethal|Crypt|Quadeca|Horrorcore|Falling In Reverse|Lil Peep|Ghostmane|Pouya|Hip Hop|Rap|Boondox|Country Rap|Tom MacDonald|Whiteboy|mgk|rap battle|freestyle","578797","69916","719","8654","https://i.ytimg.com/vi/dFlspSoW430/default.jpg","False","False","AUTOGRAPHED ALBUMS & MERCH: http://www.HangOverGang.com/storeSUBSCRIBE TO THIS CHANNEL &  CONNECT W/ TOM MACDONALD!FACEBOOK: http://www.facebook.com/TomMacDonaldOfficialINSTAGRAM: http://www.instagram.com/hangovergangTWITTER: http://www.twitter.com/IAmTomMacDonaldWEBSITE: http://www.hangovergang.comSPOTIFY: http://spoti.fi/2H35BQRiTUNES: https://apple.co/2BQucZOWRITTEN & PRODUCED BY Tom MacDonaldSHOT by Nova Rockafellerhttp://www.instagram.com/NovaRockafellerMIXED & MASTERED by Evan Morganwww.evanmorganproductions.comwww.facebook.com/EvanMorganProductionswww.instagram.com/EMorganProductions","3M20S"
"xuXQMab_X0Y","Playboi Carti ft. Kanye West - Go2DaMoon (Official Audio)","2020-12-25T05:00:34Z","UC652oRUvX1onwrrZ8ADJRPw","Playboi Carti","10","20.26.12","playboi carti|Kanye west|whole lotta red|WLR|Go2DaMoon","2409557","63460","6704","8709","https://i.ytimg.com/vi/xuXQMab_X0Y/default.jpg","False","False","Playboi Carti’s Whole Lotta Red is available now: https://smarturl.it/WLRcartiFollow Playboi Carti: http://www.playboicarti.comhttps://www.instagram.com/playboicarti/https://twitter.com/playboicarti#WholeLottaRed #PlayboiCarti","2M"
"TXwxVm5mH1U","‘무대 장인’ 방탄소년단, 흑조의 유혹 ‘Black Swan’ㅣ2020 SBS 가요대전 in DAEGU(sbs 2020 K-Pop Awards)ㅣSBS ENTER.","2020-12-25T14:25:09Z","UCmjNKt6kITwaZTqvWuaSPLg","SBS Entertainment","24","20.26.12","방탄소년단|BTS|BlackSwan|가요대전|2020SBS가요대전|2020가요대전|가요대전하이라이트|가요대전핫클립|SBS가요대전다시보기|2020SBS가요대전다시보기|SBS|20201225","1506986","243274","1286","8133","https://i.ytimg.com/vi/TXwxVm5mH1U/default.jpg","False","False","SBS '2020 SBS 가요대전 in DAEGU'☞ 저녁 7시 30분 생방송#SBS가요대전 #BTS #BlackSwan▶ Hompage : https://programs.sbs.co.kr/enter/2020daegu/main▶ Subscribe SBS Entertainment : https://bit.ly/2SpOhMC","3M17S"
"Yv-Kjk7i93k","LA PIRE CONFÉRENCE DE L'HISTOIRE ! - LE SHOW JAUNE #45 (Dernier Épisode)","2020-12-25T14:59:36Z","UCTt2AnK--mnRmICnf-CCcrw","Le Rire Jaune","23","20.26.12","jack ma|elon musk|debate|ai|artificial intelligence|mars|intelligence artificielle|la pire conference de l'histoire|la pire conférence de l'histoire|conférence|kevin tran|henry tran|le rire jaune","984410","140596","1195","3057","https://i.ytimg.com/vi/Yv-Kjk7i93k/default.jpg","False","False","Jack Ma vs Elon Musk, le débat de la décennie !","6M41S"
"SRvNEBsOQ8s","£10 vs £1000 SEAFOOD Ft KSI","2020-12-25T18:00:14Z","UCv-GNHtqM97EaU_i7gN_Ikw","Chunkz","24","20.26.12","Chunkz Entertainment|comedy|family friendly|Funny Challenges Fun","1013829","98403","714","3428","https://i.ytimg.com/vi/SRvNEBsOQ8s/default.jpg","False","False","Cooking challenge where I give a youtuber a £1000 budget to make a burger and a professional chef a £10 budget. Hope you guys enjoy.KSI - @KSI Subscribe: https://bit.ly/2PGvXfx | 🔔Make sure to enable ALL push notifications!🔔Watch the NEWEST videos: https://bit.ly/2PzaVSYFollow Chunkz :Instagram: https://instagram.com/chunkz_en/Twitter: https://twitter.com/Chunkz_ENSnapChat: https://snapchat.com/add/SpiceggWatch more Chunkz :1V1 RAP BATTLE: https://bit.ly/2RY6Ar1COOKING WITH CHUNKZ: https://bit.ly/2pWEXlc2V2 RAP BATTLE: https://bit.ly/2RYtyOHLatest Videos: https://bit.ly/2PzaVSYPopular Videos: https://bit.ly/2yGdpp","14M39S"
"zUNHZ-LXkPY","Winter Van Life - Stealth Van Building - Diesel Heater Install","2020-12-26T03:16:02Z","UCofJu853kJKpkg4y5a-9YXg","Foresty Forest","24","20.26.12","van life|winter van life|Chevrolet|van build","111975","15206","69","1648","https://i.ytimg.com/vi/zUNHZ-LXkPY/default.jpg","False","False","I continue building out my 4x4 Chevy Express!http://www.patreon.com/forestyforestMinivan Location:https://youtube.com/channel/UCJavm_pffx7i5z-ZhDAskzASummit Map:https://drive.google.com/open?id=12GFzG-9ZUr4Ue9pjq22mZVF3fdk_dYpY&usp=sharinghttp://www.strava.com/clubs/forestyforesthttp://www.instagram.com/forestyforest","10M11S"
"aqa2yJlvDF8","Jennifer Lopez | In The Morning | Triller Teaser","2020-12-25T07:18:03Z","UCr8RjWUQ_9KYcIPmWiqBroQ","Jennifer Lopez","10","20.26.12","[none]","301073","8130","456","670","https://i.ytimg.com/vi/aqa2yJlvDF8/default.jpg","False","False","Jennifer Lopez | In The Morning | Triller TeaserDownload/Stream now:http://lnk.to/JLoInTheMorningOfficial Website: https://jenniferlopez.comFacebook: https://www.facebook.com/jenniferlopez/Instagram: https://www.instagram.com/jlo/TikTok: https://www.tiktok.com/@jloTwitter: https://twitter.com/jloText Me: +1 (305) 690-0379#JLo#JenniferLopez#Triller#InTheMorning#InTheMorningChallenge#JLoBeauty","16S"
"wGBsIelFe-E","Playboi Carti ft. Kid Cudi - M3tamorphosis (Official Video)","2020-12-25T05:00:34Z","UC652oRUvX1onwrrZ8ADJRPw","Playboi Carti","10","20.26.12","Whole Lotta Red|WLR|Playboi Carti|Kid Cudi|Carti Cudi|M3tamorphosis|Metamorphosis|Red","1810461","110614","19707","25660","https://i.ytimg.com/vi/wGBsIelFe-E/default.jpg","False","False","Playboi Carti’s Whole Lotta Red is available now: https://smarturl.it/WLRcartiDirected by Nico Ballesteros Follow Playboi Carti: http://www.playboicarti.comhttps://www.instagram.com/playboicarti/https://twitter.com/playboicartiFollow Kid Cudi: https://twitter.com/kidcudihttps://instagram.com/kidcudihttps://facebook.com/kidcudihttps://snapchat.com/add/kidcudihttps://www.kidcudi.com#WholeLottaRed #PlayboiCarti","5M16S"
"Lb2tGCmjfnY","The Nutcracker","2020-12-25T00:00:09Z","UCfYyXGTdmF4O55Duc4sgaSw","Bardavon Presents","10","20.26.12","[none]","423435","7411","246","268","https://i.ytimg.com/vi/Lb2tGCmjfnY/default.jpg","False","False","Please enjoy this encore presentation of the New Paltz Ballet Theatre's 2019 performance of The Nutcracker! Donate to help the Bardavon here: https://tinyurl.com/yxr53nnn","1H36M7S"
"_xG9CviE5Fs","Ed Sheeran - Afterglow [Official Lyric Video]","2020-12-26T08:00:12Z","UC0C-w0YjGpqDXGB8IHb662A","Ed Sheeran","10","20.26.12","Ed Sheeran|Afterglow|Ed Sheeran Afterglow|Ed Sheeran Official Video|Afterglow Official Video|Ed Sheeran performance video|afterglow performance video|Ed Sheeran music|Ed Sheeran Lyrics|Afterglow Lyrics|No. 6 Collaborations Project|Ed Sheeran 4th album|Ed Sheeran songs|Pop|Pop Music|Ed|Sheeran|Ed Sheerin|EdSheeran|Ed Sheran|English Songs|English Song|Ed Sheeran 2020|Ed Sheeran New Song","647844","79224","487","4078","https://i.ytimg.com/vi/_xG9CviE5Fs/default.jpg","False","False","The official lyric video for Ed Sheeran - Afterglow Download or stream at: https://EdSheeran.lnk.to/AfterglowDirected by ELS - https://www.els.tvSubscribe to the Ed Sheeran channel for all the best and latest official music videos, behind the scenes and live performances.  http://bit.ly/SubscribeToEdSheeran See more official videos from Ed Sheeran here: https://www.youtube.com/watch?v=ryJgDL9jzKk&list=PLjp0AEEJ0-fGKG_3skl0e1FQlJfnx-TJz Follow Ed Sheeran on: Instagram: http://instagram.com/teddysphotos TikTok: https://www.tiktok.com/@edsheeran Facebook: http://www.facebook.com/EdSheeranMusic Official Website: http://edsheeran.com Lyrics:Stop the clocks it’s amazingYou should see the way the light dances off your hairA million colours of hazel, golden and redSaturday morning is fadingThe sun’s reflected by the coffee in your handMy eyes are caught in your gaze all over againWe were love drunk waiting on a miracleTrying to find ourselves in the winter snowSo alone in love like the world had disappearedOh I won’t be silent and I won’t let goI will hold on tighter ‘til the afterglowAnd we’ll burn so bright ‘til the darkness softly clearsOh I will hold on to the afterglowOh I will hold on to the afterglowThe weather outside’s changingThe leaves are buried under six inches of whiteThe radio is playing, Iron & WineThis is a new dimension This is a level where we’re losing track of timeI’m holding nothing against it, except you and I We were love drunk waiting on a miracleTrying to find ourselves in the winter snowSo alone in love like the world had disappearedOh I won’t be silent and I won’t let goI will hold on tighter ‘til the afterglowAnd we’ll burn so bright ‘til the darkness softly clearsOh I will hold on to the afterglowOh I will hold on to the afterglowAbout Ed Sheeran: Ed Sheeran is an internationally acclaimed, multi-award winning singer/songwriter who seems to acknowledge no boundaries between styles or eras with elements of folk, hip-hop, pop, dance, soul, and rock woven throughout his music. His incredible catalogue includes the studio albums ‘+’ (plus), ‘x’ (multiply) and ‘÷’ (divide) which spawned hit singles such as ‘The A team’ , ’Lego House’, ‘Sing', ‘Thinking Out Loud’, ‘Photograph’, ‘Shape Of You’, ‘Castle on The Hill’ and ‘Perfect’. In 2019, Ed Sheeran released the genre-spanning ‘No.6 Collaborations Project’ which featured a wide-range of artists including ‘Justin Bieber’, ‘Camilla’ Cabello’, ‘Travis Scott’, ‘Eminem’, ‘Cardi B, ‘Paulo Londra’, ‘Bruno Mars’ and ‘Stormzy’ amongst many others, producing hits such as ‘I Don’t Care’, ‘Beautiful People’, ‘South of The Border’ and ‘Take Me Back To London’. #EdSheeran #Afterglow #Lyric","3M6S"
"6lOgh8torPA","SZA- Hit Different x Good Days (Official Acoustic Video)","2020-12-25T20:00:01Z","UCO5IQ70V7l-XpHW40HwaGsw","SZA","10","20.26.12","sza goods days|sza hit different|good days acoustic|acoustic|live performance|new sza|sza is back|ctrl|rnb today|new rnb|the neptunes|broken clocks|supermodel|sza collabs|sza 2020|hit different acoustic","374107","75501","127","4148","https://i.ytimg.com/vi/6lOgh8torPA/default.jpg","False","False","Hit Different x Good Days Acoustic performed by SZA and Carter Lang. 2020 Top Dawg Entertainment","4M47S"
"xFD_0PIfHHA","Legends Summarized: The Journey To The West (Part VIII)","2020-12-25T16:00:17Z","UCodbH5mUeF-m_BsNueRDjcw","Overly Sarcastic Productions","27","20.26.12","Funny|Summary|OSP|Overly Sarcastic Productions|Analysis|Literary Analysis|Myths|Legends|Classics|Literature|Stories|Storytelling|History|jttw|journey to the west|sun wukong|monkey king|taoism|buddhism|pigsy|sandy|tripitaka","285164","41078","91","5288","https://i.ytimg.com/vi/xFD_0PIfHHA/default.jpg","False","False","Journey to the West Kai, episode 5: Fishy Business and Mountaineering Madness!Danger! Intrigue! Sandy fights a carp! Pigsy gets two makeovers! Monkey reunites with several old frenemies, and Tripitaka gets less screentime than the horse!(merry christmas)(Here's a cheeky little bit of merch: https://www.redbubble.com/shop/ap/65660521)FIRST EPISODE: https://www.youtube.com/watch?v=61nuXrvqNgIPREVIOUS EPISODE: https://youtu.be/ABuG8hZqynIFULL SERIES: https://www.youtube.com/playlist?list=PLDb22nlVXGgdg_NR_-GtTrMnbMVmtSSXaOur content is intended for teenage audiences and up.PATREON: https://www.Patreon.com/OSPMERCH LINKS: https://www.redbubble.com/people/OSPYouTubeDISCORD: https://discord.gg/h3AqJPeOUR WEBSITE: https://www.OverlySarcasticProductions.com/Find us on Twitter https://www.Twitter.com/OSPYouTubeFind us on Reddit https://www.Reddit.com/r/OSP/","15M39S"
"wwY7sS8FR5w","My new friend... :  )","2020-12-24T21:00:30Z","UCm-X6o81nRsXQTmqpyArkBQ","Flamingo","20","20.26.12","roblox|flamingo|flamingo funny|kreek|kreekcraft|Roblox funny moments","2484623","157006","1502","28861","https://i.ytimg.com/vi/wwY7sS8FR5w/default.jpg","False","False","GET THE PLUSHIES ON 12/29 http://flamingo.youtooz.com/Today a new friend gets shipped to my house... and this new friend must be properly initiated.","11M48S"
"YsUB1yZvVR4","Surprising MrBeast With A Custom House","2020-12-23T21:01:43Z","UClQubH2NeMmGLTLgNdLBwXg","ZHC","24","20.26.12","[none]","6235142","318811","6017","19314","https://i.ytimg.com/vi/YsUB1yZvVR4/default.jpg","False","False","I can't believe we surprised MrBeast with a custom house then gave it to someone who really needed it lolSubscribe right now and you might get picked to win cash, custom apple products, custom cars, and even custom houses!SUBSCRIBE NOW!! thank youFollow my socials! Instagram - @ zhcomicartTwitter - @ hsieh_zacharyTikTok - @ zhcytSpecial thanks to MrBeast and his crew!","19M32S"
