video_id,title,publishedAt,channelId,channelTitle,categoryId,trending_date,tags,view_count,likes,dislikes,comment_count,thumbnail_link,comments_disabled,ratings_disabled,description,duration
"gHhl1yzCDdI","SIDEMEN CHRISTMAS MUKBANG","2020-12-20T18:00:29Z","UCDogdKl7t7NHzQ95aEwkdMw","Sidemen","24","20.26.12","sidemen|sidemen sunday|#sidemensunday","7459208","583382","3590","19953","https://i.ytimg.com/vi/gHhl1yzCDdI/default.jpg","False","False","The Sidemen do a Christmas Mukbang!Randolph: https://youtube.com/c/RandolphPokemonSidemen Clothing: http://www.sidemenclothing.com👉🏻 Subscribe to our 2nd Channel: https://www.youtube.com/MoreSidemen 👈🏻👕: Sidemen Clothing: http://www.sidemenclothing.com📸: Sidemen Instagram: http://www.instagram.com/Sidemen🐤: Sidemen Twitter: http://www.twitter.com/Sidemen✏️: SUBMIT A #SidemenSunday IDEA HEREhttps://forms.gle/JDuGrSzM4F6mdo6D9-----------------------------------------------------------------------------------------------------------------------▶️ SIDEMEN ◀️🔴 SIMON (Miniminter)● http://www.youtube.com/Miniminter● http://www.youtube.com/MM7Games● http://www.instagram.com/Miniminter● http://www.twitter.com/Miniminter🔵 JOSH (Zerkaa)● http://www.youtube.com/Zerkaa● http://www.youtube.com/ZerkaaPlays● http://www.instagram.com/Zerkaa● http://www.twitter.com/ZerkaaHD🔴 ETHAN (Behzinga)● http://www.youtube.com/Behzinga● http://www.youtube.com/Beh2inga● http://www.instagram.com/Behzingagram● http://www.twitter.com/Behzinga🔵 VIK (Vikkstar123)● http://www.youtube.com/Vikkstar123● http://www.youtube.com/Vikkstar123HD● http://www.youtube.com/VikkstarPlays● http://www.instagram.com/Vikkstagram● http://www.twitter.com/Vikkstar123🔴 TOBI (Tobjizzle)● http://www.youtube.com/TBJZL● http://www.youtube.com/Editingaming● http://www.instagram.com/Tobjizzle● http://www.twitter.com/Tobjizzle🔵 JJ (KSI)● http://www.youtube.com/KSI● http://www.youtube.com/KSIOlajidebtHD● http://www.instagram.com/KSI● http://www.twitter.com/KSIOlajidebt🔴 HARRY (W2S)● http://www.youtube.com/W2S● http://www.youtube.com/W2SPlays● http://www.instagram.com/Wroetoshaw● http://www.twitter.com/Wroetoshaw","1H28M49S"
"EQlYzDdOLxI","Mirchi Lagi Toh - Coolie No.1 | VarunDhawan, Sara Ali Khan| Alka Yagnik, Kumar Sanu, Lijo, Dj Chetas","2020-12-21T06:49:56Z","UCJrDMFOdv1I2k8n9oK_V21w","Tips Official","10","20.26.12","coolie no 1|sara ali khan|varun dhawan|david dhawan|varun dhawan song|varun dhawan new song|sara ali khan songs|sara ali khan and varun dhawan|mirchi lagi toh|tips official|main toh raste se ja raha tha|mirchi lagi toh varun dhawan|coolie|coolie no 1 varun dhawan|varun dhawan coolie no 1|coolie no 1 new songs|coolie no 1 song varun dhawan|coolie no.1|coolie number 1|coolie number one|coolie songs|mirchi lagi toh song|mirchi lagi to main kya karun","43629879","0","0","37830","https://i.ytimg.com/vi/EQlYzDdOLxI/default.jpg","False","True","Old Mirchi New Tadka!!We've got the perfect Tadka this winter with #MirchiLagiToh song from #VarunDhawan #SaraAliKhan's new release #CoolieNo1 singing onto #KumarSanu #AlkaYagnik makes it even more special!! Stay updated with the latest videos from Tips Music, Subscribe below link.http://bit.ly/TipsOfficialAvailable On*Saavn*https://www.jiosaavn.com/album/coolie-no.-1-ost/dhXigk3HSyw_*Apple Music*https://music.apple.com/in/album/mirchi-lagi-toh-from-coolie-no-1-single/1545040125*Spotify*https://open.spotify.com/album/2Nf1dk0hiHHlPoWxm1Ujre*Resso*https://m.resso.app/ZSnyT1oe/*Amazon*https://music.amazon.in/albums/B08QMW1ZDJ?marketplaceId=A3K6Y4MI8GDYMT&musicTerritory=IN&trackAsin=B08QLXZS9TSet 'Mirchi Lagi Toh' as your Mobile Callertune (India Only)Vodafone & Idea Users Dial 53712245415Audio Credits:Singers: Kumar Sanu, Alka YagnikMusic: Anand-MilindMusic: Lijo George - Dj Chetas & Anand-MilindLyrics: SameerSong Produced by Lijo GeorgeChorus: Arun Ingle & TeamAdditional Vocals: Sara Ali Khan,Poonam TiwariMusic Supervisor: Azeem DayaniMixing And Mastering: Eric Pillai (Future Sound Of Bombay)Mix Assistant Engineer: Michael Edwin PillaiVocals recorded at SoundideazRecording Engineer: KittuSpecial thanks to Shabbir Ahmed, Ameen Sayani, Rajil SayaniMovie Credits:Produced By: Vashu Bhagnani, Jackky Bhagnani, Deepshikha DeshmukhDirected By: David DhawanScreenplay: Rumi JafferyDialogues: Farhad SamjiDirector of Photography: Ravi K Chandran ISCStarCast: VarunDhawan, Sara Ali Khan, Paresh RawalLyrics:Main toh raste se ja raha thaMain toh bhel puri kha raha thaMain toh ladki ghuma raha thaRaste se ja raha thaBhel puri kha raha thaLadki ghuma raha thaTujhko mirchi lagi toh main kya karoonTujhko mirchi lagi toh main kya karoonMain toh raste se ja rahi thiMain toh icecream kha rahi thiMain toh naina lada rahi thiRaste se ja rahi thiIcecream kha rahi thiNaina lada rahi thiTujhko mirchi lagi toh main kya karoonTujhko mirchi lagi toh main kya karoonJale chahe saara zamanaChahe tujhe tera deewanaJale chahe saara zamanaChahe tujhe tera deewanaSang tere main bhaag jaaonNazar kisi ko bhi na aaonLog dilwalo se yaar jalte haiKaise bataon kya kya chaal chalte haiMain toh gaadi se ja raha thaMain toh seeti baja raha thaMain toh topi phira raha thaGaadi se ja raha thaSeeti baja raha thaTopi phira raha thaTujhko dhakka laga toh main kya karoonTujhko dhakka laga toh main kya karoonNayi koi picture dikha deMujhe kahin khana khila deNayi koi picture dikha deMujhe kahin khana khila deZara nigaahon se pila dePyaas mere dil ki bujha deAaj tujhe jee bharke pyar karna haiTeri nigaahon se deedaar karna haiMain toh thumka laga rahi thiMain toh geet koi gaa rahi thiMain toh chakkar chala rahi thiThumka laga rahi thiGeet koi gaa rahi thiChakkar chala rahi thiTeri nani mari toh main kya karoonTeri nani mari toh main kya karoonMain toh raste se ja raha thaMain toh bhel puri kha raha thaMain toh ladki ghuma raha thaRaste se ja raha thaBhel puri kha raha thaLadki ghuma raha thaTujhko mirchi lagi toh main kya karoonTujhko mirchi lagi toh main kya karoonJoin Us Onhttp://youtube.com/tipsofficialhttps://youtube.com/tipsfilmshttp://youtube.com/dilapnapunjabihttp://youtube.com/jhankargaanehttp://youtube.com/volumehttp://youtube.com/tipsmarathihttp://bit.ly/TipsGujaratihttp://bit.ly/TipsBhojpuriChannelhttps://bit.ly/TipsHaryanvihttp://youtube.com/bhaktipremhttps://www.facebook.com/TipsMusichttps://www.instagram.com/tipshttps://twitter.com/tipsofficial","3M24S"
"3cUd_BK_P0w","NLE Choppa - Jiggin (Official Music Video)","2020-12-21T00:04:48Z","UCWICXNlSLc7eeNazpzUZcLg","NLE CHOPPA","10","20.26.12","NLE Choppa|Bryson|From Dark To Light|Top Shotta|New Rap Music|New Hip Hop|XXL|Complex|Lyrical Lemonade|Rap Caviar|Tee Grizzley|Comethazine|Famous Dex|Roddy Ricch|Blueface|Mulatto|Chief Keef|Shotta Flow|Narrow Road|Walk Em Down|New Hip Hop Music|No Jumper|Adam 22|Top Shotta Don Dada|Big Sean|Moonlight|Picture Me|Body Catchers|Picture Me Grapin|2Pac|2pac sample|100 grapes|Done|Jiggin","1751920","133958","1587","12850","https://i.ytimg.com/vi/3cUd_BK_P0w/default.jpg","False","False","Listen to Jiggin:https://nlechoppa.lnk.to/jigginListen to 'From Dark To Light':https://nlechoppa.lnk.to/fromdarktolightMerch: https://warnerrecords.lnk.to/choppastore Txt: (901)245-5603https://nlechoppa.comhttps://nlechoppa.com/mailing-listhttps://instagram.com/nlechoppamusichttps://facebook.com/nlechoppamusichttps://twitter.com/nlechoppa1https://snapchat.com/add/nlechoppamusicTikTok: @NLEChoppaMusicTriller: @NLEChoppa#NLEChoppa #Jiggin #FromDarkToLight","4M23S"
"i6B2gj8Y4eE","Here’s how to see the rare ‘Christmas Star’ on Monday","2020-12-22T00:17:16Z","UCjpzEgbbDUg4YC6vpSrzsyg","WKMG News 6 ClickOrlando","25","20.26.12","[none]","309063","1846","123","244","https://i.ytimg.com/vi/i6B2gj8Y4eE/default.jpg","False","False","It all comes down to weather Monday evening. The rare Great Conjunction between Jupiter and Saturn is set to take center stage in our night.","3M27S"
"lOaKOKohA3w","Joshua Weissman Cooks the Perfect Burger Combo Meal | The Burger Show","2020-12-22T16:00:27Z","UCPD_bxCRGpmmeQcbe2kpPaA","First We Feast","24","20.26.12","First we feast|fwf|firstwefeast|food|food porn|cook|cooking|chef|kitchen|recipe|cocktail|complex|complex media|Cook (Profession)sean evans|josh weissman|joshua weissman burger|josh weissman burgers|the burger show|the burger show season 5|the burger show finale|joshua weissman the burger show|combo meal|best burger recipe|burger combo meal|alvin cailan|first we feast|first we feast the burger show|burger how to|smashburger|the burger show fwf","708830","33501","556","1829","https://i.ytimg.com/vi/lOaKOKohA3w/default.jpg","False","False","It's the Burger Show season finale! And it wouldn't be a party without chef Joshua Weissman, whose viral TikToks and cooking series But Better have turned him into an Internet sensation. Today, Josh and Alvin are going to settle the debate once and for all—what makes the perfect burger combo meal? Beyond the bun and patty. What's your fry of choice? Waffle? Curly? Tots? And what drink are you washing it down with? Tune in to see what's cookin'!Subscribe to First We Feast on YouTube: http://goo.gl/UxFzhKCheck out more of First We Feast here:http://firstwefeast.com/https://twitter.com/firstwefeasthttps://www.facebook.com/FirstWeFeasthttp://instagram.com/firstwefeastFirst We Feast videos offer an iconoclastic view into the culinary world, taking you behind-the-scenes with some of the country's best chefs and finding the unexpected places where food and pop culture intersect.","16M18S"
"cLwZZWdliaQ","et dire qu'on était fiers de nos décorations","2020-12-21T17:13:31Z","UCWeg2Pkate69NFdBeuRFTAw","SQUEEZIE","24","20.26.12","[none]","4301930","424118","4356","14689","https://i.ytimg.com/vi/cLwZZWdliaQ/default.jpg","False","False","ABONNE-TOI ! http://bit.ly/2fm88Xo (merci)Vêtements Yoko : http://www.yokoshop.comRéseaux :Insta : https://www.instagram.com/xsqueezie/Twitter : http://www.twitter.com/xSqueeZieFacebook : http://www.facebook.com/SqueeZiePageOfficielleRègles de l'espace commentaire (à respecter sous peine d'être banni par l'équipe de modération) :- Écrire dans un français correct- Respecter les autres- Pas de commentaires type like si tu regardes la vidéo en chaussettes- Pas de pubs et de spams","11M27S"
"1GinX1x8-yo","LE BLOC - RÉVÉLATIONS (Épisode 11)","2020-12-22T17:30:11Z","UCdHnhKSsy1yGGZz4DSkOrJQ","Hassan","23","20.26.12","[none]","1820055","116076","1457","6351","https://i.ytimg.com/vi/1GinX1x8-yo/default.jpg","False","False","Le son HABIBA enfin disponible ici : http://obyone.lnk.to/HabibaAbonne toi ! https://www.youtube.com/channel/UCdHnhKSsy1yGGZz4DSkOrJQ/?sub_confirmation=1Acteurs (Instagram) :https://www.instagram.com/mister_officiel/ (Hassan)https://www.instagram.com/obyoneofficiel/ (Oby One)https://www.instagram.com/taj_abz/ (Taj)https://instagram.com/nim.o___?igshid=12mon0glt107t (Nimo)https://instagram.com/mnlazup?igshid=85vmbpev1qzc (Marvin)https://instagram.com/dany_mahdii?igshid=1b3ew04nl4zry (Dany)https://instagram.com/ibtiisvm?igshid=hij0gahrm1uu (Ibtisam)https://www.instagram.com/abou.diez/ (Coach)https://www.instagram.com/youss.officiel/ (Youss)https://www.instagram.com/bkz_up/ (BKZ)https://www.instagram.com/adm_abz/ (Adam)https://www.instagram.com/le_lou007/ (Loubard)https://www.instagram.com/angoofficiel/ (Ango)https://www.instagram.com/statesofficiel/ (States Dealer)Ecriture : Hassan & Camille JaRéalisateurs : - https://www.instagram.com/camilleja/ (Camille Ja)- https://www.instagram.com/wacho_officiel/ (Wacho)- Réalisation scène garage : Nuit Blanche Production https://www.instagram.com/nuitblancheproduction/2ème cam : https://www.instagram.com/rimaofficiell/ (Amir) Montage : Nuit Blanche Production https://www.instagram.com/nuitblancheproduction/Ingénieur son : Elodie TheveninGénérique : https://www.instagram.com/obyoneofficiel/Miniature : https://www.instagram.com/chronopxl/ (Chronopixel)","20M8S"
"bkQw-F1QTq4","TWICE 'CRY FOR ME' Choreography - 2","2020-12-21T14:59:48Z","UCzgxx_DM2Dcb9Y1spb9mUJA","TWICE","10","20.26.12","TWICE|트와이스|CRYFORME|크라이포미|TWICECRYFORME|트와이스크라이포미|TWICE크라이포미|CRYFORMETWICE|CRYFORME트와이스|크라이포미트와이스|크라이포미TWICE|TWICE디지털싱글|TWICEDigitalSingle|디지털싱글TWICE|DigitalSingleTWICE|트와이스디지털싱글|디지털싱글트와이스|트와이스신곡|TWICENewSong|신곡트와이스|NewSongTWICE|TWICE신곡|신곡TWICE|CRYFORMEDancePractice|CRYFORME안무|CRYFORME안무영상|CRYFORMEChoreographyVideo|CRYFORMEChoreography|CRYFORMEDance","4973400","429206","3303","24314","https://i.ytimg.com/vi/bkQw-F1QTq4/default.jpg","False","False","TWICE 'CRY FOR ME' Choreography - 2TWICE CRY FOR ME Released Online:https://twice.lnk.to/CRYFORMETWICE Official Shop: https://TWICE.lnk.to/ShopTWICE Official YouTube: http://www.youtube.com/c/TWICETWICE Official Facebook: http://www.facebook.com/JYPETWICETWICE Official Twitter: http://www.twitter.com/JYPETWICETWICE Official Instagram: http://www.instagram.com/TWICETAGRAMTWICE Official Homepage: http://TWICE.jype.comTWICE Official Fan's: http://fans.jype.com/TWICEⓒ 2020 JYP Entertainment. All Rights Reserved#TWICE #트와이스 #CRYFORME","3M30S"
"FI79_ppwn8M","Why Moff Gideon Was SCARED and Recognized Luke Skywalker! - Star Wars Explained","2020-12-20T17:11:50Z","UC00uG71I6iPyx15EX6i_GDA","Star Wars Comics","24","20.26.12","darth vader|vader vs|star wars comics|star wars comics explained|star wars explained|jedi|sith|lightsaber|vader lightsaber|darth vader lightsaber|sidious|darth sidious|darth vader vs|palpatine vs vader|darth vader revenge|vader order 66","1706582","40846","1221","4278","https://i.ytimg.com/vi/FI79_ppwn8M/default.jpg","False","False","Moff Gideon knew before anybody else that the legendary Luke Skywalker was aboard his ship and nothing could stop him now, we saw him visibly shake in fear and here is why.SWC Shop: https://teespring.com/stores/swcomics-shopT-shirt Design: https://www.instagram.com/thanksman_designApply and join the team: https://docs.google.com/forms/d/1xfC-rN9vXcScUJYf4_fu3gizOCEbPkM-0WWPkAOrOjcInstagram: https://www.instagram.com/star.wars.comicsSupport the Channel: https://www.patreon.com/BessY Join the Discord: https://discord.gg/bessy Follow me on Twitter: https://twitter.com/BessYSWC Darth Vader Explained:https://www.youtube.com/watch?v=w_R_lg066T0&list=PL6Fjyk0kIh-5yx4EHFQN8Xlh-STtOLpYzThe Forbidden Force Powers Series:https://www.youtube.com/watch?v=aKMoH6caYwk&list=PL6Fjyk0kIh-7_sB2AnjH7bFtPd-LTsx5YAll the Lightsabers Series:https://www.youtube.com/watch?v=1PsUmtuAgfs&list=PL6Fjyk0kIh-78awfmH6jZ6uz9XH9Mryx-May the Force be with YOU.... Always!","8M1S"
"-VyqsVbKFyo","ASKING NOAH BECK ABOUT DIXIE?! pt.2","2020-12-21T20:48:03Z","UCR_jb7PJVd3fYZLI_QX_nwA","Blake Gray","24","20.26.12","blake gray blake|sway la|sway house|blake gray|noah|beck|dixie|nixie|bryce|hall|damelio","664498","39616","758","1231","https://i.ytimg.com/vi/-VyqsVbKFyo/default.jpg","False","False","Asking Noah Beck about his relationship with Dixie DamelioFOLLOW METikTok : https://www.tiktok.com/@blakegrayInstagram : https://instagram.com/blakegrayTwitter : https//twitter.com/blakegraySnapchat : BlakeFOLLOW SWAYTikTok : https://www.tiktok.com/@theswaylaInstagram : https://www.instagram.com/swaylaYouTube : https://www.youtube.com/channel/UCVd9TykPzqcm1hwglZrx05gEdited and filmed by Matt: @mazzopardiiiBusiness Inquiries: blake@talentxent.com","7M4S"
"zVC9o7W9xEA","What is the Jupiter and Saturn Great Conjunction and how can I watch it tonight?","2020-12-21T13:07:30Z","UCPgLNge0xqQHWM5B5EFH9Cg","The Telegraph","25","20.26.12","Telegraph|News|conjunction|planets|jupiter|saturn|earth|star|astrology|astronomy|space|christmas","400960","3893","150","0","https://i.ytimg.com/vi/zVC9o7W9xEA/default.jpg","True","False","Saturn and Jupiter will tonight align in a rare astronomic event which hasn't happened in nearly 800 years.Their orbits will be perfectly aligned to reflect the sun onto the Earth, creating the appearance of a bright 'star' in the skies.The last time this happened was in 1226, and it can be seen with the naked eye or with a pair of binoculars.Because of its bright appearance, the Vatican now believes this could be one of the explanations of the Star of Bethlehem story, which supposedly guided the three Wise Men on the day Jesus was born.Read the full story here: https://www.telegraph.co.uk/news/2020/12/21/star-bethlehem-how-watch-great-conjunction-jupiter-saturn-tonight-time/Subscribe to The Telegraph on YouTube ► https://bit.ly/3idrdLHGet the latest headlines: https://www.telegraph.co.uk/Telegraph.co.uk and YouTube.com/TelegraphTV are websites of The Telegraph, the UK's best-selling quality daily newspaper providing news and analysis on UK and world events, business, sport, lifestyle and culture.","1M14S"
"_rBO8neWw04","Detergent packs are kinda wishy-washy (Dishwashers Explained)","2020-12-20T15:45:35Z","UCy0tKL1T7wFoYcxCe0xjN6Q","Technology Connections","28","20.26.12","[none]","936616","72266","965","13532","https://i.ytimg.com/vi/_rBO8neWw04/default.jpg","False","False","Ever wonder how dishwashers work? Are you ever bummed by the performance of yours? Well, this video can answer your question and possibly provide you with a solution!Technology Connextras (the second channel that stuff goes on sometimes):https://www.youtube.com/channel/UClRwC5Vc8HrB6vGx6Ti-lhATechnology Connections on Twitter:https://twitter.com/TechConnectifyThe TC Subreddithttps://www.reddit.com/r/technologyconnectionsThis channel is supported through viewer contribution on Patreon. Thanks to the generous support of people like you, Technology Connections has remained independent and possible. It's how I can yell at Cascade with aplomb! If you'd like to join the amazing people who've pledged their support, check out the link below. Thank you for your consideration!https://www.patreon.com/technologyconnectionsAnd thank you to the following patrons!Sebastien De Groof, Robert T Kirton, Alex Ferriroli, Juha Kuikka, Maggie Danger, Jay 'Unionize Everything Except Cops' Logan, Conduit of Queerness, Mage of Life, Matthew Lowe, An Ho, Steven Byrum-Bratsen, Sean Callinan, Scott Schreiber, Mitch Buchan, Sarah Collie, Maxime André, Chaos215bar2 , Michael Grados, Daniel Nefzger, Matias Mariani, Christopher Barback, yetanothername , Synoiz , Chip , Ulises Vargas, Jennifer Rae Fuchek, Adrian Bridgett, John Gjonola, Yannick , Chad Gertz, Zhongchao Qian, Sean Murphy, Erica Eagles, Robey Pointer, Hayden Taylor, Aimee Kidrick, Alexander folk, Matt Gibbons, Omnizen, Zach Bean, mstar27, Jack Knight, Peter Bergström, Peter Amling, David Ziemlak, GGreathouse , Stephen A. Wilson, Sam Becraft, Chris Benejam, Veronica Cary, Vincent Sandstoe, Robert Mikhayelyan, Corey Ogburn, Harlan , Mike Stunes, William Leonard, Cory King, Matt Braun, Eugene Arutchev, Steven Fazzio, Harrison Co, Michael Cafarelli, Gabriel, Justin Patriquin, Olof , Vincent Venezia, Doug Wallace, Brad Quinn, Jim Puls, Zachary W Collins, Alex, Ross James, Jonfidential, Lillian Fleming, Jason Durbin, Kevin McClaning, Keith Ditchman, ventusignis, Jeremy Iamurri, Michael, Skoddie , Alix Odendhal, bd_, Benjamin Gouveia, Ryan Doucet, Billy, Sean Crocker, Phillip M, Robert Cole, iain , Ross Carter, Jakub Strzyżewski (jeikobu__), Robert Fares, Neptunium Fluoride, Fangzahn Aviation Studios, Aaron Binns, Matthew Yu, Johannes Wüller, Adam Golden, Rustmane Skytrekker, John J Yang, Matthew Hilder, leastbad, Joe Pannullo, Alex Conner, Colin Williams, Alex Lindeman, Jim Gilsinan, Kohana Coyote, Michael Goode, Julian Freeman, Ed Torres, Jon-Håkon Røli, Matt Wright, Gunplumber , Bane Williams, Villodre , vinny rapisarda, Manuel Garcia, Matthew Lucas, Doomerdinger , Udo Strass, Jonathan Polley, SomeonesGonnaPayForThis , Thomas Rowan, Robert Valdimarsson, Atsumari, Alex Groom, Blythe Rathi, Brian Beck, Billiam , LazySpoon, Greg Lindsey, Robert Haynes, David Nelson, Eli Youngs, Paul Hackett, Alex H., John Curley, Benjamin Dykstra, Dan Cortes, Vy-let Cybra, Joseph Fickus, Raymond Ernesto Colón, Mike Berman, Kay Ohtie, Cysioland, Pathite , Mr.Bright, Frode Hauge, Stu Kabakoff, Carmichael Keane See, Chris Jordan, Steven V, Brian & Laura, Brian Holder, Mindy B., Patrick Köhl, NoFriendsThatSlav , Jeremy Whaling, Sunshine Heart, VMRosetta, Nathan Walters, Michael Yeo, Massimo Fierro, Grant Blayney, Jake Sanders, William McKinnerney, Elizabeth, Amy Cable, Rafael De Los Santos, heyitsleo , Paul Sutton, Timothy Dunn, Duncan Sanford, Jack Alderson, Eric Kalenak, Lukas Svec, Mike Nichols, Roman, Ari Kestenbaum, Sean Harding, Bryan Helmig, Luis Calvo Mayo, Felix Huang, Blake Palacio, Jonathan Cotton, Isaac , Spencer Golde, William Willing, Pedro Soto, Vincent McBeigh, Ramon Perez, Xtr3m3 , Steve Fallon, Punkey , Sascha Strauß, Scott Kuker, V. Legrand, Igor Cananea, Shane Chambers, Jacob Oost, Donald Garwood, Aeryn Light, Brian B., CyborgHobbit , Dan Basterfield, Casey Keeney, James FitzGibbon, MegaZone , Brian Ingalls, Aaron Carson, Erik T, Gregg Medley, Zackary Wojtan, Cody Bittle, Patrick, Andrew Hoddinott, Benjamin Rister, Shay Sandik, Daniel Marcinkowski, Jayde Coler, Fauxfreshness , Patrick Kennedy, Jesse S, Oswyn Brent, A tall shade of the color red, Colin Gagich, Mike McCaffrey, Michael Olpin, Charles Hayward, Andrew Krew, Devedander, Bryan Countryman, David McGrath, Richie Gaiser, Matt Christensen, Ben, Truls Zhong Konstali, Cuervo , Mauve Co, Martin Rempel, Eric Graves, Philip Cheek, Alexander Schlickenmaier, Jesse Weaver, Thomas Kula, Ed McCloskey, Harold Godwinson, Johann Thomsen, Jordan DeLong, Keith Hemenway, Aaron Greenberg, Matt Brown, Benjamin Douel, mooncow , Oliver White, Andrew Eslick, Brent Medling, Joel V, Philip Rehorst, John Harris, Mike and Zack, DCBuffalo, Emilio Mendoza, Patricia , Cody, Henry Dwyer, Colin Coyle, Cuddlefisch , nate grover, Martin Smith, Darryl !, bagel mode","32M35S"
"hYPh9H36-VU","Boris Johnson briefing after over 40 countries ban UK arrivals 🔴 Covid @BBC News live - BBC","2020-12-21T17:37:06Z","UCCj956IF62FbT7Gouszaj9w","BBC","25","20.26.12","BBC iPlayer|United Kingdom|British TV|British TV Shows|Watch UK TV Online|Watch British TV Online|Watch British TV Shows Online|coronavirus news|latest coronavirus|uk coronavirus update|boris johnson coronavirus|boris johnson coronavirus speech|coronavirus explained|coronavirus uk|coronavirus symptoms|coronavirus problems|coronavirus patient|government|politics|downing street|boris johnson corona|corona|epidemic|pandemic|coronavirus news conference","562737","2701","1087","2797","https://i.ytimg.com/vi/hYPh9H36-VU/default.jpg","False","False","Subscribe and 🔔 to OFFICIAL BBC YouTube 👉 https://bit.ly/2IXqEInStream original BBC programmes FIRST on BBC iPlayer 👉 https://bbc.in/2J18jYJ 🔘 Subscribe and 🔔 @BBC News 👉 https://bit.ly/3a1zyip🔘 Stream BBC News live on BBC iPlayer 🔴 https://bbc.in/3b64IVP🔘 Coronavirus / Covid-19 👉 https://bbc.in/3luQp33🔘 Follow BBC News live updates here 👉 https://bbc.in/2JmUswL Prime Minister Boris Johnson has spoke at the Downing Street press conference. He was joined by Transport Secretary Grant Shapps and the UK's chief scientific adviser, Sir Patrick Vallance.Follow the story  👉 https://bbc.in/3pa5sQQBBC News Live | Coronavirus Press Conference | UK Government Press Briefing | BBC#BBC #BBCiPlayer #BBCNews #BBCCoronavirus #Coronavirus #Covid-19 #CoronavirusOutbreak #Corona #CoronavirusUK #borisjohnsonspeechonuklockdowntodayAll our TV channels and S4C are available to watch live through BBC iPlayer, although some programmes may not be available to stream online due to rights. If you would like to read more on what types of programmes are available to watch live, check the 'Are all programmes that are broadcast available on BBC iPlayer?' FAQ 👉 https://bbc.in/2m8ks6v.","26M10S"
"qQtwAU6_8c4","11ANS de JDG - Partie 2","2020-12-20T14:02:59Z","UC_yP2DpIgs5Y1uWC0T03Chw","Joueur Du Grenier","23","20.26.12","Joueur du grenier|11ans|Jdg|bazar du grenier|retro gaming|Sonic 06|10ans","1507385","206456","1426","18190","https://i.ytimg.com/vi/qQtwAU6_8c4/default.jpg","False","False","Vidéo sponsorisée par Nord VPN (et oui encore) Pour toute souscription à l’abonnement de 2 ans à 3,15€ par mois, recevez en bonus 4 mois supplémentaires gratuits ! Rendez-vous sur https://nordvpn.com/joueur et utilisez le code promo “joueur lors de votre achat.---------------------------------------------------------------Salut à tous ! Nous y sommes ! voilà enfin la 2eme partie de l'episode des 11ans. La conclusion d'un projet dans lequel on a mis toute nos tripes. j'espère que vous l'apprécierez. Merci à tous d'être si nombreux à nous suivre depuis ces 11années !Merci à notre photographe plateau, Krysthal parce qu'on est des gros sacs et qu'elle a été oubliée au générique :x pour voir des photos du tournage c'est ici :https://lekanarddechaine.com/Erratum: L'acteur qui joue de rôle d'Alpha 5 s'appelle Paul Séna!","46M29S"
